removed,year,adjective,keyword,text,,,,,,,,,,,,,,,,
,1898,big,cactus,"the direction now. i took note of that big cactus ahead, last night -- hist!""""dios de mi alma!""whispered",,,,,,,,,,,,,,,,
x,2004,lucky,duck,"...""- sugar ray's mark mcgrath being the lucky duck who joins her in the pop mix of the same tune. these are",,,,,,,,,,,,,,,,
x,1855,whole,elk,"! the pot held six gallons, and the whole elk, except a few steaks, was cut up and alternately boiled down in",,,,,,,,,,,,,,,,
,1898,big,juniper,"rain, i searched for a dry bed, and made choice of a big juniper that had been pushed  down by a snow avalanche, but was resting stubbornly",,,,,,,,,,,,,,,,
x,1896,fat,elk,"little here, and the one who sees a fat elk first will drop him. we'll keep within sight and hearing of each",,,,,,,,,,,,,,,,
x,1994,big,elk,"for one of the animals to retire to that big elk refuge in the sky. (refuge literature refers to such scavengers as""",,,,,,,,,,,,,,,,
,1898,fragrant,lilac,"tearing their clothes on the spiked brush and the thorns of the sweetbrier, fragrant lilac petals falling in a shower about them, great ferns trodden and rebounding. the",,,,,,,,,,,,,,,,
x,1998,legendary,elk,"401298 intent on stalking a legendary elk nicknamed""solomon,""this blackpowder hunter didn't realize another bull was",,,,,,,,,,,,,,,,
x,1998,perfect,elk,"high meadows and the dark timber below create the perfect elk habitat. early in the season, before the snows force them down,",,,,,,,,,,,,,,,,
,1898,large,muskrat,"a black duck motionless on the water, staring with outstretched neck at a large muskrat swimming past within a yard of him. the ripple caused by the muskrat surrounded",,,,,,,,,,,,,,,,
,1898,large,muskrat,"large muskrat swimming past within a yard of him. the ripple caused by the muskrat surrounded the duck and spread beyond him, but the bird's eyes were fixed",,,,,,,,,,,,,,,,
,1898,old,woodchuck,"above the yellow sand-bank like dragons, and under their protecting claws a sulky old woodchuck had digged a den long ago. he became more sour and ill-tempered as weeks",,,,,,,,,,,,,,,,
,1899,large,black,while she was thus hard at work a large black bear came along from the opposite direction. i happened to be out in the,,,,,,,,,,,,,,,,
,1900,strange,oriole,"pack thread. the final result looked something less like a bucket than some strange oriole's hanging nest.""it will hold water,""vowed betty, ready",,,,,,,,,,,,,,,,
,1901,rare,mink,", trapped muskrat in the big meadow, a mile below, or the rare mink that hunted frogs in the brook, had any suspicion that such splendid fur was",,,,,,,,,,,,,,,,
,1901,big,otter,", and paddled hastily to find out about it. two beavers and a big otter were locked in a death struggle, diving, plunging, throwing themselves out of",,,,,,,,,,,,,,,,
,1901,big,otter,"western light, a string of silver bubbles shot across the stream and a big otter rose to the surface with a pickerel in his mouth, all the watching that",,,,,,,,,,,,,,,,
,1902,deep,birch,"do -- and i were to go back to the glen and the crag and the deep birch woods, i suppose that i would hunt again, would drive the stag to",,,,,,,,,,,,,,,,
,1902,beautiful,birch,"in the woods, the hunting of berries and grapes, the loads of beautiful birch and ash bark, the wild flowers that bloomed until frost came! and the",,,,,,,,,,,,,,,,
,1902,solitary,heron,"hoofs had the depth and resonance of drumbeats, and the cry of a solitary heron in the marsh seemed louder than its wont. he passed the rolling-house and drew",,,,,,,,,,,,,,,,
,1902,fragrant,lilac,"rice. as he stood upon the door-step, shaded on either side by fragrant lilac plumes, he resolved to be particularly brief, though impressive, in his pastoral",,,,,,,,,,,,,,,,
,1902,big,porcupine,"from within; simmo sprang away with a yell; and out wobbled a big porcupine, the biggest i ever saw, and tumbled away straight towards my tent.",,,,,,,,,,,,,,,,
,1904,rare,butterfly,"caught watching mr. budd: they behaved like naturalists on the trail of a rare butterfly. in his efforts not to notice mr. budd, lethbury centred his attentions on",,,,,,,,,,,,,,,,
,1904,fine,cypress,"ever seen. here also were more of the fine cypress trees, all of them from four to five hundred years old, one",,,,,,,,,,,,,,,,
,1904,big,lilac,"steep, grassy bask, with the two tall elms in front, the big lilac bush at the door, and the cinnamon rosebushes straggling down to the road,",,,,,,,,,,,,,,,,
,1905,sleek,antelope,"city of men the insect had ever visited. just within the gate a sleek antelope was running a pop-corn stand, and a little further on a screech-owl stood upon",,,,,,,,,,,,,,,,
,1905,fine,butterfly,"was almost starved; when peeping out of the shell, he saw a fine butterfly settled on the ground. he now ventured out, and getting astride, the",,,,,,,,,,,,,,,,
,1905,bright,warbler,fox. in the spring one may sometimes see a bluebird or redbird or bright warbler for a moment upon the ground. how artificial and accidental it looks. like,,,,,,,,,,,,,,,,
,1906,good,clover,"thus it is that lands which have grown black ash and tamarack generally make good clover lands also. but clover will not succeed well on unreduced peaty soils, since",,,,,,,,,,,,,,,,
x,1900,sleek,ferret,". smile and keep your counsel. let this sleek ferret ferris, go on and marry the girl, for i, alone,",,,,,,,,,,,,,,,,
x,1919,financial,ferret,"was little more than a""dodging, rat-like financial ferret,""a""financial stool-pigeon for some trust or other,""a",,,,,,,,,,,,,,,,
x,1922,old,ferret,"mysterious explosives:""did ye hear that the old ferret held up mark carter last night and as good as called him a murderer",,,,,,,,,,,,,,,,
x,1922,old,ferret,meeting to remember! he wanted to kill that old ferret of a harricutt whenever he thought about it. then he would be a,,,,,,,,,,,,,,,,
x,1986,old,ferret,"you haven't tried to sniff out, you old ferret, thought torisen.""you shouldn't begrudge me some poor scraps of",,,,,,,,,,,,,,,,
x,1834,new,finch,"of his time on board, and finished drawings of the murr, the new finch, and a gannet. on a sandy beach, near a ri*) pling",,,,,,,,,,,,,,,,
x,1835,new,finch,"of philadelphia. beside the warbler above-mentioned, mr. audubon has given to a new finch the name of bachman. no one can say, that this naturalist is not",,,,,,,,,,,,,,,,
x,1998,powerful,finch,"a triangular bib the color of raspberry sorbet beneath his chin, and a powerful finch's bill. the rippling song poured forth again. pam's father suddenly chuckled",,,,,,,,,,,,,,,,
x,1920,grand,fir,"the horning day of him i did ask that grand fir tree, good king edward i, to be his god-father. and that",,,,,,,,,,,,,,,,
x,1920,grand,fir,"her in the way that does lead to that grand fir tree, good king louis vi. and when we were come unto him",,,,,,,,,,,,,,,,
,1906,big,cottonwood,",""he replied respectfully,""but the big cottonwood with the dead branch forking out at the top is the ford guide.",,,,,,,,,,,,,,,,
,1906,large,hemlock,". the little shelter had stood close to a large hemlock tree. the lightning had struck the tree, causing it to topple ever",,,,,,,,,,,,,,,,
x,1994,large,fir,"inflatable santa-and-reindeer set hung from the ceiling. a large fir tree stood in the middle of the floor, lit up and covered with",,,,,,,,,,,,,,,,
x,1995,big,fir,better than that. richard looked up at the big fir tree in its agony of death. he thought again of his father's,,,,,,,,,,,,,,,,
,1907,beautiful,butterfly,"child's eyes laughed softly... she moved tiptoe...""i saw a beautiful butterfly once!""she said. but the woman did not hear. she had",,,,,,,,,,,,,,,,
,1907,old,catalpa,"been cut, and stood in corn. my old catalpa in the fence corner beside the road and the bartlett pear under which i",,,,,,,,,,,,,,,,
,1907,busy,kingfisher,"a gate post singing his broken june tune, cuckoo-cuk,' while a busy kingfisher crossed from the mill stream to the brook which ran on the other side of",,,,,,,,,,,,,,,,
x,1879,big,frog,"of the bugs, and plainly-shown annoyance of a big frog, made a somewhat surprising reply. decidedly seriously, he said,""",,,,,,,,,,,,,,,,
x,1930,big,frog,. esmeralda could see the advantages of being a big frog in a small puddle. but phyl grew up on the beach with all,,,,,,,,,,,,,,,,
x,1941,big,frog,"strangers to one another, each of them a big frog in his own little puddle, there was sure to be raging and roaring",,,,,,,,,,,,,,,,
x,1957,whole,frog,"discoglossids, and pelobatids. in proportion to its whole frog fauna, the north- temperate zone has more groups and more species of relict",,,,,,,,,,,,,,,,
x,1960,big,frog,"finn of then and all time. like a big frog always about to make a prizewinning jump, sam clemens stood out against his",,,,,,,,,,,,,,,,
x,1964,old,frog,"quit your growling! you sound like a croaking old frog -- or a grumbling bear,""she called back laughingly over her shoulder",,,,,,,,,,,,,,,,
x,1980,old,frog,"players, he could have them hitting into the old frog pond with satisfying regularity. of course i already knew ed's. and",,,,,,,,,,,,,,,,
x,1981,squishy,frog,", curdly dog; a mangy, mucky, squishy frog. let's put him in our brew and cook him up! macha",,,,,,,,,,,,,,,,
x,1999,large,frog,"from the air. the piata is of a large frog, crudely designed, with a long, relentless tongue. but if some",,,,,,,,,,,,,,,,
x,2004,attractive,frog,"behind his sleek green head. jerry was an attractive frog, really. striking. he had iridescent green skin dappled with bronze,",,,,,,,,,,,,,,,,
x,1941,big,frog,"contracts.   websterhe's certainly made himself the big frog in the little puddle around here, hasn't he? -- 85 --",,,,,,,,,,,,,,,,
,1907,old,sycamore,"far corner of the back yard where the cabin was, under a big old sycamore tree. i ricollect how the key creaked when mary turned it, and how",,,,,,,,,,,,,,,,
,1908,rare,butterfly,"am wondering if you have been able to secure a specimen of a very rare butterfly indeed, one which some naturalists believe is quite extinct. it is called'",,,,,,,,,,,,,,,,
,1909,large,antelope,"be the little forest-haunting liberian hippopot. amus. there are also stories of a large antelope, with a few white spots or markings, which has very disproportionately small horns",,,,,,,,,,,,,,,,
x,1894,double,geranium,"window i went to see, and there my double geranium stood to the right of her withered three. there, gazing in pride",,,,,,,,,,,,,,,,
,1909,big,lilac,"she walked out into the yard, until screened from the street by the big lilac bush. turning she faced toward his window. she waved a greeting. she",,,,,,,,,,,,,,,,
x,1965,brilliant,geranium,"freshness of turquoise, and even color schemes using brilliant geranium pink and regimental red are being experimented with. it's most heartening.",,,,,,,,,,,,,,,,
,1909,big,lilac,"best of repair. but the place was neat and clean, with a big lilac bush just inside the gate, giving it an air of home-like privacy; and",,,,,,,,,,,,,,,,
,1909,busy,squirrel,"back and forth upon the fallen leaves. only a dropping nut or a busy squirrel broke the exquisite peace of the forest, where the myriad life of the woods",,,,,,,,,,,,,,,,
x,1871,old,goose,"suppose anybody should come in! oh, you old goose of a tom -- let me go, i say.""""just",,,,,,,,,,,,,,,,
x,1884,large,goose,"john came in unsummoned, and carrying a fine large goose under each arm. bowing low:""i ish come to pring two",,,,,,,,,,,,,,,,
x,1898,selfish,goose,"looks as if you had been a careless, selfish goose, doesn't it now?""she went up to her own room",,,,,,,,,,,,,,,,
x,1899,old,goose,? they all did it. never was an old goose known to stay behind when the call came. that voice was louder and,,,,,,,,,,,,,,,,
x,1904,old,goose,on the rake. dal gilmor has got a old goose whitch is more then 30 years old. i bet he is tuf.,,,,,,,,,,,,,,,,
x,1907,old,goose,"why, daddy crow, you silly old goose! you're almost crying!""""what's that? now,",,,,,,,,,,,,,,,,
x,1911,old,goose,"glass, were soon floating about; and the old goose, the gander, and all the goslings went down the bank in a",,,,,,,,,,,,,,,,
x,1911,old,goose,"up behind, flapping her apron. then the old goose and the gander and all the little goslings started slowly along the road for",,,,,,,,,,,,,,,,
x,1916,old,goose,"shan't go. i wouldn't give the old goose the satisfaction of going to his fiesta.""""meaning the noble and",,,,,,,,,,,,,,,,
x,1916,jealous,goose,"it must be admitted.""i'm a jealous goose!""said she sternly to herself, and fell to helping her cousin",,,,,,,,,,,,,,,,
x,1917,old,goose,"uncle wiggily met grandfather goosey gander, the nice old goose gentleman, and the two friends walked on together, talking about how much",,,,,,,,,,,,,,,,
x,1917,old,goose,"resumed her kissing of his fingers.""silly old goose,""she murmured;""big old silly goose. just because he",,,,,,,,,,,,,,,,
x,1961,old,goose,thomas jefferson carry on a massive correspondence with an old goose quill? and most of it just to exchange ideas! he picked off,,,,,,,,,,,,,,,,
x,1993,old,goose,"hope was deceived. within a minute, the old goose landed in the bakery, hissing and panting, with mother and brinker in",,,,,,,,,,,,,,,,
x,2004,lovable,goose,"firth is again a big, stuffed, curiously lovable goose. and bridget jones: the edge of reason is, if not better",,,,,,,,,,,,,,,,
x,1917,old,goose,"..... frontispiece  silly old goose,""she murmured. carol, with an inarticulate sob, gathered her",,,,,,,,,,,,,,,,
x,1832,old,grasshopper,", and good wine warm the blood of an old grasshopper like me, and set him to chirping, if he can do nothing",,,,,,,,,,,,,,,,
,1910,giant,salamander,"should get in time the bony five-toed limb. we have many of these giant salamander forms in the rocks. the reptile now evolved from the amphibian, and a",,,,,,,,,,,,,,,,
,1911,big,sycamore,"off to care to listen longer to the talkative landlord.""see that big sycamore over yonder?""and the landlord pointed through the open door to where a",,,,,,,,,,,,,,,,
x,1850,large,grasshopper,"thought it was.""it looks like a large grasshopper,""said john.""it is the locust of the east,",,,,,,,,,,,,,,,,
x,1882,good,grasshopper,"the way, how would you like a real good grasshopper?""""too hot a day for the saddle,""said ting-a-ling",,,,,,,,,,,,,,,,
x,1887,dull,grasshopper,"air with butterflies like blooming flower-seeds, till the dull grasshopper sprung half a man's height up, and hung tranced in the heat",,,,,,,,,,,,,,,,
,1912,big,butterfly,"he and the grasshopper were walking along again, they saw a beautiful, big butterfly sitting on a tall, yellow poppy. it was quite still. so billy",,,,,,,,,,,,,,,,
,1912,different,butterfly,"to conceive the greatness of a being who could devise and colour all those different butterfly wings. i would try to decide whether he created the birds, flowers,",,,,,,,,,,,,,,,,
x,1969,big,grasshopper,. run by some gook who looks like a big grasshopper. we got the drum unhitched and were just about to bring it here,,,,,,,,,,,,,,,,
,1912,beautiful,butterfly,", my first papilio turnus. the yellow one was the largest, most beautiful butterfly i ever had seen. i was carrying them, one between each thumb and",,,,,,,,,,,,,,,,
x,1999,old,grasshopper,"favorite station. mr. freeman is ugly. big old grasshopper body, like a stilt-walking circus guy. nose like a credit card sunk",,,,,,,,,,,,,,,,
,1912,beautiful,butterfly,"toe with a dock leaf and some grass? i've killed the most beautiful butterfly, and i know i won't be forgiven!""i opened my tightly",,,,,,,,,,,,,,,,
,1912,beautiful,butterfly,"n't do any good,""i wailed.""it was the most beautiful butterfly, and i've broken it all to pieces. it must have taken god",,,,,,,,,,,,,,,,
,1912,old,chestnut,call of his memory. he seemed to be standing once more beneath the old chestnut grove where they had plighted their troth in the twilight under the stars; while,,,,,,,,,,,,,,,,
,1912,big,cottonwood,"a walk, until they arrived directly underneath a big cottonwood, which stood in sinister readiness.""here's your last chance,",,,,,,,,,,,,,,,,
,1912,big,cottonwood,. the meeting-place of the men was under a big cottonwood that stood by the bank of the little stream curving past the bar t.,,,,,,,,,,,,,,,,
,1912,large,elm,", and then i stood horrified, for my cecropia was sailing over a large elm tree in a corner of the orchard, and for a block my gaze followed",,,,,,,,,,,,,,,,
x,1977,old,grizzly,") p. 115 sam houston stop growling like an old grizzly bear, smith! speak, man. erastus smith santa anna has divided",,,,,,,,,,,,,,,,
x,2003,big,grouse,"of u.s. 2, the whole state is one big grouse covert,""says bill pierce of the maine department of inland fisheries and",,,,,,,,,,,,,,,,
x,1964,big,hackberry,", we could see their lights turn at the big hackberry tree where the trail led up to the wood lots and the timber stands",,,,,,,,,,,,,,,,
,1912,old,lilac,". i started right then and got results, for he stopped under the old lilac bush that leans over my side gate and kissed my hand. old lilac shook",,,,,,,,,,,,,,,,
x,1867,old,hare,"charge the enemy; but it is only an old hare that has jumped up, and the whole brigade is hot upon the trail",,,,,,,,,,,,,,,,
x,1905,long-legged,hare,"the patagonian cavy, which looks like a weird long-legged hare, and of which there are always examples in the gardens, and of",,,,,,,,,,,,,,,,
x,1946,big,hare,"that the eyes filled, a hunger for the big hare hills and the streams running through the cottonwood and, far off and fair",,,,,,,,,,,,,,,,
,1912,old,lilac,old lilac bush that leans over my side gate and kissed my hand. old lilac shook a laugh of perfume all over us and i believe signaled the event at,,,,,,,,,,,,,,,,
x,1898,acrobatic,harlequin,"keen they almost sting the onlooker, and the acrobatic harlequin gyrating show he makes of himself turns one giddy to see. the gray",,,,,,,,,,,,,,,,
x,1914,new,harlequin,and they join in shouts of applause as each new harlequin steps upon the stage. they forget that it is as dangerous to praise,,,,,,,,,,,,,,,,
x,1939,loud,hawk,"toweling his head went over to the rail and cleared his throat in a loud hawk that made everybody look at him.""got some sand,""he said",,,,,,,,,,,,,,,,
x,1972,old,hawk,"they are burning people for saying much less, in england, with that old hawk, arundel, watching! and he is archbishop! i hate him, too",,,,,,,,,,,,,,,,
x,1992,old,hawk,"well as an""old hawk""in the wasted body. while the old hawk""cleaned his bly's bones more than once,""bly sees the young",,,,,,,,,,,,,,,,
x,2004,sharp,hawk,", past the pool, toward the rising sun and merlin. # with sharp hawk eyes she saw he had already risen, and was waiting for her in the",,,,,,,,,,,,,,,,
,1912,large,porcupine,", large lizards (varanus), various apes and monkeys, and a large porcupine (hestrix crassispinus), and several small mammals, such as otters (lutra",,,,,,,,,,,,,,,,
,1912,fine,thistle,"cameras, and high hopes in my heart, i passed an unsuually large fine thistle, with half a dozen thysbe moths fluttering over it as if nearly crazed with",,,,,,,,,,,,,,,,
,1913,big,grasshopper,", waiting for something, when along came the big grasshopper in a hesitating, uncertain manner of flight. as it hovered above the",,,,,,,,,,,,,,,,
,1913,big,grizzly,"from among those loose rocks there? a great big grizzly bear; and making straight for the pack mule, sniffing the air as",,,,,,,,,,,,,,,,
,1914,gorgeous,butterfly,"buzzard floated with uptilted wings above the sparse woodland to the west. a gorgeous butterfly, silver-spangled, winged its way over the saw palmetto and sedge between the trees",,,,,,,,,,,,,,,,
,1914,inquisitive,lizard,"to amuse himself, until he fell asleep, watching the antics of an inquisitive lizard which in turn was watching him from a crack in the sun-baked adobe wall.",,,,,,,,,,,,,,,,
,1914,brilliant,lizard,"alligator. so dense and dark this terrible haunt of snake and bird and brilliant lizard that carl shuddered, but keela, dismounting, tethered her horses to the nearest",,,,,,,,,,,,,,,,
,1914,big,sycamore,"advanced toward the two children, who had come to a halt under a big sycamore. then, as alice was about to call, she uttered an exclamation of",,,,,,,,,,,,,,,,
,1914,old,sycamore,", at the foot of the late calvin humphries' lane.""an old sycamore tree, whose great girth gives evidence of the centuries it has seen, stands",,,,,,,,,,,,,,,,
,1914,old,sycamore,", doubtless the hilarity of the travelers increased; and by the time the old sycamore was sighted, it was a gay, though weary, procession that turned into",,,,,,,,,,,,,,,,
,1915,graceful,antelope,"not often, they were overtaken and devoured on the spot. bands of graceful antelope bounded out of our way, stopping on a knoll to watch the strange procession",,,,,,,,,,,,,,,,
,1916,wonderful,cactus,of the room. bud tanner got me some wonderful cactus blossoms for my brass bowl. i wish i could send you some.,,,,,,,,,,,,,,,,
,1916,brilliant,lilac,"clear, green foliage and the highly colored petals. quite un-english is the brilliant lilac seen in two of the flowers. josiah spode, jr., was a potter",,,,,,,,,,,,,,,,
x,1902,old,hemlock,"into its great seams? the writer has seen old hemlock logs, in the forests, covered with ferns and with innumerable tiny seedlings",,,,,,,,,,,,,,,,
,1916,big,lizard,"there was no profit in it, it must have been sport. the big lizard took himself off at a leisurely gait, and i went on through to the",,,,,,,,,,,,,,,,
x,1929,preferred,hemlock,"ontario, but never made himself believe that he preferred hemlock bows to a mattress. he was common sense apotheosized. # his wife",,,,,,,,,,,,,,,,
x,1933,old,hemlock,"beneath the shade tree, soon recognizable as an old hemlock, were a table and two benches of pine logs. the smoke from",,,,,,,,,,,,,,,,
x,1933,skillful,hemlock,", and the deerhound kennels were all concealed by skillful hemlock planting.""mistuh bo'den is expecting of you, suh.""the",,,,,,,,,,,,,,,,
,1917,big,lilac,"the road -- you were standing near the gate -- madeline nods -- that big lilac bush behind you -- there'd been a shower and""the sun had come",,,,,,,,,,,,,,,,
x,1950,big,hemlock,"off again to the bleak woods, to the big hemlock clearing where the arms hung that cracked the useless bones, that put the",,,,,,,,,,,,,,,,
,1918,big,elm,"our german neighbors and to admire their catalpa grove, or to see the big elm tree that grew up out of a deep crack in the earth and had a",,,,,,,,,,,,,,,,
,1918,big,elm,"she walked across the road, set the telescope on the grass under a big elm tree, and sat down beside it.""i find i am rather tired",,,,,,,,,,,,,,,,
,1919,big,chestnut,to the tree where he insists he left his stick. it is a big chestnut some hundred and fifty feet beyond the point where the ravine turns west. it,,,,,,,,,,,,,,,,
,1919,old,cypress,"disappeared behind one of the small thick clumps of old cypress trees draped with great curtains of spanish moss, which mark the presence of",,,,,,,,,,,,,,,,
x,1866,powerful,herbaceous,", nodded, and seemed to exhale a more powerful herbaceous odor.""mayhap, then, you' ll take a bit of",,,,,,,,,,,,,,,,
,1919,perfect,lilac,spring. her eyes drank in its beauty and then fell on two huge perfect lilac plumes on the bush nearest her. they were larger and lovelier than her own,,,,,,,,,,,,,,,,
x,1929,typical,herbaceous,"same reason, and with the same exceptions, typical herbaceous crops are those which can make their vegetative growth during the wet cool season",,,,,,,,,,,,,,,,
x,1943,successful,herbaceous,"crops) long-range plane transport is virtually essential to successful herbaceous migration, just as it is beneial to migration of live semen and insect",,,,,,,,,,,,,,,,
x,1969,thoughtful,heron,"by a huge ornate antique pool table. harvey underwood, who resembled a thoughtful heron, wearing his usual meditative look and inevitable english tweeds, was arranging three balls",,,,,,,,,,,,,,,,
,1920,big,birch,"mid-victorian way. disgusting!""cy bogart lay between the roots of a big birch, smoking his pipe and teasing fern, assuring her that a week from now",,,,,,,,,,,,,,,,
,1920,rare,butterfly,"not move or speak: it was as if her words had been some rare butterfly that the least motion might drive off on startled wings, but that might gather",,,,,,,,,,,,,,,,
,1920,perfect,butterfly,adventure may be to pursue a new bird and the conquest to mount a perfect butterfly. but every boy has muscles and lungs which need the primitive joys and violent,,,,,,,,,,,,,,,,
,1920,old,chestnut,far away. the three happy children could see them way up in the old chestnut tree over on the edge of their neighbour's wood. in the fork of,,,,,,,,,,,,,,,,
,1920,native,chestnut,creeks flowing between masses of vegetation riotously spreading over swampy lowlands. high over native chestnut trees climbed and rambled the flowering pohue (convolvulus); along the highway an,,,,,,,,,,,,,,,,
,1920,tall,elm,"wind, and in the clear starlight rebecca could see the shadows of the tall elm tree near the blacksmith shop, and the silvery line of the softly flowing river",,,,,,,,,,,,,,,,
x,1997,old,heron,that he had become lonesome and estranged from all around him as a sad old heron standing pointless watch in the mudflats of a pond lacking frogs. it seemed a,,,,,,,,,,,,,,,,
,1920,old,geranium,tamarisk and poppies and trellised roses and one woody old geranium with a stalk like a crab-apple trunk and growth enough to cover half a,,,,,,,,,,,,,,,,
,1920,beautiful,oriole,"can hear the three happy children blowing the willow whistles, and maybe the beautiful oriole will answer back. good-night. seventh night mr. scarecrow under the big oak",,,,,,,,,,,,,,,,
,1920,solitary,sycamore,"; and with this object i tethered her by the long riata to a solitary sycamore which stood in the centre of the road, the crossing of two frequented thoroughfares",,,,,,,,,,,,,,,,
