removed,year,adjective,keyword,text,,,,,,,,,,,,,,,,
x,1953,usual,albatross,"a bird flying near us. in case it was something different from the usual albatross, up john would go -- then conveniently forget to come back. when i",,,,,,,,,,,,,,,,
x,1983,Big,albatross,"bang!? and the birds filthy with ash scatter off the floes. big albatross all black and stunned, sink fer swimmin'! that black giant ram's",,,,,,,,,,,,,,,,
x,1907,delectable,ambrosia,"prop it up, the last idol of our youth toppled over: the delectable ambrosia these many years accepted as typifying? nay, glorifying? the high culture of",,,,,,,,,,,,,,,,
x,2002,fragrant,ambrosia,tried to pick up where she had left off. # try our new fragrant ambrosia flavor. to drown # she switched the channel. # would you kindly spin,,,,,,,,,,,,,,,,
,1820,graceful,butterfly,"in my bower, almora still will live for you. be thou the graceful butterfly, that flutters o'er yon gay parterre, the changeless amarantha, i will wait",,,,,,,,,,,,,,,,
,1824,beautiful,lizard,"no other interruption than the rapid movement, now and then, of a beautiful lizard, which he has startled from basking in the sunshine. the still sea at",,,,,,,,,,,,,,,,
x,1870,fine-looking,antelope,"discussion, had been altogether overlooked. during the afternoon they had shot a fine-looking antelope, cooking a portion at the time upon the prairie. a goodly portion was",,,,,,,,,,,,,,,,
x,1874,large,antelope,"of quat kare and his shillooks. shot two geese and knocked over a large antelope, but lost him in the high grass. the country is all flooded,",,,,,,,,,,,,,,,,
,1827,solitary,birch,"hunters and hackwoodsmen to this wild and independent sort of life. amidst these solitary birch woods, whose stillness was seldom disturbed hy a deer, or even a hird",,,,,,,,,,,,,,,,
x,1875,famous,antelope,"his fame as a hunter and anxious to have the honor of killing the famous antelope, and he ran up with the intention of killing togo-av; but when he",,,,,,,,,,,,,,,,
x,1881,famous,antelope,"fame as a hunter, and anxious to have the honor of killing this famous antelope, and he ran up with the intention of killing to-go' -a; but",,,,,,,,,,,,,,,,
,1827,expectant,raven,"distant and stifled groans of the dying courser, or the cry of some expectant raven eager for the repast ere its victim yielded to death as it flapped its wings",,,,,,,,,,,,,,,,
x,1884,fat,antelope,"at the stables unstrapping from the back of his sorrel the carcass of a fat antelope, gave a low whistle, remarked,""well, i'm damned!",,,,,,,,,,,,,,,,
x,1905,sleek,antelope,"city of men the insect had ever visited. just within the gate a sleek antelope was running a pop-corn stand, and a little further on a screech-owl stood upon",,,,,,,,,,,,,,,,
,1829,broad,sycamore,my absence.' the lovers were standing partly in the shadow of a broad sycamore that threw its branches over the little stream at their feet. the water there,,,,,,,,,,,,,,,,
,1831,fragrant,birch,"murdered traveller's bones were found, far down a narrow glen. the fragrant birch, above him, hung her tassels in the sky; and many a vernal",,,,,,,,,,,,,,,,
x,1911,new,antelope,"with the rabbit's foot, and starts along after me, with that new antelope walk of hers, as easy and pleased as if she'd been asked to",,,,,,,,,,,,,,,,
,1831,fragrant,birch,"murdered traveller's bones were found, far down a narrow glen. the fragrant birch, above him, hung her tassels in the sky; and many a vernal",,,,,,,,,,,,,,,,
x,1924,large,antelope,"with us, we fared better than on the journey out, bagging two large antelope not a half-mile from the harbor; so with our game and our prisoner we",,,,,,,,,,,,,,,,
x,1942,native,antelope,"mixture of raw liver, heart, kidneys and blood of a guanaco (native antelope). the spartans are still held up as the ideal hardy men. the",,,,,,,,,,,,,,,,
x,1955,big,antelope,"some eland straps -- very strong and supple, from the skin of the big antelope -- so that she can carry more firewood and potato tops and banana fronds.",,,,,,,,,,,,,,,,
x,1957,foolish,antelope,"a stick or lie on his back and thrust a foot up and the foolish antelope would race round and round it in a steadily narrowing circle, until it was",,,,,,,,,,,,,,,,
x,1964,fat,antelope,"; her eyes was like little seeds. set a fat girl to catch fat antelope, was the idea. them braves that still kept their horses now mounted,",,,,,,,,,,,,,,,,
x,1970,large,antelope,big toes. they each carry a large gourd-like rattle and one holds a large antelope drum which he pounds in a steady rhythm. their chins are outlined by a,,,,,,,,,,,,,,,,
,1831,brilliant,butterfly,"in their abuse-till he is condemned, who paints the rose, gilds the brilliant butterfly, spreads over the heavens the purple hues of sunset, and tunes the voice",,,,,,,,,,,,,,,,
,1831,old,hemlock,", and stood leaning in the shadow of an old hemlock, just on the summit of the hill. his brow was uncovered,",,,,,,,,,,,,,,,,
,1832,large,chestnut,"did not run many paces before they halted at the root of a large chestnut that threw its aged and ponderous branches over an extensive surface, and whose distant",,,,,,,,,,,,,,,,
x,1834,solitary,antelope,"on the rio del norte, with no game but here and there a solitary antelope, with no water except in here and there a hole, and with its",,,,,,,,,,,,,,,,
x,1900,old,badger,"away all the grateful memoirs of his youth,""why did this cool old badger, worthington, take me to his home, later back me through college,",,,,,,,,,,,,,,,,
x,1932,old,badger,"sim glared at harper.""war ye alludin' to me as a old badger, harper?""""i was,""replied harper.""just in",,,,,,,,,,,,,,,,
x,1932,old,badger,"bout a couple o' ounces a day,' nough to keep a old badger like me in grub. i ain't what ye might call a spendin'",,,,,,,,,,,,,,,,
x,1941,old,badger,"their mounts into a dead run across the **30;1760;toolong plain. (""de old badger, he don't have to dig dem gophers out,""johnny hooks says",,,,,,,,,,,,,,,,
x,1956,old,badger,"owl swooped and a tiny explosion of mouse-tracks scuttled to tree roots. the old badger grunted in his sleep, and a rooster, roused by so much whiteness,",,,,,,,,,,,,,,,,
x,1993,old,badger,", who, at fifty-six, is mongolia's pre-eminent ornithologist, a rough old badger in dark glasses and brown business suit that he continued to wear (without the",,,,,,,,,,,,,,,,
x,1932,old,badger,"  good idea,""agreed harper.""rugg, if the old badger gets any meat you can carry it in for him.""leaning on the",,,,,,,,,,,,,,,,
,1832,old,sycamore,"and myself, that i am about to record. we had reached an old sycamore on the bank of the brook, and had thrown our lines into a deep",,,,,,,,,,,,,,,,
,1834,solitary,antelope,"manes floating, and a trampling like thunder. imagine here and there a solitary antelope, or, perhaps, a whole herd, fleeting off in the distance,",,,,,,,,,,,,,,,,
,1834,large,cottonwood,"encamped was wide and grassy, and shaded with large cottonwood. traveled this day near twenty miles, in a due south-east course.",,,,,,,,,,,,,,,,
,1834,big,hemlock,"across the hollow, when i came to a big hemlock, which was lying in the edge of a thicket of mountain cottonwood and",,,,,,,,,,,,,,,,
,1834,old,sycamore,"a private and a parting interview.""to-night, then, at the old sycamore, as the moon rises,""he whispered in her ear, as sadly",,,,,,,,,,,,,,,,
,1835,lofty,basswood,"the mountain ash, the aromatic hemlock and the lofty basswood. this sequestered retreat, with its fresh aspect and sweet exhalations, afforded",,,,,,,,,,,,,,,,
,1835,beautiful,butterfly,"dark purple wings, tipped with pale primrose color, and flew away a beautiful butterfly, such as the one i had been seduced by. the slips of grass",,,,,,,,,,,,,,,,
,1835,big,chestnut,"do. so, major, you will have to ride down to the big chestnut, on the bank of the river, just under the rock that we call",,,,,,,,,,,,,,,,
,1835,large,chestnut,"the huntsman the favor that spared his life. with the exception of a large chestnut near the edge of the cliff, and of some venerable oaks, that had",,,,,,,,,,,,,,,,
,1835,native,clematis,assisted two little barefoot girls to-day to train a native clematis (a pretty species) over the logs of their hut. there is,,,,,,,,,,,,,,,,
,1835,tall,cottonwood,leaves are massed and rotting below; and the tall cottonwood sighs mournfully in the wind; while the dark and sullen river rolls oii,,,,,,,,,,,,,,,,
,1835,old,cypress,see -- to the little pond just beyond that old cypress -- see the log half rolled into the pond -- look at the end,,,,,,,,,,,,,,,,
,1835,old,cypress,"they all gave back the emulous sounds. the old cypress had a voice from its hollow, the green bush from its shade,",,,,,,,,,,,,,,,,
,1835,old,hemlock,", and winging to his perch on the far-up old hemlock, where they may see his reverend white head gleaming like a snow-flake among",,,,,,,,,,,,,,,,
,1835,old,sycamore,"we wander by the branch, mary?""""yes, to the old sycamore; it seems an age since i have seen it.""occupied with their",,,,,,,,,,,,,,,,
,1835,old,sycamore,"the winding path through the orchard, and then along the branch to the old sycamore, they seemed, indeed, the proper living beings of such a scene.",,,,,,,,,,,,,,,,
,1836,solitary,warbler,"the lengthened pioupiou, which interrupt, like sighs, the music of that solitary warbler, without believing, that nature had revealed her adventure to the sublime la fontaine",,,,,,,,,,,,,,,,
,1838,large,sycamore,"instant a bolt of lightning shot from the heavens, and lighting upon a large sycamore which shaded a part of the temple court, clove it in twain. the",,,,,,,,,,,,,,,,
,1838,large,tortoise,", nevertheless, what greatly astonished us, that the islands abounded in the large tortoise of the gallipagos, one of which we saw in the canoe of too-wit.",,,,,,,,,,,,,,,,
,1839,old,chestnut,"guided them on their way. they soon arrived at a clump of fine old chestnut trees, whose gnarled and farspreading branches betokened sylvan antiquities of no ordinary worth.",,,,,,,,,,,,,,,,
,1839,large,hemlock,", and firmly bound to the body of a large hemlock, with his face turned to the tree. every thing being now in",,,,,,,,,,,,,,,,
,1839,old,hemlock,"' why, i calculate to be about this old hemlock till i get it down, colonel.' nonsense, you ninny!",,,,,,,,,,,,,,,,
,1839,beautiful,snake,"no attention, we were at length obliged to listen.""a most beautiful snake,""he declared,""was coming up to the back door.""",,,,,,,,,,,,,,,,
,1840,deep,hemlock,", when the luckless captive found himself traversing a deep hemlock forest, with""the spreading dew""for his guide. the indian",,,,,,,,,,,,,,,,
,1841,fragrant,birch,"the drooping branches, are interesting to the lover of nature.""the fragrant birch above him hung her tassels in the sky, and many a vernal blossom sprung",,,,,,,,,,,,,,,,
,1841,beautiful,chestnut,"esq., at newton centre, is a venerable, though still vigorous and beautiful chestnut tree, the dimensions of which are believed to exceed any tree of the same",,,,,,,,,,,,,,,,
,1841,masterful,cuckoo,", can not travel in it two: yonder masterful cuckoo crowds every egg out of the nest, quick or dead, except its",,,,,,,,,,,,,,,,
x,1928,big,basswood,"was that a nut which fell from the big basswood?  asked gabriel chipmunk. but jeremiah yellowbird did not know, so",,,,,,,,,,,,,,,,
x,1833,broad-brimmed,beaver,"a long column of humanity, of no thickness at all, with a broad-brimmed beaver on his head, and a sporting-jacket on his back; and a short,",,,,,,,,,,,,,,,,
x,1834,old,beaver,"be caught by bait. lewis once set his traps five nights for an old beaver, and for four nights the old fellow took away his bait-stick without springing the",,,,,,,,,,,,,,,,
x,1842,fine,beaver,"fronting the raised platform, were seated, cheek by jowl, gentlemen in fine beaver hats, and tatterdemalions, with no covering but their own matted and discordant locks",,,,,,,,,,,,,,,,
x,1843,broad-brimmed,beaver,".""pardon me, sir,""repeated the stranger, raising his broad-brimmed beaver from a head remarkable for what the phrenologist would call the uncommon developement of""",,,,,,,,,,,,,,,,
x,1845,new,beaver,"from frank stanwood with what grace he could, and putting on his shining new beaver, followed the impatient lady out of the store; his eye catching the triumphant",,,,,,,,,,,,,,,,
x,1851,new,beaver,it down into the bag. he now took off his hat -- a new beaver hat -- when i came nigh singing out with fresh surprise. there was no,,,,,,,,,,,,,,,,
x,1878,uplifted,beaver,"possibly deceive her. with proudly meek, magnificently lowly obeisance, under his uplifted beaver, he passed aside as if inclined to leave her. regardless of his coldness",,,,,,,,,,,,,,,,
x,1884,TRUE,beaver,"to each other in true beaver style. in this colony there was one young beaver, by the name of flat tail. his father, whose name was mud",,,,,,,,,,,,,,,,
x,1899,fine,beaver,"satisfied with their work and said:""very good. injun have much fine beaver this time. we will have beavers' tails for supper to-morrow night.""",,,,,,,,,,,,,,,,
x,1919,wonderful,beaver,"to these men. cheap and tawdry enough were the commodities bartered for these wonderful beaver and otter pelts -- ribbons and gewgaws, looking-glasses and combs, blankets and shawls",,,,,,,,,,,,,,,,
x,1931,large,beaver,"idea. i will fill my pockets.""the apothecary put on the large beaver hat which he wore only to weddings and funerals, and they set off down",,,,,,,,,,,,,,,,
x,1931,old,beaver,"new,""jacques went on anxiously.""he's just my little old beaver the sailor made me, but he could keep i the baby warm. i",,,,,,,,,,,,,,,,
x,1932,good,beaver,"chimney and hissed in the fire. the plus was the value of one good beaver skin, the monetary unit of the northwest fur company. all other values were",,,,,,,,,,,,,,,,
x,1937,moth-eaten,beaver,"fishing tackle, still were about. and nailed upon the wall was a moth-eaten beaver skin that fentonhad trapped as a boy and always kept because of the curious streak",,,,,,,,,,,,,,,,
x,1937,moth-eaten,beaver,"her as she laboriouslycrossed back and forth over the foot-bridge, lovingly toting the moth-eaten beaver skin with the white mark, snarls of fishing tackle, old books, boots",,,,,,,,,,,,,,,,
x,1945,big,beaver,"wind turned laurie's cheeks to crimson, and though she must clutch her big beaver bonnet with her gloved hand or hold down her whirling skirts, she laughed with",,,,,,,,,,,,,,,,
x,1947,beautiful,beaver,"be silly! of course she did. but that christmasshe gave me a beautiful beaver coat, and when i said i couldn't take it, i would not",,,,,,,,,,,,,,,,
x,1949,wide,beaver,"paco laughed. it irritated the little white, who was sweating under his wide beaver hat, and breathing hard.""you help the monos prop them while we",,,,,,,,,,,,,,,,
x,1952,broad,beaver,"into the arena. they sat solid and round-shouldered on their nags, the broad beaver hats with the chin straps cocked on their heads, lances in their right hands",,,,,,,,,,,,,,,,
x,1955,old,beaver,"the staterooms softly and peering in: the ohio, the virginia (an old beaver hat and a bundle of travelling menagerie posters still lay on the bunk) and",,,,,,,,,,,,,,,,
x,1957,eager,beaver,"new law into full effect. # received publisher malcolm forbes, 37, eager beaver new jersey republican candidate for governor, and his photogenic family (four sons,",,,,,,,,,,,,,,,,
x,1974,eager,beaver,"a weasel and says""hubba, hubba, hubba""dutifully like an eager beaver. (""mr. forgione says nice things about me now,""he disclosesto",,,,,,,,,,,,,,,,
x,1978,eager,beaver,", and got a job working in program analysis. i was a young eager beaver, and one thing led to another. i was exposed to city hall.",,,,,,,,,,,,,,,,
x,1981,eager,beaver,"around kicking at people.""the captain was antsy anyway, a real eager beaver when you got right down to it look-ing for his purple hearts and his medals",,,,,,,,,,,,,,,,
x,2000,big,beaver,they end up with swollen tissue in the breasts. it's like one big beaver dam and nothing can move. the baby can only get a little milk out,,,,,,,,,,,,,,,,
x,2000,old,beaver,"a narrow inlet. there were cattails here, and the wreck of an old beaver dam, but my boat was steady in the water and nimble, and i",,,,,,,,,,,,,,,,
x,2002,eager,beaver,"had been, the challenge in his look similar.""oh-ho, an eager beaver here,""i replied. i must admit that i was impressed by such",,,,,,,,,,,,,,,,
x,2009,high-crowned,beaver,"and spun around. the man behind her stopped. he swept off his high-crowned beaver hat and bowed. #""lady farnham?""he inquired, his tone",,,,,,,,,,,,,,,,
,1841,large,grasshopper,". one of the shawanoe children having caught a large grasshopper, a dispute arose with some of the delaware children, in regard to",,,,,,,,,,,,,,,,
x,1853,observant,bee,"observant bee keeper is so well acquainted. some apiarians have supposed that the queen bee has the power to regulate the development of eggs in her ovaries, so that",,,,,,,,,,,,,,,,
x,1858,mental,bee,"are getting their honey. so is the rhythm of the measure to the mental bee, as it stores a little sweetness in its hive. i think i am",,,,,,,,,,,,,,,,
,1843,bright,geranium,"cones of the cedar; and the pansy and bright geranium live not alone for beauty, nor the waxen flower of the arbute,",,,,,,,,,,,,,,,,
x,1868,busy,bee,"mild effort to stem this theory by his little ditty be-ginninghow dotb tbe little busy bee, but it has had almost no influence against the first and most powerful teaching",,,,,,,,,,,,,,,,
x,1869,busy,bee,"esteem, and might have served as an example to dr. watts'""busy bee,""in the zeal with which he improved his""shining hours,""",,,,,,,,,,,,,,,,
x,1873,busy,bee,"illustrations, from drawings by sol eytinge. page""how doth the little busy bee""vignette. christie 1 aunt betsey's interlarded speech 4 mrs. stuart 18 hepsey",,,,,,,,,,,,,,,,
x,1881,big,bee,"' big bird rob en little bird sing, de big bee zoon en little bee sting, de little man lead en big hoss foller -- kin you tell w'at",,,,,,,,,,,,,,,,
x,1881,big,bee,"did:""' de big bird rob en little bird sing; de big bee zoon en little bee sting, de little man lead en big hoss foller --",,,,,,,,,,,,,,,,
,1843,old,owl,"and midway, in the crumbling body of a dead ash tree sits an old owl, with his broad, goggling eyes, and the dry, white moss gathered",,,,,,,,,,,,,,,,
x,1887,fine,bee,"we were helping him. one day we told him we had found a fine bee tree which could be cut down in a few minutes, and that if he",,,,,,,,,,,,,,,,
x,1889,busy,bee,"any purpose by thorough self-culture, by assimilation, digestion, meditation. the busy bee is a favorite simile with us, and we are apt to overlook the fact",,,,,,,,,,,,,,,,
x,1905,excellent,bee,collect very largely from your raspberry fields. the mountain ash is also an excellent bee tree; and it also furnishes a large amount of bird food. why not,,,,,,,,,,,,,,,,
x,1909,busy,bee,"not having the courage or the industry of our neighbor who works like a busy bee in the world of men and books, searching with the sweat of his brow",,,,,,,,,,,,,,,,
x,1909,busy,bee,"far as it goes. go on, child! how doth the little busy bee improve -- rosie how doth the little busthy bee improve. teacher improve each shining",,,,,,,,,,,,,,,,
x,1924,solitary,bee,"street by street, story by story, from the rude single cell of solitary bee, prosopis, this city of the social bees has been evolved across the ages",,,,,,,,,,,,,,,,
x,1927,venerable,bee,". # train # in orange, n. j., one louis pruden, venerable bee farmer of whippany, n. j., stood in the middle of the railroad track",,,,,,,,,,,,,,,,
x,1945,big,bee,"we looked at each other, surprised and laughing.""that was a big bee,""my mother joked. |""it was a bird,""i",,,,,,,,,,,,,,,,
x,1957,busy,bee,", piping in a high, squeaky voice,""i'm a little busy bee,""he was quite sure that they had notp225really liked the song, or",,,,,,,,,,,,,,,,
x,1989,busy,bee,"boy who won first prize playing a tricky violin song that sounded like a busy bee. after the show, the hsus, the jongs, and the st. clairs",,,,,,,,,,,,,,,,
x,1864,big,bee,"'s turn he said, --""the big bee flies high, the little bee makes the honey: the black folks make the cotton, and the white folks",,,,,,,,,,,,,,,,
x,1848,transfixed,beetle,"like a case -- and reminding you of a transfixed beetle, dangling its broken legs in the air. a looking glass too,",,,,,,,,,,,,,,,,
x,1862,new,beetle,"wolf, book a new plant, bag a new beetle, and then, reclining on the lonely prairie, talk our breakfast,",,,,,,,,,,,,,,,,
x,1884,one-eyed,beetle,"the happy boys and girls, looking for a one-eyed beetle and a four-leaved clover. the clover was soon found, but it was",,,,,,,,,,,,,,,,
x,1884,one-eyed,beetle,"the end of the rainbow, he took our one-eyed beetle, and gave the four-leaved clover to a pickaninny. together they took them",,,,,,,,,,,,,,,,
x,1884,one-eyed,beetle,"around on top of it. we showed the one-eyed beetle and the four-leaved clover, and the garuly immediately hit the gate a ringing",,,,,,,,,,,,,,,,
x,1917,polite,beetle,and had often said to her that a really polite beetle never boasts about her own accomplishments. the little brown beetle never boasted a,,,,,,,,,,,,,,,,
,1843,playful,squirrel,"? -- after resting the full hour i had been in chase of a playful squirrel, starting off at the crack of the rifle, and trying to prove by",,,,,,,,,,,,,,,,
x,1922,big,beetle,"carefully lifted off the glass lid and let the big beetle climb out upon his finger.""ladybug, ladybug, fly away home",,,,,,,,,,,,,,,,
,1844,rosy,lilac,"will produce, no doubt, many fine varieties. camaieu is a pretty rosy lilac, distinctly striped with blush white, perfectly double, always opening well. font",,,,,,,,,,,,,,,,
x,1946,big,beetle,"the window screen back of the light. a big beetle, a horned one, was trying to get in. all at once",,,,,,,,,,,,,,,,
,1844,rosy,lilac,"mathilde de mondeville is one of the sweetest of roses, of a delicate rosy lilac fading to blush, and blooms profusely. painted damask, in some soils may",,,,,,,,,,,,,,,,
x,1974,giant,beetle,papa!' charlotte cried. look at that giant beetle coming to consume us.' the way she pronounced the word consume captivated,,,,,,,,,,,,,,,,
x,1997,luminous,beetle,"the swing creaks on austin's porch, a luminous beetle swings ferociously over the clematis, insects swarm to the golden holocaust of the",,,,,,,,,,,,,,,,
,1845,large,grasshopper,"to the wind was 370 miles distant, a large grasshopper flew on board. more than once, when the ship was in the",,,,,,,,,,,,,,,,
x,1999,believable,beetle,"a little bigger, and you have a highly believable beetle; bigger still, a cricket or hopper. rubber legs give this pattern",,,,,,,,,,,,,,,,
x,2000,large,beetle,"'s ancestral home, he's looking at a large beetle that zeros in on the roots. (it hasn't made it to",,,,,,,,,,,,,,,,
,1846,bright,butterfly,"his wanderings in the woods and fields. it might be fancied that the bright butterfly, which had come so spirit-like into the window as owen sat with the rude",,,,,,,,,,,,,,,,
,1846,lofty,chestnut,in life-blood through every leaf. orange and umbered brown no longer clothed the lofty chestnut or the drooping elm. the gnarled oaks stretched their scorbutic arms; the frozen,,,,,,,,,,,,,,,,
,1846,large,cypress,"cast over an angle of the wall by a large cypress. i seized the arm of cassius, to check his speech""--",,,,,,,,,,,,,,,,
x,1847,old,birch,"have neglected; the garden gate off the hinges; the limbs of the old birch tree broken down for firewood; the back windows ornamented with an old hat,",,,,,,,,,,,,,,,,
,1846,brilliant,lizard,", and wait for all things to come to me?""even the brilliant lizard, when he crawled over his bark, or twined about his stems, roused",,,,,,,,,,,,,,,,
x,1851,old,birch,"exposed when the water has subsided. the best plan is to take an old birch broom, or anything similar, and, laying it down near the root,",,,,,,,,,,,,,,,,
x,1853,large,birch,", and is represented as very superior. while here, there arrive a large birch canoe and a boat, full of chippeways of the anse. one of them",,,,,,,,,,,,,,,,
x,1858,fragrant,birch,"in venison served up in silver dishes, in costly china, and on fragrant birch bark; we have tried it when relying upon its natural sweetness for its flavor",,,,,,,,,,,,,,,,
,1846,beautiful,lizard,"and weeping dryads threw mosses and green garlands over the decaying roots. a beautiful lizard, with bright metallic hues, glided about on the trees and temples of herculaneum",,,,,,,,,,,,,,,,
,1846,bright,oriole,"of strength and peace to cheer life's slow decline...... there the bright oriole built his airy home, pendent from slender bough, beyond the hope of truant",,,,,,,,,,,,,,,,
,1846,large,wolf,"his mind than intended for the car of the trumpeter. it is a large wolf, effendi l' said the man as he drew near and gazed on the",,,,,,,,,,,,,,,,
x,1875,large,birch,"a singular and a beautiful spectacle, which was presented by this flock of large birch canoes, eight or ten in number, filled with indians, and frenchmen in",,,,,,,,,,,,,,,,
x,1875,large,birch,"the timid women and children kept cautiously in the distance. eight or ten large birch canoes, from which more than fifty persons landed upon the beach, presented a",,,,,,,,,,,,,,,,
,1847,old,sycamore,"distant home, just a few paces from the village path, where the old sycamore stands, your daughter comes to the window, and looking upon the very moon",,,,,,,,,,,,,,,,
,1848,native,buckeye,". i saw hundreds of acres covered with the native buckeye, the most beautiful tree of the forest -- if, indeed, any",,,,,,,,,,,,,,,,
,1848,strong,cypress,"palm, so lone in its majesty; the strong cypress, so big, in every inch of its rugged bark, with the",,,,,,,,,,,,,,,,
x,1895,graceful,birch,"matting so closely woven from rushes as to be thoroughly rain-proof. scores of graceful birch canoes, such as the northern tribes excel in making, were drawn up on",,,,,,,,,,,,,,,,
