removed,year,adjective,keyword,text,,,,,,,,,,,,,,,,
,1941,large,lizard,"locomotion alternatingly, according to fancy or to circumstances. a living and fairly large lizard from australia had come to light (chlamydosaurus), which walked on all fours",,,,,,,,,,,,,,,,
,1941,big,lizard,"her, but the dog was actually smaller than the reptile, and the big lizard simply half rose and hissed at her. wriggles was charmed. she approached closer",,,,,,,,,,,,,,,,
x,1891,elegant,otter,"in""a season in sutherland""), that he once found an elegant otter, a well-made engine of some unscrupulous tourist, lying in the bottom of the",,,,,,,,,,,,,,,,
x,1897,big,otter,"this.""beth thought her father looked so brave and noble in that big otter overcoat, and his long white beard flowing down. she opened the door for",,,,,,,,,,,,,,,,
,1941,stealthy,skunk,"predatory world, she is an easy mark for the wily weasel and the stealthy skunk. all the same, she sets a pattern of industry for the nation in",,,,,,,,,,,,,,,,
x,1901,big,otter,"and smoothed it all down, and hid it away -- to stretch the big otter' s skin upon when i should catch him. when november came, and",,,,,,,,,,,,,,,,
,1941,native,wild,"to washington, d.c., in the space of two years. the pure-blood native wild horse of the pampas, is as scarce in the pampas today, as is",,,,,,,,,,,,,,,,
,1942,old,chestnut,the emergency rose too suddenly to permit the mitten to be removed. the old chestnut tree that had been struck by lightning four times was the north pole. the,,,,,,,,,,,,,,,,
,1943,tall,lilac,", fretworkon the porch where the bare twigs of the wistaria writhed, the tall lilac bushes, the curtained windows -- she knew so well just what she could see",,,,,,,,,,,,,,,,
x,1974,beautiful,otter,"abalone. i moved away and down came""white face,""a beautiful otter with a long white cape. he bristled with enthusiasm at the prospect of the",,,,,,,,,,,,,,,,
x,1997,favorite,otter,"can deteriorate from the warm water. when the kelp goes, so do favorite otter prey species such as turban snails and kelp crabs.""# faurot-daniels said research",,,,,,,,,,,,,,,,
x,2002,likely,otter,"canoes, we stop, a half mile across the river from the most likely otter dens, to await the daylight. the foghorn-like humming of curassow birds begins to",,,,,,,,,,,,,,,,
x,2002,sleek,otter,"an old tarzan movie went through his head, johnny weissmuller speeding like a sleek otter through the water, and after a while the rafts appeared to be a little",,,,,,,,,,,,,,,,
x,2002,typical,otter,"the squeeze from ever diminishing rain forests. although the home range of a typical otter family is only about 270 acres, they need thousands of acres to thrive.",,,,,,,,,,,,,,,,
x,1922,old,owl,"face gave way to a smile.""o doug! doug! you old owl! what's the matter with you? after all, it's good to",,,,,,,,,,,,,,,,
,1944,strong,chestnut,"the first christian martyr is celebrated by chopping down the maio, a fine strong chestnut tree, and setting it up in the church piazza. woodcutters and young men",,,,,,,,,,,,,,,,
,1944,big,snail,"a relic. among the indian objects some are very interesting, such as big snail shells with ornamentations. the shells must have come from the gulf of mexico and",,,,,,,,,,,,,,,,
x,1889,veritable,owl,"off his knowledge of the classics, and solemn and serious ever as a veritable owl. his notes and introductions, and scrappy latin and greek, are among the",,,,,,,,,,,,,,,,
x,1928,whole,owl,":""my eyes are fairly good, and they tell me that a whole owl is sitting in that tree!""then samson crow flew down to where robert",,,,,,,,,,,,,,,,
x,1863,big,owl,"csar,""he was too big for dat; and der's a big owl, with eyes as big as your spectacles, comes after de chickens in de",,,,,,,,,,,,,,,,
,1945,old,chestnut,"looked out. there lay the courtyard of the hotel lancaster. a huge old chestnut tree stretched its naked arms upward toward the wet sky.""this rain,",,,,,,,,,,,,,,,,
x,1907,old,owl,".""""by thunder, you're right. you're a wise old owl, after all. i never thought of that. let's reconnoitre.""",,,,,,,,,,,,,,,,
,1945,big,lizard,"awake listening to the hum of mosquitoes, counting the loud talk-kay of the big lizard in the trees, for when his call is repeated seven times it brings good",,,,,,,,,,,,,,,,
x,1919,big,owl,edge of the bush maheegun dragged herself. there she freed herself of the big owl. but the deep wounds were still in her sides. the blood dripped from,,,,,,,,,,,,,,,,
,1945,big,sycamore,from putting on a fly and saw him round the bend there by the big sycamore and then i forgot all about him. the blue pool is wonderful rock bass,,,,,,,,,,,,,,,,
,1946,large,birch,"however, dr. james and berenice lingered a while in the shadow of a large birch tree, and then walked slowly down the slope along a winding path, as",,,,,,,,,,,,,,,,
x,2004,main,panther,"the cat had been relegated to private quarters - a smaller habitat off the main panther area. and cate had kept silent vigil, watching the cat, feeling absurdly",,,,,,,,,,,,,,,,
x,1937,old,parrot,".""his sparkling black eyes, shrewd and sharp and bright as an old parrot's, looked steadily into mine.""it's absurd, isn't it",,,,,,,,,,,,,,,,
x,1845,old,parrot,"this must account for clary's not being terrified, and for the shrewd old parrot's staring so knowingly.""i will wait no longer,""said the",,,,,,,,,,,,,,,,
x,1981,large,parrot,", dogs barking somewhere next door. sophie was wearing a turban. a large parrot hovered over edmund, staring out of a mean yellow eye. this was new",,,,,,,,,,,,,,,,
x,1922,old,parrot,"now -- this moment -- is the time for you to go.""the truth of the old parrot's words seemed to be striking home; for the doctor stood silent a minute",,,,,,,,,,,,,,,,
,1946,wonderful,butterfly,"said he heard them calling in the night. and there was that same wonderful butterfly, yellow with black markings, that she had seen here yesterday. it was",,,,,,,,,,,,,,,,
x,1883,good,parrot,"oyster for a black eye.""you don't want to buy a good parrot, do you,""said the bad boy to the grocery man, as",,,,,,,,,,,,,,,,
x,1966,large,parrot,"he had dark spots and his neck was yellow. he was not a large parrot, in fact he seemed a young one. i gave him some millet and",,,,,,,,,,,,,,,,
x,2007,expensive,parrot,"rich. she spoke in squeaks and harsh grating noises, like a very expensive parrot. actually, the grande dame had seen nothing that contributed in any way to",,,,,,,,,,,,,,,,
x,1903,old,pelican,"met him. your aunt jane, miss seaford, strikes me as an old pelican. (rises, goes up, joining duffield. they sit, couch l.",,,,,,,,,,,,,,,,
x,2008,fat,pelican,"say that whenever she was angry her neck swelled beneath her chin like a fat pelican's pouch. she carried her weight in her hips and her breasts, whereas",,,,,,,,,,,,,,,,
,1946,thirsty,cottonwood,a little willow grew along them and sometimes a thirsty cottonwood. and nowhere was there an indian or a lodge. the buffalo grazed,,,,,,,,,,,,,,,,
,1946,big,cottonwood,"looked as they always had. there was the big cottonwood, with the broken limb flying its yellow leaves, the buffalo-berry bush showing",,,,,,,,,,,,,,,,
,1946,large,magpie,"over his shoulder. the cause, however, was soon discovered in a large magpie who was perched upon a shelf over the fireplace, and who immediately relapsed into",,,,,,,,,,,,,,,,
x,1885,old,porcupine,"n't know what's bin a progressin' during your temporary abstinence, you old porcupine, they're goin' to be spliced, so overhaul your marriage harticles,",,,,,,,,,,,,,,,,
x,1845,old,porpoise,"of them; and to beat us too, to boot, you stupid old porpoise. why, there's harry t --, and nick l --, and",,,,,,,,,,,,,,,,
x,1854,fat,porpoise,"children starving -- and the devil to pay generally. wake snakes, you fat porpoise, and conduct me to your master!""the flunkey's red nose grew",,,,,,,,,,,,,,,,
x,1964,happy,porpoise,. loomis hauls back on the wheel. our nose leaps up like a happy porpoise. we go up like a skyrocket in a series of great power surges.,,,,,,,,,,,,,,,,
x,1919,fat,porpoise,"to complain of when once you're mrs. carder. you can have that fat porpoise or any other woman come to see you, and when you're ridin'",,,,,,,,,,,,,,,,
x,1849,fat,porpoise,"and his sea boots drawn up to his knees, he looked like a fat porpoise, standing on end. he had a round face, too, like a",,,,,,,,,,,,,,,,
x,1924,fat,porpoise,"said pud.""letting you drown,""said bill.""you fat porpoise, don't you know that you couldn't sink if you tried?""",,,,,,,,,,,,,,,,
x,1885,amiable,porpoise,"a foot or two deep, and the waves rolled her around like an amiable porpoise. merton and junior were soon swimming fearlessly, the latter wondering, meanwhile,",,,,,,,,,,,,,,,,
x,1893,stale,porpoise,", not so fast, i pray you! better a double mouthful of stale porpoise fat, with a fin bone in it, than so many questions at once",,,,,,,,,,,,,,,,
x,1849,fat,porpoise,"through a block in the mizen-rigging, as if we were hauling up a fat porpoise. when the lead came in sight, i was all eagerness to examine the",,,,,,,,,,,,,,,,
x,1866,big,porpoise,"'s the ugly snout of one now. he made a bite for that big porpoise but missed.""""bless my meat axe!""cried the odd man",,,,,,,,,,,,,,,,
x,1866,large,porpoise," wow! did you see that?  cried tom, as one large porpoise leaped clear of the water, turned over several times and fell back with a",,,,,,,,,,,,,,,,
x,1972,good,quail,"and swore loudly. a of them were printed in bright colors on relatively good quail paper, and of recent vintage. but they were all in russian. ah",,,,,,,,,,,,,,,,
,1948,large,cottonwood,as the scene progresses. to one side a large cottonwood tree. nat enters from the cornfield with a hoe and dripping with sweat,,,,,,,,,,,,,,,,
x,1912,fat,quail,"i want to be within reach of red leaves, and wheat-stubble, and fat quail running in the roadside grass. did the little red and yellow chrysanthemums do well",,,,,,,,,,,,,,,,
x,1997,delectable,quail,". in my other hand, i held, with equal finesse, a delectable quail's egg. i lowered the glass and sipped, watching the marne river glide",,,,,,,,,,,,,,,,
x,1874,fine,quail,"large and fat; but take good care not to fail to take six fine quail to put by their side. after that you must take a dozen skylarks,",,,,,,,,,,,,,,,,
x,2003,smart,quail,"me, her hunting master, to walk up and flush the covey before smart quail figured out they were being hunted, flushed themselves, and flew away out of",,,,,,,,,,,,,,,,
x,1925,sleek,raven,"few score in dinner coats, sitting by dazzling, waved blondes, by sleek raven hair. about and beyond, without limit, the great vestiess, knee-showing hulk",,,,,,,,,,,,,,,,
x,1908,old,raven,"any pallid bust of pallas,""he announced.""but that jolly old raven's method of paying a visit was crude and commonplace compared to yours. he",,,,,,,,,,,,,,,,
x,1880,old,raven,"face were like the thawings of ice.""you would croak like an old raven, and i should forget my reckoning.""""come now, lees,",,,,,,,,,,,,,,,,
x,1840,deep,raven,". her eyes were large, quick, and dazzling, of the same deep raven hue with her tresses, which hung down upon her shoulders, streaming from beneath",,,,,,,,,,,,,,,,
x,1870,deep,raven,", yet anything but sallow or sick ly. her hair was a wonderful deep raven black, black as night, black as death; not raven black, for",,,,,,,,,,,,,,,,
x,1944,luxuriant,raven,"of singular personal beauty. in stature he is tall and somewhat slender, luxuriant raven locks bestrewhis lofty brow; his flashing eyes stir and startle the beholder, for",,,,,,,,,,,,,,,,
,1948,wary,deer,"blind buildings clustering about the mill grew green moss on their shingles, the wary deer once more ventured out of the forest to drink shyly at the deserted ford.",,,,,,,,,,,,,,,,
,1948,wide,elm,? greene it was who had been picked to face the new commander-inchiefunder a wide elm tree and speak the welcome of new england. greene it was who brought to,,,,,,,,,,,,,,,,
x,1985,large,salamander,"to a funny-looking kid, harold""reptile""sherbecoe. reptile has a large salamander on his shoulder.   coachreptile, how many times have i told you,",,,,,,,,,,,,,,,,
x,1948,self-respecting,skunk,", but none of them clean enough to cook a meal in for any self-respecting skunk. not so far off a ditch to use as a latrine. and that",,,,,,,,,,,,,,,,
x,1999,high-tech,skunk,of today's most innovative work is being done by designers in their own high-tech skunk works. # burt rutan airplane kits with nose-mounted wings and no tail that seem,,,,,,,,,,,,,,,,
,1948,bright,snake,"safe. the burning stars explode. the beautiful insect bears death, the bright snake, death. love is a vacuum. the eyes of mortals are to each",,,,,,,,,,,,,,,,
x,1918,old,skunk,"i'll fix his hash! i'll git even with him, the old skunk! you watch me! and this very night, too! sweeney how d'",,,,,,,,,,,,,,,,
,1949,smart,squirrel,"and limped back to the shadow of my bench.""he's a smart squirrel, all right,""i tried to reassure myself.""he's a",,,,,,,,,,,,,,,,
x,1937,extraordinary,snail,"... mr. macfadden, as he read over a batch of this extraordinary snail one morning, remarked to one of his associates,""men and women are",,,,,,,,,,,,,,,,
x,1985,big,snail,"n't it, mike? it's kind of curled around itself like a big snail. mike you got me. beth snail. meg yes. i think so",,,,,,,,,,,,,,,,
x,1866,old,snail," said gypsy, with a little scream,  there's a horrid old snail crawled out my moss!""and over went moss, flowers, basket,",,,,,,,,,,,,,,,,
x,1868,big,snake,"chance -- fire!""hoarsely whispered ned. it seemed as if the big snake heard, for, raising its head still higher, it fairly glared at ned",,,,,,,,,,,,,,,,
,1950,big,basswood,and limbs hanging on a single trunk. one big basswood she recollected especially. they had seen it first a long ways off across,,,,,,,,,,,,,,,,
x,1895,new,snake,"bent low, his hands thrust deep in the bulging pockets.""a new snake, perhaps,""ventured the father;""he's a queer child.",,,,,,,,,,,,,,,,
,1950,big,basswood,"she sat there listening to the soft wind in the big basswood. it stirred like something alive. it was immense and powerful, yet",,,,,,,,,,,,,,,,
x,1896,similar,snake,"shown across the border, for skiff lake, new brunswick, has a similar snake thirty feet long. in cotton mather's time a double-headed snake was found at",,,,,,,,,,,,,,,,
x,1921,big,snake,"was the answer. and mrs. johnson called again:""oh, a big snake is in the carriage with my baby!""chapter x mr. capper's",,,,,,,,,,,,,,,,
x,1944,big,snake,"makin' a show. it's like a man who sees a great big snake. he's got a gun on him, but he don't use it",,,,,,,,,,,,,,,,
x,1946,big,snake,had never before seen so much honest emotion on human faces as when a big snake accidentally got loose and glided toward the characters on the stage. one of the,,,,,,,,,,,,,,,,
x,1947,old,snake,"established dominance. niel's hand pulled him around.""canby, you old snake in the grass, where you been? i've tried to call you up",,,,,,,,,,,,,,,,
,1950,whitish,lizard,"i discovered, was a ghekko, a fat, lazy, friendly little whitish lizard, almost transparent. the ghekkos' favorite dish is mos- | quitoes? insects",,,,,,,,,,,,,,,,
x,1962,big,snake,"behind him. it mightn't be maulbow's doing, but having the big snake loose in the storage could, in fact, make things extremely awkward now.",,,,,,,,,,,,,,,,
x,1963,big,snake,"'s worse. he's a sympathizer, a traitor. i gave that big snake his start. fifteen years ago, in one of my factories. white-haired boy",,,,,,,,,,,,,,,,
x,1970,giant,snake,out of his storage vault by something that stank of ammoniaand looked like a giant snake. to have one of the queen's passengers order him to stand where he,,,,,,,,,,,,,,,,
x,1971,old,snake,", don't be scared, honey, come on, he's an old snake, a water moccasin, a buffalo, an old crow no, i'm",,,,,,,,,,,,,,,,
x,1971,big,snake,"i yelled to my boys,""come over here! there's a big snake in my basha!""naturally, the snake got just as much of a",,,,,,,,,,,,,,,,
x,1975,torpid,snake,"banner on the road to the dam. it was like a big, torpid snake, kept alive as moving wheels fed it. through the dust, along the",,,,,,,,,,,,,,,,
x,1993,giant,snake,"missouri where the sail could be used, since the river writhed like a giant snake through bluff-dominated prairie and there was often a terrible surprise waiting at each dramatic bend",,,,,,,,,,,,,,,,
x,2003,big,snake,"the wooden chair.""all i know is it was big. a big snake in the middle of the kitchen.""# jennifer ducked under the geyser and",,,,,,,,,,,,,,,,
x,2005,nice,snake,"we'd dish up some sauted roaches on a bed of seaweed with a nice snake venom sauce.""sophie dragged a piece of her own hair under her nose",,,,,,,,,,,,,,,,
x,2006,giant,snake,"deep into the heart of the congo basin. twisting and turning like a giant snake, the congo river is guarded on both banks by what joseph conrad, writing",,,,,,,,,,,,,,,,
,1954,strong,wolf,"in two days, the anonymous author of the diary decided to find a strong wolf to protect her from the pack. protection came at the customary price, first",,,,,,,,,,,,,,,,
x,1957,old,squirrel,"between the shoulders will make a man stop and think, let alone an old squirrel. from where this fellow lay, he looked as big as a tomcat.",,,,,,,,,,,,,,,,
x,1939,old,squirrel,. when i seen that nigger foul you i went home and got the old squirrel gun. i been livin' on this here island more'n twenty years. if,,,,,,,,,,,,,,,,
,1955,interesting,beetle,"nosed into the grass on the trail of an interesting beetle. stiffly the boy went to stand before the window, and there was",,,,,,,,,,,,,,,,
,1955,old,chestnut,with other people somehow and at communion with a whole self in himself. |p261the old chestnut tree on brattle street had flowered and shed its leaves five times since orlando fosca,,,,,,,,,,,,,,,,
x,1993,good,squirrel,"climbed headfirst to the ground as daine cringed. you won't make a good squirrel at this rate, he informed her when they were safely on the ground.",,,,,,,,,,,,,,,,
x,2000,frisky,squirrel,satan could move among us in the form of a building inspector or a frisky squirrel. it never occurred to young people that the world could descend into darkness and,,,,,,,,,,,,,,,,
,1956,big,elm,"gardens vanished. snow capped the fence posts, and each branch of the big elm tree that sheltered the church was black stroke under white. the snow sifted through",,,,,,,,,,,,,,,,
x,1918,long-legged,stork,"philo firmly.""it's her house.""""why, you long-legged stork you!""said slippery,""she knows i'm here for that beer",,,,,,,,,,,,,,,,
x,1956,TRUE,stork,"up squad""(page 269). strangely enough the marabou is a true stork that has for the ways of its relatives and become a ca eater. fine",,,,,,,,,,,,,,,,
,1956,powerful,wolf,"ofernpty wanigans, lunged uncertainly at the first one then recognized ours. the powerful wolf leaped at the small window, smashing it. i dragged her down, wrenched",,,,,,,,,,,,,,,,
x,1856,large,sturgeon,", lonely, and out-of-the-way place. the manito advised owasso to spear a large sturgeon which came alongside, and with its great glassy eye turned up, seemed to",,,,,,,,,,,,,,,,
x,1962,big,sturgeon,"spinning gear, even the heaviest ocean type, is generally ineffective when a big sturgeon is hooked, but fishermen who are out for thrills or glory probably will continue",,,,,,,,,,,,,,,,
,1957,Native,cypress,"by refugees and a high birth rate.""native cypress grows too slowly,""american forestry consultant paul j. zehngraff explained.""",,,,,,,,,,,,,,,,
x,1962,big,sturgeon,"most of the first anglers were really making tentative casts because""a really big sturgeon was considered something to think about -- but not to tie onto.""a",,,,,,,,,,,,,,,,
x,1994,concerned,swan,"girl, 1993, for example, he poses a serene-looking leda and her concerned swan on one side of the form and a raised scissors-shaped hand on the other.",,,,,,,,,,,,,,,,
x,1995,proper,swan,"other stunts. some man must have taught him, for he made the proper swan dive and did it as beautifully as i have ever seen it done. you",,,,,,,,,,,,,,,,
x,1838,fugitive,swan,gold would yet find a danae; that a leda would still protect the fugitive swan; and that amphitryon in disguise would still find his cousin alcmena in many a,,,,,,,,,,,,,,,,
x,1964,perfect,swan,"went to the edge of the dock where the springboard was and made a perfect swan dive. the next boy, and the next followed him, doing as well",,,,,,,,,,,,,,,,
,1957,fat,mallard,"feet hanging out and wings cocked. there is no easier target than a fat mallard or pintail grabbing for water with his feet and his wings locked. well,",,,,,,,,,,,,,,,,
,1958,big,elm,", flying from the topmost twig above the copper-colored leaves. it was a big elm tree, the biggest and prettiest tree on the campus, where many of us",,,,,,,,,,,,,,,,
,1958,big,sycamore,"- up. jackie bowlen left the road and ran into a swamp beside the big sycamore and mired up to his waist. young people were running in all directions.""",,,,,,,,,,,,,,,,
,1958,big,sycamore,". watched a car come up, park thirty feet beyond -- under the big sycamore. taillight on. nobody got out. when i came back from the window",,,,,,,,,,,,,,,,
,1959,old,birch,"narrowed, as if it faced the trail squarely. he edged around the old birch to get behind it, and from that side there was no hole, just",,,,,,,,,,,,,,,,
,1961,old,grizzly,"involving a vicious wolverine, a great big nasty old grizzly bear, a number of extraordinarily large and healthy timber wolves who have obviously",,,,,,,,,,,,,,,,
,1961,big,lilac,of them with one shot. then i buried the furry ruins under the big lilac and i was miserable in the stomach. it was simply that i had grown,,,,,,,,,,,,,,,,
,1961,big,sycamore,"through a tangle of briars. ahead of him in the fork of a big sycamore were the remains of a tree house. the climbing-cleats, nailed to its shaggy",,,,,,,,,,,,,,,,
,1961,bright,woodpecker,"daze of weariness and vacuity, malone walked through the november twilight. a bright woodpecker pecked hollowly at a telephone pole. the afternoon was silent except for the woodpecker",,,,,,,,,,,,,,,,
,1962,large,boxwood,flat on the lawn and squirmed around to peer at the house under a large boxwood which flanked the roses lining the terrace. the kitchen door banged and a shiny,,,,,,,,,,,,,,,,
,1963,big,lilac,"never cried -- until he heard the news. behind will one of the big lilac trees was moving a little in the wind, all its flowers shriveled and brown",,,,,,,,,,,,,,,,
,1964,precious,butterfly,", and an athletic young explorer sailed up the amazon in search of a precious butterfly. the argument, the characters, the particulars of the adventures, and even",,,,,,,,,,,,,,,,
,1965,large,juniper,"came on the others. they were standing in a circle next to a large juniper bush, and when i took my place beside dolphin in the ring i saw",,,,,,,,,,,,,,,,
,1966,unspoiled,birch,"the areas we had cut in winter. we were deep in that typically unspoiled birch forest lyricized in russian novels, and i began to understand the russians' fierce",,,,,,,,,,,,,,,,
,1966,old,quail,"bit, but i won't do it any more tonight. if the old quail birds in the woods where elder calvin prayed, if those old birds had been",,,,,,,,,,,,,,,,
,1967,fragrant,honeysuckle,"structures were grown with thorn and moss and incongruously fragrant honeysuckle. in the center, under a splintering arbor that bore withered vines of",,,,,,,,,,,,,,,,
,1968,old,lilac,"years old. there, at the end of the porch, is the old lilac tree. everything is blurred with misty light, because there was a fog the",,,,,,,,,,,,,,,,
,1971,large,elm,"spent more than half of her last summer in the upper branches of a large elm tree, and i think that the only times she let herself be caught was",,,,,,,,,,,,,,,,
,1971,playful,hare,"of such""blissful creatures""as the""playful hare,""walking""far from the world""""as if life's",,,,,,,,,,,,,,,,
,1971,big,sycamore,walking on cornflakes. we came to an opening in the trees. the big sycamore 41 | which partly overarched it had been burned. smoke was still rising from,,,,,,,,,,,,,,,,
,1972,old,cactus,"in chaparral, and the hillsides stood gray-green with old cactus. the stunted trees were lower than the giant bushes and yucca. manuel",,,,,,,,,,,,,,,,
,1972,large,crocodile,"vegetation of the bank, a species of very large crocodile, called by martin caymanos, which he informed us are great eaters 30",,,,,,,,,,,,,,,,
,1973,precious,antelope,", scimitar-horned oryx, and barasingh deer. there are also four varieties of precious antelope? addax, gemsbok, eland, and greater kudu. many of these animals",,,,,,,,,,,,,,,,
,1973,native,deer,"225,000 to 433,000, and most of them go to the texas ranches where native deer and exotics abound. no one, however, has done a better job of",,,,,,,,,,,,,,,,
,1974,giant,lizard,"i can assure you, to hold in your hand the remnant of a giant lizard who stood 70,000,000 years ago where you now stand. warning. you understand,",,,,,,,,,,,,,,,,
,1974,inquisitive,otter,"but before the abalone would have a chance to clamp down securely, an inquisitive otter would steal it and foil our plans of photographingtool-use. whenever we located an abalone",,,,,,,,,,,,,,,,
,1974,large,otter,"feeding station. we waited to observe tool use. at long last a large otter came down, felt the abalone on the rock, pulled at them and then",,,,,,,,,,,,,,,,
,1974,old,sycamore,"in off the blue water, a breeze that stirred the leaves of the old sycamore, lingered among the stiffer leaves of the oaks. the breeze cooled the water",,,,,,,,,,,,,,,,
,1976,luxuriant,chestnut,"disturb the monotonous platitude of its horizon. a serene, dead-straight alley of luxuriant chestnut trees stretched from the little castle to the country road. to the left stood",,,,,,,,,,,,,,,,
