entry,year,genre,source,a,b,c,text
184,1811,FIC,Africans,A,B,C,"  ; a broil'd ostrich garnished with ganders, twenty stewed magpies, and an antelope's brisket. Sutta. Sutta Dat nice. Mad. Madiboo Very delicate:"
484,1811,FIC,Africans,A,B,C,"  and sinkatoo, for king Ali Beg, O! But Serawooli king he eat antelope's leg, O! Sing shannawang, sing sharrawang, Sing shongo! Torri"
289,1819,FIC,TriumphLiberty,A,B,C,"  where he comes! -- He bounds along the plain, and like the nimble Antelope, disdains the craggy cliff. (Opechanchanoug armed capapie, his rifle slung across"
754,1823,MAG,NorthAmRev,A,B,C,"  .' He was well enough on the 30th to sail, in the schooner Antelope, for Middletown, where he arrived, the 3d of June. He was"
936,1823,MAG,NorthAmRev,A,B,C,"  on the eleventh, eight days after. Capt. Vail, of the schooner Antelope, in the latter part of May went to New York, where he remained"
635,1830,MAG,NorthAmRev,A,B,C,"  family, he had taken to his bosom the young and graceful Tabtokab (The Antelope), thought to be the best hand at skinning the buffalo, making moccasins"
187,1831,FIC,Julian,A,B,C,"  Led by this curious pigmy, her attendant, As fleet and active as an antelope. This one was mounted on a noble steed. My master went to seek"
103,1832,MAG,NewEngMag,A,B,C,"  uncommon draws them. Now they are nigh enough for you to see that an Antelope is about as big as a common goat, and a great deal handsomer and"
315,1832,MAG,NewEngMag,A,B,C,"  a Grizzly Bear has got to windward of them. Here he comes like an antelope. Sauve qui peut! You must put your horse to full speed, I"
637,1832,FIC,LastNightPompeii,A,B,C,"  robe and flowers The sunbeams from the sleeper, with a step Soft as the antelope's, she stole and knelt In prayer for that loved one at Vesta's"
781,1832,FIC,LastNightPompeii,A,B,C,"  gentle breathings of the song Whispered along the arches, and with step Like hunted antelope he sprung to the edge Of his dark home of banishment. "" Behold!"
376,1833,FIC,CrayonSketches [ed],A,B,C,"  in air; "" with a step as free as fancy, agile as an antelope, and elastic as a bow, who was to be compared with her?"
2,1834,FIC,ProseSketchesPoems,A,B,C,"  . He thus lost the course and his companions. Towards evening Lewis killed an antelope and drank the blood. It drank like new milk, but increased the thirst"
14,1834,FIC,ProseSketchesPoems,A,B,C,"  the right of it, we found a spring by which we encamped. No antelope was killed to-day. Some of the party tried to kill cranes, and Bill"
30,1834,FIC,GuyRiversATale,A,B,C,"  earth with the firm pace of an elephant, yet with the ease of an antelope; moving carelessly as in pastime, and as if he bore no sort of"
256,1834,FIC,ProseSketchesPoems,A,B,C,  beaver below on the river; he said the water would run soon. Another antelope was killed this day. Traveled this day about twelve miles. 3. -- Traveled
341,1834,FIC,ProseSketchesPoems,A,B,C,"  manes floating, and a trampling like thunder. Imagine here and there a solitary antelope, or, perhaps, a whole herd, fleeting off in the distance,"
344,1834,FIC,ProseSketchesPoems,A,B,C,"  fresh and running. Course still south-east. 5. -- This day we killed another antelope, and encamped early, upon the creek. While I was on the first"
473,1834,FIC,ProseSketchesPoems,A,B,C,"  , and we pushed on cheerily with our jaded animals, now weary with running antelope. After traveling among the hills to the distance of a mile and a half"
501,1834,FIC,ProseSketchesPoems,A,B,C,"  , too, was nearly gone, but Bill Williams, fortunately, killed an antelope, which was divided as usual. Ducks were abundant in this pond, and"
556,1834,FIC,ProseSketchesPoems,A,B,C,"  timber. Andrews was, as Lewis expressed it, for fooling along and killing antelope.' They held a long confab, and at length Andrews agreed to go"
664,1834,FIC,ProseSketchesPoems,A,B,C,"  branch, and gave our animals drink. Early in the day Bill killed an antelope, and about noon, as we ascended a hill upon the edge of a"
670,1834,FIC,ProseSketchesPoems,A,B,C,"  on the Rio del Norte, with no game but here and there a solitary antelope, with no water except in here and there a hole, and with its"
672,1834,MAG,NewEngMag,A,B,C,"  wishes. He arrests, moreover, in their flight, the stag and the antelope, circumvents the cunning of the fox and the beaver, and takes even the"
710,1834,FIC,ProseSketchesPoems,A,B,C,"  that it would make them unlucky in hunting. A son of Harris killed an antelope, here, and our mess still ate no horse meat. We traveled this"
725,1834,MAG,NewEngMag,A,B,C,"  their prey; the watchfulness, timidity, and swiftness of the stag and the antelope; the harmony between the size, structure, and instiiicts of the elephant;"
405,1835,FIC,InfidelFallMexico,A,B,C,"  and wild dogs, -- the bison of Chihuahua staggering in his pen, the antelope or pronghorn of the north, and even the great bear from the ridges of"
418,1836,FIC,WifeAtVenture,A,B,C,"  The whole city is up in arms against me. I've run like an antelope from Rozelea and that cursed Irishman, but which way to fly I know not"
467,1836,FIC,WifeAtVenture,A,B,C,"  . Hassan Star of the East! Bulbul of purity! Rose of perfection! Antelope of beauty! Fall down, ye slaves, and worship. Den. Dennis"
568,1836,NF,AstoriaAnecdotes,A,B,C,"  This usually consists of a gray surcoat and leggins of the dressed skin of the antelope, resembling chamois leather, and embroidered with porcupine quills brilliantly dyed. A buffalo"
579,1836,FIC,WifeAtVenture,A,B,C,"  down, ye slaves, and worship. Den. Dennis Owhack Aside Rather an antelope in swiftness. Now here's a spalpeen worshipping a star behind a cloud."
607,1836,NF,AstoriaAnecdotes,A,B,C,"  air. This had the effect of the fabled fascination of the rattlesnake. The antelope approached timidly, pausing and reconnoitering with increased curiosity; moving round the point of"
836,1836,FIC,WifeAtVenture,A,B,C,"  world, your orders are obeyed. I bring the star of perfection, the antelope of beauty. Caliph. The Caliph Open the palanquin. Kazrak enters from it"
930,1836,NF,AstoriaAnecdotes,A,B,C,"  These islands were often the resort of the buffalo, the elk, and the antelope, who had made innumerable paths among the trees and thickets, which had the"
964,1836,NF,AstoriaAnecdotes,A,B,C,"  by the chase of the buffalo, the elk, the deer, and the antelope, and waging ruthless warfare with other wandering tribes. As the boats made their"
456,1837,NF,AnAccompaniment,A,B,C,"  lightness, and repeating this attack until his enemy is destroyed. One species of Antelope, the prong-horned, is peculiar to America; it is a graceful and fleet"
220,1838,FIC,NarrativeArthur,A,B,C,"  tail, however, was bushy, and the legs slender as those of the antelope. Its motion was exceedingly awkward and indecisive, and we never saw it attempt"
386,1838,NF,AmericanInParis,A,B,C,"  her native country, and an African cow supplied her with African milk. An antelope and three goats followed in an open barouche. She was formally invited to visit"
771,1839,FIC,NixsMateAnHistorical,A,B,C,"  prodigious efforts to overtake the schooner, the latter flew away before her like an antelope before a hunter; and as she dashed the spray a-stern, seemed to exult"
16,1843,FIC,NewPurchaseSeven,A,B,C,"  jet black color and glistening, and moving with the grace and swiftness of an antelope. On the rider's left was couched a spear in size like a beam"
25,1843,FIC,WildScenesInForest,A,B,C,"  prairie from which he started; and on he went with the speed of an antelope. The dreary waste of sand was soon gained, and the limbs of the"
413,1843,FIC,RingwoodRoverA,A,B,C,"  stately lord, uttered a shrill cry of surprise, and bounded forward like an antelope to meet him; quick, however, as were her movements, she was"
415,1843,FIC,WildScenesInForest,A,B,C,"  his own bosom. Nor was Zecana unworthy such a passion. Gentle as the antelope that skimmed the green savannas near, she was still a being, fond,"
669,1843,FIC,WildScenesInForest,A,B,C,"  to go out of his sight; and when the disappearance of the buffalo and antelope from his immediate neighbourhood extended the range of the chase, Zecana always accompanied him"
924,1843,FIC,WildScenesInForest,A,B,C,"  nor hunting-grounds which they claim as peculiarly their own. They hunt the buffalo and antelope, and, dwelling only in tents of leather, migrate from place to place"
202,1844,NF,KnickerbockerNew-,A,B,C,"  turned her face toward her father's camp, and with the fleetness of an antelope passed the intervening space, and soon found herself safe in her changing habitation."
571,1844,FIC,GuaricaCharibBride,A,B,C,"  ankles; her eyes large, dark, and liquid as those of a Syrian antelope, were curtained by the longest and most silky lashes that ever fringed a human"
621,1844,FIC,SpanishGalleon,A,B,C,"  solid gold set with a hundred and one rubies, each the size of an antelope's eye!' What may be the worth of it?' Five thousand"
846,1844,NF,MentalMoralCulture,A,B,C,  The Coypou or Neutra-lur Animal. Forest Trees in N. S. Wales. I-arge African Antelope. Ancient Egyptian Pottery. Egyptian Potters at Work. Remarkable Rock in Wales.
33,1845,MAG,NorthAmRev,A,B,C,"  which is eminently barren, is tenanted by the elephant, rhinoceros, hippopotamus, antelope, and giraffe, all large in size, and abundant in numbers; no"
401,1845,FIC,MargaretATaleReal,A,B,C,"  flip-dog, and follow on. Great stakes. Old Highflyer himself, out of Antelope; grandam, Earl of Godolphin's Arabian. "" "" Well, "" said"
431,1846,FIC,SpectreSteamer,A,B,C,"  of her ride. She was mounted upon a white palfrey, limbed like an antelope, and who, with tossing mane and champing bit, stepped as featly and"
868,1846,FIC,FactFictionACollection,A,B,C,"  a wealthy merchant, was highly cultivated in mind and manners, graceful as an antelope, and beautiful as the evening star. She had early attracted the attention of"
106,1848,FIC,TrappersBrideSpirit,A,B,C,"  pointed out to them on their route during the day fresh signs of deer and antelope, and when they once ascended the hills they had heard the bleats of the"
563,1848,FIC,TrappersBrideSpirit,A,B,C,"  lost to the eye of the spectator in the distance. Droves of deer and antelope, with their wide branching antlers, would sometimes sweep by in majesty, raising"
663,1848,FIC,TrappersBrideSpirit,A,B,C,"  ? whose arms were clothed with mighty strength, and whose feet outstripped the fleet antelope. Far in the happy valley of the blessed hunter's realm I see the"
31,1849,NF,OregonTrailSketches,A,B,C,"  monotony of sun-scorched plains, where no living thing appeared save here and there an antelope flying before us like the wind. When noon came we saw an unwonted and"
39,1849,NF,OregonTrailSketches,A,B,C,  horses that can for a moment compete in swiftness with this little animal. The antelope ran down the hill toward the main body of the Indians who were moving over
345,1849,NF,OregonTrailSketches,A,B,C,"  in their hand, galloped over the hills, often starting a wolf or an antelope from the thick growth of wild-sage bushes. Shaw and I were in keeping with"
356,1849,NF,OregonTrailSketches,A,B,C,"  of the latter alternately appearing and disappearing as they bounded awkwardly along; while the antelope, with the simple curiosity peculiar to them, would often approach as closely,"
392,1849,NF,OregonTrailSketches,A,B,C,  appears to fire them with martial ardor and thirst for renown. At length the antelope spoke. He told the young dreamer that he was not to follow the path
482,1849,NF,OregonTrailSketches,A,B,C,"  stupidly at me through their tangled manes, and then gallop heavily away. The antelope were very numerous; and as they are always bold when in the neighborhood of"
541,1849,NF,OregonTrailSketches,A,B,C,"  flocks of large white plover flew screaming over their surface. Having failed of the antelope, Raymond tried his hand at the birds with the same ill success. The"
572,1849,NF,OregonTrailSketches,A,B,C,"  with ease. Raymond and I would go out upon the neighboring prairies to shoot antelope, or sometimes to assail straggling buffalo, on foot, an attempt in which"
631,1849,NF,OregonTrailSketches,A,B,C,  banks. There was something exciting in the wild solitude of the place. An antelope sprang suddenly from the sagebushes before me. As he leaped gracefully not thirty yards
652,1849,NF,OregonTrailSketches,A,B,C,"  hours of the day, and a bountiful provision was made for them. An antelope or a deer usually swung from a stout bough, and haunches were suspended against"
767,1849,NF,OregonTrailSketches,A,B,C,  revelations. Again and again the form of an antelope appeared before him. The antelope is the graceful peace spirit of the Ogallalla; but seldom is it that such
798,1849,NF,OregonTrailSketches,A,B,C,"  starting. We were getting ready our morning's meal, when Raymond saw an antelope at half a mile's distance, and said he would go and shoot it"
806,1849,NF,OregonTrailSketches,A,B,C,"  , I found it 204 paces. When I stood by his side, the antelope turned his expiring eye upward. It was like a beautiful woman's, dark"
811,1849,NF,OregonTrailSketches,A,B,C,"  us at the mouths of their burrows on the dry plain beyond. Suddenly an antelope leaped up from the wild-sage bushes, gazed eagerly at us, and then,"
818,1849,NF,OregonTrailSketches,A,B,C,"  but as it came up, I saw by its motions that it was another antelope. It approached within a hundred yards, arched its graceful neck, and gazed"
888,1849,NF,OregonTrailSketches,A,B,C,  in an instant I heard the sharp quick crack of his rifle. A wounded antelope came running on three legs over the hill. I lashed Pauline and made after
928,1849,NF,OregonTrailSketches,A,B,C,"  the beaver had dammed it up. We placed our last remaining piece of the antelope before a scanty fire, mournfully reflecting on our exhausted stock of provisions. Just"
929,1849,NF,OregonTrailSketches,A,B,C,"  ""; yet no living game presented itself. At length, however, an antelope sprang up and gazed at us. We fired together, and by a singular"
989,1849,NF,OregonTrailSketches,A,B,C,"  swayed to and fro in billows with the light breeze, and far and near antelope and wolves were moving through it, the hairy backs of the latter alternately appearing"
703,1850,MAG,NorthAmRev,A,B,C,"  strewed along my gory track. "" The eland is a much larger species of antelope, often exceeding an ox in size, and being much burdened with fat,"
946,1850,MAG,NorthAmRev,A,B,C,"  came to drink. Lions, elephants, rhinoceroses, and the various kinds of antelope usually drink only at night, and often travel many miles to a favorite watering"
480,1851,FIC,MobyDickWhale,A,B,C,"  The Tail. Other poets have warbled the praises of the soft eye of the antelope, and the lovely plumage of the bird that never alights; less celestial,"
523,1851,FIC,CircassianSlave,A,B,C,"  a free rein now, and the horse dashed over the level plain like an antelope, while his rider sat in the saddle like a Marmaluke. The traveller poured"
3,1853,FIC,AmericanFamily,A,B,C,"  , "" said the chief; "" you shall go to meet her. The antelope can ride, - - will you? "" he continued, pointing to his horse,"
32,1853,FIC,AmericanFamily,A,B,C,"  aside to hide the emotion that was welling up from his heart. "" The antelope shall not die, "" said the chief, "" there is another remedy if"
69,1853,FIC,AmericanFamily,A,B,C,"  we must make a new one. Then we shall be content again. The antelope shall sit in her lodge happy as the singing bird, while her brothers bring"
129,1853,FIC,AmericanFamily,A,B,C,"  generally most abundant. A pair of partridges, a wild turkey, and an antelope, were soon brought down; but as it was early in the day,"
183,1853,FIC,AmericanFamily,A,B,C,"  Let my brother go to his home, but Whirlwind's home is where the antelope is, he will live and die with her. "" "" Pshaw! chief"
244,1853,FIC,AmericanFamily,A,B,C,"  he has led his warriors to victory. Let the white chief give him the antelope for his squaw, and he will no more go out to battle; but"
270,1853,FIC,AmericanFamily,A,B,C,"  chief said, as if divining her thoughts. "" It is not for the antelope. See, Whirlwind kill it, "" and he raised his tomahawk, and"
296,1853,FIC,LittleFernsFor,A,B,C,"  own papa "" -- and she rushed to the door with the speed of an antelope. How can I describe to you that meeting, when I couldn't see"
379,1853,FIC,AmericanFamily,A,B,C,"  with the softest furs, best fish and venison in the forest, and the antelope's life shall be happy as the singing bird, and bright as the sun"
380,1853,FIC,AmericanFamily,A,B,C,"  you can. "" "" And I, "" said Sidney. "" If the antelope goes, I will go to defend her, "" said the chief, following"
411,1853,FIC,AmericanFamily,A,B,C,"  distant forest, that bounded the prairie, looming against the horizon. Buffalo, antelope, elk, deer, and fowl now became quite numerous, giving indications that"
444,1853,FIC,LiberiaMrPeytons,A,B,C,"  home of the leviathan, the behemoth, the unicorn, the giraffe, the antelope, the elephant, the lion, the buffalo. It is the home,"
495,1853,FIC,AmericanFamily,A,B,C,"  speaking rapidly, anticipating her inquiry, "" and I have come to claim the antelope. Will she not now go with her chief? "" "" I can not"
575,1853,FIC,AmericanFamily,A,B,C,"  from Superior for her. "" "" My brother's squaw's tongue was forked -- the antelope's tongue is not forked, she can not lie, "" said the chief"
630,1853,FIC,AmericanFamily,A,B,C,"  in a white man's wigwam, "" returned the chief. "" If the antelope will not go with him to his people, he must leave her; """
677,1853,FIC,AmericanFamily,A,B,C,"  their abode, was filled with fruit, venison, skins and furs; the antelope accepted his offering, and a half-tamed, high mettled colt was at his command"
684,1853,FIC,AmericanFamily,A,B,C,"  passing around him, and with the one feeling filling his entire soul -- that of the antelope lying at the point of death, and he could do nothing to save her"
694,1853,FIC,AmericanFamily,A,B,C,"  , in Jane's hand, he said: "" Whirlwind's gift to the antelope, "" and walking away left the young girl in possession of his noble love-token"
714,1853,FIC,AmericanFamily,A,B,C,"  clear limpid waters lashed to a foam. Large quantities of deer, elk, antelope, and mountain sheep, were found there, as well as wild turkeys,"
739,1853,FIC,AmericanFamily,A,B,C,"  himself by her side, he said in a mild tone -- "" Why is the antelope troubled? is not her warrior by her side to make her a new home"
741,1853,FIC,AmericanFamily,A,B,C,"  , then said: "" Whirlwind is not to be played with. When the antelope says she will go with him, he will take her, if she is"
789,1853,FIC,AmericanFamily,A,B,C,"  three milch cows, with six as fierce hunting dogs as ever run down an antelope, constituted their live stock. Thus prepared the family bade a glad adieu to"
792,1853,FIC,AmericanFamily,A,B,C,"  for our speedy return to the land of civilization. "" "" Let not the antelope be fearful. Strong hearts and hands are still around her, "" said the"
884,1853,FIC,AmericanFamily,A,B,C,"  and of which the fat condition of the wild horses, buffaloes, deer, antelope, mountain sheep, and goats that feed thereon, is sufficient proof. Often"
899,1853,FIC,AmericanFamily,A,B,C,"  Yet Whirlwind does not grieve. He has found another squaw, fleeter than the antelope, more graceful than the fawn, whose voice is like the singing birds,"
959,1853,FIC,AmericanFamily,A,B,C,"  the ground in their rapid leaps, heeded not each other, and even an antelope joined in the flight unmolested, from their common foe. Innumerable prairie fowls filled"
580,1854,FIC,Eventide ASeries,A,B,C,"  on the soft grass, half woman, half child, As gay as her antelope, almost as wild. The bloom of her cheek is like that on her"
92,1855,NF,WondersGeology,A,B,C,"  form the gazelle, and must have lived after the manner of the deer and antelope. The Anoplotherium commune was of the height of the wild boar, but its"
122,1855,FIC,Sea-Witch,A,B,C,"  was to the being he really loved. Maud, with the fleetness of an antelope, had ran by the land-path from the spot of the contest, and reached"
233,1858,MAG,NorthAmRev,A,B,C,"  give great speed beyond, so the muscles are crowded nearer the j*ints in the antelope than in the camel, and in the hinder legs of the horse than in"
85,1859,MAG,Atlantic,A,B,C,"  "" the wild-cat, the wolf, and the grizzly bear. There are few antelope or elk. Trout abound in the mountain-brooks and in Lake Utah. In the"
520,1859,FIC,BorderWarTaleDisunion,A,B,C,"  catastrophe put an end to the naval battle. A solitary British ship, the Antelope, escaped. The rest were either destroyed or captured. CHAPTER XL. RETURN"
601,1859,NF,MississippiBubble,A,B,C,"  the sky, and foliage of the American prairie, the shape of the lithe antelope, the heavy bear, who feels the spirit of the scenes described, in"
940,1859,MAG,Atlantic,A,B,C,"  the northern, on which the blue line of the horizon is interrupted only by Antelope Island. The prospect in that direction is apparently as illimitable as from the shore"
255,1860,MAG,NorthAmRev,A,B,C,"  as far as she could safely go, and went on to Canton in the Antelope, (a steamer of light draught which he had hired,) and visited"
691,1860,FIC,ElFureidis,A,B,C,"  above his head, a footfall scarcely heavier than that of a hare or an antelope, and, with a light bound, a figure stood before him, which"
95,1862,FIC,Walking,A,B,C,"  of trees and grass. I would have every man so much like a wild antelope, so much a part and parcel of nature, that his very person should"
310,1862,FIC,JohnBrent,A,B,C,"  , too, was Armstrong. No day passed that we did not bag an antelope, a deer, or a big-horn. It was the very land of Cocaigne"
513,1863,FIC,WildWesternScenes,A,B,C,  more strive to avoid us than our domestic animals. I want to see the antelope and the wild horse lick salt from the tiny hands of Jule and Charley.
591,1863,NF,AntiquityMan,A,B,C,"  historical period seems doubtful. They were said to consist of a stag, an antelope, and a goat, all named by M. Marcel de Serres as new;"
849,1863,FIC,WildWesternScenes,A,B,C,"  "" I will try, "" said William. He had promised to capture an antelope for her. "" But it may be a long time before I succeed."
866,1863,FIC,Gala-days,A,B,C,"  any more than you would pity an elephant for being an elephant instead of an antelope. A woman's hair is silky and soft, and, if not always"
892,1863,FIC,WildWesternScenes,A,B,C,"  . Let us agree that we will not shoot buffalo, or deer, or antelope, or horse, or hare, or any of the feathered tribes, within"
839,1864,FIC,CenteolaOtherTales,A,B,C,  in size all other known quadrupeds as much as the largest buffalo surpasses the lightest antelope. In shape and appearance they were something between the ox and the elephant with
177,1865,FIC,ArtemusWardHis,A,B,C,"  bounded, with naked feet, over hills and plains like the wild and frisky antelope. It was a onlucky moment for us when Chris. sot his foot onto"
976,1865,FIC,ArtemusWardHis,A,B,C,  not wholly unconnected with bottles) the drivers to keep their mules in motion. Antelope by the thousand can be seen racing the plains from the coach-windows. At Elk
71,1867,FIC,CondensedNovels,A,B,C,"  idly in the morning heat, or wrestled with the afternoon breezes. Deer and antelope dotted the plain. The water-courses brawled in their familiar channels, nor dreamed of"
248,1868,NF,HistoryUnitedNetherlands1588d,A,B,C,"  the Spanish flagships. Lord Henry in the Rainbow, Sir Henry Palmer in the Antelope, and others, engaged with three of the largest galleons of the Armada,"
34,1869,NF,DelugeInLightModern,A,B,C,"  , cinnamon bear, wapiti or Canadian stag, the moose, American deer, antelope, mountain sheep, buffalo, opossum, rattlesnake, copperhead, and an innumerable"
109,1869,NF,BOWCBookBoys,A,B,C,"  on board the schooner, and retired to bed. Some time after midnight the Antelope w? afloat again. None of her passengers waked. She moved away from"
120,1869,NF,BOWCBookBoys,A,B,C,"  . "" The anchor went up, and up went the sails, and the Antelope once more spread her wings to the blast, and went over the waters."
128,1869,NF,BOWCBookBoys,A,B,C,"  from behind Pinnacle Island, was a schooner of the size and rig of the Antelope, and he did not doubt for a moment but that it was their schooner"
139,1869,NF,BOWCBookBoys,A,B,C,"  fair, and all gave themselves up to the joy of the occasion. The Antelope, it is true, was of ancient build and model; she was short"
164,1869,NF,BOWCBookBoys,A,B,C,"  carrying the bundles; and just as they came opposite to their companions, the Antelope grounded about a hundred.' feet from the beach. Without waiting another instant"
179,1869,NF,DelugeInLightModern,A,B,C,"  seventy-eight clean beasts, -- oxen, elk, giraffes, camels, deer, antelope, sheep, goats, with the horses, zebras, asses, hippopotami,"
198,1869,NF,BOWCBookBoys,A,B,C,"  my boosom, an' sustained me when we watched,' em in the Antelope, up there at the pint. As to that there anchor, ef it"
205,1869,NF,BOWCBookBoys,A,B,C,"  hold, the lines were cast off, the sails were hoisted, and the Antelope dropped down the stream. Messrs. Simmons and Long retired, but most of"
215,1869,NF,BOWCBookBoys,A,B,C,"  lay another object, which had for them a greater charm. It was the Antelope. There she swung at her anchor, while ever and anon the passing breeze"
226,1869,NF,BOWCBookBoys,A,B,C,"  yet its appearance had startled them all. It was twice as large as the Antelope, of a bright green color j /z/ its masts were yellow, and its"
316,1869,NF,BOWCBookBoys,A,B,C,  to them all. He had been asked to go on the trip of the Antelope from a very kindly desire to give him all the advantages possible. He had
