entry,year,genre,source,a,b,c,text
476,1955,FIC,MissMorissaDoctor,A,B,C,  plain that there was nothing else ahead for her. Gently she pushed the little antelope away from the door and went inside. There was a tremendous electric storm that
499,1955,FIC,BandAngels,A,B,C,"  some eland straps -- very strong and supple, from the skin of the big antelope -- so that she can carry more firewood and potato tops and banana fronds."
535,1955,FIC,MissMorissaDoctor,A,B,C,"  to get the boy to swallow a little warm mare's milk taken from the antelope's ration, or a little skimmed venison broth with the rice strained out."
552,1955,FIC,MissMorissaDoctor,A,B,C,"  carefully widening circles everywhere, even along the edge of the muddy riverbank, the antelope at her heels, bumping her every time she stopped to look. Finally when"
639,1955,FIC,MissMorissaDoctor,A,B,C,"  full of excitement over his sister's visit here, and over the live young antelope he brought rolled in a gunny sack and tied across the back of his saddle"
649,1955,FIC,MissMorissaDoctor,A,B,C,"  roof boards to the cot and the floor. Morissa had caught up the young antelope, suddenly shy and wild with his animal foreboding, and now, as the"
701,1955,FIC,MissMorissaDoctor,A,B,C,"  , | greenish-yellow satin, with dusty bumblebees buzzing drowsily. A couple of young antelope huddled in the middle of - the patch, the ears so nearly the shape"
723,1955,FIC,MissMorissaDoctor,A,B,C,"  Reeder since he left the man at the post hospital at Sidney. The young antelope had vanished almost at once, probably into some empty frying pan. A lot"
757,1955,FIC,MissMorissaDoctor,A,B,C,  another new-leafed whip of cottonwood for Jackie's spade and then watched a couple of antelope coming down a little spring draw north of the river. Back at the soddy
761,1955,FIC,MissMorissaDoctor,A,B,C,  patient reins dragging. Sometimes he might say as many as five words to the antelope nosing along the yard fence while Morissa kneaded bread sponge or folded powders. Finally
821,1955,FIC,MissMorissaDoctor,A,B,C,"  , was still blue against Chimney Rock and Scotts Bluff ahead of them, with antelope and even rabbits thick, perhaps from the burned-over region. There was silence between"
832,1955,FIC,MissMorissaDoctor,A,B,C,"  . She pulled herself up firm and erect for a while, watching the occasional antelope spring from his resting, looking back over his white rump as he ran,"
878,1955,MAG,NatGeog,A,B,C,"  Kangaroos Come in Many Sizes Kangaroos lacked competition from hoofed animals such as deer, antelope, and bison, and had few enemies: thus they developed into a multitude"
897,1955,FIC,MissMorissaDoctor,A,B,C,"  ridges of the northeast. But there was a chill at the river. Two antelope grazed beside the trail, tamer than all summer, and soon the sky would"
903,1955,FIC,MissMorissaDoctor,A,B,C,"  care that might help keep him alive a while longer. She would miss the antelope, although he had grown large enough to jump the fence into the yard and"
907,1955,FIC,MissMorissaDoctor,A,B,C,"  she must. But the morning hills seemed empty, bare except for a grazing antelope and a prairie chicken calling to her young, at least a dozen of them"
365,1956,NF,TreeCulture,A,B,C,"  . Farther south both sexes wore small aprons. Blankets, made from skins of antelope or other wild animals, were a constant item of clothing throughout the entire area"
485,1956,MAG,NatGeog,A,B,C,"  the plain below. Sleek buff-colored kob proved to be the region's most plentiful antelope. Slightly smaller than a white-tailed deer but a bit more stocky, and with"
676,1956,MAG,SportsIllustrated,A,B,C,"  snow. Geysers don't spray the air every hour, and neither deer nor antelope play. For the newest federal playground is two-thirds of the island of St. John"
43,1957,FIC,RallyRoundFlag,A,B,C,"  that had the smell and taste of camphor, yet was a favorite with the antelope. He noted the appearance of salts, coal, sulphur, pumice stone;"
307,1957,FIC,Harpers,A,B,C,  towered above her with its shining columbined pedestal atop which a calm Grecian face with antelope eyes looked serenely at them even as Miss Hillgood looked now. The two men
449,1957,FIC,RallyRoundFlag,A,B,C,"  Robes and an ear of Mandan corn. 3 Box Skins of the Male and female Antelope, with their Skeletons and the Skin of a brown, or Yellow Bear. |"
496,1957,FIC,RallyRoundFlag,A,B,C,"  and put a paw up and waggle it or in some other way arouse the antelope's curiosity; and it would begin to race round and round, all the"
530,1957,FIC,RallyRoundFlag,A,B,C,"  his head and roll head over heels. The wolf they hated because of the antelope's innocence. This beast, fleetest by far of all those on the plains"
593,1957,FIC,RallyRoundFlag,A,B,C,"  the wild animals here were not wild at all: while buffalo, elk or antelope were feeding he could walk up and almost touch them, without exciting fear or"
627,1957,FIC,RallyRoundFlag,A,B,C,"  it had to explore up- or downstream for another site. The beaver or the antelope, George Shannon said, you could take your choice. It was a wonder"
653,1957,FIC,RallyRoundFlag,A,B,C,"  their empty whisky kegs; great herds of half-starved buffalo, elk, deer and antelope; tens of thousands of geese feeding on the first green grass of the prairie"
742,1957,FIC,RallyRoundFlag,A,B,C,"  a stick or lie on his back and thrust a foot up and the foolish antelope would race round and round it in a steadily narrowing circle, until it was"
762,1957,FIC,Harpers,A,B,C,"  only child, and an old Indian retainer who chased zigzag and kicking like all antelope as though pursued -- all four? of them shouting and shouted to, distant"
813,1957,FIC,RallyRoundFlag,A,B,C,"  an inch deep. Dark against the snow were the huge herds of elk and antelope and buffalo; and everywhere were geese, ducks and swans. By May 4th"
852,1957,FIC,RallyRoundFlag,A,B,C,  they were swimming. His dog had plunged into the river and caught a swimming antelope and drowned it. Sometimes out on the plains the wolves lured a single beast
981,1957,FIC,RallyRoundFlag,A,B,C,"  for a few minutes at the huge herds of buffalo, elk, deer and antelope all around him; at hills so fantastically and grotesquely eroded that he found it"
994,1957,FIC,RallyRoundFlag,A,B,C,"  and there a pack of wolves, a herd of elk or the solitary mother antelope and her child. Far in the south they saw a lofty range, a"
807,1958,MAG,Harpers,A,B,C,"  He stopped the car to look at the greater 47 kudu, a buff-colored African antelope with sweeping horns, standing motionless like a magnificent statue, its great head held"
824,1958,MAG,Harpers,A,B,C,"  greeting from Oka. Climbing back in his car, lie drove slowly past the Antelope House. The okapi, a cousin of the giraffe that looks more like a"
393,1959,MAG,Time,A,B,C,"  , would be reduced from 3,542 to 1,972 by late 1960. # But to Antelope Valley realtors bad news is no news. They were convinced that the Gazette had"
548,1959,MAG,Time,A,B,C,"  was clear to all that Publisher Valentine had won his point: "" Everyone in Antelope Valley is entitled to the news, whether good or bad. """
845,1959,MAG,Time,A,B,C,"   264978 To Publisher W. J. Valentine of California's Antelope Valley Ledger-Gazette (circ. 6,612) the news was significant, and he printed it"
900,1959,MAG,Time,A,B,C,"  had betrayed their efforts to sell land, and they began a campaign to get Antelope Valley retailers to pull their ads out of the Gazette. Said an angry realtor"
974,1959,FIC,Harpers,A,B,C,"  been running just for the bell of it, or else they had sighted an antelope or deer. They didn't have to gallop to eat beef. Without wind"
17,1960,MAG,SatEvePost,A,B,C,"  you'll all have to help me. "" Charley and Mike had killed an antelope and two deer the evening before, so meat was no problem. There was"
325,1960,FIC,ConstantImage,A,B,C,"  dress was then in order, worn with one of these wicked hats and long antelope gloves of a shade to match it. The whole scheme enchanted Har- riet,"
374,1960,FIC,Carrington,A,B,C,"  feet, that crest, so Alex said. On the plain a herd of antelope twisted to stare at them; a hawkp151circled overhead, the sunlight shining through its"
823,1961,FIC,Harpers,A,B,C,"  hanging at his throat by a blackened string and a medicine horn from some small antelope stuck as an earring through the lobe of one ear, and with his forbidding"
319,1962,FIC,DefiantAgents,A,B,C,"  him for his dull response. His examination took a more practical turn. An antelope's defense was speed, though it could be tricked into hunting range through its"
551,1962,MAG,Time,A,B,C,"  , Montana elk, bear meat from the Okefenokee Swamp, Georgia turkey, and antelope from Chugwater, Wyo. Boykin's all-for-love motto was bantered about the banquet hall"
225,1963,FIC,GatesMountains,A,B,C,"  two rafts came down the river. One was loaded with peltries, one with antelope tallow and bear lard. We purchased 300 pounds of the combined greases, a"
239,1963,FIC,GatesMountains,A,B,C,"  pleasant. At 2 P.M. we encountered a memorable blockade on the river -- an antelope "" harvest. "" By a system of set fires on the outer prairie some"
240,1963,FIC,GatesMountains,A,B,C,"  me, the Indian replied that he was Chief Lame Horse, the father of Antelope and the Grandfather of her half-white son. Since I spoke the handsign language fluently"
291,1963,MAG,Atlantic,A,B,C,"  men, along with an undetermined number of bears, coyotes, bighorn sheep, antelope, bison, mule deer and horses. "" In Canyonlands the issue is one"
361,1963,FIC,GatesMountains,A,B,C,"  This nephew of mine is Achille's true son by the Pawnee woman, | Antelope, a daughter of the chief, Lame Horse. A very fine woman,"
857,1963,FIC,GatesMountains,A,B,C,"  west, the earth was a soft green inclined plain upon which incredible numbers of antelope, elk and buffalo were feeding in mixed herds. The air, inland,"
867,1963,FIC,GatesMountains,A,B,C,"  chief who asked for the son of Achille Rivet and of the Pawnee woman, Antelope. One may well envision the excitement which sprang up within me when, upon"
969,1963,FIC,GatesMountains,A,B,C,"  belly of a hard winter to see this son of his only and dead daughter Antelope, and he had found not the Indian scion he had envisioned in his Pawnee"
23,1964,FIC,LittleBigMan,A,B,C,"  round. If when them other men pounded on the lodge skin any u:uitity of antelope hair fell off the cover, the hunt would be cessful. cssful. While this"
57,1964,FIC,LittleBigMan,A,B,C,"  in return, and Not h ing was there in her fringed dress of white antelope. They knew about where 1 was, although they might not let been told"
90,1964,FIC,RightDie,A,B,C,"  sat she poked her feet out, the shins parallel, and muttered, "" Antelope legs. "" "" In the first place, "" I said, "" that"
102,1964,FIC,LittleBigMan,A,B,C,"  that until it got to be a habit, they started to call me "" Antelope Girl, "" because there I was, helping to dismantle the toy tepees,"
154,1964,FIC,LittleBigMan,A,B,C,"  having minds of one track, they was fascinated with the prospect of eating that antelope. The pretty woman with the doe eyes went so far as to come and"
162,1964,FIC,LittleBigMan,A,B,C,"  Red did was to cut off that black and white rosette of tail from the antelope's behind, which he would keep for decoration, it being a cunning little"
176,1964,FIC,LittleBigMan,A,B,C,"  , for h (was very near Inc. That boy tried to break an antelope's neck with his bare hands, like some of the stronger men could,"
194,1964,FIC,LittleBigMan,A,B,C,  has one flaw against living to old age: he is nosy. Show an antelope something that flutters and he can't resist it. That is the practical side
216,1964,FIC,LittleBigMan,A,B,C,"  side of those poles-and-wheels that Old Lodge Skins was carrying: the Cheyenne called them antelope arrows, and they were deadlier than if equipped with iron points, for they"
235,1964,FIC,LittleBigMan,A,B,C,"  eyes and a slavering mouth, who decided to give me his preference over the antelope carcass. He crouched below our pony's left haunch, and while studying my"
237,1964,FIC,LittleBigMan,A,B,C,"  know that we shall share equally what we capture. I don't hear Little Antelope complain. He is a better Human Being than you, and he is white"
262,1964,FIC,LittleBigMan,A,B,C,"  he was kindly disposed to us on account of our breaking bread, or rather antelope, in his tepee, which does an Indian so much honor that the host"
267,1964,FIC,LittleBigMan,A,B,C,"  covering about the same measure east to west: an enormous heaving wedge of pure antelope. We people now stirred, extending the crescent horns, rounding out the base"
277,1964,FIC,LittleBigMan,A,B,C,"  of the affair, then you'll ve a job explaining why maybe a thousand antelope run towards In; and also how Old Lodge Skins could know this herd would"
328,1964,FIC,LittleBigMan,A,B,C,"  for the simple reason that there wasn't any food to be had. The antelope had been ate up totally the night before, and they couldn't afford to"
332,1964,FIC,LittleBigMan,A,B,C,"  , and I believe it was that winter that that enormous fat girl from the antelope surround ran the price for her hand up to six horses and other gifts too"
355,1964,FIC,LittleBigMan,A,B,C,"  ; her eyes was like little seeds. Set a fat girl to catch fat antelope, was the idea. Them braves that still kept their horses now mounted,"
373,1964,FIC,LittleBigMan,A,B,C,"  with water, was Burns Red in the Sun. Alongside him lay a pronghorn antelope whose panting throat he was iii the act of cutting, the animal having been"
459,1964,FIC,LittleBigMan,A,B,C,"  women come up before him, and he chose the stoutest two by waving the antelope arrows at them, sort of charming them into sitting alongside him. One girl"
468,1964,FIC,LittleBigMan,A,B,C,"  the arrows that Stick; Everything Under I! is Belt shot at the ghost antelope in the tim (when the cherries was ripe. "" This being a famous"
483,1964,FIC,LittleBigMan,A,B,C,"  tight work. I'd say it took a good hour to beat every last antelope to death though we was swinging incessantly, and a number of animals died of"
486,1964,FIC,LittleBigMan,A,B,C,"  behind -- men, women, children, and dogs. I have told about antelope as we encountered that little herd the day before at the buffalo wallow: they"
537,1964,FIC,LittleBigMan,A,B,C,"  have caught the wind had not we all mounted again, Burns Red with the antelope carcass leaking gore on the rump of his pony, where he toted it."
576,1964,FIC,LittleBigMan,A,B,C,"  on a dead line with Old Lodge Skins's position. Like men, grazing antelope put out sentries. These here signal the herd I, v putting up their"
600,1964,FIC,LittleBigMan,A,B,C,  the tepee cover. What | nt on here concerned the preparation for a gigantic antelope round. If when them other men pounded on the lodge skin any u:uitity of
611,1964,FIC,LittleBigMan,A,B,C,"  the middle. Two other girls, skin- | vier people, suddenly grabbed the antelope arrows from Old Lodge Skins and dashed away on diverging tracks like the legs of"
681,1964,FIC,LittleBigMan,A,B,C,"  apparently orders, for she left directly and come back with a fresh hunk of antelope from the carcass earlier referred to. This moon-faced woman hacked up the flesh and"
686,1964,FIC,LittleBigMan,A,B,C,"  was satisfied to have established it insofar as my sister went. Besides, the antelope was all ate up at that moment and the dog wasn't quite ready."
704,1964,FIC,LittleBigMan,A,B,C,"  peace of mind: it was pretty strong, I'll tell you. The antelope chunks weren't too well done. Indians don't have a prejudice against grease"
717,1964,FIC,LittleBigMan,A,B,C,"  didn't need nighttime or even to fall asleep. Not long after shooting the antelope we arrived at the Cheyenne camp, which had located on a little creek about"
731,1964,FIC,LittleBigMan,A,B,C,"  , holding up the little wheels with the raven feathers fluttering. Now a single antelope come into sight on a roll of ground about a quarter mile ahead of the"
796,1964,FIC,RightDie,A,B,C,"  . In the second place, what I said was that you looked like an antelope in a herd of Guernseys. In a crowd you still do. We will"
844,1964,FIC,LittleBigMan,A,B,C,"  when Burns Red in the Sun, who rode last, splashed across with the antelope slung behind, it created quite a stir among | the women. I found"
854,1964,FIC,President,A,B,C,"  Sergeant Lawrence Wolff, 27th Division U.S.A. (Infantry) Inactive Reserve, resident in Antelope Valley, California. Gratitude was deanishly expressed for instigating these offers of appointment."
906,1964,FIC,LittleBigMan,A,B,C,"  sudden turned pretty as a buckskin colt, with big, shy eyes like an antelope and the graceful limbs of a doe. She always used to like me when"
934,1964,MAG,SatEvePost,A,B,C,"  Bird, "" he says, "" Let's go see the deer and the antelope play. "" "" We share a deep sense of with the land, a"
935,1964,FIC,LittleBigMan,A,B,C,"  gave him the jwedicine devices. There was now a magic line tied round the antelope, and with a wand in each hand, the chief began to draw it"
945,1964,FIC,LittleBigMan,A,B,C,"  their owners had tethered right outside their tepees. 11ov ever, quite a mess of antelope hair was laying on the ground about the medicine tent, so the lookout was"
951,1964,FIC,LittleBigMan,A,B,C,"  That was actually a mark of preference, for he was mighty fond of fresh antelope heart himself, to which he owed his prowess as swiftest runner in Old Lodge"
975,1964,FIC,LittleBigMan,A,B,C,"  got al intending to fast for twenty-four hours. He had had another dream about antelope. Coming on top of the one of the day previous, it meant he"
987,1964,FIC,LittleBigMan,A,B,C,"  and stalked proudly around camp, leaving the throng of women to dispose of the antelope, which they fell on and skinned in the time it takes to fill and"
545,1965,FIC,Harpers,A,B,C,"  , this animal with its narrow face and long legs is as frisky as an antelope; its body is as involuted as a monogram and it leaps and weaves over"
231,1966,FIC,OmensettersLuck,A,B,C,"  , chuckling. All around Omensetter, like a monstrous halo, the unholy burns. antelope and swan centipede and swanWatson lurched toward Furber, threateningly. Why do you turn"
562,1966,MAG,Time,A,B,C,"  the 400-acre L.B.J. Ranch to gaze at his menagerie of wild deer, turkeys, antelope and buffalo. In his paneled office, Lady Bird put up a 6-ft. - high"
647,1967,FIC,Arrangement,A,B,C,"  Africa. And just as in Africa, along the perimetersof the great herds of antelope and wildebeests and zebras, there were lions, so along the perimeters of these"
48,1968,MAG,SatEvePost,A,B,C,"  the gate. In the morning Hindu boys set up his low dais and his antelope skin, and for the reporters they spread rugs on the ground. The reporters"
303,1968,MAG,SatEvePost,A,B,C,  to be the Maharishi's bedroom. A low bed covered with silk and an antelope skin stood against a wall sheathed in bamboo slatting; on the opposite wall hung
377,1968,MAG,SatEvePost,A,B,C,"  . An alrmisl coquettish smile straying across his face, he sal cross-legged on his antelope skin. often toying with a flower or a strand of heads. When he"
412,1968,MAG,SatEvePost,A,B,C,"  never turning away from the noise and the blowing sand. A monk placed his antelope skin on the copilot's seat, and somebody else handed him a single dahlia"
963,1969,FIC,Play:OsbertsCareer,A,B,C,"  was freedom, there was leisure, there was gaiety -- there were dances and antelope races. We were the happiest people in the world! And now, when"
996,1969,FIC,Play:OsbertsCareer,A,B,C,  she was the belle of the season. I remember her so vividly at the antelope races! They used to say that there were more people looking at Marguerite Rosemary
51,1970,FIC,Mov:ZabriskiePoint,A,B,C,  move up to mice and rabbits. If we're lucky we might find an antelope. At the end we'll count up how many deaths each of us has
67,1970,FIC,Play:OperationSidewinder,A,B,C,"  the snake altar to operate one of the puppets. Once this is finished the ANTELOPE PRIESTS are all visible, dancing and chanting with the snakes. The SNAKE PRIESTS"
72,1970,FIC,Play:OperationSidewinder,A,B,C,"  . In front of them are three large pottery jars, the tops covered with antelope skins. Behind them is the snake altar; a large screen of antelope skin"
123,1970,MAG,Harpers,A,B,C,"  its great roller coaster long ago burned down, and on another island buffalo and antelope forage on the edge of the strange water. In the city, on a"
131,1970,FIC,Play:OperationSidewinder,A,B,C,"  picks it up with both hands, holds it aloft and dances over to the ANTELOPE PRIESTS. He hands it to one of the ANTELOPE PRIESTS at the end of"
137,1970,NEWS,NYT-Reg,A,B,C,"  for sport or slaughtered for pet food or killed because it competes for grass with antelope, deer, cattle and sheep. The plight of the horses has touched off"
265,1970,FIC,Play:OperationSidewinder,A,B,C,  the ANTELOPE CHIEF exchange places and walk to opposite sides of the stage. The ANTELOPE CHIEF faces HONEY and the SNAKE CHIEF faces the YOUNG MAN. They each simultaneously
330,1970,NEWS,NYT-Reg,A,B,C,"  "" said Mr. Utter. "" You need every spear of grass for deer, antelope and cattle. I don't have any ax to grind either way. But"
555,1970,FIC,Play:OperationSidewinder,A,B,C,  big toes. They each carry a large gourd-like rattle and one holds a large antelope drum which he pounds in a steady rhythm. Their chins are outlined by a
634,1970,FIC,Play:OperationSidewinder,A,B,C,"  the two parts toward each other, then away. The SNAKE CHIEF and the ANTELOPE CHIEF exchange places and walk to opposite sides of the stage. The ANTELOPE CHIEF"
692,1970,FIC,Play:OperationSidewinder,A,B,C,  between his teeth. The same process goes on as with the CHIEF until each ANTELOPE PRIEST in the line has a snake in his hand and each SNAKE PRIEST has
876,1970,FIC,Play:OperationSidewinder,A,B,C,"  and dances over to the ANTELOPE PRIESTS. He hands it to one of the ANTELOPE PRIESTS at the end of the line. He takes it and holds it,"
967,1970,FIC,Play:OperationSidewinder,A,B,C,  left to stage right as in Act One. Then one at a time eight ANTELOPE PRIESTS come out of the wikiup in single file. They are dressed similarly to
125,1971,MAG,Time,A,B,C,"  exaggerated. There are still 40 folks, mostly ranchers, living in the same Antelope Valley site, and they figure that the census bureau ought to be able to"
279,1971,MAG,SatEvePost,A,B,C,"  of Polynesia, Malay Peninsula, ancient Babylonia. The American pronghorn, incorrectly called antelope. Early European cave artists. Above all, the Chinese art, One of"
726,1971,NEWS,NYT-Reg,A,B,C,"  downtown center to select a 17,000-acre airport site in Palmdale, in dry, barren Antelope Valley. The Sierra Club is now suing to invalidate F.A.A. approval of the site"
881,1971,NF,HumanSpeciesABiology,A,B,C,"  and vast herds of other large mammals such as elk, deer, caribou, antelope, and moose. All these species now exist in only small numbers, or"
42,1973,FIC,GreatAmericanNovel,A,B,C,"  , give me a home where the buffalo roam, Where the deer and the antelope play, Where seldom is heard a discouraging word, And the skies are not"
74,1973,MAG,Harpers,A,B,C,"  fingers: "" Well, let's see, I've got myself two hlackbuck antelope, a Corsican ram, a white fallow deer, a whitetail deer, and"
99,1973,MAG,SportsIll,A,B,C,"  seven points, a wide-racked whitetail deer, a solemn mountain goat, a pronghorn antelope, a pair of black bear hides and the heavy, glowering, bug-eyed head"
200,1973,MAG,Harpers,A,B,C,"  and mother into a serious big-game hunter. Sandy took another look at the two-tone antelope and recalled what Raymond had told her earlier that day: "" In their native"
311,1973,FIC,WildPitch,A,B,C,"  He cleared the gate near me by about five feet and was gone like an antelope, leaving as spoor a scattering of papers. I gave Mrs. Jenkins what I"
465,1973,MAG,Harpers,A,B,C,"  , scimitar-horned oryx, and barasingh deer. There are also four varieties of precious antelope? addax, gemsbok, eland, and greater kudu. Many of these animals"
599,1973,MAG,Harpers,A,B,C,  Texas rancher friends have also been workii ing to head off the extinction of blackbuck antelope in their native lands of India arid Pakistan. They 4 have shipped small blackbuck
808,1973,MAG,Harpers,A,B,C,  the cab and propped the unfamiliar weapon across the truck hood. Sandy sighted the antelope through the scope and leveled him at 200 yards with her first shot. After
4,1974,FIC,SomethingHappened,A,B,C,  you ever seen her shoot or not. I seen her drop a rennin' antelope seventy yards off with a quick shot. You're closer an' a bigger
230,1974,FIC,Centennial,A,B,C,"  . They hated Indians, sheriffs, missionaries, schoolteachers, buffalo, deer, antelope and other things yet to be identified. On their third day in Oklahoma they"
489,1974,NEWS,Chicago,A,B,C,  like this sort of life. You can still hear the coyotes bowl and the antelope graze all around. My son and his wife moved out here two years ago
696,1974,FIC,Centennial,A,B,C,"  then Jim Lloyd, who was always gazing at thep492horizon in search of birds or antelope, cried, Look!' and there on a distanthill the missing cattle were"
826,1974,FIC,SilentThunder,A,B,C,"  "" Her last word rang over and over in Chief's brain. Jadi? antelope? what a perfect name for this graceful girl. He went with her into"
400,1975,FIC,Play:Action,A,B,C,  looked at the picture I thought of Pennsylvania. I had a picture of an antelope on a yellow prairie. Every time I looked at this picture I saw him
517,1976,FIC,Speedboat,A,B,C,"  He bought the sweater because he thought it was funny: a very realistically knitted antelope on top of a pointed brown mound. Very stark, very ugly. """
529,1976,FIC,Speedboat,A,B,C,"  pants, and a blue button-downshirt. Over that he pulls a sweater with an antelope standing on top of a mountain. He bought the sweater because he thought it"
