entry,year,genre,source,a,b,c,text
186,1844,NF,-,-,-,-,"Ashe, of the Americans, occupied the post at Brier Creek, and, thus placed, the opposing commanders seemed disposed for a"
187,1896,-,-,-,-,-,"Stanislow, Round a roarin' fire of bresh and brier, stirred up by a pitch-pine bough, And Jones of Yolo had finished"
188,1921,-,-,-,-,-,"demands were offset by her skilfully timed escapes from the Brier Bush. She would either be too early or too late for Raymond,"
189,1886,-,-,-,-,-,"was sent to Collingwood, and Grassy Spring, and Brier Hill, and lastly to Tracy Park, to take the height of the"
190,1845,-,-,-,-,-,"and then, gradually forced our way through brake and brier toward the outward verge of the dense covert. Before we met again,"
191,1896,-,-,-,-,-,"a vast easy-chair, was dividing his attention between a brier pipe and the odes of Propertius; his wife, beside him in her"
192,1870,-,-,-,-,-,"it ain't none of ourn, "" said Mrs. Brier, "" its only a boy we took to bring up. Nobody knows"
193,1860,-,-,-,-,-,"made chiefly of the dressed skins of animals, defied brier or thorn. "" Are we on the road to Evora? "" L'Isle"
194,1921,-,-,-,-,-,Three days later Kenneth Raymond ate his luncheon at the Brier Bush and spoke no word to Joan. The following day he nodded to
195,1979,-,-,-,-,-,"safari jacket, white breeches and two-tone shoes, a brier burl pipe in his manicured hand. "" I say, this is quite"
196,1921,-,-,-,-,-,"time? "" "" Yes. I went to the Brier Bush -- Miss Gordon gave me to understand that you had gone away with someone -- married,"
197,1850,-,-,-,-,-,"and part with flowers, while many vines and sweet brier bushes stood before the cottage door. There were also large, white roses"
198,1921,-,-,-,-,-,"; I had to come. I telephoned to the Brier Bush -- they gave me your number. "" Raymond closed the door behind him and"
199,1870,-,-,-,-,-,". Every lady rose simultaneously to their feet. Mrs. Brier fainted, and dropped limp and lifeless and unobserved. The Editor's lady"
200,1831,-,-,-,-,-,"blooming waste it left behind, As that the sweet brier yields it; and the shower Wets not a rose that buds in beauty"
