entry,year,genre,source,a,b,c,text
536,1879,FIC,Hunchback,A,B,C,"  York, Footnote: 1Kb June 18, 1832. First performance in America. Chestnut Street, 1833. Daly's Theatre, New York, November 29, 1892"
537,1879,FIC,LittleMissMillion,A,B,C,"  small, from Mr. Beverly Primrose is a pleasure. I just got the finest chestnut mare -- the very thing for you. Fifteen hands, a regular beauty."
538,1879,MAG,Atlantic,A,B,C,"  idea of personal possession or *) eculiarity to such an address as No. 1347 Chestnut Street, or No. 100 West Fifty-First Street. How much more character there is"
539,1880,FIC,BricksWithoutStraw,A,B,C,"  uplands, thin and gray, bearing only stunted pines or a light growth of chestnut and clustering chinquapins, interspersed with sour-wood, while here and there a dogwood or"
540,1880,FIC,TalesChesapeake,A,B,C,"  to love me? There is Marion, the Doctor's daughter, with the chestnut curls falling all round her neck -- she loves me, I know; but until I"
541,1880,FIC,BohemianDays,A,B,C,"  , and on the pond a little scow floated in pond-lilies. All around were chestnut trees, their burrs full of fruit. Across the lane, only a few"
542,1881,FIC,PoemsStories,A,B,C,"  cruel bit, Or nibbled at the leaves. Beneath the shade Of a great chestnut that obscured the sun The hunters, gathered in a little group, Talked of"
543,1881,FIC,PoemsStories,A,B,C,"  as the deer's are in young Lord Massy's park; And the long chestnut hair blown loosely by the wind, -- All this seemed at my shoulder,"
544,1881,FIC,PoemsStories,A,B,C,"  boy Who used to gayly climb his knee, -- Young Charley, with the chestnut hair And hazel eyes and laughing lip: "" May Heaven look down, """
545,1881,FIC,PoemsStories,A,B,C,"  waves He sees a human head float by, With long, drenched curls of chestnut hair, And wild but fearless hazel eye. Out with the hooks! One"
546,1881,FIC,PoemsStories,A,B,C,  A lover like my lover. His eyes were of a dancing blue; His chestnut hair was just the hue That flecks the golden plover.' T was on
547,1881,FIC,PoemsStories,A,B,C,"  hair was that shade of which poets are fond, A compromise lustrous' twixt chestnut and blond. Her figure was fragile, Yet springy and agile; While her"
548,1882,FIC,TalkingLeaves,A,B,C,"  are altogether different from the white. As for Steve, his hair was nearer chestnut than yellow, but it had given him his Indian name; one that would"
549,1882,FIC,PoemsNathaniel,A,B,C,"  , Like a rich tint that makes a picture warm, Is lurking in the chestnut of thy tress, Enriching it, as moonlight after storm Mingles dark shadows into"
550,1882,FIC,Poems,A,B,C,"  whose music wells Tender and low through those luxuriant dells, Wherefrom a single broad-leaved chestnut towers; -- Still musing in the long, lush, languid hours, --"
551,1882,FIC,Poems,A,B,C,"  : The evening's soft, pathetic splendor streams O'er her clear forehead and her chestnut hair, All glorified as in celestial air; But the dark eyes a wistful"
552,1882,FIC,Poems,A,B,C,"  reel! Ha! many a foliaged guardian of the height, Majestic pine or chestnut, riven and bare, Falls in the rage of that aerial fight, Led"
553,1883,FIC,RedAcorn,A,B,C,"  That gets better the deeper down you go. First it was like swallowing a chestnut burr; now, old hand-made Bourbon couldn't be smoother. "" "" A"
554,1883,FIC,RedAcorn,A,B,C,"  gentleness, and reaching back for his musket. "" There, by that big chestnut. Can't you see him? or have you got so much whisky in"
555,1883,FIC,RedAcorn,A,B,C,"  cracked, and the bullet buried itself in the thick, soft bark of the chestnut, just above Fortner's head, and threw dust and chips in his eyes"
556,1883,FIC,FloydGrandonsHonor,A,B,C,"  hear from the languid woman. "" It is a kind of bright brown, chestnut. Mrs. McLeod's is red. "" "" Auburn, my dear, """
557,1883,FIC,FloydGrandonsHonor,A,B,C,"  abundant hair with rippling sheen that almost defies any correct color tint, and is chestnut, bronze, and dusky by turns, the sweet, dimpled mouth, the"
558,1883,FIC,FloydGrandonsHonor,A,B,C,"  cheek and rosy, fragrant lips. They seem like a picture, gold and chestnut hair intermingled, complexion of pearl, and the other of creamy tints, soft"
559,1883,FIC,PecksBadBoyHis,A,B,C,"  stand, and that his rank in the army was about the same as a chestnut roaster on the sidewalk here at home. It made me sick, and I"
560,1884,FIC,DreamLife A,A,B,C,"  what they have not. The profile is a Greek profile, and the heavy chestnut hair is plaited in Greek bands. The figure, too, might easily be"
561,1884,FIC,DreamLife A,A,B,C,"  , as they came out at dusk to feed; there, upon that tall chestnut, you cruelly maimed your first captive squirrel. The old maples are even now"
562,1885,FIC,WomansTrials,A,B,C,"  companion to his place of business, they went to a certain public house in Chestnut Street, where they first drank at the bar. "" Shall we go up"
563,1885,FIC,Off-HandSketches,A,B,C,"  For a time he carried all before him. Daily might he be seen in Chestnut street, gallanting some favoured belle, with the elegant air of a dancing-master,"
564,1885,FIC,DrivenBackEden,A,B,C,"  . "" No matter, "" cried Winnie, at the breakfast-table; "" the chestnut burrs are opening. "" By frequent stirring the rest of the corn-fodder was soon"
565,1885,FIC,HectorsInheritance,A,B,C,"  , with one or two small pieces of meat, about the size of a chestnut, in each plate, and fragments of potatoes and carrots. A small,"
566,1885,FIC,DoctorsDaughter,A,B,C,"  mine were in this instance. Cousin Bessie was a tall, graceful woman with chestnut brown hair and fine soft eyes, her figure was slight as a girl's"
567,1885,FIC,Monte-CristosDaughter,A,B,C,"  heard or imagined she heard a singular noise amid the thick boughs of an immense chestnut tree immediately outside the garden wall. She started up in affright, but could"
568,1885,FIC,Monte-CristosDaughter,A,B,C,"  letter. At this thought she gave a guilty start and gazed piercingly into the chestnut tree, but nothing was visible there save boughs and leaves. After all,"
569,1885,FIC,Monte-CristosDaughter,A,B,C,"  call you my own. I strove to attract your attention just now in the chestnut tree outside the wall. I uttered your beloved name, but you did not"
570,1885,FIC,Monte-CristosDaughter,A,B,C,"  whether to remain or return, there was a rustle amid the foliage of the chestnut tree immediately outside the garden enclosure, and a man's form swung from one"
571,1885,FIC,Monte-CristosDaughter,A,B,C,"  of the elm to meditate; how she had heard the singular noise in the chestnut tree, and, finally, how the letter, fastened to a stone,"
572,1885,FIC,Monte-CristosDaughter,A,B,C,"  To-morrow at dawn. "" "" Where? "" "" In the clearing beyond the chestnut copse on the further side of the brook. There is no need of witnesses"
573,1885,FIC,Monte-CristosDaughter,A,B,C,"  tremulous companion by the arm, Siebecker hurriedly drew him behind a clump of small chestnut trees. No sooner were they hidden than three masked men cautiously opened the gate"
574,1885,FIC,Monte-CristosDaughter,A,B,C,"  of the sun. Giovanni was about to step aside into a little grove of chestnut trees beside the road there to wait until the new comer had passed, but"
575,1885,FIC,Monte-CristosDaughter,A,B,C,"  a deer sprang at the staff, grasped it and sent it whirling into the chestnut grove. Then he caught old Solara by the throat and a terrible struggle at"
576,1885,FIC,Monte-CristosDaughter,A,B,C,"  . Finally he retreated no more, but began pressing his adversary backwards towards the chestnut grove, the while delivering blow after blow. Then he suddenly gave his wrist"
577,1885,FIC,Monte-CristosDaughter,A,B,C,"  a dream he heard a sound as of many feet. Hastily dashing into the chestnut grove, he looked back and saw old Solara surrounded by a group of Luigi"
578,1885,FIC,Monte-CristosDaughter,A,B,C,"  signally favored by Fate, the Viscount Massetti dragged himself rather than ran through the chestnut grove by the roadside, pausing now and then to glance back through the trees"
579,1886,FIC,TheirPilgrimage,A,B,C,  's geographical. There it's a question whether you live within the lines of Chestnut Street and Spruce Street -- outside of these in the city you are socially impossible
580,1886,FIC,AnAlgonquinMaiden,A,B,C,"  the gray heads of society's veteran devotees were a little turned, and the chestnut and golden pates of their juniors tossed sleeplessly on their pillows for several nights preceding"
581,1886,FIC,MissElliotsGirls,A,B,C,"  suppose -- though I say it, who shouldn't -- that I was an uncommon fine -- looking colt, dark chestnut in color, and not a white hair on me except this spot in my"
582,1886,FIC,TracyPark,A,B,C,"  would do her good, she found him seated in an arm-chair under a horse chestnut tree, stretching himself and yawning as if he were just out of bed."
583,1886,FIC,RomanticYoungLady,A,B,C,"  a fine figure, was six feet high, with blue eyes and a luxuriant chestnut beard. In his thirty years he had lived and travelled everywhere, reserving the"
584,1886,FIC,Poems,A,B,C,"  s gone like a passing sigh. These Autumn morns when we may stray Through chestnut woods, where glancing play The checkered light and shadow thrown O'er trunk, and"
585,1886,FIC,Henrietta,A,B,C,  two? (Turns quickly.) Bertie. Bertie Vanalstyne This one is a chestnut filly from Kentucky. Agnes. Agnes Bertie! Look me straight in the face
586,1886,FIC,Henrietta,A,B,C,  can you and Lord Arthur go in that little dog-cart of yours and take a chestnut filly from Kentucky between you? Bertie. Bertie Vanalstyne We aren't. We
587,1886,FIC,Henrietta,A,B,C,"  anything about a woman named "" Henrietta ""? Agnes. Agnes There's a chestnut filly called Henrietta; she's going to race at Jerome Park to-morrow. Cornelia"
588,1886,FIC,Henrietta,A,B,C,"  's going to race at Jerome Park to-morrow. Cornelia. Mrs. Cornelia Opdyke A chestnut filly! (Takes a letter from her bosom, looks at it; then"
589,1887,FIC,Beulah,A,B,C,"  entered the room. She was pale and handsome, with a profusion of short chestnut curls about her face. With her hand resting on the door, she said"
590,1887,FIC,Beulah,A,B,C,"  eyes of deep, dark violet hue, shaded by curling brown lashes. Her chestnut hair was thrown back with a silver comb, and fell in thick curls below"
591,1887,FIC,Beulah,A,B,C,"  ! "" He passed his hand over his brow, and swept back the glossy chestnut hair, as if it oppressed him. "" I would willingly take it,"
592,1887,FIC,AdriftInWilds,A,B,C,"  remarkable resemblance in person, character and disposition. Both had dark, curling, chestnut hair, hazel eyes, and an active muscular organization that made them leaders in"
593,1888,FIC,ErrandBoy,A,B,C,"  . One day she had a scare. She was occupying a seat in a Chestnut Street car, while Jonas stood in front with the driver, when a gentleman"
594,1888,FIC,ErrandBoy,A,B,C,"  discover where we are. "" The Continental Hotel is situated at the corner of Chestnut and Ninth Streets, and Mrs. Brent feared that Jonas would stop the car at"
595,1888,FIC,CapitolaMadcap,A,B,C,"  , with a clear olive complexion, languishing dark hazel eyes and dark, bright chestnut hair and beard. In temperament he was ardent as his clime. In character"
596,1888,FIC,Reverberator,A,B,C,"  the red silk chairs and she hoped Mr. Probert would at least taste a sugared chestnut or a chocolate; and when he declined, pleading the imminence of the dinner-hour"
597,1888,FIC,Clover,A,B,C,"  but with a lithe active figure, red-brown eyes and a long mustache of tawny chestnut. He wore spurs and a broad-brimmed sombrero, and carried in his hand a"
598,1889,FIC,QueenHildegarde,A,B,C,"  a road led off into the woods, hiding itself behind the low-hanging branches of chestnut and maple, ash and linden trees. That was all. Now that the"
599,1889,FIC,StandishStandish,A,B,C,"  giant swung himself up on deck and ran his fingers through a shock of curling chestnut hair; a glorious youth, six feet and over in his hose of hodden"
600,1889,FIC,StandishStandish,A,B,C,"  gentle blood and the habit of predominance. The bare head was covered with thick chestnut hair, worn at the temples by pressure of a steel cap, and well"
601,1880,MAG,Harpers,A,B,C,"  a smothered fire of splendor to the dark deep eye; and to the rich chestnut hue of the cheek was added a color which made it wear the ripe,"
602,1880,MAG,Atlantic,A,B,C,"  moss-like spots hardly distinguishable in color, but which are really forests of oak and chestnut. All above this rose what even from my distant station could be recognized as"
603,1880,NF,Wake-Robin,A,B,C,"  I do not find the same songsters that I know where thrive the oak, chestnut, and laurel. In going from a district of the Old Red Sandstone to"
604,1880,NF,Wake-Robin,A,B,C,"  a remote clearing, covered with heath and fern, with here and there a chestnut and an oak, I go to hear in July the wood sparrow, and"
605,1880,NF,Wake-Robin,A,B,C,"  cedar, laurel, and blackberry. The ground is mainly occupied with cedar and chestnut, with an undergrowth, in many place, of heath and bramble. The"
606,1880,NF,Wake-Robin,A,B,C,"  existence. Birds that are not attracted by the heath, or the cedar and chestnut, are sure to find some excuse for visiting this miscellaneous growth in the centre"
607,1880,NF,Wake-Robin,A,B,C,"  of the rarest and handsomest of the warblers; his white breast and throat, chestnut sides, and yellow crown show conspicuously. Last year I found the nest of"
608,1880,NF,Wake-Robin,A,B,C,"  natural beauty and picturesqueness, shaded nearly all the way by woods of oak, chestnut, and beech, and abounding in dark recesses and hidden retreats. I must"
609,1880,NF,Wake-Robin,A,B,C,"  most charming to be found in the District. The main growth is oak and chestnut, with a thin sprinkling of laurel, azalea, and dogwood. It is"
610,1880,NF,SuccessWithSmall,A,B,C,"  localities. I agree with the view taken by Mr. A. S. Fuller. "" Chestnut stakes, "" he writes, "" five feet long and two or three inches"
611,1880,NF,SuccessWithSmall,A,B,C,"  , in many instances, three times that amount. "" Of course, split chestnut stakes look the neatest and last the longest; but a raspberry bush is not"
612,1880,NF,MissParloasNew,A,B,C,"  weighing eight pounds, and ten minutes for every additional pound. Roast Turkey with Chestnut Stuffing and Sauce. Clean the turkey, and lard the breast. Throw fifty"
613,1880,NF,MissParloasNew,A,B,C,"  turkey with this. Truss, and roast as already directed. Serve with a chestnut sauce. The remaining half of the chestnuts are for this sauce. Boned Turkey"
614,1880,NF,MissParloasNew,A,B,C,"  you like, one of grated horseradish. Taste to see if salt enough. Chestnut Sauce. One pint of shelled chestnuts, one quart of stock, one teaspoonful"
615,1880,NF,EasiestWayInHousekeeping,A,B,C,"  of nitrogen is less in pease, but about the same in lentils. The chestnut also comes under this head, and is largely eaten in Spain and Italy,"
616,1881,NF,HousesHouse-Life,A,B,C,"  was earth; the sides and roof were made of reed and the bark of chestnut trees; the posts or columns were limbs of trees stuck in the ground,"
617,1882,NEWS,NYT-Reg,A,B,C,"  in this way. It was what is generally known along the river as the Chestnut Grove property, situated at Highland. opposite Poughkeepsie. It covers the point where"
618,1882,NEWS,NYT-Reg,A,B,C,"  Aaron Innis, and others, with a keen eye for gain, bought this Chestnut Grove property, paying $12,000 for 45 acres of land lying in a narrow strip"
619,1882,NEWS,NYT-Reg,A,B,C,"  that point, work on the bridge ceased, and has not been resumed. Chestnut Grove has been a cool and shady resort for Summer picnics, but aside from"
620,1882,NF,AtlantisAntediluvian,A,B,C,"  not a mulberry, not a hickory, or a beech, or a true chestnut. These facts would seem to indicate that the forest flora of North America entered"
621,1882,NF,AtlantisAntediluvian,A,B,C,"  New Mexico) are white. They have a fair skin, blue eyes, chestnut or auburn hair, and are quite good-looking. They claim to be full-blooded Zunians"
622,1883,NEWS,NYT-Reg,A,B,C,"   18830708_5 txt Much excitement was caused in the neighborhood of Seventh and Chestnut streets about noon to-day by a personal encounter between Dr. J. William White, one"
623,1883,NEWS,NYT-Reg,A,B,C,"  of Bender's barber's shop. "" said he, "" and was crossing Chestnut street in company with a New-Orleans gentleman I was taking about over the city for"
624,1883,NF,GoldenChersonese,A,B,C,"  , plum, mango, mulberry, date, cocoa-nut, olive, walnut, chestnut, lichi, and papaya, through the unsavory precincts of the "" salt-fish market"
625,1884,NF,JamesNasmythEngineer,A,B,C,"  found the castle amidst its deep forests of pine, larch, elm, and chestnut. The building consists of a high quadrangular pile of many stories, projecting backwards"
626,1885,MAG,NorthAmRev,A,B,C,"  , had kindly arranged a meeting at Jones' Hotel, near Seventh, on Chestnut street, Philadelphia. He was then a stoutly built, round-faced youth, twenty-one"
627,1886,FIC,Henrietta,A,B,C,"  her side. Hilton crosses to mantel l.) Now, is it the chestnut filly or the ballet-dancer? Vanalstyne Nicho las Vanalstyne (aside, r.)"
628,1886,FIC,Henrietta,A,B,C,  Opdyke No! Ha -- ha -- ha -- ha! She's neither a chestnut filly nor a ballet-dancer. Ha -- ha -- ha -- ha -- ha!
629,1886,FIC,Henrietta,A,B,C,"  Arthur. Lord Arthur Trelawney Lady Mary! I still insist that Henrietta is a chestnut filly from Kentuckissippiana, or some other damned American state, at the races at"
630,1886,FIC,Henrietta,A,B,C,  .) Lord Arthur. Lord Arthur Trelawney I always said it was only a chestnut filly. Lady Mary. Lady Mary Trelawney Ha! ha! ha! ha
631,1886,FIC,Henrietta,A,B,C,"  Agnes. Agnes Which of' em is the corporation -- the ballet-dancer, the chestnut filly, or the witch? Bertie Bertie Vanalstyne (both sit on sofa,"
632,1886,FIC,Saratoga,A,B,C,"  , madam; she has come home from the races with her head full of chestnut fillies, and three-year-old geldings, and little bay mares, and quarter poles,"
633,1886,NEWS,NYT-Reg,A,B,C,"  Chestnut street, below Eighth, was destroyed by fire today. Tho loss on the"
634,1887,FIC,MidnightBell,A,B,C,"  . The City Lawyer, Napier KeeneCrosses back R. Aside to Deacon That's a chestnut. Deac. The Deacon, Lemuel Tidd What's a chestnut? Oh,"
635,1887,FIC,MidnightBell,A,B,C,"  That's a chestnut. Deac. The Deacon, Lemuel Tidd What's a chestnut? Oh, yes. Go on, Martin. Mar. The Country Boy"
636,1887,FIC,MidnightBell,A,B,C,"  spare that tree and you want him to spare that tree because it's a chestnut tree. Now take the next line: "" Touch not a single bough."
637,1887,MAG,Atlantic,A,B,C,"  portrait, which I have always kept, shows him as a great, powerful chestnut horse, well deserving the name of "" bullock, "" which one of the"
638,1887,MAG,Atlantic,A,B,C,"  but there were smooth, polished buckeyes, fairy cups of acorn shells, velvetlined chestnut burs, and the spicy walnuts, with which we once stained our // hands"
639,1887,NEWS,NYT-Reg,A,B,C,  in the habit of going to the saloon at the southwest corner of Tenth and Chestnut for their diurnal supply of whisky. The saloon keeper missed his customers for several
640,1888,MAG,Century,A,B,C,  to the store on the opposite side of the road. South of Ulidia the Chestnut Valley stretches out at the foot of the Belt Mountains in brown undulations to the
641,1889,MAG,Harpers,A,B,C,"  ash, poplar, black walnut, linn, elm, hickory, beech, chestnut, red cedar. The climate may honestly be called temperate: its inhabitants do"
642,1889,MAG,Harpers,A,B,C,"  the south side of Pine, is a conglomerate, covered with superb oak and chestnut trees. We climbed up to the mountain over a winding road of ledges,"
643,1889,MAG,Harpers,A,B,C,"  friendly to fruit of all sorts, with abundance of walnut, oak, and chestnut timber -- a fertile, agreeable valley, settled with well-to-do farmers. The next"
644,1889,MAG,Harpers,A,B,C,"  base of Black Mountain. Such a wealth of oak, beech, poplar, chestnut, and ash, and, sprinkled in, the pretty cucumber-magnolia in bloom!"
645,1889,MAG,NewEngMag,A,B,C,  recovery of his health. One who met him from time to time at this Chestnut Street Boston. // period remembers seeing him frequently walking on Boston Common with the
646,1889,MAG,NewEngMag,A,B,C,"  years been his home companion; and it is at her house, at *o Chestnut Street, Boston, that he has his winter home. Here he occupies as"
647,1889,NF,HistoryPhoenicia,A,B,C,"  , and have stood to it as the pine to the Swiss Alps and the chestnut to the mountains of North Italy. Of shrubs, below the rank of trees"
648,1889,NF,Arena Volume4,A,B,C,"  you stop this lecture to say that all this is a truism -- a "" chestnut ""? Yes, but everybody who talks against Nationalism forgets it. So follow"
649,1890,FIC,SunsetPass,A,B,C,"  dark gorge, still three miles before them, the riders of the beautiful "" chestnut sorrel "" troop swept across the plains. Meantime the savage fight was going on"
650,1890,FIC,MizoraAProphecy,A,B,C,"  common in Mizora, as if it had stolen the golden edge of a ripe chestnut. Her beauty was a constant charm to me. The National College contained a"
651,1890,FIC,MizoraAProphecy,A,B,C,"  first I mistook them for brown. Her hair was the color of a ripe chestnut frosted with gold, and in length and abundance would cover her like a garment"
652,1890,FIC,TomDickHarry,A,B,C,"  one? (goes r. c., then goes c.) That's a chestnut! Hadn't you better make it half a crown? Gen. Gen. Rufus Stanhope"
653,1891,FIC,CalendarSonnets,A,B,C,"  is heaped! The yellow birch-leaves shine like bright coins strung On wands; the chestnut's yellow pennons tongue To every wind its harvest challenge. Steeped In yellow,"
654,1891,FIC,InitialStudies,A,B,C,"  did, a most awkward, ridiculous appearance. Then I turned and went down Chestnut Street and part of Walnut Street, eating my roll all the way and,"
655,1891,FIC,ElsiesVacation,A,B,C,"  body was hung in chains, with hoop iron bands around it, on a chestnut tree hard by the roadside, about a mile from Freehold. "" "" O"
656,1892,FIC,Marriages,A,B,C,"  , when afternoon had touched all the air to gold, when the shadows of chestnut and cypress and gnarled olive lay long on the grass, other sounds floated down"
657,1892,FIC,TakenAlive,A,B,C,"  existence. One October day I was walking on a country road, and a chestnut burr lay in my path. I said to myself, "" There is a"
658,1892,FIC,TakenAlive,A,B,C,"  out. "" With little volition on my part, the story "" Opening a Chestnut Burr "" took form and was written. One summer evening, when in New"
659,1892,FIC,ManWoman,A,B,C,"  though not uncouth, and had keen, laughing gray eyes, heavy eyebrows and chestnut hair. She was a half jaunty, buxom amazon, with a brazen,"
660,1892,FIC,ManWoman,A,B,C,"  . The night passed, and the sun rose clearly over the forest. The chestnut setter roused himself from behind the tent, and came in front of it,"
661,1892,FIC,PeaksIsland,A,B,C,"  acquaintance of her cousin. In the broad stone fireplace, logs of beech and chestnut were piled up on the hearth, across brass dogs, where they blazed,"
662,1892,FIC,PeaksIsland,A,B,C,"  which are a part of the arms of Spain. The furniture was all of chestnut, carved in the deeply cut and highly raised work, which is so rich"
663,1892,FIC,PeaksIsland,A,B,C,"  under the middle size, and his face exceedingly handsome and refined. His bright chestnut colored hair was long and fell in waving masses on his shoulders. He wore"
664,1892,FIC,Poems,A,B,C,"  is heaped! The yellow birch-leaves shine like bright coins strung On wands; the chestnut's yellow pennons tongue To every wind its harvest challenge. Steeped In yellow,"
665,1893,FIC,PrinceIndia —Volume01,A,B,C,"  he laid his forehead on her shoulder so his white hair blent freely with her chestnut locks; and sitting passively, but wondering, she heard him sob and sob"
666,1893,FIC,PrinceIndia —Volume02,A,B,C,"  , two of his men brought a complete equipment, and placed it on the chestnut steed. The furniture was all sheen of satin and gold. Another attendant brought"
667,1893,FIC,PrinceIndia —Volume02,A,B,C,"  , and finally resolved to go out into the city. He sent for the chestnut Arab, and putting on the steel cap and golden spurs had from the Holy"
668,1893,FIC,PrinceIndia —Volume02,A,B,C,"  of Flowers, the Princess, was of the company. I offered her my chestnut courser, but she preferred a jennet. Remembering your instructions, O my Lord"
669,1893,FIC,PrinceIndia —Volume02,A,B,C,"  his back, and a small shield or buckler over the quiver. The favorite chestnut Arab served him for mount, its head and neck clothed in flexible mail."
670,1893,FIC,Poems,A,B,C,"  The pine is bending his proud top, and now Among the nearer groves, chestnut and oak Are tossing their green boughs about. He comes! Lo, where"
671,1893,FIC,Poems,A,B,C,"  . To the door The red man slowly drags the enormous bear Slain in the chestnut thicket, or flings down The deer from his strong shoulders. Shaggy fells Of"
672,1893,FIC,EastWest,A,B,C,"  Where the liquid calm leaves Shadow as it passes, Flash of raven tresses! Chestnut nakednesses! Vain the guesses, Be they forest lads or lasses. No Paynims"
