entry,year,genre,source,a,b,c,text
1352,1956,MAG,Time,A,B,C,"  not yet the gentle greybeard whom every U.S. child would associate with Hiawatha and spreading chestnut trees, but Harvard had given him a chair of languages and literature and even"
1353,1956,MAG,NatGeog,A,B,C,"  it in a display building. To me it suggested the pecky cypress and worms chestnut popular in the East. "" After we've used everything we can making lumber"
1354,1956,MAG,SatEvePost,A,B,C,"  giving her playmates. So we enrolled her at the age of three in the Chestnut Hill Academy, taught by Mrs. Madeline Harper. She liked to go to school"
1355,1956,MAG,SatEvePost,A,B,C,"  intimation that no one could help her. Except for Mrs. Harper, at the Chestnut Hill Academy, them was no one to whom we had turned for aid who"
1356,1957,FIC,MrAudubonsLucy,A,B,C,"  signaled William Rankin, and he and Carmarthan brought in the box. It was chestnut, put together by McTag at Lucy's order, big enough to hold Audubon"
1357,1957,FIC,MrAudubonsLucy,A,B,C,"  , ""? hereby grant a lease on the valuable river frontage from Main to Chestnut for the nominal sum of twenty dollars, for the term of ninety-nine years,"
1358,1957,FIC,NothingButNight,A,B,C,"  his troubles. The sweeter and more innocent, the better. V THE Spreading Chestnut Country Club was located in Mamaroneck, among those flowing hills and long vistas which"
1359,1957,FIC,NothingButNight,A,B,C,"  Beyond that, what did it matter? One more turn, past the Spreading Chestnut Club, and then they were on a wide pleasant street with soft yellow lamps"
1360,1957,MAG,SportsIll,A,B,C,"  of the race. // Neji ambled delicately in the walking ring, his rich chestnut color ricocheting sunlight. As he walked past his owner, Mrs. Ogden Phipps,"
1361,1957,MAG,SportsIll,A,B,C,"  , with one ace in Bold Ruler, goes after this big one with a chestnut colt, Misty Flight. Second in both The Futurity and Champagne, the Wheatley"
1362,1957,MAG,SportsIll,A,B,C,"  N.Y., 1:45 p.m. (NBC). Boston College vs. Villanova, Chestnut Hill, Mass. Brown vs. Pennsylvania, Providence. California vs. Southern"
1363,1957,MAG,Time,A,B,C,"  favorite. It was a little too early in the season to be sure the chestnut was ready, but the horseplayers knew that a Jerkens horse would always give them"
1364,1957,MAG,Time,A,B,C,"  National just the week before, nor to Alfred Patrick Smithwick, who is the chestnut champion's pilot, nor to his brother Daniel Michael Smithwick, who nursed Neji"
1365,1957,MAG,Time,A,B,C,"  month, is already steeplechase horse of the year. Barring injury, the big chestnut has a long career ahead in which to build on his earnings of $233,625-only $1,600"
1366,1957,NF,ArabianHorseIn,A,B,C,"  Y. 1824.) Corns. W. Van Rantz'. "" Cardozo: A chestnut horse imported into Boston, in June 1832, by Messrs. R. D. Tucker"
1367,1957,NF,ArabianHorseIn,A,B,C,"  Arabian owners: ""' We, the undersigned, do hereby certify that the Chestnut Horse five years old, with a white spot on the forehead, was sent"
1368,1957,NF,ArabianHorseIn,A,B,C,"  Arabian horse of the tribe bred on the borders of Syria? he was a chestnut horse, and selected from the stables of the Sultan Mahmoud, in Constantinople;"
1369,1957,NF,ArabianHorseIn,A,B,C,"  of Va. New Jersey printed Advertisement, 1830'. "" Stamboul: A chestnut horse; an Arabian of the tribe called Uegdi'. He was selected from"
1370,1957,NF,ArabianHorseIn,A,B,C,"  mountain Arabian horse. Nothing except his name is known. "" Zilcaadi: A chestnut horse, an Arabian of the tribe on the borders of Syria. He was"
1371,1957,NF,ArabianHorseIn,A,B,C,"  a gray mare; Lulie, an Arab mare in foal to Ahzees Pasha's chestnut Arabian, Bagdad; Fysaul, a chestnut stallion; Hamdan, a gray Arabian"
1372,1957,NF,ArabianHorseIn,A,B,C,"  mare in foal to Ahzees Pasha's chestnut Arabian, Bagdad; Fysaul, a chestnut stallion; Hamdan, a gray Arabian stallion; Massoud, a chestnut stallion;"
1373,1957,NF,ArabianHorseIn,A,B,C,"  , a chestnut stallion; Hamdan, a gray Arabian stallion; Massoud, a chestnut stallion; and Mokladi, a gray stallion. All are recorded in early American"
1374,1957,NF,ArabianHorseIn,A,B,C,"  by giving considerable boot. This last importation consisted of the bay Sacklowie, a chestnut "" Faysal, ""' supposed to be the best young horse in the Anayza"
1375,1957,NF,ArabianHorseIn,A,B,C,"  7, under "" Bussorah Arabian "" for further information. "" Cardoza? A chestnut horse... See Chapter 7, under "" Cardozo "" for further information"
1376,1957,NF,ArabianHorseIn,A,B,C,"  "" Spot? Imported by Major Wormley, of Virginia. "" Stamboul? A chestnut horse... See Chapter 7, under "" Stamboul "" for further information. 7 77"
1377,1957,NF,ArabianHorseIn,A,B,C,"  mountain Arabian horse. Nothing is known except his name. "" Zilcaadi? A chestnut horse? an Arabian of the tribe on the borders of Syria. He was"
1378,1957,NF,ArabianHorseIn,A,B,C,"  the pure Koheyl race. This mare was imported in foal by Ahzees Pasha's Chestnut Arab Bagdad. "" Produce: 1857, lost colt foal by Ahzees Pasha's"
1380,1957,NF,ArabianHorseIn,A,B,C,"  Not bred in 1885-' 9. Barren in 1893. "" Nazli? Chestnut Arab mare, foaled 1888; bred by Rev. F. F. Vidal; imported and"
1381,1957,NF,ArabianHorseIn,A,B,C,"  1895, b. c. Roala by Anazeh (Arab). "" Seglawi? Chestnut Arab horse, foaled 1881, of the well-known blood of Seglawel Jedran, and"
1382,1957,NF,ArabianHorseIn,A,B,C,"  She is fifteen and one-half hands high, strong. "" Islam is a dark chestnut, with two white ankles behind. He was got from Nell Andrews by Red"
1383,1957,NF,ArabianHorseIn,A,B,C,"  stands fifteen hands high at three years old. His dam is also a dark chestnut, with two white ankles behind and stripe in the face; and her dam"
1384,1957,NF,ArabianHorseIn,A,B,C,  ankles behind and stripe in the face; and her dam was also a dark chestnut mare inbred to Morgan blood. The dam of Islam is fifteen and one-quarter hands
1385,1957,NF,ArabianHorseIn,A,B,C,"  1881, and is much larger than her dam. "" Claybeale Grant is a chestnut, with stripe in the face and three white legs, the nigh one forward"
1386,1958,FIC,Play:Confederacy,A,B,C,  (She goes out and the WOMEN continue their swift working.) MRS. CHESTNUT Bless her. Mrs. Davis would hold those dances if the city fell in on
1387,1958,FIC,SummerPlace,A,B,C,"  into the sand, and picked up a dark brown object, shiny as a chestnut, but flatter and larger. "" What's that? "" John asked."
1388,1958,MAG,SportsIll,A,B,C,"  not yet the greatest horse -- of the decade. // This amazing, flame-red chestnut has California in a condition akin to hysteria. He has, in addition to"
1389,1958,MAG,SportsIll,A,B,C,"  . But Silky is a picture horse nonetheless, with a beautiful sheen to his chestnut coat and a placid disposition. He is always completely relaxed, gentle as can"
1390,1958,MAG,Time,A,B,C,"  must have known he was on the spot. California horseplayers knew what the implausible chestnut could do. They had seen him before, loafing while a fast field stole"
1391,1958,MAG,Time,A,B,C,"  Wallman's fighters, including Heavyweight Alex Miteff, Middleweight Randy Sandy and Featherweight Ike Chestnut."
1392,1958,MAG,SatEvePost,A,B,C,"  daytime in Paris, the nurses in the park, the children playing, the chestnut blossoms glossing in the springtime tin: He recited the lyric, and our on:hest"
1393,1959,FIC,WalkWithPeril,A,B,C,"  He always goes with his head very high. There's Dame Margaret on the chestnut. The others ride like sailors. Jesu must be in from Calais. """
1394,1959,FIC,WalkWithPeril,A,B,C,"  said in a whisper, "" the two horses, the white-foot bay and the chestnut with lop ears.... "" He knew them for the mounts ridden"
1395,1959,FIC,WalkWithPeril,A,B,C,  for our keeping 117 | and put those worn nags in their place. The chestnut and the whitefoot bay look the worst to me. Get rid of them.
1396,1959,MAG,SportsIll,A,B,C,"   133219 BOSTON COLLEGE Chestnut Hill, Mass. // DEC. // 1 Brown 5 Army 7 Northeastern 12 Connecticut 15"
1397,1959,MAG,Time,A,B,C,"  in Europe. "" Gushed a reporter: "" With those eyes and that long chestnut hair, when you call' Ella' the echo comes back' bella."
1398,1959,MAG,SportsIllustrated,A,B,C,"  get to running leaving the three-quarter pole. "" When Eddie clucked to his easygoing chestnut on the backstretch the second time around, Sword Dancer moved smoothly but with devastating"
1399,1959,MAG,SatEvePost,A,B,C,  poison in a mass medium. This is a thinly disguised switch on the old chestnut that no one ever went broke in show business underestimating the intelligence of the public
1400,1959,MAG,SatEvePost,A,B,C,"  , alone. And so he was one splendid Sunday in early May when the chestnut trees along the Avenue Foch were at their glorious height and the evening sun,"
1401,1950,NF,ForestProducts,A,B,C,"  customary in so far as possible to use only those species of proved durability. Chestnut, black locust, osage-orange, and most cedar posts could be relied upon to"
1402,1950,NF,ForestProducts,A,B,C,"  , beech, birch, ash, some hickory, and the dwindling supplies of chestnut are other hardwoods commonly used. Some yellow-poplar is used for sawed stock. Among"
1403,1950,NF,ForestProducts,A,B,C,"  more durable and softer woods, such as cedars, cypress, redwood, and chestnut, gave good service when not subjected to severe mechanical wear. Now, however"
1404,1954,NF,GoodTasteInHome,A,B,C,"  wood might be used, if it served a purpose. Ash, hickory, chestnut, pine, and maple were also used, | separately, or combined with"
1405,1954,NF,GoodTasteInHome,A,B,C,"  The most popular fruitwoods were: cherry, almond, apricot, pear, and chestnut. Their fresh, vibrant color lends added charm to much provincial furniture, though"
1406,1954,NF,GoodTasteInHome,A,B,C,"  furniture was made lighter in appearance by eliminating stretchers. Furniture woods were mahogany, chestnut, and a number of fruit woods, but painted furniture in light tones was"
1407,1960,FIC,Perfectionists,A,B,C,"  in particular, an attractive woman of about thirty, tossed back her long, chestnut locks and gazed up intently at Pembroke as he passed. Seldom had he enjoyed"
1408,1960,FIC,DopeOnMars,A,B,C,"  ) is scarlet-faced, barrel-chested and gives the general appearance of belonging under the spreading chestnut tree, not in a metal bullet flinging itself out into airless space. Come"
1409,1960,FIC,SetThisHouseOn,A,B,C,"  out. "" I just love Boston, don't you? We lived on Chestnut Street, in a house with violet windows. My family was very rich."
1410,1960,FIC,Carrington,A,B,C,"  But I had not yet begun to laugh. "" Crossing the avenue along which chestnut trees, bomb-crippled but living still, raised the stumps of their arms to the"
1411,1960,FIC,Carrington,A,B,C,"  , God, he thought, to see the Seine polluted, to hear the chestnut trees on the boulevards go down screaming under the teethp236of the electric saw! To"
1412,1960,FIC,Harpers,A,B,C,"  runs one of the most beautiful streets in Europe. It has double rows of chestnut and linden trees on both sides, is straight and broad, and has on"
1413,1960,MAG,Time,A,B,C,"  cronies in the court of Louis XV. There, in view of the blossom-laden chestnut tree that dominates the Elysee gardens, the fateful confrontation began."
1414,1960,MAG,Time,A,B,C,"  Philadelphia... Presb.... $1,600-$1,800 # Chatham (500)... Pittsburgh... $2,290 # Chestnut Hill (597)... Philadelphia... Rom. Cath.... $2,000 # Elmira"
1415,1960,MAG,Time,A,B,C,  of the picture seems at a glance no more than a reroast of an old chestnut: the tale of the reformer reformed. The hero (portrayed by Director Dassin
1416,1961,FIC,ChairmanBored,A,B,C,"  in the rain in droves, multitudes, refugee millions -- maple, oak, chestnut, walnut, pear, cherry, mountain ash, and the large alien sycamore"
1417,1961,FIC,ChairmanBored,A,B,C,"  baths of tiny yellow leaves. Elms had golden hair and naked black bodies. Chestnut trees in strong sunlight wore orange impasto. Vine maples, the only adventurers,"
1418,1961,FIC,WinterOurDiscontent,A,B,C,"  outlined fuller than they were, the lower particularly. Her hair dyed a rich chestnut brown that doesn't occur in nature, but pretty. Her chin was fragile"
1419,1961,FIC,WinterOurDiscontent,A,B,C,"  had a communications system that ran from her pointed patentleather toe to her curving soft chestnut hair. "" You seem to have got over your mullygrabs. "" "" I"
1420,1961,FIC,AgonyEcstasy,A,B,C,"  of nine chisels. Bertoldo told him to start a fire in the forge; chestnut wood made the best charcoal and produced a slow, intense, even heat."
1421,1961,FIC,AgonyEcstasy,A,B,C,"  , his eyes gleaming amber in the candlelight that brought whorls of red to his chestnut hair. He listened to his own voices. One thing he knew for certain"
1422,1961,FIC,Carpetbaggers,A,B,C,"  put you to work in Madame Pompadour "" Rina sighed. "" Not that old chestnut again. Every time they get stuck for a picture, they take that one"
1423,1961,NF,ColoringFinishing,A,B,C,"  white oak by fuming with ammonia can be obtained on certain varieties of oak, chestnut, ma-hogany, gum, pine, and some other woods, by preparing the"
1424,1961,NF,ColoringFinishing,A,B,C,  to produce a rich brown tone on white oak commonly known as fumed oak. Chestnut is another wood that is quickly and beautifully stained by this process because it contains
1425,1961,NF,ColoringFinishing,A,B,C,"  the above acids, the time for fuming is generally doubled. Articles made of chestnut will usually fume in about one-half the time required for white oak. Chestnut wood"
1426,1961,NF,ColoringFinishing,A,B,C,  of chestnut will usually fume in about one-half the time required for white oak. Chestnut wood does not usually require the preliminary coat of tannic acid; and care must
1427,1961,NF,ColoringFinishing,A,B,C,"  but, when used on ring porous woods, like oak, ash, or chestnut, such mixtures are too thin to fill completely the large open tracheal vessels located"
1428,1962,FIC,SimpleHonorable,A,B,C,"  nearest to the burned churches. Also, Phillip had a stack of oak and chestnut lumber that might be used for pews. Saturday morning Harry Donner helped a group"
1429,1962,FIC,Mov:Lolita,A,B,C,"  the new building, isn't it?   KENNYYes, ma'am.   CHARLOTTEAnd Chestnut Street is closed for repairs?   KENNYYes. You have to turn after the"
1430,1962,FIC,Harpers,A,B,C,"  . Just never having enough money. "" "" Well, you have that fine chestnut hair, "" I said, trying to cheer her up, "" and you"
1431,1962,FIC,Reivers,A,B,C,"  (at least, maybe more: I wasn't expert enough to tell) chestnut gelding, not large, not even sixteen hands, but with the long neck"
1432,1962,MAG,SportsIll,A,B,C,"  who also owns Sunrise County. Three lengths behind Sebring was Larkspur, the smallish chestnut colt trained by that incomparable Irishman, Vincent O'Brien, for Virginia Sportsman Raymond Guest"
1433,1962,MAG,SportsIll,A,B,C,"  rich Arlington-Washington Futurity (at seven furlongs), but Candy Spots, a rough chestnut, developed slowly in California this year, and Ellsworth decided to leave the colt"
1434,1962,MAG,SportsIll,A,B,C,"  "" On Shoemaker's opinion, Ellsworth wrote a check for $25,000 and made the chestnut a supplementary nomination. // "" The strategy for the race wasn't really complicated"
1435,1962,NEWS,NYT-Let,A,B,C,"  out for rescue and we will have to respond courageously. DAVID A. LURENor: Chestnut Hill, Mass., Sept. 5, 1962. ests as they relate to professional artists"
1436,1962,NF,scan,A,B,C,"  , Triassic lowland, and Ridge and Valley sections carried deciduous woods of oak, chestnut and yellow poplar. Very little virgin forest remains, but there is much cut-over"
1437,1962,NF,scan,A,B,C,"  southern deciduous (Appalachian) forest, in which broad-leaved hardwoods such as oak, chestnut, walnut, maple, hickory, elm and ash were found. This deciduous"
1438,1963,FIC,Centaur,A,B,C,"  known as a "" big gray, "" and Phillips a gallant little Morgan, chestnut, with a prissy tail and nicely polished hooves -- practically a pony. Caldwell"
1439,1963,FIC,Centaur,A,B,C,"  slowly to the rear. Suddenly neat groves of trees, elm, maple, chestnut, poplars, and then an ugly space of sky. Signals, winking blinkers"
1440,1963,FIC,WyomingSummer,A,B,C,"  bunch, never like herself but reproducedin the image of the Sire -- a golden chestnut. And they are as alike as peas in a pod. She raises them"
1441,1963,NF,ChemistryWoods,A,B,C,"  from South America contains up to 20% tannin, and appreciable amounts are found in chestnut wood, the heartwood of redwood, and several other wood species (188)"
1442,1963,NF,ChemistryWoods,A,B,C,"  trees, cultivated in South Africa. Several other extracts, including the extract of chestnut wood, are used. In the past, eastern hemlock bark and American chestnut"
1443,1963,NF,ChemistryWoods,A,B,C,"  chestnut wood, are used. In the past, eastern hemlock bark and American chestnut wood were major sources of the tannins used in this country. As blight has"
1444,1963,NF,ChemistryWoods,A,B,C,"  the tannins used in this country. As blight has killed most of the American chestnut trees, this source has largely been depleted, but chestnut extract is being imported"
1445,1963,NF,ChemistryWoods,A,B,C,"  most of the American chestnut trees, this source has largely been depleted, but chestnut extract is being imported from Europe. Eastern hemlock bark was important when the tanner"
1446,1964,FIC,RectorJustin,A,B,C,"  's board, because I have the gift of being able to get any old chestnut out of any old fire, people take for granted that I'm dull."
1447,1964,FIC,RectorJustin,A,B,C,"  more distinguished. At this point she had just started to dye her hair the chestnut color that it was always to remain. She did it, I am sure"
1448,1964,FIC,Mov:Americanization,A,B,C,"  first assault wave.   GENERAL HALLERTONGood Lord, you're not dragging that old chestnut in.   ADMIRAL JESSUPThe Marines are the traditional shock troops, and you know"
1449,1964,FIC,Mov:DrStrangeloveHow,A,B,C,"  . Anthony 120 his hair blowing in the wind on the first horse, a chestnut stallion. Almost abreast of him, his young (future) son (seen"
1450,1964,MAG,SportsIll,A,B,C,"  seen this year -- the four-time stakes winner Golden Joey, a fat butterball of chestnut that has broken two track records without even trying. Jacobson also has the stakes"
1451,1964,NEWS,Chicago,A,B,C,"  Winnetka ay. The dead boy was Frank Kelly III, 11, of 147 Chestnut st., Winnetka, one of five children of Dr. Frank B. Kelly Jr."
1452,1965,FIC,OrchardKeeper,A,B,C,  against the quick bloom of the lightning. As he passed it thus a barren chestnut silver under the sluice of rain erupted to the heart and spewed out sawdust and
1453,1965,FIC,OrchardKeeper,A,B,C,"  in a field of broom sedge bright as wheat, treeless but for a broken chestnut the color of stone. The sun was up by then and the old man"
1454,1965,FIC,DoLordRemember,A,B,C,"  at the quarry, and Penrose fractured his left arm in a fall from a chestnut tree. Punishmentwas by spanking; barehanded by Adelaide when they were young; with"
1455,1965,FIC,DoLordRemember,A,B,C,"  a public high school. The day pupils were the daughters of nearby Overbrook, Chestnut Hill, and Germantown families, and many of them would be leaving Miss Dawson"
1456,1965,MAG,NatGeog,A,B,C,"  most notorious crop ravagers. These fungi account for an appalling list of scourges: chestnut blight, apple scab, peach leaf curl, alfalfa leaf spot, corn ear"
1457,1965,NEWS,Chicago,A,B,C,"  Last Friday, Miss Rude won the Peter Snite memorial trophy by riding a 9-year-old chestnut mare, Fantasia, to victory in the Oak Brook horse show. On Thursday"
1458,1966,FIC,AllInFamily,A,B,C,"  read once, "" he said, "" I read a thousand times that old chestnut about Charles and me standing up to Pa, trying to beat him down on"
1459,1966,FIC,WaitingWinter,A,B,C,"  where you rent masquerade costumes. You know the place I mean, down on Chestnut Street. Van Something. "" "" What color wig? "" | "" Get"
1460,1966,FIC,IKing,A,B,C,"  of respect "" decked out in velvet of blue and black and drawn by six chestnut horses from Denmark. Margarita, with the usual regalia of hat and staff of"
1461,1966,FIC,CoffinCorner,A,B,C,"  he said to Yakov, who was gazing out the windowat the rain in the chestnut trees, "" you know well this concerns you so pay attention. "" In"
1462,1966,FIC,DeathDoxy,A,B,C,"  without company, but that time, from the Neptune bouchees right through to the chestnut whip, he not only let the guest, a female guest, take over"
1463,1966,MAG,Nation,A,B,C,"  issue "" dominating all other campaign issues, says Reagan; is that old Goldwater chestnut "" morality in government ""; the details are not defined, but it is"
1464,1966,NEWS,NYT-Let,A,B,C,"  Roads, has announced that the long-disputed Route 87 will take the easterly route along Chestnut Ridge Road, instead of the westerly route. The latter route has been highly"
1465,1966,NEWS,NYT-Let,A,B,C,"  , and national and local conservation groups. Mr. Whitton promises that the sanctuaries bordering Chestnut Ridge Road will be beautified by his landscaping and that wild life will benefit by"
1466,1966,NF,CautionaryScientists,A,B,C,"  (when he was in his natural, private, unpowdered state) by long chestnut hair. His eyebrows had a proudly perfect arch above clear deep-set eyes and,"
1467,1966,NF,LandsContrast,A,B,C,"  They can be cropped for many years without the use of artificial fertilizers. The chestnut soils of the short grass prairie also have plentiful humus but, owing to the"
1468,1967,FIC,ConfessionsNat,A,B,C,"  is wearing a white bonnet, and beneathit glossy strands of hair the color of chestnut have become unloosened, which all unconsciously lends to her demure and virginal beauty the"
1469,1967,FIC,Arrangement,A,B,C,  in herp169garters. Her gray eyes looked back at her from the mirror. Her chestnut hair fell down to her naked shoulders; she contemplated the scar on her forehead
1470,1967,FIC,EighthDay,A,B,C,"  slid to the floor on her knees. He recited, "" Under the spreading chestnut tree, The village smithy stands. "" He started off on a fragment from"
1471,1967,NEWS,NYT-Let,A,B,C,"  encourage it. RIDER ON THE SHORE White gulls wake where a girl rides A chestnut horse over the wet brown sand, Clearing the mossy breakwaters with, long strides"
1472,1967,NF,Interpretations,A,B,C,"  of enterpriser against capitalist, of banker against regulation, and of Wall Street against Chestnut. "" The last phrase refers to the New York City bankers who, Hammond"
1473,1967,NF,FartherShorePolitics,A,B,C,"  the seminary in 1929 to set up his own more conservatively oriented Westminster Seminary in Chestnut Hill, Pennsylvania, McIntire followed and secured his degree from the new institution two"
1474,1968,FIC,MorningNoonNight,A,B,C,"  though in the college library portrait of Caleb Cuthbertsonthey are half hidden by a voluminous chestnut beard. My mother had them. They bypassed me, Worthingtongenes, or perhaps"
1475,1968,FIC,Mov:Swimmer,A,B,C,"  . They scan the branches of nearby trees through binoculars. HARRIET It's a Chestnut Sided Warbler! See there! It has a yellow cap! JANE No,"
1476,1968,FIC,PreserveProtect,A,B,C,"  men's room? "" Helen-Anne snorted. "" Oh, Christ, that old chestnut! No, I have not caught one of his assistants in the men's"
1477,1968,FIC,TestimonyTwoMen,A,B,C,"  neighbors, and was made of wood painted a particularly -- to Jonathan -- repulsive chestnut brown, with bright yellow shutters and yellow shingles. It had two towers,"
1478,1968,MAG,SportsIll,A,B,C,"  his first ride on a really fine horse -- Silver Fame, a big pale chestnut, winner of the Cheltenham Gold Cup and the best horse Lord Bicester ever owned"
1479,1968,NEWS,Chicago,A,B,C,"  for parishioners will be held in the chapel of Quigley Preparatory seminary, Rush and Chestnut streets. Arrangements for additional masses and other services in other nearby churches are being"
1480,1969,FIC,WhatImGoingDoI,A,B,C,  militants had decided to march out of the ghetto and take the white houses of Chestnut Lane by force. Nailles was not in bed and she went to the window
1481,1969,FIC,SickFriends,A,B,C,"  a large, spreading tree, resembling a cross between an elm and a horse chestnut. The leaves were flat, almost like lily pads, and the cover they"
1482,1969,FIC,Mov:MidnightCowboy,A,B,C,"  upstairs! EXT. BARBIZON FOR WOMEN - NIGHT Ratso warms his hands at a chestnut vendor's cart, seeing...... zoom close-up, a lady in a window"
1483,1969,FIC,Promise,A,B,C,"  . She was a striking woman, tall, slender, lithe, with short chestnut hair and beautifully proportioned features, and she moved'about in front of the net with"
1484,1969,FIC,Promise,A,B,C,  looked very beautiful in a dark-blue woolen suit and a small white hat over her chestnut hair. But she seemed fatigued and there were dark circles under her eyes.
1485,1969,MAG,SportsIllustrated,A,B,C,"  he be faulted Or Johnny Longden or Bill Hartack!' The big, durable chestnut has run six times since early January and won ail but the Derby by four"
1486,1969,MAG,NatGeog,A,B,C,"  with rows of tent markings across its polished dome and an orange underside flecked with chestnut dots. Within a few hours we had harvested scores of money cowries, Cypraea"
