entry,year,genre,source,a,b,c,text
945,1922,FIC,Half-PastSeven,A,B,C,"  "" flies "" he would knock, if he only had the chance -- over the dead chestnut tree, over the Gold Rooster on the top of the barn, and even"
946,1922,FIC,Half-PastSeven,A,B,C,"  "" this big rock'll be home-plate, and that one over there by the chestnut tree' first.' An' we'll choose up sides -- first choosin'!"
947,1922,FIC,Half-PastSeven,A,B,C,"  ! He had hit it! And away the Rocket ball flew towards the dead chestnut tree, up, up, by the old crow's nest, and plop"
948,1922,FIC,SkyLineSpruce,A,B,C,"  . A fat brook or lake trout, dipped in flour and fried to a chestnut brown, was a delight that never grew old. At every fresh find Beatrice"
949,1922,FIC,CopperStreakTrail,A,B,C,"  old nor young. He wore a thick mop of brown hair, tinged with chestnut in the sun. His forehead was broad and high and white and shapely."
950,1922,FIC,RaggedEdge,A,B,C,"  towers of the pawnshops. Celestial Uncles! Spurlock chuckled, and a bit of chestnut, going down the wrong way, set him to coughing violently. When the"
951,1922,FIC,VehementFlame,A,B,C,"  be gone a week, maybe more; because if I don't pull the chestnut out of the fire in St. Louis, I'll have to go to some"
952,1922,FIC,LastHarvest,A,B,C,"  counting their rings. Apparently not a stump escaped him -- pine, oak, birch, chestnut, maple, old or new, in the pasture or in the woods;"
953,1922,FIC,SheBoss AWestern,A,B,C,"  . She was straight and sturdy and strong. Her hair was of a dark chestnut hue, and its beauty and luxuriant growth made it at once the envy and"
954,1922,FIC,Rosemary,A,B,C,"  , with the air of a martyr, took her sewing out under the horse chestnut tree, Sarah and Shirley went to a neighbor's to play and Winnie announced"
955,1922,FIC,FlamingJewel,A,B,C,"  morning sun: and the sun fell on Eve's drooping head, turning her chestnut hair into fiery gold. * * * * * An hour later Trooper Stormont"
956,1922,FIC,HiddenGold,A,B,C,"  , as Dorothy's fresh complexion and lithe, alert figure bore witness. Her chestnut hair, piled in a silken crown on her shapely head, shaded a face"
957,1922,FIC,PenguinPersons,A,B,C,"  with Spring for company, all that blissful day, through forests of oak and chestnut where the Judas trees danced, past dogwood thickets and over beds of violets,"
958,1922,FIC,PenguinPersons,A,B,C,"  its close: And yet it is the same as when I looked across the chestnut woods, And saw the barren landscape then O'er the red bunch of lilac buds"
959,1922,FIC,PenguinPersons,A,B,C,"  whether they were or not. I was told in tripping measures of the village chestnut tree, to the total exclusion of the linden and ilex; and as for"
960,1922,FIC,PenguinPersons,A,B,C,"  laurel rise -- "" Kennst du das Land? "" Not I! The spreading chestnut tree alone cast its oppressive shadow across my childish fancy. Another memory gem that"
961,1922,FIC,VirginiaScout,A,B,C,"  . And now I was riding away to battle, riding right joyously over the chestnut ridges and through the thick laurel, through stretches of pawpaw, beech and flowering"
962,1923,FIC,Confidence-Man,A,B,C,"  of the glazed colors on stone-ware. Her hair was of a deep, rich chestnut, but worn in close, short curls all round her head. Her Indian"
963,1923,FIC,BlackOxen,A,B,C,"  to the eye with her calm and regular features softened by a cloud of bright chestnut hair that matched her eyes to a shade, her serene brow and her exquisite"
964,1923,MAG,Time,A,B,C,"  at Barbizon, France, where he "" lived the simple life "" in a chestnut forest with the rest of the famous Barbizon Group (Corot, Rousseau, Diaz"
965,1924,FIC,Play:Show-Off,A,B,C,"  MRS. FISHER Of course she has. CLARA It's only at Ninth and Chestnut, and she's at Eighth. MRS. FISHER That's what I told"
966,1924,FIC,Play:Show-Off,A,B,C,  at the Show. And that I'll be at Childs' at Fifteenth and Chestnut until eight o'clock. He looks at his Ingersoll MRS. FISHER Fifteenth and Chestnut
967,1924,FIC,Play:Show-Off,A,B,C,"  Chestnut until eight o'clock. He looks at his Ingersoll MRS. FISHER Fifteenth and Chestnut? PIPER That's the said and done, Mother. He laughs boisterouslyThe old"
968,1924,MAG,Time,A,B,C,"  highly skillful brothers Kinsey-Robert and Howard - convinced all comers at the Longwood Cricket Club (Chestnut Hill, Mass.) that the national doubles wreath ought to hang on the Golden"
969,1924,MAG,Time,A,B,C,"  was crippled with cramps, had to default. # ... # At Chestnut Hill, Mass., tennis court-keepers put by their weeding-knives, rollers, mowers and"
970,1924,MAG,Time,A,B,C,"  Satin Slippers, his two-year-old traveling companion (female). He is a bright chestnut beast, slightly undersized, insured for $150,000, valued at $300,000. # At"
971,1924,MAG,Time,A,B,C,"  summary of events, the Generous Citizen points with pride to: # A bright chestnut beast, slightly undersized, valued at $300,000. (P. 25.) #"
972,1924,MAG,Atlantic,A,B,C,"  not ivy at all, but a mass of twisted kalmia from which several great chestnut trees rose in triumph. From somewhere in the tangled interior I could hear Sam"
973,1924,MAG,Atlantic,A,B,C,"  shall' scape a predestinate scratched face.' These words, uttered in the Chestnut Street Opera House in Philadelphia in 1883, still ring in my cars; from"
974,1925,FIC,Coyote AWestern,A,B,C,"  in the doorway. Rathburn noted her trim, slim figure and her wealth of chestnut hair. She was pretty and capable. He surmised that her parents were dead"
975,1925,FIC,Play:FirstFlight,A,B,C,"  fire. I'd shut his eyes, even if they can be sharp as chestnut burrs He'll go away and there won't ever be another one in a"
976,1925,MAG,Time,A,B,C,"  was Munning's picture of the Prince of Wales on Forest Witch, his graceful chestnut mare. There was Sir James J. Shannon's portrait of the Princess Patricia,"
977,1925,MAG,Time,A,B,C,  name was Jos Vespaciano. He was tall and slender with dark brown eyes and chestnut hair and beard; people who saw him walk the mean streets in his curious
978,1926,MAG,GoodHouse,A,B,C,"  in all their glory of rich bronze-green and iridescent purple and white and blue and chestnut. This was a great adventure? not because anything startling happened, but because"
979,1926,MAG,Atlantic,A,B,C,  gang of boys and roamed the streets till late at night. We made ourselves chestnut pipes and smoked dry cherry leaves. And I learned to swear worse than any
980,1926,MAG,Atlantic,A,B,C,  The street watchman was singing his two-o'clock rhyme. I ran over and dropped my chestnut pipe in the cart. Then I went home and fell asleep. Besides cursing
981,1926,MAG,Atlantic,A,B,C,"  white with wings of spangled gauze flitting in and out of the under-woods among massive chestnut stems. As relaxation and frivolity the Opera House was hired, and they played"
982,1927,MAG,Time,A,B,C,"  plow a furrow across the vicarage lawn, plow up the doorstep, with three chestnut horses steaming and gleaming on a snowy morning. Part is uneasy: a weathercock"
983,1927,MAG,Time,A,B,C,"  in Rye, N. Y. The Flirt was first. # Dazzle, a magnificent chestnut gelding of the Vesperland Stables, was pronounced Champion Polo Mount in the leading event"
984,1927,MAG,GoodHouse,A,B,C,"  as I have never heard a blackcap sing before or since in the great old chestnut tree said to have been planted by Francois Premier, on the high terrace at"
985,1927,MAG,Harpers,A,B,C,  bits of string and the harness with decayed rope. I still see the agile chestnut horses; I still feel the jolting over the roads which in England we should
986,1928,FIC,ExcitingAdventures,A,B,C,"  through the woods telling everyone that there had been a frost, and that the chestnut burrs would soon be open. Mister Tom Squirrel was very much pleased, but"
987,1928,FIC,Play:LyricalOpera,A,B,C,  they have had it for for it to be where they have it to have chestnut trees as trees very nicely as soon. Creditably. She and he see.
988,1928,FIC,Play:LyricalOpera,A,B,C,  mauve blossoms and they come out before leaves on a spreading Pologna tree. A chestnut tree has blossoms and leaves at the same time so has a Pologna tree.
989,1928,FIC,Play:ComicArtist,A,B,C,"  -- ELEANOR To Paris -- to Springtime in Paris. Luella smiles at Stephen. Chestnut trees dripping with rain, the hiss of a syphon into a glass! STEPHEN"
990,1928,MAG,Time,A,B,C,"  her nails every morning, how her house, in the sedate Boston suburb of Chestnut Hill, was fitted with an elaborate system of bells by which her "" watchers"
991,1928,MAG,Time,A,B,C,  her beliefs; they hung like a pack of phantoms around her neat house in Chestnut Hill and she could hear their painful voices screaming in the dark. Once she
992,1928,MAG,Time,A,B,C,"  Knitting Co., director of many New England woolen mills and knitting companies; in Chestnut Hill, Mass. # Died. Max Pine, 62, labor leader,"
993,1928,MAG,Time,A,B,C,"  auburn-haired young woman whom shameless Berlin sports writers did not scruple to call "" a chestnut filly, "" + # Meanwhile, in Shanghai, China, a distinguished mingling"
994,1928,MAG,Time,A,B,C,"   164248 Mrs. Frances W. Capper made a hole-in-one at the Chestnut Hill Golf Club in Brookline, Mass. Then, just for practice, she"
995,1928,MAG,Time,A,B,C,"  day Lott &; Hennessey came out on the courts of the Longwood Cricket Club, Chestnut Hill, Mass., defeated the Australian team, Gerald L. Patterson &; John B."
996,1928,MAG,Time,A,B,C,"  two saplings, 70 years ago, and cried: "" As these two horse chestnut trees grow and spread their branches, so the cause of temperance shall grow and"
997,1928,MAG,Time,A,B,C,"  du Pont (explosives) of Wilmington, Del.; to Donald P. Ross of Chestnut Hill, Pa. # Married. Carlos Salzedo, famed harpist, of New"
998,1928,MAG,NatGeog,A,B,C,"  and they had "" sawed 2,500 pales, 220 rails, 65o f. of inch chestnut plank &; 250 of 24-inch do. "" So were cut and left to season"
999,1929,MAG,Time,A,B,C,"  at Tiajuana (Aunt Jane). Mexico. Golden Prince is a sleepy-looking Kentucky chestnut, a five-year-old gelding from the stables of the Sunshot Stock Farm owned by one"
1000,1929,MAG,Time,A,B,C,"  shot, owned by a woman, ridden by a former sailor-Gregalach II, a chestnut gelding. # Americans owned eleven of the horses which made the first charge."
1001,1920,NEWS,WallStJrnl,A,B,C,"  the year the dealer: have not been able to stock up on stove and chestnut and in this section many have been out of these sizes for weeks, Massachusetts"
1002,1920,NF,MargotAsquithAutobiography -,A,B,C,"  was lengthening my stirrup. Havoc, as he was called, was a dark chestnut, 16.1, with a coat like the back of a violin and a spiteful"
1003,1921,NEWS,WallStJrnl,A,B,C,"  finding a place for all of their egg and stove, though storing pea and chestnut and the buckwheats. There are indications that the movement west to the Lakes may"
1004,1921,NEWS,WallStJrnl,A,B,C,  but retailer takes only small percentage of normal amount. Large tonnage of peu and chestnut is being stored on docks.
1005,1922,NEWS,NYT-Reg,A,B,C,"  have some anthracite coal. There is reported to be some pea, stove and chestnut coal in stock in the mining region which owners are unwilling to ship, fearing"
1006,1922,NF,AfootInEngland,A,B,C,"  a big queen bumble-bee on the ground, looking extremely conspicuous in its black and chestnut coat on the fresh green sward; and thinking it numbed by the cold I"
1007,1922,NF,AfootInEngland,A,B,C,"  glossy red; but the silky hair on the distended udder was of an intense chestnut, and all the parts that were not clothed were red too -- the teats"
1008,1922,NF,AfootInEngland,A,B,C,"  and by other names, calling each old oak, elm, ash, and chestnut after one of the immortals. I can even imagine that the literary man,"
1009,1922,NF,ConfessionsBook-,A,B,C,"  my mother, and I remember, as a small boy, going up to Chestnut Street in Philadelphia, with divine eagerness, to buy the latest number of a"
1010,1923,NEWS,NYT-Reg,A,B,C,"  and Nevin was shot in the leg. Fire at the family home. 2,021 Chestnut Street. Aug. 5, 1922, almost ended Nevins's life. After alarming"
1011,1923,NEWS,NYT-Reg,A,B,C,"  two brothers. Ogden and Perot, and a sister; Mrs. Thedbold Clark of Chestnut Hill. The, pollee assert that when Nicholson and Fotterall first rayached the station"
1012,1924,NEWS,WallStJrnl,A,B,C,"  only passing influence on the anthracite trade. Large producing companies are distributing stove and chestnut without difficulty, but these are the only sizes really in demand. Dealers'"
1013,1924,NEWS,WallStJrnl,A,B,C,"  move, and barely 25 to 75 cents above, the circular on stove and chestnut, a competitive basis more nearly exists. Though present market conditions are not favorable"
1014,1924,NEWS,NYT-Reg,A,B,C,"  auction yesterday at East' Williston, Will Rogers buying one, Jackinto, a chestnut gelding, for *2,100. Rogers is going to give it to Patricia Ziegfeld."
1015,1925,NEWS,NYT-Reg,A,B,C,"  over and allove the grab shared by all the producers. "" The mesh for chestnut and pea sizes has been changed so that between onefourth and 30 per cent."
1016,1925,NEWS,NYT-Reg,A,B,C,"  the pea coal sold, or 1.437,000 tons at least, is now sold as chestnut. Chestnut has always had an allowance of 15 per cent. of smaller sizes"
1017,1925,NEWS,NYT-Reg,A,B,C,"  coal sold, or 1.437,000 tons at least, is now sold as chestnut. Chestnut has always had an allowance of 15 per cent. of smaller sizes, but"
1018,1925,NEWS,NYT-Reg,A,B,C,"  has also been changed by 7 per cent., so that 1,242,000 tons' of chestnut are now being sold annually as stove coal, which sells for 60 cents more"
1019,1925,NEWS,NYT-Reg,A,B,C,"  and retailers would be "" making hay while the sun shines. "" He said chestnut coal was already selling at $18 -a ton in Philadelphia and as high as $10.50"
1020,1925,NF,CompleteDogBook,A,B,C,"  flat as possible. COLOR AND MARKINGS.? The COIOr should be a rich golden chestnut, with no trace whatever of black; white on chest, throat, or"
1021,1926,NEWS,NYT-Reg,A,B,C,"  companies quoted $8.75 a ton for egg coal, $9.25 for stove, $8.75 for chestnut and $8 for pea. These prices, it was announced, were on the"
1022,1926,NEWS,NYT-Reg,A,B,C,"  Stotesburys. The Prince and Princess, guests since their arrival last night at the Chestnut Hill home of E. T. Stotesbury, arrived at Logan Square at 9:40 o'clock,"
1023,1926,NEWS,NYT-Ed,A,B,C,"  dying. According to Mr. Witsua there are indications at present that some of the chestnut trees, after a hard and apparently lost battle with their enemy, have developed"
1024,1926,NEWS,NYT-Reg,A,B,C,"  agent was out when the Jersey City detectives first called at his home, 103 Chestnut Street, Brooklyn. Attorneys with De Martini.; Captain Walsh and Sergeant Burke"
1025,1926,NF,AnimalHusbandry,A,B,C,  horse must have long hairs growing from the back of the cannons and fetlocks; chestnut color is favored among Suffolk draft horses and Hackney coach horses; PolandChina and Berkshire
1026,1926,NF,ChemistryInWorlds,A,B,C,"  , and our almost losing battle against the brown tail and gypsy moths, the chestnut blight, and the white pine blister need not be emphasized here. These questions"
1027,1927,MAG,NewYorker,A,B,C,"  who himself an enthusiastic horseman). is Cedar King and it is a dark chestnut with a blaze face and two white feet. Mayor Walker, they say,"
1028,1927,NEWS,Chicago,A,B,C,"  the windows on the west side of the home of J. T. Peterson at 1202 Chestnut street, Wilmette, were broken last night by the explosion of a bomb."
1029,1927,NEWS,NYT-Reg,A,B,C,"  at six furlongs. The winner turned up in Mrs. T. 0. Webber's chestnut colt, Cherry Brook, which had half a length to spare over Le Panto"
1030,1928,NEWS,NYT-Reg,A,B,C,"  , of which city he was a native. His former wife lives in the Chestnut Hill district."
1031,1928,NF,HelenKouesOnDecorating,A,B,C,"  of drawers in oak, or solid walnut (and today | sometimes reproduced in chestnut, stained), is the proper bureau. Plate 165 shows a modern reproduction"
1032,1929,NEWS,Chicago,A,B,C,"  Winnetka police early this morning started a search for Mrs. Alice B. Austin, 437 Chestnut street, Winnetka, and her two children, Alice, 6 years old,"
1033,1929,NF,NewRegionalGeography,A,B,C,"  clothed with high forest, including deciduous trees like some of the oaks and sweet chestnut, in addition to evergreens. Elsewhere Mediterranean conditions tend to be limited to coastal"
1034,1929,NF,RussellsSoilConditions,A,B,C,"  , alder, hazel and hornbeam; the Fagaceae? the beech, oak and chestnut; and the Salicaceae? the poplars and willows, as well as a few"
1035,1929,NF,RussellsSoilConditions,A,B,C,"  the diagram on p. 256, separated from a prairie, a chernozem and a chestnut soil, analysed them for carbon, hydrogen, nitrogen and oxygen, and determined"
1036,1929,NF,RussellsSoilConditions,A,B,C,"  Madonov5 found that the nitrogen-sulphur ratio in the organic matter of some Kazan chernozem and chestnut soils was between Io? 5 and 1 1.4, agreeing fairly well with the"
1037,1930,FIC,Harpers,A,B,C,"  there was black blood in him. But the vision of his soft, straight chestnut hair, his hazel eyes, his light skin flung derision back at him,"
1038,1930,FIC,Harpers,A,B,C,"  clung to him the closer. Then they hurried away into the shadows of the chestnut trees. "" When I reached my room it was dawn. I threw myself"
1039,1931,FIC,MoneyFromHome,A,B,C,"  in the country, riding the filly bareback, bringing in hedgehogs rolled tight as chestnut burrs. A whole week end of Luc in the bosom of the family."
1040,1931,FIC,Harpers,A,B,C,"  time I did it I took elaborate precautions -- climbed high into the maple and chestnut grove, and then, when I began to approach Willard's farm, got"
1041,1931,FIC,Harpers,A,B,C,"  pasture -- it was something to do. And in the fall there were the chestnut trees, the best of which were directly north of the field. I used"
1042,1931,FIC,Harpers,A,B,C,  day she came here she saw you go by. You were riding that big chestnut horse youused to own and you had on white riding breeches and spiffy brown boots
1043,1931,FIC,Harpers,A,B,C,"  black horse, and they watched another man lift Harrison flair's wife onto a chestnut mare and then mount a bay horse in his turn. One of the men"
1044,1931,FIC,Harpers,A,B,C,"  . The white man indicated the man who was holding the bay horse against the chestnut mare's flank. "" Oh, "" the groom said. "" Mr. Gawtrey"
1045,1931,FIC,Harpers,A,B,C,  n't never been on a horse before in all her life until he bought this chestnut horse for her to match her hair. We went all the way to Kentucky
1046,1931,FIC,Harpers,A,B,C,  Blair told her to go on and bust if she aimed to ride on this chestnut horse we brought all the way back from Kentucky.' I don't aim
1047,1931,FIC,Harpers,A,B,C,"  right. Leave it be a lyron. Anyways, she would ride on this chestnut horse, trying to keep up, and Blair already outrun the dogs and all"
1048,1931,FIC,Harpers,A,B,C,"  smoke faint and windless in the sunny silence, and at the woman on the chestnut, her arms lifted and her hands busy in her bright, cloudy hair;"
1049,1931,FIC,Harpers,A,B,C,"  . Mal, one arm in a sling, racing down the street on the chestnut mare Lady, pulling her back on her haunches to a sudden stop in a"
1050,1931,FIC,ShadowsOnRock,A,B,C,"  fed by the royal hand, the King accompanied me a little way down the chestnut avenue. He wished me God-speed and said adieu. I took my departure by"
1051,1932,FIC,Sons,A,B,C,"  darkened by smudges of pain and fatigue. Everything about him, from his light chestnut hair, so thick and upspringing that it seemed blown back on his head,"
1052,1932,FIC,DonJim,A,B,C,"  arched tail, however, were flaxen, such as might have better fitted a chestnut sorrel. Ellery walked slowly round and round the horse, examining with open admiration"
1053,1932,FIC,Harpers,A,B,C,"  task finished; It is grayly-golden as a full-fledged plover, And sound as a chestnut kernel without its sweetness, And has but little interest in any lover. Foxes"
1054,1933,FIC,WandererInfinity,A,B,C,"  a high-backed chair that stood in the ancient paneled hall. Soft waves of her chestnut hair framed the pinched, terrified face, and wide eyes looked up at Bert"
1055,1933,FIC,AsTheEarthTurns,A,B,C,"  old Hattie Lord had been just the same. Manuel recited "" Under the Spreading Chestnut Tree "" with only one prompting. Betty Shaw danced the "" Summer Wind """
1056,1933,FIC,UnionSquare,A,B,C,"  . By a clever maneuver (leave it to Mr. Feibelman!), the chestnut vender had gained his objective, and none too soon. As the traffic light"
1057,1933,FIC,UnionSquare,A,B,C,"  . It was a bit of slick strategy. Sweatingand breathing hard, the little chestnut vender smiled proudly toward the statue of the Frenchman: "" Lafayette, I am"
1058,1933,FIC,CaseFoSulkyGirl,A,B,C,"  's paw for you, and get my fingers burnt unless I know whether the chestnut is worthwhilereaching for. "" Mason shook his head. "" You've got me"
1059,1933,FIC,OneMoreRiver,A,B,C,"  charge of them. "" "" What colour? "" "" Two bays and a chestnut. "" The three paddocks sloped slightly towards the river and were sheltered by a"
1060,1933,FIC,Harpers,A,B,C,"  body. He was tall and lank. A curling lock of hair, dark chestnut in color, fell down over his high, narrow forehead. At the temples"
1061,1933,FIC,LastAdam,A,B,C,"  down the tapering black shadows of screening cedars, gilding the enclosing fence of woven chestnut paling, Virginia watched her headlights sweep the garage and stable. Immediately mounted up"
1062,1933,FIC,LastAdam,A,B,C,"  must have been down to that lousy play. "" Behind the cedars and the chestnut sapling fence, she stopped the car. The dogs, muzzles down, had"
1063,1933,FIC,LastAdam,A,B,C,"  lichen, and the low huckleberry bushes growing from drifts of old leaves and open chestnut burrs. "" Listen, "" he said, "" I think the best thing"
1064,1934,FIC,LongRemember,A,B,C,"  be ready by then. "" Huddlestone watched Marta go riding away on the clumsy chestnut stallion. He shook his head. "" I wonder if there's any war"
1065,1934,FIC,LongRemember,A,B,C,"  forcing his boottoesthrough his stirrups, reaching forward and adjusting the curb-bit as his big chestnut wrenched her head about... There seemed to be a fatal weight of experience"
1066,1934,FIC,Folks,A,B,C,"  with queer hazel eyes, wild and bright, and a curly childish mass of chestnut hair, came now to take Margaret'sorder. "" But I couldn't wear my"
1067,1934,FIC,CaptainCaution,A,B,C,"  , apparentlyhearing nothing, he turned from the avenue, entered the edge of the chestnut forest and emerged on the leafcoveredgrass of the chateau gardens. Even before he had"
1068,1934,FIC,Harpers,A,B,C,"  him. Did acres of awful things, of course. So your hair was chestnut? "" Mrs. Damfort drawled, "" Sweet of you not to say red."
1069,1934,FIC,Harpers,A,B,C,"  . Rum running. "" Why didn't she flame? The part in her chestnut hair was exact; her eyes had the blue of autumn mist in the hills"
1070,1934,FIC,Witchfinders,A,B,C,"  eyes; the sweet inducement of her generous mouth, the heavy curtain of her chestnut hair; each curl a provocation; the lithesome beauty of her pliant body curved"
1071,1935,FIC,TimeOutMind,A,B,C,"  freckles that go with sandy hair, even if mine had grown out into thick chestnut braids that wound twice round my head. My mouth turned up like a Jack-O-Lantern"
1072,1935,FIC,TimeOutMind,A,B,C,"  to the brief shining of that northern Indian Summer. I might have been a chestnut freed of its burr, or a snail without its shell, set helpless in"
1073,1935,FIC,Harpers,A,B,C,  know that if we go out to the stables you will have a stunning new chestnut mare that looks like a million dollars but that you really picked up yesterday afternoon
1074,1936,FIC,HeadOW-Hollow,A,B,C,"  black-oak stump now. "" "" No. She looks like a wet piece of chestnut bark. "" "" Ain't it funny the things the wind can do."
1075,1936,FIC,HeadOW-Hollow,A,B,C,  I was a young man. See. There is a pine plank by a chestnut plank and a poplar plank on tother side of the pine plank. I laid
1076,1936,FIC,HeadOW-Hollow,A,B,C,"  at that loft and wonder just why I put down a pine plank between a chestnut plank and a poplar plank. "" "" Can you see them planks like that"
1077,1936,FIC,HeadOW-Hollow,A,B,C,  the chipyard every day. That old spider is allus out there next to that chestnut knot hole. I watch her spin her web and trap her grub. And
1078,1936,FIC,MountainPlain,A,B,C,"  "" Mme. Broquin continues to sell her flesh-coloured pomade which dyes red or white hair to chestnut or black in a single treatment. The price of the pomade is nine francs"
1079,1936,FIC,MountainPlain,A,B,C,"  the distance behind him was the world he had known, open like a prickly-spined chestnut husk out of which he had burst. In the darkness of that world men"
1080,1936,FIC,LastPuritan,A,B,C,"  frilled and edged with lavender satin, her enormous chignon, for which several good chestnut heads of hair and a horse's tail must have furnished the materials, her"
1081,1936,FIC,LastPuritan,A,B,C,"  bitter commitments. The new world began at the corner, where Main Street and Chestnut Street parted, and dividedbetween them the banks and shops and clanging electric cars of"
