entry,year,genre,source,a,b,c,text
252,1979,-,-,-,-,-,"least avoids confusion with the game fish also called the dolphin. Use dolphin and porpoise interchangeably, I have finally concluded, and no"
269,1979,-,-,-,-,-,his visage alone: A strong straight nose suggests a dolphin's rostrum; his hair (bottlenose gray) sweeps back from a prominent
292,1979,-,-,-,-,-,"individual "" signature "" calls: "" I am Joe Dolphin. "" But most scientists I spoke to believe, like behaviorist and veteran"
293,1979,-,-,-,-,-,"to. He was a sleek, gray, spotted dolphin, Stenella plagiodon, obviously young and male, slightly over six feet long"
294,1979,-,-,-,-,-,"1,450. More signiant, he says, are the dolphin's unusually large "" silent associational areas ""? those heavily fissured cortical regions"
317,1979,-,-,-,-,-,", modeled after the animal's natural equipment. A dolphin emits many of its inquiring echolocation sounds at frequencies far higher than we can"
323,1979,-,-,-,-,-,"|p538 FREED? Foundation for the Release of Every Enslaved Dolphin. "" And so a pair of dolphins innocently swam into another developing storm"
383,1979,-,-,-,-,-,"' "" Almost every porpoise trainer has tales of the dolphin's cleverness and ingenuity. Like Jim Mullen of Marine World/Africa, U.S.A.,"
392,1979,-,-,-,-,-,. No one knows why. One hears of such dolphin behavior occasionally? at least half a dozen times in this century? and
411,1979,-,-,-,-,-,". When completed, the array will ena man and dolphin, each in his own eleme to exchange precise sounds adjusted to t comfortable"
192,1981,-,-,-,-,-,"been on display from the 1890s to 1978. The dolphin pool, or "" tray, "" is visible from almost every vantage point"
23,1982,-,-,-,-,-,"... WHAT DELIGHTFUL NEWS ABOUT THE BABY DOLPHIN! I CAN just imagine how excited Chris was when the proud parents brought
24	1976	-	-	-	-	-	sustain their numbers, government scientists announced in September. Dolphin stocks associated with tuna today are only 50 to 60 percent of what they
25	1850	-	-	-	-	-	the surface of the lips of Melicent, like a dolphin at play, and disappeared. The room was bright, and all were
26	1987	-	-	-	-	-	, flattened shadow with disklike, unblinking eyes and a dolphin's smile. The creature burbled happily. The calf backed away. Sudden
27	1979	-	-	-	-	-	its auditory memory? remembering a speci tone? a dolphin easily outperformed another highly acoustical animal, man. But most exciting to Dr.
28	1988	-	-	-	-	-	to have it look like a water mammal -- a dolphin or killer whale. In terms of form, they're very efient.
29	1931	-	-	-	-	-	up in their digging. One thus acquired was a dolphin's head, fashioned out of a magnient emerald; another, a priceless
30	1854	-	-	-	-	-	nest of buccaneers. Just at this time, the Dolphin, a vessel of fourteen guns, which was the property of the Scotch
31	1970	-	-	-	-	-	with the fishing boats crisscrossing it sailing and trolling for dolphin. There were half a dozen fishermenat the bar and two tables of them
32	1966	-	-	-	-	-	would run for at least a year, the Mark Dolphin pilot would be made in 196-1 for the 1965-66 season.  Until then"
67,1982,-,-,-,-,-,"and here comes an ocean liner.' Then the dolphin began to leap, blue, silvery beasts frolicking as if they were in"
147,1982,-,-,-,-,-,"the unplumbed depths of the Amazon. Six of the dolphin accompanied the launches back to Manaus, and as they leaped in the dying"
152,1982,-,-,-,-,-,"the sailfishing is best late in the year, when dolphin also run heavy. Tuna, king and Spanish mackerel and other favored species"
255,1982,-,-,-,-,-,"haven. Right off the bow of the launches the dolphin rose, twisting in air to spy upon the astronauts, then diving to"
477,1982,-,-,-,-,-,reviewers (unlike their insulting American cousins) compared The Dolphin with Yeats's last poems? a comparison that I suspect future critics will
163,1983,-,-,-,-,-,", really. The exercise we just ran, NIFTY DOLPHIN, worked out all right. Our part of it, "" Painter corrected"
407,1983,-,-,-,-,-,". Then he churned up and down like a frantic dolphin confined in too small a space. When he hit it, man,"
435,1983,-,-,-,-,-,"their lengthy development program. Now he was "" Grand Dolphin, "" the senior admiral who fought all the battles with Congress. """
34,1984,-,-,-,-,-,"know about it? -- and I ran into the dolphin? "" "" Louder. "" They were probably forty feet away from each"
202,1984,-,-,-,-,-,"then put her down again. "" Well, this dolphin -- "" "" -- what was his name? "" "" Jesse, it"
282,1984,-,-,-,-,-,"hold the controls. LANGUAGE: Swiss, English, Dolphin... whatever. Our Eden has a 100-year moratorium on regarding language as the"
256,1985,-,-,-,-,-,back by losing to AFC East co-leader Miami 30-26. Dolphin QB Dan Marino ignored the 29? cold in Mile High Stadium to throw
455,1985,-,-,-,-,-,. Today's bow tie appeared to have a maroon dolphin motif. A big leather suitcase lay on the | floor in the middle
131,1986,-,-,-,-,-,"very evening, while his masters were carousing in the Dolphin -- and the monster that had done it was now loose in Smithfield,"
143,1986,-,-,-,-,-,that's any way to talk about the Amazon River dolphin... It was here before you were... (pause
160,1986,-,-,-,-,-,"to some extent Patriotism. Confronted with rumors before the Dolphin play-off game, Coach Raymond Berry agreed to cooperate if the Globe would sit"
352,1986,-,-,-,-,-,"better mind for company, went with Matthew to the Dolphin, a handsomely appointed chamber where the inn's guests and their friends could"
356,1986,-,-,-,-,-,". We want to save it. The Amazon River dolphin is a friendly, gentle creature and they're practically being made extinct."
116,1987,-,-,-,-,-,"curve of her back looked like the body of a dolphin, almost as dark as that, her relaxing muscles elongating under the sheath"
210,1988,-,-,-,-,-,"Perseus, had been unable to save him. The dolphin had added that native marine life was swarming to the surface, fighting over"
314,1988,-,-,-,-,-,"times like this, Jane fancied she felt like a dolphin 87 | cruising far below sun-dappled waves, making intelligent blips in the depths"
184,1990,-,-,-,-,-,the bed and took the lamp-its marble base was a dolphin shape -- and raised it till the cord was taut. The mirror held
185,1991,-,-,-,-,-,"the Turtle, what else, oh, Save the Dolphin stickers on my old station wagon in Illinois. I'm an environmentalist,"
188,1991,-,-,-,-,-,"PHOTO (COLOR): Struggling with debt # WILLIAM DOLPHIN AND REBECCA WHITEMAN # Like many other Young married couples with babies, William"
216,1991,-,-,-,-,-,"getting a master's degree at San Francisco State. Dolphin earns $33,000 as an associate editor of a trade magazine. "" Right now"
315,1991,-,-,-,-,-,the courtyard trying to decide where I could hang my dolphin wind chime. I looked up and saw the huge bird I'd glimpsed
37,1992,-,-,-,-,-,set apart from the others calls to mind a real dolphin's leap above the waves. Twenty degrees (one handspan) northwest of
301,1992,-,-,-,-,-,"come to one of the smallest constellations. Delphinus the Dolphin is compact and, once you find it, easy to see. Look"
331,1992,-,-,-,-,-,"Society, of which she is a member and a Dolphin Fellow. # While caring for her dogs makes it difult to travel,"
440,1992,-,-,-,-,-,", moisture trailing from the tail rotor as from a dolphin leaping from the sea. A collective gasp fills the chopper -- we've"
18,1993,-,-,-,-,-,"and sensuous meandering through the plaintive melody of "" Green Dolphin Street, "" and for the next forty minutes, I let myself drown"
302,1993,-,-,-,-,-,"grave. "" That moment, up swims the biggest dolphin I've ever seen. The Lady sent it out of mercy for me"
303,1993,-,-,-,-,-,"feasible for the mass-market, everyone had gone for the dolphin and whale stuff. Out of guilt, maybe: sorry we killed so"
1,1994,-,-,-,-,-,"committee, and as another Senior honor, was elected Dolphin Queen. Throughout her years at BHS she has maintained a high scholastic standard"
124,1994,-,-,-,-,-,"fundamental ways. Two pieces that were shown at the Dolphin Gallery, for instance, refer directly to the artist's contemplative activities."
133,1994,-,-,-,-,-,"When with a lot of skill they reeled in a dolphin in their canoe, they cried in silence as one cries in our land"
142,1994,-,-,-,-,-,"won her many friends. "" # What is a Dolphin Queen? "" I asked on the phone after reading the photocopies. #"
173,1994,-,-,-,-,-,"knickknacks. Jerome picked up a soapstone sculpture of a dolphin and held it in his open hand. He liked the soft, doughlike"
233,1994,-,-,-,-,-,EIBA champion when he took a split decision from Ben Dolphin of Syracuse. In a bout fought cautiously at long range most of the
249,1994,-,-,-,-,-,"ability, Walker "" proved too clever for hard-punching Ben Dolphin, "" was awarded the decision, and gained vital points for Idaho toward"
486,1994,-,-,-,-,-,the water cleave before me. Humans call it a dolphin kick. Bah! I despise those goody-goody porpoises. Give me the noble
71,1995,-,-,-,-,-,"straight to the end of the dock and flog yet dolphin? "" # I could feel my face glowing red. "" No."
487,1995,-,-,-,-,-,"of foam, and Moana calls him Mahi-Mahi, his dolphin. # Mama Hina has a name for him that she says only to"
299,1996,-,-,-,-,-,"with the green images of bobcat, whale, and dolphin. In the past half a hand of time, so much blood had"
339,1996,-,-,-,-,-,"binoculars between Enif and the tadpole-like constellation, Delphinus the Dolphin. The creator of Equuleus, the second-smallest constellation in the sky, is"
222,1997,-,-,-,-,-,"when I hooked a dolphin. # "" Not a dolphin! "" I cried out at first, though Daddy and the captain assured"
478,1997,-,-,-,-,-,"captain assured me that it wasn't that kind of dolphin. Still, the fish was so beautiful that it took my breath away"
62,1998,-,-,-,-,-,"topiary sculptures dotting the lawn: a bear, a dolphin, Atlas shouldering the world. "" I lost Hope, "" I said"
132,1998,-,-,-,-,-,"143/4 inches, diameter of shade 8 inches. The dolphin base is number C6153. Private collection; photographs are by Tim Sylvia."
134,1998,-,-,-,-,-,"inches, diameter of shade 8 3/4 inches. The dolphin base is number D3077. Gift of Mrs. Rodney Briggs in memory of Emily"
176,1998,-,-,-,-,-,"swim with them if you want. "" # One dolphin surfaced and rolled over slowly. The skin on his back was brown tinged"
286,1998,-,-,-,-,-,"listen to his tale about a big fish like a dolphin. Alan had laughed at him, Melvyn said, when he told him"
305,1998,-,-,-,-,-,"inches, diameter of shade 8 3/4 inches. The dolphin base is number D3077. Gift of Mrs. Rodney Briggs in memory of Emily"
334,1998,-,-,-,-,-,"inches, diameter of shade 8 3/4 inches. The dolphin base is number D3077. Gift of Mrs. Rodney Briggs in memory of Emily"
470,1998,-,-,-,-,-,". "" "" A big black fish like a giant dolphin. I saw it in the distance when our boat was out at sea"
272,1999,-,-,-,-,-,"biotech company called QLT PhotoTherapeutics, Levy worked with David Dolphin of the University of British Columbia to develop Visudyne, a drug that uses"
348,1999,-,-,-,-,-,"read, divers have discovered a female manatee, a dolphin, a red-bellied pacu -- a native of South America, related to piranhas"
87,2000,-,-,-,-,-,"a signal of friendship, or possibly that the first dolphin wants a favor from the second. Direct head-on approaches, or fast approaches"
113,2000,-,-,-,-,-,seem to go with what noises. Here are some dolphin behaviors that Kathleen has identified: Resting of a pectoral fin against the side
159,2000,-,-,-,-,-,to sit down later and make careful notes about what dolphin actions seem to go with what noises. Here are some dolphin behaviors that
171,2000,-,-,-,-,-,", water-sport vacation - and a better relationship. # Dolphin chasers We motored out of Koko Marina, about a half-hour east of Waikiki"
196,2000,-,-,-,-,-,"I heard a high-pitched squeal that I thought was the dolphin. It was Julia. "" Cost: Adults $ 79. Children under"
207,2000,-,-,-,-,-,"man, you were in the lobby of the Flying Dolphin, getting your photo taken, "" Rocko tells me. "" You were"
320,2000,-,-,-,-,-,"the swaths dapple in the sun, and once a dolphin rose against the horizon. Eliot hooked the belt around his head, using"
364,2000,-,-,-,-,-,"few feet beneath us. "" Mom, we're dolphin chasers! "" shouted 13-year-old Alexandra in a little runabout bouncing nearby. The"
433,2000,-,-,-,-,-,give kids a chance to see what the science of dolphin study is really like. Photograph // #
447,2000,-,-,-,-,-,"her. Too defined to be a whale or a dolphin, it flattened itself to her back, grasped her waist and hauled her"
476,2000,-,-,-,-,-,"would arc together out of the water or a single dolphin would showboat by dancing on his tail. "" Look Daddy! They're"
434,2001,-,-,-,-,-,"me. I didn't get the ladies and the dolphin, obviously, I got small inanimate replicas, you understand, but I"
234,2002,-,-,-,-,-,". Angelo is nineteen, smooth and muscular as a dolphin; Norman, curly-haired, is in his thirties. "" Hallelujah, brother"
270,2002,-,-,-,-,-,"in town. They're fed goat stew, fried dolphin, and salt-cod pancakes that the cook calls "" stamp-and-go. "" Everyone guzzles"
332,2002,-,-,-,-,-,"I tell Ship to bring us up, and one dolphin, one mermaid, and twelve metric tons of water shoot through the rings"
343,2002,-,-,-,-,-,"is walkin down the Hill, lookin like a fat-ass dolphin. Cracka her ass switchin in the breeze. Pussy stankin up the sidewalk"
377,2002,-,-,-,-,-,"his pupil's ingenuity; and watching Kekmi carve a dolphin out of whale bone. Beetle lazed in the moonlight, twined in the"
408,2002,-,-,-,-,-,anglers to catch dolphin fish near a sargassum raft. Dolphin probably feed on numerous baitfishes that use the natural flotsam for refuge and forage
441,2002,-,-,-,-,-,"the deep end. "" He went under like a dolphin then, through cilia of white legs, under the eight-foot rope, his"
466,2002,-,-,-,-,-,"sailors, moving with the grace and speed of a dolphin through deep water, more rifles were fired, more errant shots finding human"
479,2002,-,-,-,-,-,"! "" or "" Really.... "" or Latin or dolphin talk. I just knew I was being sized up. I paid with"
489,2002,-,-,-,-,-,"that I don't notice that Shar is a boy dolphin until I feel her penis enter me. I buck with surprise, but"
84,2003,-,-,-,-,-,"a clear day her dearest friend, a matronly pink dolphin named Meeleamee, surfaced near the place where Zelana sat cross-legged on the face"
94,2003,-,-,-,-,-,village: the courthouse; the Barnstable Tavern; the Dolphin Restaurant; the Cancer Ransack Shop; shake-roofed cottages and Victorian guesthouses; the
200,2003,-,-,-,-,-,"1), a horseshoe-shaped cove near the Hotel Twin Dolphin, is not only a protected marine sanctuary but a good family beach as"
219,2003,-,-,-,-,-,"be much more difult to care for than a young dolphin. "" "" But it's one of those man-creatures! "" she protested"
304,2003,-,-,-,-,-,"would like their AUV sonars to be more like the dolphin's, whose broadband acoustic transmissions range from about 30 to 100,000 hertz."
500,2003,-,-,-,-,-,"fisherman for an obscenity he had committed against the seathe dolphin he had mangled with a metal hook, or the school of baby fish"
70,2004,-,-,-,-,-,"I threw it back into the water, only one dolphin was hurt. And no one was killed. # A few weeks later"
227,2004,-,-,-,-,-,"peering intently. Abe reappears. He is slender, dolphin gray, with dark patterns streaking his soft skin. Bright blue eyes shine"
244,2004,-,-,-,-,-,"Before the cold water embraced her, she became a dolphin, plunging into a wave, sliding under the water to spin out the"
319,2004,-,-,-,-,-,"at me, flying over those same furrows like a dolphin taking the sunset waves. I was paralyzed - I have no memory of"
444,2004,-,-,-,-,-,"spin out the other side, laughing as only a dolphin can. # Nimue had been a dolphin before, but it was Merlin"
74,2005,-,-,-,-,-,is destroyed in a five-alarm fire that severely damages the Dolphin Club next door. All 30 people in the Dolphin Club escape safely.
120,2005,-,-,-,-,-,"surface of water. A burst of spray. A dolphin leaps from the waves and hangs suspended. Text scrolls around: "" Get"
138,2005,-,-,-,-,-,"She walks over to her shelves and picks up her dolphin. She steams it up with her breath, and polishes it with a"
237,2005,-,-,-,-,-,"Of State &; Out Of Mind - Ride the Grey Dolphin Line! "" This is the next incarnation of the greyhound. The blue"
278,2005,-,-,-,-,-,christening me Flipper. Flipper was the name of a dolphin that once starred in a hit TV shownot surprisingly titled Flipperin the late 1960s
387,2005,-,-,-,-,-,"French Street, and a final Assembly endured at the Dolphin Inn. I even danced on that occasion with a black-eyed foreign gentleman too"
461,2005,-,-,-,-,-,Dolphin Club next door. All 30 people in the Dolphin Club escape safely. Damage is estimated at $1.2 million. # -- Members
462,2005,-,-,-,-,-,"fans who expected something out of the ordinary like the dolphin song, not her expectation of their brilliant fifty-second threnodies. The next song"
469,2005,-,-,-,-,-,451-1202. 4. Do a Flip. Stop at the Dolphin Research Center in Grassy Key (MM 59). This is where the
48,2006,-,-,-,-,-,"the dorado (also called "" mahi-mahi "" and "" dolphin fish "") that swam along Callahan for much of his journey. Dorado"
347,2006,-,-,-,-,-,"parents do not file complaints. # Examples include "" dolphin therapy and horseback riding, "" said Johnny Welton, a special ed coordinator"
361,2006,-,-,-,-,-,"Road, Rosemont. (847) 928-9900. # GREEN DOLPHIN STREET. Sun, 8 pm: Intimate Jazz Series. No cover."
382,2006,-,-,-,-,-,"who they are.'' "" THE AIR-ESS Glory Dolphin, 31 Occupation: CEO of IQAir North America Nominated by: ESSENCE editors"
384,2006,-,-,-,-,-,"this or any other aspect of spinner life, every dolphin is awarded the same voting power. However many individuals reside here today is"
98,2007,-,-,-,-,-,"all kinds of birds. It's a manatee and dolphin highway. "" A manatee surfaces like a stealthy submarine in the marina that"
273,2007,-,-,-,-,-,"Road, Rosemont. (847) 928-9900. # GREEN DOLPHIN STREET. Sun, 8 pm: Intimate Jazz Series. No cover."
281,2007,-,-,-,-,-,. Chargers - Qualcomm Stadium # 23. Dolphins - Dolphin Stadium # 24. Cardinals - Univ. of Phoenix Stadium # 25.
357,2007,-,-,-,-,-,vision. By Capt. John Wooldridge 24 Sportfishing What dolphin lack in longevity they make up for in fight. By Gary Caputi 28
414,2007,-,-,-,-,-,"at the rainbow sparkles of the water jetting from a dolphin's mouth. "" Why should Marcus Antonius remember that, when more recently"
149,2008,-,-,-,-,-,"one above the other, making a kind of Jurassic dolphin pod (although of course they are not biologically related to those similar-looking living"
436,2008,-,-,-,-,-,"Carey quoted my friend, colleague, and expert on dolphin and elephant communication, Diana Reiss: "" The work revolutionized the way we"
101,2009,-,-,-,-,-,with a tarnished brass knocker in the shape of a dolphin. The other is empty. A handsome sign declares it For Sale.
153,2009,-,-,-,-,-,"she opened her eyes and focused on Mom's teakwood dolphin statue and the white rocks around the water, glinting in the late afternoon"
