year,adjective,keyword,text
1981,graceful,heron,"to tell her. fidelio was like a bird, robin thought -- a graceful heron gliding through the air, or a ruddy turnstone flitting from rock to rock,"
2004,graceful,sycamore,"creek just east of sharpsburg, maryland. beside it spreads a huge, graceful sycamore that was little more than a sapling on september 17, 1862, when more"
2007,hardy,geranium,"proli self-seeder-surround a birdbath. hellebore foliage, a hardy geranium with magenta flowers, and a variegated hosta draw your attention to more woodland"
2001,hardy,muskrat,", reinforcing them with mud. these lodges have underwater entrances, and the hardy muskrat can hold its breath for up to 15 minutes. the muskrat is a highly"
2001,hardy,muskrat,"and the hardy muskrat can hold its breath for up to 15 minutes. the muskrat is a highly adaptable creature, and its plight in the meadowlands has actually improved"
1888,hoary,cypress,"again, waking at dawn, and making the hoary cypress wood merry with their carollings to the wives and younglings in the nests."
1871,innocent,snake,"! take me away!""""poh, dotty; nothing but an innocent snake; he's more afraid of you than you are of him."""""
2007,inquisitive,black,", trails to keep clear, and an inquisitive black bear to shoo away from interpretive signs. but the real work began when the"
1931,inquisitive,grasshopper,"as if in answer to my quest, an inquisitive grasshopper lighted on my knee. when i grabbed him as excellent trout medicine,"
1914,inquisitive,lizard,"to amuse himself, until he fell asleep, watching the antics of an inquisitive lizard which in turn was watching him from a crack in the sun-baked adobe wall."
1974,inquisitive,otter,"but before the abalone would have a chance to clamp down securely, an inquisitive otter would steal it and foil our plans of photographingtool-use. whenever we located an abalone"
1955,interesting,beetle,"nosed into the grass on the trail of an interesting beetle. stiffly the boy went to stand before the window, and there was"
1909,large,antelope,"be the little forest-haunting liberian hippopot. amus. there are also stories of a large antelope, with a few white spots or markings, which has very disproportionately small horns"
1946,large,birch,"however, dr. james and berenice lingered a while in the shadow of a large birch tree, and then walked slowly down the slope along a winding path, as"
2002,large,birch,branches that i positioned jutting out from the torso. the legs were two large birch saplings with plenty of spring for running and jumping. these i laid angled to
1889,large,bison,", in the autumn months, very fat. audubon says:""a large bison bull will generally weigh nearly 2,000 pounds, and a fat cow about 1,200 pounds"
1856,large,black,"he soon discovered that his competitor was a large black bear. the animal outran him, tore up the ground, and sported before"
1899,large,black,while she was thus hard at work a large black bear came along from the opposite direction. i happened to be out in the
1930,large,black,"path beyond the dillard place they met a large black bear. phyl knew the dillard boys would be right behind him, and she"
1962,large,boxwood,flat on the lawn and squirmed around to peer at the house under a large boxwood which flanked the roses lining the terrace. the kitchen door banged and a shiny
1897,large,buckeye,point he pulled his horse up violently. a large buckeye tree stood on the roadside a hundred yards ahead. its large thick leaves
1883,large,butterfly,"place in the shade, i watch with lazy interest the career of a large butterfly, - a rich ethiopian, with gorgeous decorations. in the parched and discouraged"
1886,large,butterfly,"from a honey-cup, or resting on a leaf or twig, was a large butterfly with black-velvet wings and spots and bands of blue and red and yellow."""
1898,large,butterfly,"; but at last he ventured to peep out, and seeing a fine large butterfly on the ground, near the place of his concealment, he got close to"
1992,large,cactus,".""we decided to use a lot of large cactus here,""bollinger says,""because when the plants are really large"
1832,large,chestnut,"did not run many paces before they halted at the root of a large chestnut that threw its aged and ponderous branches over an extensive surface, and whose distant"
1835,large,chestnut,"the huntsman the favor that spared his life. with the exception of a large chestnut near the edge of the cliff, and of some venerable oaks, that had"
1849,large,chestnut,"far from two hundred annual rings or layers to the foot, in the large chestnut tree already mentioned, now standing upon the entrenchments. this would give nearly six"
1921,large,chestnut,"to record that tish grew more companionable after luncheon, and got into a large chestnut tree near the house by climbing on top of the hen house. we had"
1937,large,chestnut,"the past twenty-five years a disease or blight has almost completely destroyed all the large chestnut trees over practically all of our eastern states, and for the past few years"
1834,large,cottonwood,"encamped was wide and grassy, and shaded with large cottonwood. traveled this day near twenty miles, in a due south-east course."
1948,large,cottonwood,as the scene progresses. to one side a large cottonwood tree. nat enters from the cornfield with a hoe and dripping with sweat
1849,large,crocodile,"above the water. we saw with surprise a large crocodile on the opposite shore, motionless, and sleeping in the midst of these"
1929,large,crocodile,"roots of the tree and water with a dozen large crocodile heads looking expectantly up at them with yawning throats, lashing playfully their tails"
1972,large,crocodile,"vegetation of the bank, a species of very large crocodile, called by martin caymanos, which he informed us are great eaters 30"
1846,large,cypress,"cast over an angle of the wall by a large cypress. i seized the arm of cassius, to check his speech""--"
1921,large,deer,"daniel peered over john howland's broad shoulder just in time to see a large deer disappearing into a thicket of young birches some distance ahead of them.""oh"
1851,large,elm,"cottage, in which they lived. it was shaded in front by a large elm tree, that spread its arms far out over the moss-covered roof, as if"
1892,large,elm,"you gathering flowers one day soon after you came here. there is a large elm tree down there, the only one near. the indians are buried there all"
1912,large,elm,", and then i stood horrified, for my cecropia was sailing over a large elm tree in a corner of the orchard, and for a block my gaze followed"
1971,large,elm,"spent more than half of her last summer in the upper branches of a large elm tree, and i think that the only times she let herself be caught was"
1855,large,frog,"was so intently engaged in the pursuit of a large frog, that he had not heeded the uproar in the vicinity.""blue"
1841,large,grasshopper,". one of the shawanoe children having caught a large grasshopper, a dispute arose with some of the delaware children, in regard to"
1845,large,grasshopper,"to the wind was 370 miles distant, a large grasshopper flew on board. more than once, when the ship was in the"
1984,large,grasshopper,"he ran up to the line, clutching a large grasshopper in his hand. he tossed it over. it lay still."""
1875,large,grizzly,"it a coyote; but we soon recognized a large grizzly bear, swimming directly across the channel. not having any weapon, we"
1879,large,grizzly,"door, on which was the carcass of a large grizzly bear, shot behind the house this morning. i had intended to ride"
1839,large,hemlock,", and firmly bound to the body of a large hemlock, with his face turned to the tree. every thing being now in"
1852,large,hemlock,"need of it; for on the outside a large hemlock shot up towards the blue sky, far beyond the ridge-pole of the little"
1906,large,hemlock,". the little shelter had stood close to a large hemlock tree. the lightning had struck the tree, causing it to topple ever"
1965,large,juniper,"came on the others. they were standing in a circle next to a large juniper bush, and when i took my place beside dolphin in the ring i saw"
1941,large,lizard,"locomotion alternatingly, according to fancy or to circumstances. a living and fairly large lizard from australia had come to light (chlamydosaurus), which walked on all fours"
1946,large,magpie,"over his shoulder. the cause, however, was soon discovered in a large magpie who was perched upon a shelf over the fireplace, and who immediately relapsed into"
1898,large,muskrat,"a black duck motionless on the water, staring with outstretched neck at a large muskrat swimming past within a yard of him. the ripple caused by the muskrat surrounded"
1898,large,muskrat,"large muskrat swimming past within a yard of him. the ripple caused by the muskrat surrounded the duck and spread beyond him, but the bird's eyes were fixed"
1888,large,opossum,"that he was not the only occupant of the fallen tree. a fine large opossum had taken refuge in one of the upper branches, and sam used his rifle"
1856,large,otter,"came to a large lake; on looking about, he discovered a very large otter on an island. he thought to himself,""his skin will make me"
1856,large,otter,"came to a great lake, and on looking about he discovered a very large otter on an island. he thought to himself,""his skin will make me"
1974,large,otter,"feeding station. we waited to observe tool use. at long last a large otter came down, felt the abalone on the rock, pulled at them and then"
1848,large,panther,", to his amazement and alarm, the fiery, glaring eyeballs of a large panther, crouched on a neighboring tree, and just in the act of springing."
1875,large,porcupine,"presently i heard something in the near bushes, and in a moment a large porcupine came into view. i thought that he, too, was looking for water"
1912,large,porcupine,", large lizards (varanus), various apes and monkeys, and a large porcupine (hestrix crassispinus), and several small mammals, such as otters (lutra"
1859,large,sturgeon,"good spirits. confound the fish!""bim made this exclamation when a large sturgeon leaped over his head and splashed a quantity of water into the boat."""
1838,large,sycamore,"instant a bolt of lightning shot from the heavens, and lighting upon a large sycamore which shaded a part of the temple court, clove it in twain. the"
1848,large,sycamore,"a bolt of lightning shot from the heavens, and, lighting upon a large sycamore which shaded a part of the temple court, clove it in twain. the"
1848,large,sycamore,"at the meeting of three streets, and beneath the dark shade of a large sycamore tree. the spot was retired as the street was but little frequented, though"
1880,large,sycamore,"had placed its nest in the lowest twig of the lowest branch of a large sycamore, immediately over a great thoroughfare, and so near the ground that a person"
1884,large,sycamore," bee tree run.  here, just at the foot of a large sycamore, and among its roots, was fastened a curious boat, made of a"
1888,large,sycamore,"it exceedingly dangerous to travel in daylight in this region; and seeing a large sycamore log that was hollow, he crawled into it. the february air was keen"
1838,large,tortoise,", nevertheless, what greatly astonished us, that the islands abounded in the large tortoise of the gallipagos, one of which we saw in the canoe of too-wit."
1846,large,wolf,"his mind than intended for the car of the trumpeter. it is a large wolf, effendi l' said the man as he drew near and gazed on the"
1870,large,wolf,"things. and it was while walking thus that he did not observe a large wolf advance to the edge of the gully, look down, and then whisk back"
1993,large,wolf,would have seen the figure of a very large wolf. or was it a wolf? for when it reared up in the darkness its pointed ears seemed almost to
1856,large,woodpecker,"was badly bruised, and at his very wit's end, when a large woodpecker flew past and lit on a tree. it was a bird he had known"
1856,large,woodpecker,"the blows which the manito kept making at him. at that moment a large woodpecker (the ma-ma) flew past, and lit on a tree.""manabozho"
1835,lofty,basswood,"the mountain ash, the aromatic hemlock and the lofty basswood. this sequestered retreat, with its fresh aspect and sweet exhalations, afforded"
1934,lofty,boxwood,suddenly to brushing their garments and arranging their cravats in the shelter of the lofty boxwood hedge that stood between them and the gardens of the chateau. argandeau sighed and
1846,lofty,chestnut,in life-blood through every leaf. orange and umbered brown no longer clothed the lofty chestnut or the drooping elm. the gnarled oaks stretched their scorbutic arms; the frozen
1872,lofty,chestnut,"right glad to go. among the maple's crimson-mottled leaves and in the lofty chestnut's brilliant glow there is no sign of anything that grieves. ah, well"
1860,long-legged,heron,"lake float flotillas of wild swans, fleets of black ducks, and the long-legged heron wades far out from the shore to catch his morning's breakfast. as i"
1872,long-legged,heron,", and thus lifting up his hunched shoulders and looking the picture of a long-legged heron standing in the water,""mr. anderson, you and our young and happy"
1997,luminous,beetle,"the swing creaks on austin's porch, a luminous beetle swings ferociously over the clematis, insects swarm to the golden holocaust of the"
1856,lusty,elk,"him to get on, such a huge and lusty elk was he by his own request. presently, as he dashed past an"
1938,luxuriant,chestnut,", a modest, patient man who loves trees, eagerly showed reporters four luxuriant chestnut trees on the new jersey estate of success coach walter boughton pitkin. then he"
1976,luxuriant,chestnut,"disturb the monotonous platitude of its horizon. a serene, dead-straight alley of luxuriant chestnut trees stretched from the little castle to the country road. to the left stood"
1873,luxurious,lizard,"fletcher, with his hat over his eyes, lay sunning himself like a luxurious lizard, as he watched the face that grew daily fairer in his sight, and"
1896,magnificent,thistle,"in earnest or whether he meant it in fun when he sent us a magnificent thistle, with the suggestion that we plant it in our lawn. but, out"
1897,majestic,bison,him into manlier reflections. it was one of the forest highways of the majestic bison opened ages before into what must have been to them nature's most gorgeous kingdom
1841,masterful,cuckoo,", can not travel in it two: yonder masterful cuckoo crowds every egg out of the nest, quick or dead, except its"
1896,meditative,snake,"to my feet, but found, alas, he was charmed by a meditative snake that lay near me in the scented grass. harte, bret, 1836-1902:"
1854,miraculous,deer,"some twelve years before in the forest of senlis, he had encountered a miraculous deer, which had survived to display the golden collar with which it had been decorated"
1848,native,buckeye,". i saw hundreds of acres covered with the native buckeye, the most beautiful tree of the forest -- if, indeed, any"
1920,native,chestnut,creeks flowing between masses of vegetation riotously spreading over swampy lowlands. high over native chestnut trees climbed and rambled the flowering pohue (convolvulus); along the highway an
1835,native,clematis,assisted two little barefoot girls to-day to train a native clematis (a pretty species) over the logs of their hut. there is
1957,Native,cypress,"by refugees and a high birth rate.""native cypress grows too slowly,""american forestry consultant paul j. zehngraff explained."""
1973,native,deer,"225,000 to 433,000, and most of them go to the texas ranches where native deer and exotics abound. no one, however, has done a better job of"
2002,native,muskrat,"the nutria,""according to mccann's report. nutria also compete with native muskrat and waterfowl. * canada geese. remember when it was cool-a rarity-to see a canada"
1999,native,parrot,"people to learn that, until the beginning of the twentieth century, a native parrot flourished in the eastern united states, ranging as far north as new york and"
1993,native,trillium," it works the other way round as well, of course. a native trillium from the united states is an exotic in europe. but further than this,"
1850,native,warbler,"wild fowl awaking in the forests, with occasionally the merry chaunt of some native warbler, arousing to the day, spake also in the language of encouragement. on"
1941,native,wild,"to washington, d.c., in the space of two years. the pure-blood native wild horse of the pampas, is as scarce in the pampas today, as is"
1997,new,birch,"not all the way to arizona, but somewhere: someplace. # the new birch leaves are rattling in the breeze. she will climb the ridge and look down"
1880,new,clover,"that time a good dressing of lime. as we try to have a new clover field every year, we get all around the farm in six or eight years"
1888,noble,cypress,"swamps of barataria, where he had seen some noble cypress forests tantalizingly near to navigation and market, but practically a great way off"
1856,noble,trout,"that while you were in, you never thought for a moment of the noble trout that inhabit it.""""i certainly did not,""said the other"
2002,nocturnal,lizard,"nothing came in here - no animals, no birds - not even a nocturnal lizard, bat, or moth. #""i've got a theory too,"
1875,old,birch,"caught in the deep snow. his home is in the trunk of some old birch or maple, with an entrance far up amid the branches. in the spring"
1876,old,birch,"caught in the deep snow. his home is in the trunk of some old birch or maple, with an entrance far up amid the branches. in the spring"
1959,old,birch,"narrowed, as if it faced the trail squarely. he edged around the old birch to get behind it, and from that side there was no hole, just"
1972,old,cactus,"in chaparral, and the hillsides stood gray-green with old cactus. the stunted trees were lower than the giant bushes and yucca. manuel"
1886,old,catalpa,"for the night. they usually roosted in an old catalpa tree near the back gate, earlier in the season; but as christmas"
1907,old,catalpa,"been cut, and stood in corn. my old catalpa in the fence corner beside the road and the bartlett pear under which i"
1839,old,chestnut,"guided them on their way. they soon arrived at a clump of fine old chestnut trees, whose gnarled and farspreading branches betokened sylvan antiquities of no ordinary worth."
1860,old,chestnut,"the same hard tasks -- together they had built their playhouse beneath the same old chestnut tree -- together, hand in hand, had they wandered over the rocky hills"
1863,old,chestnut,"the grass.""hendie was soon established on a flat stone under the old chestnut trees, in a happy oblivion of mahala's injustice, and her little sister"
1875,old,chestnut,"as it was called. the proprietor was aroused from his slumbers under the old chestnut tree at the end of the house, where he had been vainly endeavoring to"
1912,old,chestnut,call of his memory. he seemed to be standing once more beneath the old chestnut grove where they had plighted their troth in the twilight under the stars; while
1920,old,chestnut,far away. the three happy children could see them way up in the old chestnut tree over on the edge of their neighbour's wood. in the fork of
1927,old,chestnut,"as i have never heard a blackcap sing before or since in the great old chestnut tree said to have been planted by francois premier, on the high terrace at"
1940,old,chestnut,"148224 last week a hardy old chestnut, still to be cracked, was picked over for the umpteenth time. picker"
1942,old,chestnut,the emergency rose too suddenly to permit the mitten to be removed. the old chestnut tree that had been struck by lightning four times was the north pole. the
1945,old,chestnut,"looked out. there lay the courtyard of the hotel lancaster. a huge old chestnut tree stretched its naked arms upward toward the wet sky.""this rain,"
1955,old,chestnut,with other people somehow and at communion with a whole self in himself. |p261the old chestnut tree on brattle street had flowered and shed its leaves five times since orlando fosca
1998,old,chestnut,"two of them out on""the singing way,""under a huge old chestnut in the morning sun, were surely one of the most lyrical sights in all"
1877,old,cottonwood,"the beach, and seated ourselves on a white old cottonwood that had floated out of the columbia river, and been cast by the"
1937,old,cottonwood,"by ash and box elder, with a wide old cottonwood standing alone in the centre, | a tall man was rapidly loading a"
1939,old,cottonwood,"left from the tussle at the foot of the old cottonwood, some nice dun-colored shirts torn to rags, evidence enough for the ofers"
1835,old,cypress,see -- to the little pond just beyond that old cypress -- see the log half rolled into the pond -- look at the end
1919,old,cypress,"disappeared behind one of the small thick clumps of old cypress trees draped with great curtains of spanish moss, which mark the presence of"
2005,old,cypress,"we had seen the bird.  another great old cypress, perhaps seven  feet in diameter, stood not far from  where"
1851,old,elm," what was liberty tree?  inquired clara.""it was an old elm tree,""answered grandfather,""which stood near the corner of essex street"
1855,old,elm,"a scream, marian, dear -- what was it?""marian pointed to the old elm tree outside the cottage fence, under the shade of which stood the poor stroller"
1876,old,elm," echoing ishmael, reeling and supporting himself against the trunk of the bare old elm tree.  it was most unexpected, sir; mist'ess sat up most all"
1889,old,elm,"moaning over the fields and rushed against their dwelling, which, saving one old elm tree that bent its protecting branches over it, stood all alone, exposed to"
1931,old,elm,"the road by which he had come. there, suspended from a fine old elm tree, like a tavern sign, was a white notice hoard with the words"
1920,old,geranium,tamarisk and poppies and trellised roses and one woody old geranium with a stalk like a crab-apple trunk and growth enough to cover half a
1922,old,grizzly,yet vibrant and ecstatic with renewed life. the old grizzly bear had left his winter lair; and good feeding was putting the fat
1961,old,grizzly,"involving a vicious wolverine, a great big nasty old grizzly bear, a number of extraordinarily large and healthy timber wolves who have obviously"
1990,old,hackberry,"the barn out back, then lounged under an old hackberry tree. at noon dinner he loaded up his plate with fried chicken and"
1831,old,hemlock,", and stood leaning in the shadow of an old hemlock, just on the summit of the hill. his brow was uncovered,"
1835,old,hemlock,", and winging to his perch on the far-up old hemlock, where they may see his reverend white head gleaming like a snow-flake among"
1839,old,hemlock,"' why, i calculate to be about this old hemlock till i get it down, colonel.' nonsense, you ninny!"
1857,old,hemlock,mistaken for the sighing of the breeze through the old hemlock in front of her window. even when gradually swelling in sound and volume
1869,old,hemlock,"delight and wonder burst from both children. an old hemlock that hung slantwise over the water opposite was garlanded and interwoven, through all"
1880,old,hemlock,"of them. walking the other day in an old hemlock wood, i counted over forty varieties of these summer visitants, many of"
2006,old,hemlock,"house and sidewalk, overly shaded by a big old hemlock tree. anything that did manage to grow there the neighborhood dogs quickly dispensed"
1895,old,jackdaw,"various pets, left behind in the gardener's care. there was an old jackdaw, an especial favorite of his, a miserable owl, too, who had"
1912,old,lilac,old lilac bush that leans over my side gate and kissed my hand. old lilac shook a laugh of perfume all over us and i believe signaled the event at
1968,old,lilac,"years old. there, at the end of the porch, is the old lilac tree. everything is blurred with misty light, because there was a fog the"
1895,old,magpie,"was leaping about his feet, evidently asking for more games, and our old magpie was perched familiarly on his shoulder.""good-morning, joe,""i said"
1843,old,owl,"and midway, in the crumbling body of a dead ash tree sits an old owl, with his broad, goggling eyes, and the dry, white moss gathered"
1858,old,owl,"lived where there are many said he found in a large hollow tree an old owl, with several fishes he had laid up for his private eating. so,"
1921,old,owl," tell me, i prithee, little bird-woman, what is the wise old owl saying? has he a message for me? ""yes. and i"
1966,old,quail,"bit, but i won't do it any more tonight. if the old quail birds in the woods where elder calvin prayed, if those old birds had been"
1880,old,stork,"such a squawking you never heard. it keeps the devil away! the old stork sits up on one long straight leg, and with the other foot he hands"
1832,old,sycamore,"and myself, that i am about to record. we had reached an old sycamore on the bank of the brook, and had thrown our lines into a deep"
1834,old,sycamore,"a private and a parting interview.""to-night, then, at the old sycamore, as the moon rises,""he whispered in her ear, as sadly"
1835,old,sycamore,"we wander by the branch, mary?""""yes, to the old sycamore; it seems an age since i have seen it.""occupied with their"
1847,old,sycamore,"distant home, just a few paces from the village path, where the old sycamore stands, your daughter comes to the window, and looking upon the very moon"
1848,old,sycamore,"better. happy seventeen, then, was she who stood leaning against the old sycamore -- god keep her from the cold, stinging, unhappy experience of many of"
1848,old,sycamore,". in keeping with the hour and the scene, there glided beneath this old sycamore, in the checkered light which the moon made by stealing among the leaflets,"
