entry,year,genre,source,a,b,c,text
105,1993,-,-,-,-,-,"moved in the breeze. The windowsills held bright red geranium plants in clay pots. Delighted, Jada walked over to the windows and"
112,1993,-,-,-,-,-, The geraniums?  Jada looked at the red geranium plants lining the two windows in the bedroom. Aunt May had red geraniums
134,1993,-,-,-,-,-,"she curls up naked on the bed, milk on geranium, while he works in a circle of light. He has the power"
88,1994,-,-,-,-,-,"begonia, forget - me - not, hollyhock, geranium, impatiens, petunia, phlox, rose, snapdragon, tiger lily and"
139,1994,-,-,-,-,-,"bulbs' flowers were nearly gone by the time the geranium's first foliage appeared, effectively hiding what was left of the bulbs."
146,1994,-,-,-,-,-,"Along the front edge of one border, I underplanted Geranium sanguineum var. striatum with Crocus chrysanthus Blue Bird' and Cream Beauty' and"
177,1996,-,-,-,-,-,pomegranatetrees. The place was lined with clay pots filledwith geranium andbougainvillea flowers. A large stonefountain was at the center of the garden.
104,2000,-,-,-,-,-,", smaller pair of purple slippers embroidered with pansies and geranium leaves. I never asked about them. # "" I bet you could"
147,2000,-,-,-,-,-,", smaller pair of purple slippers embroidered with pansies and geranium leaves. I never asked about them. # "" I bet you could"
5,2002,-,-,-,-,-,"diapers his daughter at the age of 12 has a geranium in his cranium ""), a heartfelt respect for her readers and a"
18,2002,-,-,-,-,-,"lemon, basil, ginger, comfrey, rose and geranium Pitta Bitter: sandalwood, jasmine, licorice, neem, coriander, mint"
38,2002,-,-,-,-,-,. Repeat filler plants (like Bidens ferulifolia and ivy geranium) for visual continuity throughout the garden. * Don't be afraid to
100,2002,-,-,-,-,-,". New varieties to try: Black Magic Rose' geranium has unique, dark foliage edged with lime green, and hot pink blooms"
142,2002,-,-,-,-,-,". "" Look! Enough space for you to plant geranium and flowering almond and myrtle like your garden back home. "" "" Water"
48,2003,-,-,-,-,-,"$2.50 and up, smallflower.com), or passionflower or geranium soaps ($8, latherup.com). Bonus: These fragrances make you feel"
86,2003,-,-,-,-,-,"on the table and windowsills filled with pots of scented geranium. The woman introduced herself as Luella Mitchell, Hannah's niece. As"
159,2003,-,-,-,-,-,"have enclosed another flower for you. This one is Geranium pratense, more commonly known as the meadow cranesbill. With great regard,"
167,2004,-,-,-,-,-,"mounds like petunias, but its 1-inch-wide flowers resist the geranium (tobacco) budworms that chew petunias. Since Calibrachoa freely drops its faded"
185,2004,-,-,-,-,-,"He is plucking crunchy, brown leaves from a lemon-scented geranium during an occupational therapy session at Craig. # With a burning stare,"
69,2007,-,-,-,-,-,"proli self-seeder-surround a birdbath. Hellebore foliage, a hardy geranium with magenta flowers, and a variegated hosta draw your attention to more woodland"
