entry,year,genre,source,a,b,c,text
11,1984,NF,AnAmericanProcession,A,B,C,"  gang is really playacting by respectable people. It is necessarily where The Adventures of Huckleberry Finn will begin, for Huck is not middle-class and respectable, so he must"
73,1984,NF,AnAmericanProcession,A,B,C,"  show him entirely as objective storyteller? he capitalized on his early life. Before Huckleberry Finn, he had no greater story to tell than one about an irrepressibly imaginative"
121,1984,NF,AnAmericanProcession,A,B,C,"  The Adventures of Tom Sawyer. "" When Mark Twain turned to The Adventures of Huckleberry Finn after finishing The Adventures of Tom Sawyer in 1876, he clearly meant to"
123,1984,NF,AnAmericanProcession,A,B,C,"  along like a river and is as wayward as the great river that flows through Huckleberry Finn, so his genius was always in some sense for the circumstantial, never"
154,1984,NF,AnAmericanProcession,A,B,C,"  over. The glow of his style would obscure the raw dread he got into Huckleberry Finn, the violence of A Connecticut Yankee in King Arthur's Court. He"
163,1984,MAG,NewYorker,A,B,C,"  intended to call "" Find -- ers, Weepers, "" would be a modern Huckleberry Finn story although, he reminded the press, "" this is another century and"
180,1984,NF,AnAmericanProcession,A,B,C,"  "" boy's book ""; it explains why boys can read The Adventures of Huckleberry Finn as boys and then grow up to read it as an epic of life"
197,1984,NF,AnAmericanProcession,A,B,C,"  wrote when he was seventy-one. His two most famous creations, Tom Sawyer and Huckleberry Finn, never had to grow up. * They remain eternally boys? the American"
55,1985,NEWS,CSMonitor,A,B,C,"  s story,'' The Adventures of Tom Sawyer,'''' Huckleberry Finn'' is largely considered to be a sophisticated satirical censure of a nation"
68,1985,NEWS,CSMonitor,A,B,C,"  moral failings. // Twain, to his credit, predicted'' The Adventures of Huckleberry Finn'' would be a'' handsome success'' because of the"
76,1985,NEWS,CSMonitor,A,B,C,"  for them,'' wrote Alcott. // // Well, what has come of Huckleberry Finn -'' one of the permanent symbolic figures of fiction,''"
100,1985,NEWS,NYT,A,B,C,"  "" // "" Every existing edition of Mark Twain' s work - including' Huckleberry Finn' - is subject to new discoveries, "" said Robert H. Hirst,"
116,1985,NEWS,NYT,A,B,C,"  he leave out this passage in order to publish "" Tom Sawyer "" and "" Huckleberry Finn "" as companion volumes and make the two books closer in length. Mr."
119,1985,NEWS,CSMonitor,A,B,C,"  to rework it as a children' s story. //'' Twain started' Huckleberry Finn' as another boys' book,'' says Twain biographer Kaplan."
125,1985,NEWS,NYT,A,B,C,"  the writer David Bradley, who teaches at Temple University, will talk about "" Huckleberry Finn "" on May 10 at a church across the street from the Memorial."
151,1985,NEWS,CSMonitor,A,B,C,"  leaders during the 1960s that despite Twain' s use of irony,'' Huckleberry Finn'' is objectionably racist and should be removed from mandatory reading lists and"
152,1985,NEWS,CSMonitor,A,B,C,"  '' All modern American literature comes from onebook by Mark Twain, called' Huckleberry Finn,''' wrote Hemingway.'' If Mr. (Samuel)"
173,1985,MAG,Newsweek,A,B,C,  last Broadway has a new musical of substance. Big River: The Adventures of Huckleberry Finn is a work of so many virtues that your heart aches because it also
82,1986,NEWS,CSMonitor,A,B,C,"  000, slippery-when-wet, black-nylon-and-neoprene, elongated inner tube referred to as a raft. Huckleberry Finn, eat your heart out. //'' John, how about you goin"
19,1987,FIC,LegacyHeorot,A,B,C,  in the fire. Sparks sizzled whitely from the relays as the section shorted. Huckleberry's body twitched and leaped like a frog on a griddle. Carlos turned away
70,1987,FIC,LegacyHeorot,A,B,C,"  colts and fillies froze their nervous motions, moist eyes glistening like frozen flames. Huckleberry growled, then subsided. "" We'll have the infrared up tomorrow night,"
72,1987,FIC,Harpers,A,B,C,"  , locomotive, steam, steam, steam, "" and "" Strawberry shortcake, huckleberry pie. "" We had pep rallies that were like revival services in tone and"
110,1987,FIC,LegacyHeorot,A,B,C,"  . There was nothing to be seen, nothing heard except the dreadful screeching. Huckleberry was charging full tilt, snarling his challenge as if he could see something,"
147,1987,FIC,LegacyHeorot,A,B,C,"  , let it be a turkey -- He | stumbled, lost his grip on Huckleberry. Before he could catch the leash, the animal was bounding toward the fence"
167,1987,FIC,LegacyHeorot,A,B,C,"  , these fenced separately, each enclosed in another "" graduated "" electric fence. Huckleberry sniffed the cages as they turned west towards the cliff edge, the fifty-meter drop"
200,1987,FIC,LegacyHeorot,A,B,C,"  but there was no time, and in the darkness, in the frenzy, Huckleberry leaped directly into the triple strands of the fence. His fur shot up away"
137,1988,MAG,Time,A,B,C,"  American imagination. But they have a dark side too. In The Adventures of Huckleberry Finn, Huck's journey in the Delectable Land is also a drama of alcoholism"
165,1988,FIC,MarkTwainsLetters —,A,B,C,"  . Tom Sawyer, The Prince and the Pauper, Life on the Mississippi, Huckleberry Finn, and A Connecticut Yankee in King Arthur's Court were among the volumes"
155,1989,FIC,OtherSide,A,B,C,"  , and girls being girls, were among the worst offenders! Tom Sawyer and Huckleberry Finn, for example; they were an education in condescension to women -- all"
140,1990,FIC,Ploughshares,A,B,C,  impressed her the previous Friday with an explanation of the function of chapter sixteen in Huckleberry Finn. She was obviously expecting big things from me for the discussion of Wright
190,1990,MAG,Time,A,B,C,  is unique among heroes because he is a living embodiment of black liberation. Like Huckleberry Finn and Tom Sawyer enjoying their own eulogies from a hiding place in the church
81,1991,MAG,AmHeritage,A,B,C,  restricted to portrayals of exotic natives and such roles as Jim in The Adventures of Huckleberry Finn. He became a Soviet citizen and died sometime after 1959. With a
71,1992,MAG,FieldStream,A,B,C,"  are set in the Rockies to renew winter range for bighorn sheep and to stimulate huckleberry growth for grizzlies. The positive affects of these fires can last for years,"
193,1992,NEWS,WashPost,A,B,C,"  # Among familiar faces available are those of Tom and Jerry, Bugs Bunny, Huckleberry Hound, Daffy Duck, Tweety, the Jetsons, Johnny Quest, Scooby Doo"
54,1993,FIC,DirtyWork,A,B,C,  better than the U.S.? You think Russia is heaven just because they've got Huckleberry Finn on the shelves and rap music on the radio and abortion on demand?
177,1993,FIC,Mov:PickleThe,A,B,C,"  make what I wanted to make... why didn't I make "" Huckleberry Finn ""? CAMERA BEGINS TO MOVE IN TIGHT ON HARRY FOR A FANTASY."
52,1995,FIC,Mov:MrHollandsOpus,A,B,C,  I know... Cole likes Huckleberry Hound.   IRISThis isn't about Huckleberry Hound.   HOLLANDWhat is it about? He confronts her. She backs off
57,1995,FIC,Mov:MrHollandsOpus,A,B,C,"  note. INT. HOLLAND HOUSE, NIGHT Holland watches TV with Cole -- "" Huckleberry Hound "". Holland is signing the dialogue, inane as it is, for"
171,1995,FIC,Mov:MrHollandsOpus,A,B,C,"  HOLLAND (getting irritated) I know, I know... Cole likes Huckleberry Hound.   IRISThis isn't about Huckleberry Hound.   HOLLANDWhat is it about"
56,1996,FIC,Ploughshares,A,B,C,"  a deer halfway up a brushy canyon. Rifle cocked, John climbed toward a huckleberry thicket. Rustling froze him. Clayton crept alongside. Both raised their guns and"
50,1998,MAG,AmerArtist,A,B,C,"  work out of the realm of history into Missouri mythology, with such icons as Huckleberry Finn, Jesse James, and Frankie and Johnny. By doing so, the"
134,1998,FIC,FantasySciFi,A,B,C,"  and peered into the crackling blue aurora. "" I think it's a wild huckleberry, "" he said. "" Often noted for spontaneous combustion, "" Dan said"
30,2000,FIC,SerpentNovelFrom,A,B,C,"  your thoughts. Assess the details. Start acting like a scientist, not like Huckleberry Finn. She sat underwater on a waist-high stone block and pondered her findings."
87,2000,FIC,SouthernRev,A,B,C,"  the remote heights of literature such flawed idealists as Ahab, Hester Prynne, and Huckleberry Finn -- ambiguous yet unmistakable, repugnant yet beloved. Already Harry seems destined for"
124,2000,MAG,Time,A,B,C,"  and respectable, but this documentary mini-series -- which examines Edouard Manet's Olympia, Huckleberry Finn, 1920s jazz and racy 1930s movies -- recovers what was shocking in art"
34,2001,MAG,Time,A,B,C,"  's Life. There's a touch of The Painted Bird, of a Hungarian Huckleberry Finn. # Like most good memoirs of childhood, Swimming Across has the poignant"
47,2001,FIC,DangerousWater,A,B,C,"  signature "" boys' "" novels, The Adventures of Tom Sawyer and Adventures of Huckleberry Finn. It might suggest that Twain in the tortured final decade-and-a-half of his life"
162,2002,NF,CloakDollarHistory,A,B,C,"  continued to attract considerable attention, meandering Mississippi-like through American culture via Mark Twain's Huckleberry Finn (1884) and David Maurer's The Big Con (1940) to"
183,2002,FIC,SouthernRev,A,B,C,"  is in old books. I have to wait a moment until I can add Huckleberry Finn. Mary Shelley. Leaves going red and blue at the margins, yellow-orange"
69,2003,MAG,TownCountry,A,B,C,"  , and neighbors who came to the door would announce, "" Here's our huckleberry friend "" - thus, the expression Johnny used in his lyrics.Today I often call Abe"
83,2003,MAG,TownCountry,A,B,C,"  - thus, the expression Johnny used in his lyrics.Today I often call Abe my "" huckleberry friend "" and get a big grin from him. Savannah is very proud of"
103,2003,MAG,Time,A,B,C,  on the upper Mississippi. This is great. It's like the townsfolk in Huckleberry Finn who attended the Duke and Dauphin's theatrical show and then told their neighbors
176,2004,NF,TeachLibrar,A,B,C,"  Pilkey, for insensitivity and being unsuited to age group; and The adventures of Huckleberry Finn by Mark Twain, for racism, insensitivity and offensive language. LITA LEADERS"
188,2005,NEWS,SanFran,A,B,C,"  times he goes a little too far, such as using an ashtray for his huckleberry creme brulee. # On other visits, McGinnis used martini glasses for a dense"
166,2006,FIC,LiteracyLonging,A,B,C,"  of information, such as the fact that Mark Twain's brilliant The Adventures of Huckleberry Finn went through seventeen hundred revisions, and the most recent draft was unearthed in"
192,2006,MAG,Sunset,A,B,C,"  the panhandle, Priest Lake offers calm water, thick cedar forests, and seclusion-with huckleberry pie to boot. Photograph Clockwise from top: Pilot Grant Brooks parks his seaplane"
170,2007,FIC,CamelBookmobile,A,B,C,"  link to the modern world. "" Fi grinned. "" Besides, we want Huckleberry Finn to arrive before Sex in the City reruns, don't we? """
26,2009,FIC,TightLie,A,B,C,"  ? Feel like a good porter house or something? # # Sounds good, Huckleberry. # # He heaved the big bag onto his shoulder and moved away."
45,2009,FIC,PlayItAgainSAH,A,B,C,  betting is stupid. I was truly just kidding. Phyllis # From: Dulcie Huckleberry # To: P. Lorimer # Subject: Re: Zelia? # LOL!
157,2009,FIC,TightLie,A,B,C,"  # Kenny took the driver from my hands. # # Take a breath, Huckleberry. You're fine. # # Okay, yes, that's really my"
161,2009,FIC,TightLie,A,B,C,  middle name so I had few options growing up except to run or fight. Huckleberry Doyle. A schoolyard bully's wet dream of a name. Kenny and my
189,2009,FIC,PlayItAgainSAH,A,B,C,"  this rate, we'll ALL need intensive therapy. Z # From: Dulcie Huckleberry # To: "" Green Eggs and Ham "" # Subject: Re: She"
