entry,year,genre,source,a,b,c,text
1,1982,FIC,DinnerAtHomesick,A,B,C,"  and responses, losing track of the service while smiling out the window at a hummingbird. Imagine him in bed with a woman. (Cody snorted.) He"
2,1996,MAG,AmericanCraft,A,B,C,"  Acoma Pueblo to turn to Mimbres designs, in the I950s. A beautiful little hummingbird pot by Garcia captures the feel of the original Mimbres work without any sense of"
3,1900,FIC,RedemptionDavid,A,B,C,"  , of her own buoyancy. Settling down at length as if she were a hummingbird lighting upon a flower, she began to circle slowly around the fire and sing"
4,2001,MAG,Sunset,A,B,C,  90 miles southeast of Tucson is popular with birders (with an especially interesting summer hummingbird population). A trail along its riparian area leads onto the forested slopes of
5,1966,FIC,Harpers,A,B,C,  arose and shook hands pleasantly. The patient took a last look at the dusty hummingbird that had been buzzing away at the same trumpet vine for five years. The
6,1993,MAG,HarpersMag,A,B,C,"  Battersea. It took a good deal longer to adjust to the way the rufous hummingbird, like a tiny thrashing autogiro, redisposed itself in space, zapping from point"
7,1957,FIC,VelvetHorn,A,B,C,"  her brother's shoulder; yet there was in her body all the concentration of a hummingbird, or wasp, poised before its object. Then her fists were flailing her"
8,1953,FIC,GoldenApplesSun,A,B,C,"  night air. "" Charlie, oh, you went fast! Quick as a hummingbird! Oh, Charlie, come back to me! "" "" But I'm"
9,2007,FIC,FantasySciFi,A,B,C,"  Early in their courtship she pictured him as a hummingbird - a large, gawky hummingbird - but lately she saw him as something else - perhaps a mongoose. """
10,2004,FIC,WifeNovel,A,B,C,"  's mother, a stylish woman whose body is as small and compressed as a hummingbird's? Why can't she just go away? But she didn't,"
11,2004,NF,PSAJournal,A,B,C,"  (CA) 195. # The 2004 Class B Slide of the Year was Hummingbird Sipping Nectar, Ray Coleman, APSA, Photographic Guild, Detroit (MI)"
12,2002,FIC,ScandalousSummer,A,B,C,"  for herself. He cupped his hand and leaned forward to light hers. A hummingbird fluttered inches from the honeysuckle on the porch post. It hovered in space,"
13,1961,FIC,HouseOnColiseum,A,B,C,"  you saying you've eloped? "" "" No, "" Joan said. A hummingbird swooped into the narrow passage, was frightened by their figures, and swooped out"
14,1986,MAG,SatEvePost,A,B,C,  . With hog lard I greased my boots until they were as soft as a hummingbird's nest. I was grinding my ax when papa came around. He smiled
15,1880,NF,Wake-Robin,A,B,C,"  except that it is much larger, appears almost identical with the nest of the hummingbird. But the nest of nests, the ideal nest, after we have left"
16,1900,MAG,Dial,A,B,C,"  ago, serves as an introduction. He tells of the domestic life of the hummingbird, as follows: "" If you have the good fortune to have discovered an"
17,1987,FIC,OutPhaze,A,B,C,"  instantly. One moment she? a pretty girl; the next she be a hummingbird. Of course that's magic. "" "" I can not do that,"
18,1987,FIC,OutPhaze,A,B,C,"  moment her forehead was clear. Abruptly she vanished. In her place was the hummingbird, and its buzz was quite angry. It darted at the goblin leader."
19,1942,FIC,HighWindow,A,B,C,"  worked on the car that a groom makes rubbing down a horse. A red-throated hummingbird went into a scarlet bush beside the door, shook the long tubular blooms around"
20,2009,FIC,OrderThings,A,B,C,"  butteries appear wispy and undetermined, but really they are just as hardworking as the hummingbird or the dirt dauber. They glide maybe instead of dart, like the dragony"
21,1945,FIC,HappyTime,A,B,C,"  same, "" Maman said quietly, "" I am going. "" "" My hummingbird, "" my father insisted, "" you will never arrive. "" Pouf!"
22,1914,FIC,VandoverBrute,A,B,C,"  mingled with the odour of wet grass and fresh paint. Somewhere he heard a hummingbird singing, a tiny tweedling thread of song, while farther off two roosters were"
23,2000,FIC,LightningStrikes,A,B,C,"  at the way she flitted from topic to topic. She reminded me of a hummingbird, buzzing over one flower and then rushing off to the next. It was"
24,2004,NF,PSAJournal,A,B,C,"  67 Merrimack Valley CC (MA) 67 Oklahoma CC 67 # Award winners were Hummingbird Sipping Nectar, Ray Coleman, APSA, Photographic Guild; Wood Peck and Red"
25,2001,FIC,Ploughshares,A,B,C,"  always cheerful and full of excitement about life, so he called her his little hummingbird, even though she was much too zaftig for such an image. She had"
26,1945,FIC,HappyTime,A,B,C,"  Ending,' eh? Do not imagine any such thing to yourself, my hummingbird. "" "" Hummingbirds, "" I said, "" do not sing. """
27,1999,MAG,AmericanCraft,A,B,C,"  act out the legends seldom duplicate nature. For example, in Autumn Ceremonies a hummingbird dwarfs a flamingo. "" Some are specific, but others are just birds,"
28,1974,MAG,Harpers,A,B,C,"  he insisted. "" They are the most alive. The normal temperature of a hummingbird or a swift is 108. If it gets excited, it runs up to"
29,1955,FIC,DreamKings,A,B,C,  tales they spun of him: less than five feet tall but fierce as a hummingbird with a great snow-shock of hair like Old Hickory and a tomahawk scar in his
30,1963,FIC,AnythingYouCan,A,B,C,"  could, because of its inertia drive, move with the three-dimensional ability of a hummingbird, so the rivers that cut the island off from the mainland were no barrier"
31,2002,FIC,Play:ImaginaryFriends,A,B,C,"  were you thinking about? FIZZY Just now? Summertime, and my mama's hummingbird garden. Sarah and I used to sit still as statues on the stone bench"
32,1997,FIC,OrdinarySeaman,A,B,C,"  la Rosa has a yellow fish outlined in red tattooed on his chest and a hummingbird on his arm and at the beach that chavala said, What are you,"
33,1969,FIC,LoveMachine,A,B,C,"  jars on a kitchen windowsill. I lie here in the sun-light, watch the hummingbird. This morning I threw the coins in the swimming pool, and they gleamed"
34,1975,FIC,BeyondBedroomWall,A,B,C,"  redbreast, a chickadee, a mockingbird who poured brook-trills from a branch, a hummingbird bejeweled among bumblebeesin a surge of honeysuckle. The air was vivid with odors,"
35,1981,FIC,FollowRiver,A,B,C,"  the ivory disks of an abacus so swiftly that they made a blur like a hummingbird's wings. "" Naturally, a single caravan is worthless. "" Shirik offered"
36,1988,MAG,Harpers,A,B,C,"  come off. Broken canopy admits daylight and then actual shafts of sunshine. A hummingbird appears in the air before us to hover and gape. Phaethornis superciliosus, says"
37,1947,FIC,SecondGrowth,A,B,C,"  imperceptiblytoward the front again, moving as slowly as he would have moved if a hummingbird had been in a flower near his face. The image of the brown woman"
38,1962,MAG,Time,A,B,C,   270841 STAND STILL LIKE THE HUMMINGBIRD (194 pp.) - Henry Wilier-New Directions ($4). # # Henry Miller
39,1957,FIC,MrAudubonsLucy,A,B,C,"  , then, superimposed over them, with startling clarity, the drawing of the hummingbird swinging in the trumpet vine. The vine was growing. As she stood at"
40,2000,FIC,FantasySciFi,A,B,C,"  # Close up it still looked grim, but there were odd touches. A hummingbird feeder, for instance, with hummingbirds helicoptering around it. Wild azaleas growing as"
41,1965,FIC,WhiteLotus,A,B,C,"  the entire contents of a boll at a time with a single snatch of either hummingbird hand, and she kept the lint, as she pulled it out, quite"
42,1995,FIC,Play:HungryWoman,A,B,C,"  inside Coatlicue, he ain't gon na punk out on his mami. A hummingbird buzzes by and gives the little Sun-God the 4-1-1 about the planned matricide, and"
43,2007,FIC,FantasySciFi,A,B,C,"  do. It wasn't enough. "" Stop, "" Maureen said. A hummingbird that had somehow made it down into the cellar buzzed through the air, zigzagging"
44,2000,MAG,Bazaar,A,B,C,"  of white chicken breast heaped with a salad of seedlings, an ethereal feast for hummingbird women. The background music suddenly increases in volume and takes over the room."
45,1987,FIC,Mov:AmazingGraceChuck,A,B,C,"  door in his pajamas, still half-asleep.   CHUCKDad?   RUSSELLIt's a hummingbird feeder.   CHUCKOkay.   RUSSELLYour Mom loves hummingbirds.   CHUCKIt's kind"
46,1969,FIC,LoveMachine,A,B,C,"  am working very hard at not thinking about how everything goes. I watch a hummingbird, throw the I Ching but never read the coins, keep my mind in"
47,1880,NF,Wake-Robin,A,B,C,"  I am the more forcibly reminded of his deficiency in this respect from observing yonder hummingbird's nest, which is a marvel of fitness and adaptation, a proper setting"
48,1901,NF,WildFlowers,A,B,C,"  are well adapted to their requirements. That exquisite little feathered jewel, the ruby-throated hummingbird, flashes about the bright patches an instant, and is gone; but he"
49,1995,NEWS,Atlanta,A,B,C,"  herbal sachets, listen to banjo picking and try their hand at plowing. A hummingbird program is presented by a naturalist at the Overlook. You can rent bicycles and"
50,1965,FIC,DoLordRemember,A,B,C,"  "" said Mr. Pike. He stood up, jarring the table, and the hummingbird flew away without even preparing to go. "" I can't see Ansel today"
51,1948,FIC,TownWithFunnyName,A,B,C,"  was thinking, and how a whale is in no less constant jeopardy than a hummingbird. I was about to say something of this effect to Perky, then noticed"
52,1953,FIC,GoldenApplesSun,A,B,C,"  a newborn chick, his feet shimmering and rushing like the wings of a low-skimming hummingbird. Old Lady's tongue locked in her mouth.' What could she say"
53,1986,MAG,NewRepublic,A,B,C,"  that expansion of breath necessary to existence; and unless it is conceited for the hummingbird or the osprey to not behave like a chicken, one does not find her"
54,1974,FIC,MyLifeAsMan,A,B,C,"  eyes, she was like one of nature's undersizedindefatigables, the bee or the hummingbird, who are out workingthe flowers from sunup to sundown, sipping from a million"
55,1956,MAG,Time,A,B,C,"  26). # The Muses Are Heard, by Truman Capote. A literary hummingbird in the tundra writes a funny and occasionally gripping report about the Porgy and Bess"
56,1903,MAG,Century,A,B,C,"  stiff, unyielding twigs! What a contrast to the suitableness of the material the hummingbird uses? the down of some plant, which seems to have a poetic fitness"
57,1865,MAG,Atlantic,A,B,C,"  , // about as intelligent as those of a good stout Shanghai hen on a hummingbird. Most useful and comfortable, these Shanghai hens, - and very ornamental,"
58,1863,NF,NaturalistOnRiver,A,B,C,"  a moth should change into a hummingbird. The resemblance between this hawk-moth and a hummingbird is certainly very curious, and strikes one even when both are examined in the"
59,1961,NF,scan,A,B,C,"  high temperature, even those that remain in cold regions during the winter. The hummingbird is interesting in this regard. It is very small and therefore has a very"
60,1987,FIC,OutPhaze,A,B,C,"  seen Meta change to her natural unicorn form many times, and to her other hummingbird form, and back to girl form. That was interesting, not revolting;"
61,1997,FIC,Ploughshares,A,B,C,  held little Bobby Lee in their arms and rocked him to sleep like a scared hummingbird. Shenay stepped back until she was just a speck on the distance. #
62,1987,FIC,OutPhaze,A,B,C,"  along the way as I flew. "" "" Rut that could only sustain a hummingbird! What of the unicorn? "" "" It matters not what form I take"
63,2006,FIC,FantasySciFi,A,B,C,"  gums and tangled beard, and in through the morning light flew the same silver-back hummingbird that had carried Adelia from the Mushroom Folk to the Sunflower Folk and beyond."
64,1996,FIC,SouthernRev,A,B,C,"  said. "" You must stroke an animal as lightly as you'd stroke a hummingbird. You want him to remember you? "" she asked. "" Blow into"
65,1966,NEWS,Chicago,A,B,C,"  Society? "" he asked. "" The Johnson administration has a remarkable collection of hummingbird economists who can reverse themselves without first stopping. They stand still in mid-air while"
66,1953,FIC,CressDelahanty,A,B,C,"  . Far off in the Santa Ana valley Cress heard a train whistle. A hummingbird dropped into the arroyo, whirred disappointedly about the wild tobacco blossoms which were still"
67,2001,FIC,HellsKitchenLocation,A,B,C,"  or jay, sitting on a branch %151; was as carefully done as the hummingbird downstairs. When he'd first come here, several months ago, he'd"
68,1987,FIC,OutPhaze,A,B,C,  see how she could join him here. Then he heard the hum of the hummingbird. She was back! The bird perched on a nearby twig and tucked her
69,1993,FIC,ThoseWhoHuntWounded,A,B,C,"  the chesterfield was at an angle to the bay window so you could watch the hummingbird feeder and the stream. "" Workin today, "" he said. Ralphie,"
70,2002,FIC,FantasySciFi,A,B,C,"  n't believe in omens, exactly, but he had come to think of the hummingbird as a harbinger, if not of Kris then of his reawakening from isolation."
71,1996,MAG,Ms,A,B,C,"  's appearance, encouraging her to look "" sexy. "" Farey's mother, Hummingbird ("" Humm "") Berreyesa, didn't have a clear idea that there"
72,2005,NEWS,SanFran,A,B,C,"  fiction, set among Hawaii's upper-class private schools and private clubs. # The Hummingbird's Daughter by Luis Alberto Urrea (Little, Brown; 499 pages; $24.95"
73,1921,FIC,HerFathersDaughter,A,B,C,"  with a little spray of Pentstemon whose bright tubular flower the canyon knew as "" hummingbird's dinner horn. "" That gave, her the idea of introducing a touch"
74,1970,FIC,ElectricCotillion,A,B,C,"  the title, or didn't care to, always referred to it as the hummingbird song. "" Hey, Niles, I got some new changes on that hummingbird"
75,2000,FIC,SouthernRev,A,B,C,"  the house. She uncoiled a hose and watered the flowers planted there. A hummingbird flickered above us like some strange gift, and I thought, "" Summer."
76,1980,FIC,PrincessDaisy,A,B,C,"  demands to climb a tree, catch an earthworm, make cookies, train a hummingbird, take a walk in the woods and collect pebbles on the beach -- all"
77,1970,FIC,ElectricCotillion,A,B,C,"  hummingbird song. "" Hey, Niles, I got some new changes on that hummingbird song. "") "" Were you ever a junkie? "" "" No,"
78,2000,FIC,FantasySciFi,A,B,C,  yards away the heat was intense. I saw the grass catch fire. The hummingbird feeder was gone and the wild azaleas looked like big burnt matchsticks. Nearby trees
79,1987,FIC,OutPhaze,A,B,C,"  waist. But she sagged, too tired to keep her feet. "" The hummingbird! "" he exclaimed. "" Change to that form! "" | "" Nay"
80,1984,FIC,CrescentCity,A,B,C,"  Every day. You fill my mind. "" She fastened her eyes on a hummingbird whose long beak was sucking deeply from a creamy flower on the trumpet vine."
81,2004,MAG,Sunset,A,B,C,"  no supplemental water. Salvias and unusual flowering shrubs, which Jensen calls her "" hummingbird buffet, "" enhance the plantings. Photograph In winter Last season's scraggly growth"
82,1961,NF,scan,A,B,C,"  of the birds; the eggs are little larger than pearls, and a young hummingbird will (ill only a portion of a teaspoon. Their wings are small and"
83,2001,MAG,ArtAmerica,A,B,C,"  orange and black dress of a Baltimore oriole, the captivating antics of a ruby-throated hummingbird or the melodic song of a house finch -- right in your own backyard! All it"
84,1967,FIC,EustaceChisholm,A,B,C,"  the rain. "" Her vividness troubled the air as the blur of the returning hummingbird troubled the corner by the orange tree. I sat smiling, dabbling a stream"
85,1880,NF,Wake-Robin,A,B,C,"  , great blue (Ardea herodias). High-hole. SEE Woodpecker, golden-winged. Hummingbird, ruby-throated (Trochilus colubris). Indigo-bird (Cyanospiza cyanea). Jay,"
86,1991,MAG,Money,A,B,C,"  . SHEEN FINANCIAL GROUP WILL MAKE SURE YOUR NEST EGG DOES N'T LOOK LIKE A HUMMINGBIRD EGG WHEN YOU NEED IT. "" # THAT'S BRIAN SHEEN'S EIGHT-YEAR-OLD SON"
87,2007,FIC,FantasySciFi,A,B,C,"  had always been in motion. Early in their courtship she pictured him as a hummingbird - a large, gawky hummingbird - but lately she saw him as something else"
88,1983,FIC,BeyondMountain,A,B,C,"  been in a fighter before, much less one with ambitions to mate with a hummingbird, "" Ryan smiled. The bridge was overheated, and it felt good."
89,1901,NF,SecretWoods,A,B,C,"  , first one then the other would hover before the point selected, as a hummingbird balances for a moment at the door of a trumpet flower to be sure that"
90,1988,FIC,Counterprobe,A,B,C,"  they begot Julie, a tall, fragile girl with the darting shyness of a hummingbird. Tall. Nordstrom even hated the look of the word. But 83 |"
91,2000,FIC,DontCloseYourEyes,A,B,C,"  sister Lily, who owned a successful antique store downtown. Tamara was making the hummingbird quilt for Lily's shop. "" People like old furniture but not old bedding"
92,2002,FIC,FantasySciFi,A,B,C,"  from isolation. The idea of her had become superimposed on the memory of the hummingbird, and whenever Brian thought about it he realized that she was inscribed in every"
93,1962,FIC,SimpleHonorable,A,B,C,"  on mythumb rubbing its nose then stepping to the page of mybook There's the hummingbird swinging his headfrom side to side like a hoodlum There's all that, andall"
94,2000,FIC,DontCloseYourEyes,A,B,C,"  paper. She could work on her latest quilt, the lovely one with the hummingbird design she'd created, but she wasn't in the mood. She could"
95,2004,FIC,WhenWindBlowsNovel,A,B,C,  . His eyes quickly took in the place. The big porch deck festooned with hummingbird feeders and a couple of wind socks. My trusty-dusty mountain bike. Wildflowers everywhere
96,1971,FIC,UndergroundMan,A,B,C,"  deep porch, red fuchsias dripped from hanging redwood baskets. At a red glass hummingbird feeder suspended among the baskets, a hummingbird which also seemed suspended was sipping from"
97,1974,FIC,HardOnRoad,A,B,C,"  , which she waved away and then consented to sip about enough to make a hummingbird do headstands. After a while she settled down again. She said: """
98,1998,FIC,Ploughshares,A,B,C,"  a false heat, a false blush of her mating colors. When the male hummingbird sees her, he becomes very generous, he lets the female eat whatever she"
99,1945,FIC,HappyTime,A,B,C,"  worse. No? So it is my duty to find the watch of my hummingbird. Come, we go to hunt. "" The four of us made our"
100,1966,FIC,Harpers,A,B,C,"  But now he nodded equably and, leaning back, gazed at the dusty little hummingbird. "" Very well, "" said Dr. Gamow when he did not answer."
