entry,year,genre,source,a,b,c,text
245,1999,NEWS,Denver,A,B,C,"  and front porches. But just about everything has a therapeutic purpose. At the Juniper Gym &; Spa, clients can drop in for a massage or for a jaunt"
319,1999,FIC,Hermit,A,B,C,"  Yes, I tell Plato every story I know. About the girl and the juniper tree, Snow White and Rose Red, the West Wind, the witch house"
369,1999,FIC,Olivia,A,B,C,"  midst of the crab grass and flat emerald weeds, would be a patch of juniper swaying in the ocean wind, reminding me of that horrible night. At the"
489,1999,MAG,Shape,A,B,C,"  relaxation: Claire Burke's Tranquil Eucalyptus Bouquet Mood Beads contain eucalyptus, patchouli and juniper to calm - and heighten - the senses ($10 at department stores nationwide)"
491,1999,MAG,Time,A,B,C,"  long. Or how about Broadcom, or just created Red Hat, Sycamore, Juniper and Akamai, all with valuations north of $15 billion in their rookie year of"
12,2000,FIC,CloseRangeWyoming,A,B,C,"  air scented with resinous lodgepole, the dry needle duff and hot rock, bitter juniper crushed beneath the horses' hooves. Ennis, weather-eyed, looked west for the"
22,2000,MAG,Shape,A,B,C,"  day with only a knife, tin cup and water purification drops, subsisted on juniper berries and slept on the bare ground without a tent. Now she was ready"
45,2000,FIC,NoDefense,A,B,C,"  Butte, windows placed by giantsuntaught in human architecture. It shines on dawn-still needlesof juniper trees, on motionless sage and bitter grasses, and castspreternaturally elongated shadows as black"
109,2000,FIC,HermitsPeakKevin,A,B,C,"  into a trot. "" Probably not. "" Kerney walked Soldier to a lone juniper at the edge of the grove, tied him off, looked into the shadows"
175,2000,FIC,HermitsPeakKevin,A,B,C,"  rode, Kerney eyed the wide mesa. There were small stands of pinon and juniper trees sprinkled over the land and folded rock outcroppings along the edges of shallow depressions"
181,2000,FIC,HermitsPeakKevin,A,B,C,"  of the mesa where a stock trail began, winding through a dense thicket of juniper and pion pine trees. Halfway up the trail got rocky, and the horses"
16,2001,FIC,JuniperTreeBurning,A,B,C,"  me to rest. He kept pulling me back into the wilderness, calling me Juniper, trying to make me be what I am not. The bride and the"
42,2001,FIC,JuniperTreeBurning,A,B,C,"  motorist. He sucked hard on his cigarette. "" Isn't that right, Juniper? "" "" More than that, "" I said. I held myself at"
89,2001,FIC,JuniperTreeBurning,A,B,C,"  ? "" "" The point! "" the Brother announces to the room. "" Juniper wants a point! "" He leans over her shoulder and breathes his smoky vodka"
102,2001,FIC,JuniperTreeBurning,A,B,C,"  his toast, if that's what it is, will go on. "" Juniper boughs for Juniper's wedding, "" he says to the room, pointing his"
139,2001,MAG,ArtAmerica,A,B,C,  TREES AND SHRUBS Fir (Abies species) # Hemlock (Tsuga species) # Juniper (Juniperus species) # Manzanita (Arctostaphylos species) # Pine (Pinus species
170,2001,NEWS,Atlanta,A,B,C,"  covered parking; guest suite; conference room. Photo: Park Central, 1101 Juniper St., Midtown Photo: Museum Tower at Centennial Park, 173 Baker St.,"
213,2001,FIC,Play:GhostDanceOn,A,B,C,"  . And complex, melodic warbled songs.Wind moves up the canyon. It whistles.Manzanita and juniper branches wave and flutter.The outpost is scented with sage. Lu lets it all wash"
222,2001,FIC,JuniperTreeBurning,A,B,C,  if that name were the only word he spoke. How did you sleep? Juniper! Are you hungry? Juniper Tree Burning! I think of the two days
231,2001,FIC,JuniperTreeBurning,A,B,C,"  "" The point, "" he said, raising his flask again. "" To Juniper Tree Burning, the lovely bride! "" I stared down at the boots he"
280,2001,NEWS,Houston,A,B,C,"  It will feature James Carville at 7 p.m., Feb. 22 at The Houstonian's Juniper Room, 111 N. Post Oak Lane. For reservations, call 713-655-8852. #"
290,2001,MAG,Esquire,A,B,C,"  , access, and remote favors-makes Cisco vulnerable in each one. Our old friend Juniper, for example, makes a high-capacity 10-gigabit router that is supposed to be excellent"
322,2001,FIC,JuniperTreeBurning,A,B,C,"  if that's what it is, will go on. "" Juniper boughs for Juniper's wedding, "" he says to the room, pointing his flask at the"
395,2001,FIC,FantasySciFi,A,B,C,"  moves. # As I go out, right outside the door there's some juniper branches threaded together as though it had made itself a wind shield of some sort"
396,2001,FIC,JuniperTreeBurning,A,B,C,"  house without running water, and most of all, not with a name like Juniper Tree Burning. I was not meant to live like that. Even a kid"
412,2001,NEWS,Atlanta,A,B,C,"  floor. / RYAN BLAKEY / Staff Graphic: High-rise profiles 1. Park Central 1101 Juniper St., Midtown Price range: $181,000-$260,000 Number of units: 396 Height: 15"
426,2001,FIC,JuniperTreeBurning,A,B,C,"  word he spoke. How did you sleep? Juniper! Are you hungry? Juniper Tree Burning! I think of the two days, New Year's Eve and"
427,2001,FIC,JuniperTreeBurning,A,B,C,"  their elbows and feed each other a bite, another Wedding Album opportunity. "" Juniper, "" calls the brother, "" smash it in his face! "" The"
477,2001,FIC,JuniperTreeBurning,A,B,C,"  no. His nose touches hers. He whispers, "" Liar, liar, Juniper Tree on Fire. "" He straightened. "" The point, "" he said"
76,2002,FIC,FantasySciFi,A,B,C,"  my silence for ignorance, her smile enlarged, so I snapped back, "" Juniper, Christmas, Mimosa! "" and she continued to grin, as though she"
78,2002,FIC,WhiteShellWoman,A,B,C,  in splashes of sunlight; patches of melting snow hiding in the shadows of fragrant juniper. The rider directed his mount to the rim of the sandstone cliff. Snuffy
142,2002,FIC,WaterTouchingStone,A,B,C,"  of life, composed of hundreds of intricate figures created of colored sands. Fragrant juniper had been burning in a brazier, and dozens of butter lamps lit the chamber"
156,2002,FIC,SouthernRev,A,B,C,"  too, there in the yard. There'd be piles of eggs in the juniper bush, at the base of the elm, surprising places, and the ones"
164,2002,MAG,MotherEarth,A,B,C,"  , black pepper, celery seed, dandelion, garlic, ginger, horseradish, juniper, lemongrass, oregano, parsley, sarsaparilla, thyme, turmeric, valerian,"
185,2002,MAG,Antiques,A,B,C,"  those on Messenger lamps from England. The finial, for example, is a juniper berry surrounded by curling leaves, expertly cast and finished in England. The prism"
277,2002,FIC,DevilInOlRosie,A,B,C,"  a country that is cut up into gullies and ridges and rimrocks and covered with juniper trees and pine forest, or shoulder-high sagebrush where, if you were lucky,"
331,2002,MAG,Money,A,B,C,"  call a tech company, but I don't. It's not like a Juniper Networks that's trying to come up with a new box that can revolutionize the"
442,2002,FIC,SmallRocksRising,A,B,C,  woman would be interested in homesteading such an isolated claim so many miles away from Juniper Valleyor he didn't want her to be. But the place did have water
74,2003,MAG,Money,A,B,C,"  to soften next year, "" he explains. And he finds communications equipment company Juniper very expensive now. Like Smith, Levkovich sees softness in telecom capital spending,"
421,2003,FIC,Fantasy & Science Fiction,A,B,C,"  old growth with some birch and maple, but mostly they were jack pine, juniper, and spruce. There was something primeval about an evergreen forest, the way"
471,2003,NF,ButterfliesNorth,A,B,C,"  may exist within what // we now call the Square-spotted Blue, Dotted Blue, Juniper Hairstreak, // Common Ringlet, Mormon Metalmark, Mustard White, and others."
481,2003,FIC,ChristmasBlessing,A,B,C,"  was born at Christmas, "" she said, wrapping a long strand around a juniper yew. "" He left Heaven to live here. "" She bent over the"
499,2003,FIC,Fantasy & Science Fiction,A,B,C,"  towering pride of an old spruce on your skin, taste electric silver-blue around a juniper. And as my people have known for millennia, an evergreen forest can smoke"
129,2004,FIC,DeadSoul,A,B,C,"  willows weep not and lime-green cottonwoods are crowned with shimmering rainbows. Hardy pion and juniper dot the crests of wind-sculpted mesas. Between these long sandstone benches are dark,"
186,2004,FIC,FantasySciFi,A,B,C,"  southwest of town. Not long after, the Terrible Trio smeared a wad of juniper pitch into Jacques's hair. I made each of them stand in a separate"
329,2004,NF,BetweenRockHard,A,B,C,  finally comes to an end. I dismount and walk my bike over to a juniper tree and fasten a U-lock through the rear tire. I have little worry that
378,2004,FIC,FantasySciFi,A,B,C,"  the woman standing at the door said. "" You always were a fool, Juniper. You might as well have given him stupidity and be done with it."
401,2004,FIC,FantasySciFi,A,B,C,"  forced herself to listen. "" I give him the gift of charm, "" Juniper was saying. "" All will love him and delight in his company. He"
445,2004,NF,BetweenRockHard,A,B,C,  It's nearing ten-thirty a.m. as I pedal into the shade of a very lonesome juniper and survey my sunbaked surroundings. The rolling scrub desert gradually drops away into a
27,2005,FIC,OtherwiseEngaged,A,B,C,"  As she made her way up the front path, lined with stiff spears of juniper that cast zebra stripes of shadow across the winter brown lawn, Jessie thought there"
149,2005,FIC,Mov:IslandThe,A,B,C,"  Late golden sunlight through a mist of sawdust. Abstract wood sculptures are visible. Juniper wood, carved along the bias of the grain, polished to accentuate the curves"
239,2005,MAG,Shape,A,B,C,"  golden eagles soar above the patches of bleached prairie grass and groves of cottonwood and juniper, this Serengeti of the Great Plains remains nearly cheek to antler with pronghorn,"
301,2005,FIC,LeaphornCheeNovels,A,B,C,  by a pack of dogs that had flushed it out of its den under the juniper. Chee looked around the trailer. Far too dark to see where the cat
325,2005,FIC,LeaphornCheeNovels,A,B,C,"  The cat had appeared last winter, finding itself a sort of den under a juniper east of Chee's trailer -- a place where a lower limb, a boulder"
68,2006,NF,StrangePieceParadise,A,B,C,"  set up our tent along a river in a small park in a desert of juniper and sage, and bedded down for the night. It was Wednesday, June"
217,2006,FIC,LadysChoice,A,B,C,"  , Kate, had embroidered the caparison with branches of Macleod of Glenelg's green juniper and had sent it especially for the occasion. Like all six of her sisters"
6,2007,FIC,FantasySciFi,A,B,C,"  It's an hour's scramble to the bottom. He ties Maggie to a juniper and starts down, boot-skiing a gully. A few blades of green grass sprout"
133,2007,NEWS,Atlanta,A,B,C,"  building's south side, facing Peachtree Place and is accessible either by Peachtree or Juniper streets. Parking is $8. # * The Georgia Tech trolley will circle the"
150,2007,FIC,FantasySciFi,A,B,C,"  , holding barely to his seat and swearing. A familiar face, tucked amongst juniper tangle. "" Goddamnit! "" Lolo lets the shotgun drop back into its scabbard"
218,2007,FIC,FantasySciFi,A,B,C,  filter urn. The water is cool in the shadows of the adobe house. Juniper beams hang low overhead. He sits down and connects his BuRec camera to the
296,2007,MAG,NatlParks,A,B,C,"  scale, too. Here, Newberry's twinpod sprouts up through a curl of juniper wood and pinyon pine cones. Sidebar NATURAL LIGHT hits rock formations, and Bryce"
306,2007,NEWS,Atlanta,A,B,C,"  805 Peachtree St., Units 102, 317, 602 and 620; and 891 Juniper St., Units 601. 603 and 605. # TICKETS # * Individual tickets are"
411,2007,FIC,FantasySciFi,A,B,C,"  for some new adventure. That's when Phillip found a backpack tucked under a juniper tree. Scott didn't approve. "" You should have left it there,"
34,2008,FIC,BodiesLeftBehind,A,B,C,"  of the grimy kitchen windows. She saw nothing but dense clusters of cedar, juniper and black spruce rising up a steep hill, whose rocks resembled cracked yellow bone"
38,2008,FIC,SeptemberSociety,A,B,C,"  observed the birds fluttering, partially obscured, soon to be dead. Ruminatively, Juniper said, "" What do you miss most? About England? "" # His"
79,2008,FIC,SeptemberSociety,A,B,C,"  They must've told you in training. "" # "" Yes, "" said Juniper, nodding agreeably. # "" Just past that grove of banyan trees, then"
110,2008,FIC,SeptemberSociety,A,B,C,"  along the Sutlej Frontier in Punjab. # It was beastly hot weather, as Juniper remarked to Captain Lysander out on the veranda of the officers' mess, fit"
115,2008,FIC,SeptemberSociety,A,B,C,"  moment would have made the trade Lysander proposed. # "" Well, "" said Juniper. "" I may go look around and have a bit of a shoot with"
126,2008,FIC,SeptemberSociety,A,B,C,"  Best go do it now, "" Lysander said. "" He's off with Juniper. Both of them, would you? They're hunting, out east,"
131,2008,FIC,SeptemberSociety,A,B,C,"  # But he wouldn't, and the other man knew it. # When Juniper had gone out of sight, Lysander leapt out of his chair and walked briskly"
302,2008,FIC,SeptemberSociety,A,B,C,"  a thousand other conversations before. It was clear how much closer they were than Juniper and Lysander. # "" A farthing says you'll never eat what you shoot"
324,2008,FIC,SeptemberSociety,A,B,C,"  inspirational speech before I leave? "" # "" On your way. "" # Juniper stood up. "" I'm sure I'll see you for cocktails. """
353,2008,NEWS,SanFran,A,B,C,"  sugar and salt dissolve. Add bay leaves, thyme, garlic, allspice and juniper berries. # Use self-sealing brining bags or two heavy-duty, unscented trash bags not"
390,2008,NEWS,SanFran,A,B,C,  1/4-3 hours. Let bird rest for at least 20-30 minutes before carving. # Juniper berries are available in the spice section of some supermarkets and specialty grocers. #
441,2008,NEWS,SanFran,A,B,C,"  garlic, cloves separated and peeled # 5 whole allspice berries, crushed # 4 juniper berries, smashed see Note # The roasting # 2 tablespoons softened butter + butter"
463,2008,FIC,SeptemberSociety,A,B,C,"  sapphire. # As he snapped the box shut and had it taken away, Juniper and his friend Jim emerged from the latter's house, guns broken over their"
490,2008,FIC,SeptemberSociety,A,B,C,"  bushes and trees scattered around it. They didn't have a dog, but Juniper shot into the undergrowth and drove a few birds out into the open, where"
495,2008,FIC,CountryCalledHome,A,B,C,"  learning the dying art of horse-logging from an old man who stank of sweat and juniper berries. Manny's birth just a few miles up Itsy Creek, and the"
81,2009,FIC,OceanInside,A,B,C,"  in the bath. "" He sipped his drink, and the distinct taste of juniper and lime tingled his nose. # "" Sloan's supposed to be helping her"
201,2009,FIC,HeartCanyon,A,B,C,"  hills sloped up from the water's edge, speckled with pion and sage and juniper; downstream, salmon pink cliffs marked the beginning of Marble Canyon. # JT"
212,2009,FIC,JackLondonInParadise,A,B,C,"  "" He took a step back and let Hobart enter. The stuntman smelled of juniper berries and strong pipe tobacco, and so did his small house. # """
