entry,year,genre,source,a,b,c,text
488,1955,FIC,DreamKings,A,B,C,"  sinner's blood in hell. Hyer's your potash, Tommy, cried Carly Juniper and heaved the | bag onto the counter amid the twinkling jars of French currants"
100,1957,FIC,RallyRoundFlag,A,B,C,"  and smelled a hundreddifferent plants, including sage, wormwood, hyssop, elm, juniper; and many which he could not identify, such as the prairie sagebrush,"
294,1957,FIC,WapshotChronicle,A,B,C,"  , the bungalows were very rustic. Exteriors of half-round bark slab, of rough juniper veranda posts and rails, of roofs whose shingles were hand-hewn, enclosed consciously simple"
111,1960,FIC,Carrington,A,B,C,"  past shale that sparkled with mica and fool's gold to shelves of feldspar and juniper, whose dark needles drew blood from his fingers. He welcomed the pain."
313,1960,FIC,Carrington,A,B,C,"  snowdrifts mounted until at the timber line the fir gave way to stunted juniperp228and the juniper to rock and shale. Scores of live things scurried into hiding there, bleating"
177,1961,FIC,WinterOurDiscontent,A,B,C,"  day that makes you feel fat and crazy too. Danny went behind a young juniper straight and slender as a column. I heard his voice, distorted and thick"
207,1961,FIC,Harpers,A,B,C,"  the Mexicans reached out a great arm and broke off a thick branch from a juniper tree and tapped it on the ground. "" Este. "" The translator did"
410,1961,FIC,WinterOurDiscontent,A,B,C,"  day that makes you feel fat and crazy too. Danny went behind a young juniper straight and slender as a column. I heard his voice, distorted and thick"
443,1961,NF,ColoringFinishing,A,B,C,"  sandarac, which cones fmm a tree that is somewhat similar to the cypress or juniper and which is indigenous to North Africa, especially Algeria and Morocco. The Moors"
447,1961,FIC,Play:SomeoneFromAssisi,A,B,C,  ? MOTHER CLARA They can not understand it. You let Brother Avisio and Brother Juniper eat with us. FATHER FRANCIS Yes yes MOTHER CLARA But you have never sat
161,1962,FIC,Mov:Lolita,A,B,C,"  love is gone: Strong wing, soft breast, bluish plume; In the juniper tree moaning at dawn: doom, doom.   HUMBERTWhat an ominous last line"
173,1962,FIC,Mov:Lolita,A,B,C,  whirr. CUT TO: Another Stretch of Road For the first time sagebrush and juniper appear. There is some uncertainty whether it is a bank of clouds or a
104,1965,FIC,WhiteLotus,A,B,C,  standing a few paces from the lip of the limestone quarry. A thicket of juniper bushes and scrub pine straggled off down the hill behind the temple. There were
134,1965,FIC,DoorbellRang,A,B,C,"  . Wolfe was at the center table with Fritz, arguing about the number of juniper berries to put in a marinade for venison loin chops. Knowing that that could"
317,1965,NEWS,NYT-Reg,A,B,C,"  the Staley College of the Spoken Word in Boston, listing his address as 880 Juniper Street, Atlanta. Mr. Katzenbach said it was unknown whether the nominee had returned"
364,1965,MAG,Time,A,B,C,"  I hate it. "" # # Ill lay: Russia's world record-holding high juniper Valeri Brumel, 23, in a Moscow hospital with a double fracture of the"
375,1965,FIC,WhiteLotus,A,B,C,"  came on the others. They were standing in a circle next to a large juniper bush, and when I took my place beside Dolphin in the ring I saw"
482,1965,FIC,WhiteLotus,A,B,C,  my tongue I closed my eyes and saw again the tattered free man under the juniper bush gnawing like an animal on the dry millet cake. At the first series
8,1967,FIC,ConfessionsNat,A,B,C,"  is in an abandoned corner of a meadow, hard by a scrubby grove of juniper trees and loblolly pine. A plain pole fence, dilapidated to begin with but"
327,1967,MAG,ReadersDigest,A,B,C,"  pellets smashing and splattering on the flat rock, knock ing the berries off the juniper. plastering my shirt to my back, drumming on my hat like hailstones,"
391,1967,NF,GenusPinus,A,B,C,"  on the arid mesas, forming rather scraggy, open forests either pure or with juniper. Its elevational range is between somewhat below 15(X) | has four needles per bundle"
496,1967,FIC,WhenSheWasGood,A,B,C,"  is in an abandoned corner of a meadow, hard by a scrubby grove of juniper trees and loblolly pine. A plain pole fence, dilapidated to begin with but"
50,1970,NF,PlantKingdom,A,B,C,"  enormous tree of up to 150 feet, producing an extremely hard wood. The juniper, Juniperus, grows as a bush or small tree with sharp needle or scale"
264,1970,NF,PlantKingdom,A,B,C,"  . The stomata of conifers, as shown by the example of a species of juniper, are quite distinctive, while sharing the same basic features as those of angiosperms"
469,1970,FIC,BayNoon,A,B,C,"  , the limestonepeaks and dolomitic escarpments, the sea luridlyp139streaked between slopes of oak and juniper. Foreign tourists were doing their best to ruin it -- "" When I knew"
430,1972,FIC,OpenHeart,A,B,C,"  "" and "" I know where I'm going "" and Donovan's "" Jennifer Juniper, "" and after a while Chris came paddling downstairs to listen, and it"
192,1973,FIC,WildPitch,A,B,C,"  good to me as I scrambled down the wet ridge. Everything? grass, juniper, scrub pine? breathed revival. The patches of gravel lay polished, each"
309,1973,FIC,WildPitch,A,B,C,"  the bottom. The ridge had a few stunted pines on it and some creeping juniper and, in the gravel and dry grass, a crisscross of tire tracks left"
366,1973,MAG,SportsIll,A,B,C,  its antlers clawing the air. It crashes through a spray of snow into a juniper stand. A half a dozen coyotes follow. Stillness. // By late afternoon
15,1974,FIC,SomethingHappened,A,B,C,  around boulders. Then they went up a bank and into a small forest of juniper and manzanita. A few minutes later they were in the pines that covered most
86,1974,FIC,SomethingHappened,A,B,C,"  apart, looking into the small flame. She liked the smell of the crushed juniper, the smell of wood-smoke, and the soft rustling of the water in the"
205,1974,FIC,SilentThunder,A,B,C,"  heard Chipeta cry out. Perplexed, she struggled to her feet and approached the juniper under which Chipeta lay. It took only a moment for her to realize what"
352,1974,FIC,ICameHighlands,A,B,C,"  . For the first time I noticed that beyond them, near the pines and juniper, there was another low mound, blanketed with coarse grass. Kenneth looked at"
362,1974,FIC,ICameHighlands,A,B,C,  part of an hour when the path began to slant upward toward a grove of juniper and pine. We moved through the trees and into a grassy open space beyond
392,1974,FIC,SilentThunder,A,B,C,"  make camp. Chief jumped from his brown mount and tied him to a small juniper, then led the palomino over into the center of a large sandy area."
153,1975,NF,scan,A,B,C,"  cuttings, ivy, Tradescantia (spiderwort), spider plants, etc. Tiny juniper trees are brought in from the woods and rest in their pots in the humid"
187,1975,NF,scan,A,B,C,"  you have to buy all the plants. I grow only three types now? juniper trees; the herb, rosemary; and an ivy (Hedera helix conglomerata)"
332,1975,FIC,OverOnDrySide,A,B,C,"  on a shelf behind me a pot with flowers in it and some sprigs of juniper. The flowers wasn't two days old, and when I looked in the"
449,1975,FIC,BeyondBedroomWall,A,B,C,"  by lamps. The floor is strewn with rushes or, on special occasions, juniper boughs. At one end are clay daises, wooden stools, a weighted loom"
117,1976,FIC,yyy,A,B,C,"  they could spend the summer at his family's place in Maine... mosquitoes, juniper bushes, sand flies. Maine makes a very definite picture for me. Emma"
367,1976,FIC,Deep,A,B,C,"  'm on the tack myself. Old guts can't take the fury of the juniper berries. "" Confused, Sanders looked at Treece and saw that he was grinning"
484,1977,MAG,SportsIll,A,B,C,"  is an antipathy that Everett himself expressed one afternoon before a workout in Philadelphia's Juniper Street gym. "" The problem is you don't see other southpaws much and"
44,1978,FIC,MortalFriends,A,B,C,"  for the stuff. What am I supposed to do? Serve grain alcohol with juniper drops? They want champagne! "" "" Well, "" Brady said, """
211,1978,FIC,Whistle,A,B,C,"  strata going back a billion years, and across the view of them a gnarly juniper, and know something of Earth. Thus did Eric learn something of the depths"
234,1978,FIC,MortalFriends,A,B,C,"  bad moment had passed and that they had survived it and that the scent of juniper filled the air. Though they were not sure. They left the cemetery,"
347,1978,NF,WildWildWoman,A,B,C,"  the entrance of the monster had cut paths of destruction through the desert, uprooting juniper trees and flinging them into tangled heaps along the way. No amount of recreational"
356,1979,MAG,Time,A,B,C,"  of 8,200 ft., the track breaks through onto a rolling plateau of sagebrush, juniper and pine. It is here, on this remote plateau, southwest of Rifle"
493,1979,FIC,PassionPlay,A,B,C,"  , the sun-dried reek of urine, dust, some residual odor of sage and juniper. The sun falls straight down; the band of shade in the caves is"
75,1980,FIC,RiddleyWalker,A,B,C,"  "" voters in certain areas of Nautauga, Eden, Clawson, Calla, and Juniper counties who had turned out in the hundreds to defeat (by a narrow margin"
225,1982,NEWS,NYT,A,B,C,"  applause, as the saddle of lamb, marinated in red wine with carrots and juniper berries and served with a tart sauce that included freshly cooked cherries, was being"
32,1983,FIC,BeyondMountain,A,B,C,"  of fences and above the thatch of roofs, and the incenselike smell of burning juniper lingered above the villages. A boy picked large fresh mushrooms and placed them in"
287,1984,NEWS,CSMonitor,A,B,C,"  you outside of Santa Fe will be pale pink, studded with rotund pinon and juniper bushes about four feet high. At any distance, these bushes take on the"
1,1985,MAG,Time,A,B,C,  are harmoniously soldered in a chamber opera that should prove practical and durable. The Juniper Tree represents the triumph of experience over youth.
55,1985,MAG,Time,A,B,C,"  's parlance. # Based on an especially grisly Brothers Grimm fairy tale, the Juniper Tree libretto, by Children's Author Arthur Yorinks, recounts the fable of an"
90,1985,MAG,Time,A,B,C,"  is joyfully restored to his father and half sister. Watching over all is the juniper tree, in which dwells the benign spirit of the boy's real mother."
191,1985,MAG,Time,A,B,C,"  Mass., the American Repertory Theater (ART) offered the world premiere of The Juniper Tree, a collaborative opera by Glass and Composer Robert Moran, in a staging"
2,1986,FIC,Skinwalkers,A,B,C,  . He found nothing. That left the trailer itself. He paused behind a juniper and studied it. Light from a half-moon made the setting a pattern of cottonwood
11,1986,FIC,Skinwalkers,A,B,C,"  and restated the sentence. "" That's where Wilson Sam was, by the juniper. Looked like it was a regular stopping place for him when he was out"
14,1986,FIC,Skinwalkers,A,B,C,"  . "" "" Where was the killing? "" "" See that little bunch of juniper? Look across the shale slope, and then to the right. That man"
160,1986,FIC,Skinwalkers,A,B,C,  Wash Trading Post. He'd parked it under the gnarled limbs of a one-seed juniper -- a place that gave him a little shade and a long view back down
166,1986,FIC,Skinwalkers,A,B,C,"  time. And, as an accidental by-product, giving the cat crouched under the juniper a case of nerves, eroding its instinct to stay hidden until this human left"
197,1986,MAG,Harpers,A,B,C,"  some cactus or a little tumbleweed or maybe a few mutilated trees like mesquite, juniper, or hackberry. I'm not going to bombard you with graphs and statistics"
242,1986,FIC,Skinwalkers,A,B,C,"  hole -- measuring its width with his fingers. "" Lives out there under that juniper, "" Chee added. "" Sometimes when something scares it, it comes in"
377,1986,FIC,Skinwalkers,A,B,C,"  's something, "" he said. His imagination made the figure squatting behind the juniper, watching the Chee trailer, a small figure holding a pump shotgun in his right"
389,1986,FIC,Skinwalkers,A,B,C,  its den about dawn. So perhaps it slept early and hunted late. The juniper under which Cat made its home was along the slope to Chee's left.
459,1986,FIC,Skinwalkers,A,B,C,"  gesture. "" Ground was scuffed. I think somebody had knelt there behind the juniper. It's not far from where people dump their trash and there's always"
56,1987,MAG,Newsweek,A,B,C,"  rubbed on the body or splashed in the bath, contain essences of patchouli, juniper, thyme, lemon, sandalwood and equally romantic ingredients, suspended in the prosaic"
95,1987,FIC,LegacyHeorot,A,B,C,"  then took one of the young women by the shoulder. "" Mary Ann. Juniper berries. "" | "" Eh? "" Mary Ann Eisenhower looked wary. Her"
208,1987,NF,Anthropological,A,B,C,"  cliffs grows the cold desert vegetation of the Upper Sonoran Life Zone? sagebrush, juniper, and pinyon pine. Above the cliffs, the Ponderosa pine of the Transition"
219,1987,MAG,NewRepublic,A,B,C,"  Sills's Story Theater, not to mention the Philip Glass-Robert Moran-Arthur Yorinks opera The Juniper Tree, both of which, through simple fidelity to the source material, allowed"
257,1987,FIC,LegacyHeorot,A,B,C,"  Her blond hair was plastered down with ocean spray. "" What? "" "" Juniper berries. You're in agriculture. Did we bring the seeds? "" Mary"
307,1987,FIC,CaptiveBride,A,B,C,"  There was still nothing but red rock, scrub of pinon, yucca, occasional juniper, sand and dry soil all around us. The sun was high, and"
370,1987,MAG,NewRepublic,A,B,C,"  simple fidelity to the source material, allowed its deeper meanings to resonate. The Juniper Tree, for example, with its account of stepmother infanticide, parental cannibalism,"
431,1987,FIC,LegacyHeorot,A,B,C,"  the light. "" We have them. "" "" Have?? "" "" Juniper berries, silly. I remembered. "" Mary Ann shook water onto him and"
470,1987,FIC,HeavenHell,A,B,C,"  during the week in Orange Park Acres. The property was mostly covered with western juniper, Ponderosa pine, and sugar pine, and their nearest neighbor was far beyond"
268,1989,FIC,SaracenTheHoly,A,B,C,"  girl, was over six weeks late. It seemed the brew of myrrh, juniper berries, and powdered rhubarb Tilia had concocted for her, and which she had"
18,1990,MAG,Wilderness,A,B,C,  grasslands on Burro Mesa run off into the distance largely unblemished by scruffy mesquites and juniper thickets. Tufts of black grama grass sway erratically in time to the gusts of
36,1990,MAG,Wilderness,A,B,C,"  as 11,000 feet give it an identity all its own; with pinyon pine and juniper forests being dominant in many areas. A few animals are unique to the region"
120,1990,MAG,Horticulture,A,B,C,"  be said about mixing a somewhat trendy plant like an ornamental grass with the commonplace juniper, foot soldier of so many nondescript public plantings. When I began planting my"
243,1990,NF,ModelsMirrorsTowards,A,B,C,"  paper laundry lines that send out messages by waving in the breeze, doused in juniper incense and tinted to represent the five elements of the world. By staggering traveler"
250,1990,MAG,Horticulture,A,B,C,  in combination with the so-called Waukegan juniper (J. horizontalis Douglasii'). This juniper turns a purplish color in autumn that contrasts well with the green of the fountain
265,1990,MAG,Horticulture,A,B,C,"  respectable until the ice storms of March finally bend the blades for good. The juniper, of course, is enjoyable through all four seasons. # Finally, a"
283,1990,MAG,Horticulture,A,B,C,"  gains aahs of admiration from passing neighbors, especially in combination with the so-called Waukegan juniper (J. horizontalis Douglasii'). This juniper turns a purplish color in autumn"
289,1990,MAG,Horticulture,A,B,C,"  (around here usually sometime in February). In fact, both grass and juniper are particularly beautiful with frost on them, which enhances the coolness of their color"
61,1991,NEWS,CSMonitor,A,B,C,"  bars under his cot. About twice a week I would tell our daughters, Juniper and Amanda, they could go to Guy's and get a candy bar."
368,1991,NF,SaucesClassical,A,B,C,"  An Overview ""). Sauces for roast game also benefit from a few crushed juniper berries infused in the jus before the addition of the blood. MODEL FOR PREPARING"
382,1991,NF,SaucesClassical,A,B,C,"  herbs, a small amount of oil, and sometimes spices such as cloves, juniper berries, and crushed peppercorns. Although some contemporary chefs feel that marinades sometimes distort"
96,1992,FIC,Ploughshares,A,B,C,"  in Wyoming, a small place with spotty grass and clumps of slender, wind-bent juniper saplings. It was crowded with trailers and RVs and station wagons, and the"
269,1992,FIC,Ploughshares,A,B,C,"  , "" Forrest said, gently pulling Lillie and me into a nearby clutch of juniper saplings so my mother wouldn't see us. We stood there a long time"
381,1992,MAG,Horticulture,A,B,C,"  hybrid Etoile Violette' almost covers Berberis temolaica, while Abundance' cascades from a juniper. # # By Christopher Lloyd # Photographs by JERRY HARPUR # # Frequent contributor"
35,1993,FIC,TemptationsStEd,A,B,C,"  poisoning this monastery. "" They walked together in the fading evening light through the juniper grove, where, beyond the stand of trees, they glimpsed the yellow metal"
39,1993,FIC,VoiceInWind,A,B,C,"  suggested a tunnel or entrance, just land sloping away, gently spotted with puffy juniper shrubs and a band of ponderosa pines below that. Across a dry riverbed was"
48,1993,FIC,Ploughshares,A,B,C,"  was washing out in a dangerously deep arch, a red-clay cave marbled with exposed juniper roots and resonant with lapping water. Crouching, she counted twenty or more cigarette"
51,1993,FIC,Ploughshares,A,B,C,"  rose before them, the mare cornered neatly, and a magpie flared from a juniper. The mare jarred sideways, dodging the bird and then dodging from haywire momentum"
66,1993,FIC,DirtyWork,A,B,C,"  He took a few steps this morning using that cane you carved for him from juniper wood. "" "" Good. After we finish here, I will visit him"
77,1993,FIC,TemptationsStEd,A,B,C,"  of that day he'd seen Amy stretched out naked on the log in the juniper grove, the night she'd crawled into his bed, and the day he"
85,1993,FIC,TemptationsStEd,A,B,C,"  , "" she told St. Ed. Succulent smells of cooking meat drifted from the juniper grove where, Pete's friends had turned a lamb on a spit over a"
88,1993,FIC,VoiceInWind,A,B,C,"  for the wash. They carefully erased their tracks with their brooms of sagebrush and juniper. Don't make it look too even, Liberty flashed as she and July"
94,1993,FIC,TemptationsStEd,A,B,C,"  light to see, even at night. "" Dale sprinkled the fire with sweet juniper incense. With a black and white feathered fan of magpie tailfeathers, he waved"
116,1993,FIC,SacredClowns,A,B,C,"  its autumn mode, low in the southwest, and shadows slanted away from every juniper. They formed zebra stripes where the slopes ran north and a polka-dot pattern where"
182,1993,FIC,TemptationsStEd,A,B,C,"  's arrival was solved; a drilling truck was parked in the flat beyond the juniper grove. The racket grew louder as the monks filed through the junipers, St."
183,1993,FIC,DirtyWork,A,B,C,"  . Never had she felt so pure and cleansed. The fragrance of reeds, juniper, and wildflowers near the pool wafted on the breeze and filled her lungs."
227,1993,FIC,DirtyWork,A,B,C,"  into a mush. Even the children worked, busily sweeping the earth with fresh juniper branches to make the air smell sweet. Ipa's uncle and the older men"
254,1993,FIC,TemptationsStEd,A,B,C,"  're having. "" He adjusted a pillow behind his head. The smell of juniper and pinon came through the dark window as they passed Tonopah, heading east."
260,1993,FIC,StrangeDevices,A,B,C,"  that were important to him, like a handknitted blanket and a pillow stuffed with juniper berries and a china thimble just the right size to use as a teacup."
261,1993,FIC,SacredClowns,A,B,C,"  truck jolted higher into the summer pastures of the Chuskas, and ponderosa pine replaced juniper and pinon, and the air was colder in his nostrils and brought the old"
266,1993,FIC,DirtyWork,A,B,C,  with water to form a mushy paste. Kadoh and Xucate sat under a twisted juniper tree and shared their food. Ipa sat on a gray rock in the shade
267,1993,FIC,VoiceInWind,A,B,C,"  to a rock that jutted out next to the cleft and Lightning to a nearby juniper. As they pointed the ponies toward home, Liberty looked back over her shoulder"
275,1993,FIC,SplitHeirs,A,B,C,"  . I led her through the broadest part of the meadow, past the wild juniper that fanned apart in green chevrons, the young birch that was just high enough"
304,1993,FIC,DirtyWork,A,B,C,  empty for they had already gathered them not long ago. The fresh smell of juniper tingled Ipa's nostrils as they stopped at a resting place. The women removed
337,1993,FIC,BooksKeepers,A,B,C,"  her fingertips ingrained with dirt, but she had a clean smell, sharp with juniper and fir smoke, sweet with beeswax and mint. Bram was fascinated by her"
338,1993,FIC,TemptationsStEd,A,B,C,"  . "" He turned and walked away from the monks in the direction of the juniper grove. "" Where's his truck? "" Pete asked. St. Ed shrugged"
345,1993,FIC,TemptationsStEd,A,B,C,"  up, dressed in his blue cowl, and walked with the dogs through the juniper grove to where the drilling rig, lit with strings of lights like Christmas ornaments"
365,1993,FIC,TemptationsStEd,A,B,C,"  of love to St. Ed. | Later that morning, Brother S worked in the juniper grove marking weak hives that would need to be combined and requeened before the winter"
402,1993,FIC,TemptationsStEd,A,B,C,  S was returning from Sun Cave when he started to cut through a stand of juniper with the dogs. He stopped abruptly. On a fallen cottonwood log Amy lay
415,1993,FIC,DirtyWork,A,B,C,"  lips. As soon as Kadoh was able to walk with the help of his juniper cane, Rodrigo had placed him in charge of tending his horse again. Before"
417,1993,FIC,DirtyWork,A,B,C,"  though her aunt checked their granary daily for moldy ears and though Ipa replaced the juniper branch inside the dark room often, the musty smell was always there. This"
472,1993,FIC,TemptationsStEd,A,B,C,"  gathering four long aspen poles for a tepee they planned to set up in the juniper grove. "" You might as well leave, too, "" St. Ed said"
3,1994,FIC,Postcards,A,B,C,"  mister, tell you what else you said. You bitched and whined about the juniper movin' into the fields, talk half an hour about the orchard, suckers"
41,1994,NEWS,Atlanta,A,B,C,  to hear from you. # UPCOMING: The Grady Cluster is moving to 776 Juniper St. on Sept. 1. # The position of cluster coordinator is being posted.
492,1994,NEWS,WashPost,A,B,C,"  . He noted that Berlage recently switched positions on a low-cost housing project slated for Juniper Street and Blair Road near Silver Spring and now opposes it. # "" He"
478,1995,MAG,ConsumResrch,A,B,C,"  secret blend of up to ten fruits, herbs, and spices which must include juniper, this being the essential component which identifies a drink as gin. Other botanicals"
62,1996,FIC,FantasySciFi,A,B,C,"  decent interval began to search the bushes. He soon located McArthur lying under a juniper. The raccoon was unconscious, but Bill could detect a heartbeat. "" Poor"
286,1996,MAG,Smithsonian,A,B,C,"  serissa, Japanese hornbeam and rock cottoneaster, as well as fuchsia, wisteria and juniper. And Kate Johnson's trolls, and Melissa Fox's ceramic wall vases,"
178,1997,FIC,coca_mag,A,B,C,  slender barbed shafts of bone and fit them into a socket at the end of juniper arrows. Then they'd sit on the porch and wait for some small animal
238,1997,FIC,Triquarterly,A,B,C,"  chaparral to tundra to mixed-conifer forests; four, the Modoc Plateau, sagebrush, juniper, volcano country; five, the Klamath Coast, mountains up to Trinidad Head"
270,1997,MAG,VegTimes,A,B,C,"  Inhaling essential oils can help quell an upset stomach. Try lavender, bergamot, juniper, lemon grass and lemon. Here are a few more tips gleaned from aromatherapy"
414,1997,NEWS,USAToday,A,B,C,  . The closest that tourists can get to the condors is a rustic shelter of juniper boughs more than a mile below the birds' roost. In the shelter's
87,1998,FIC,FantasySciFi,A,B,C,"  near the highway fence, a dusty blue Dodge Caravan was parked by a crooked juniper. The Rainmaker was sitting on a little folding stool beside the car, a"
200,1998,FIC,FantasySciFi,A,B,C,"  residue in the bottom, an oily smear, which smelled vaguely of camphor and juniper and weeds. He set the glass down and forced himself to look at the"
271,1998,NEWS,AP,A,B,C,  winter due to the heavy snowpack. Rim ice is starting to form. # Juniper Lake: Fishing is fair for 15-inch cutthroat trout. Rim ice is starting to
460,1998,FIC,FantasySciFi,A,B,C,"  BACK out to the dry wash where we sat in the shade of a twisted juniper, watching its shadow creep across the ground. Waiting for the rain, I"
465,1998,FIC,AntiochRev,A,B,C,"  distant. They can never be turned into part of a pasture. Nothing but juniper and sage grow on these arid heights, yet I don't find them forbidding"
479,1998,NEWS,Chicago,A,B,C,"  flavors of the various woods, which can include oak, cherry, mulberry, juniper, chestnut and others. No set number of barrel transfers is required, but"
70,1999,FIC,Ploughshares,A,B,C,"  house that featured my aunt's strange bonsai specimens, miniature chrysanthemum, pomegranate, juniper, and other odd Lilliputian plants on which she performed experiments, wiring branches,"
130,1999,NEWS,Denver,A,B,C,"  Town Hall, lounging outside near the sensory garden or sweating it out in the Juniper Gym &; Spa - Brookins has Alzheimer's disease. # In less than six"
195,1999,MAG,Antiques,A,B,C,"  in his Proffitable Arte of Gardening (Fig. 1). Bowers were constructed of juniper or willow poles, bound together and arched over. The gardener then transplanted various"
