entry,year,genre,source,a,b,c,text
159,1920,FIC,LittleMaidOldMaine,A,B,C,"  moment's lull in the storm, and Anna could clearly see the wide branched juniper bushes where she had left Melvina. "" Melly! Melly! "" she called"
249,1920,FIC,LittleMaidOldMaine,A,B,C,"  . "" Come up the slope a little way, and sit down behind those juniper bushes until I come back. Luretta must be near the pine trees. I"
284,1920,FIC,LittleMaidOldMaine,A,B,C,"  . "" Melvina agreed to this plan, and followed Anna slowly up to the juniper bushes, and crouched down well under their branches so that she was completely hidden"
498,1920,FIC,LittleMaidOldMaine,A,B,C,"  she could think only of Melvina, cowering, wet and afraid, under the juniper bushes. "" Perhaps she will be blown down the slope into the river,"
20,1921,FIC,LaughingPrince,A,B,C,"  he came upon a wild woman who was combing her hair with a branch of juniper. "" That isn't the way to comb your hair, "" the Youngest"
248,1921,MAG,Atlantic,A,B,C,"  by that route. He may make his bed on the lee side of a juniper bush, or, if it is very cold, among the undergrowth of a"
30,1922,FIC,FlamingJewel,A,B,C,"  but before he could fire again Quintana's shot in reply came ripping through the juniper and tore a ghastly hole in the calf of his left leg, striking a"
83,1922,MAG,Harpers,A,B,C,"  that door and thefireplace. There are a big black Santa Clara jar filled with juniper over the hearth, and a round, terra-cotta bowl of startling carmine Indian paintbrush"
93,1922,FIC,CopperStreakTrail,A,B,C,"  shoot -- I shall now show you something. "" A chuck box was propped against the juniper trunk. From this the Texan produced a horseshoe hammer and the lids from two"
157,1922,FIC,CopperStreakTrail,A,B,C,"  saw a long watering-trough with a float valve. Before the dugout stood a patriarchal juniper, in the shade of which two saddled horses stood droop-hipped, comfortably asleep."
255,1922,FIC,CopperStreakTrail,A,B,C,"  brown earth, the spicy tang of crushed herb and shrub, of cedar and juniper, mingled with a delectable and savory fragrance of steaming coffee and sizzling, spluttering"
288,1922,NF,AfootInEngland,A,B,C,"  contrasts with the other trees and bushes that flourish on the downs -- furze, juniper, holly, blackthorn, and hawthorn! Two years ago, one day in"
336,1922,FIC,FlamingJewel,A,B,C,"  hand with the first shot. Them Jim Hastings, kneeling behind a bunch of juniper, fired a high-velocity bullet into the tree behind which Quintana stood; but before"
346,1922,FIC,CopperStreakTrail,A,B,C,"  frost; he tossed his empty gun through the sunlight to the bed under the juniper tree and spread out his hands. Bill was still firing -- one shot -- two! "" Judgment"
351,1922,FIC,FlamingJewel,A,B,C,"  amid the evergreens, when Quintana suddenly squatted close to the moist earth behind a juniper bush. At first, except for the threshing of Sard and Sanchez through the"
448,1922,FIC,LouisianaLou <,A,B,C,"  the plunging horse, but his head struck hard against the gnarled trunk of a juniper and, half stunned, his body slid over the edge and dropped. Chuckling"
453,1922,FIC,FlamingJewel,A,B,C,"  alive, crawled at his heels. Presently they saw Quintana, waist deep in juniper, looking down at something. And when they drew closer they saw Georgiades lying"
26,1925,NEWS,NYT-Reg,A,B,C,"  the home, the colleges, the schools -- almost in the nursery. The juniper and the dandelion have become the national flowers. "" All this disgraceful condition is"
40,1925,MAG,Time,A,B,C,  as they swung themselves from the mangrove to the coconut palm and clambered about the juniper and olive trees. The chattering stopped; curious faces peered through the leaves toward
43,1925,FIC,Coyote AWestern,A,B,C,"  a long, black slicker and was tying a handkerchief about his face. "" Juniper, hoss, "" said Rathburn, "" what does that gent want that slicker"
228,1925,FIC,Coyote AWestern,A,B,C,"  desert. A wistful light came into the horseman's eyes. "" Home, Juniper, hoss, "" he said softly. "" We've just got to have"
198,1930,FIC,Arundel,A,B,C,"  the hair on his chest, so that he looked as much like a walking juniper bush as a man. I had ever liked Paul Higgins, despite the sneers"
29,1931,MAG,NatGeog,A,B,C,"  skin, our hands numb and our shoes full of water, until we struck juniper forests and the roaring glacier stream of Shenrezig, whose eternally snow-crowned peak was hidden"
148,1931,MAG,NatGeog,A,B,C,  to a chanting priest to pay for prayers and burned some printed prayercovered papers and juniper boughs to the deity protecting pilgrims. | I agreed not to take much baggage
226,1931,FIC,Mov:BlondeCrazy,A,B,C,"  mix a little business with pleasure. Answering a want ad, Charles Mayard of Juniper Junction, Mo., is shown a short cut to financial independence, and is"
311,1931,MAG,NatGeog,A,B,C,"  rgellah! "" (The gods are victorious!) Then they hastened to burn juniper twigs as an offering to the sacred mountain Chanadordje, which we were then facing"
413,1931,FIC,Harpers,A,B,C,"  Rock Pasture, one of those delightful New England hillsides of granite and cedar and juniper, and eventually come to the wood which covered the long spur of Hateful Mountain"
455,1932,FIC,Invasion,A,B,C,"  , bitter herb stews, mallow for the kidneys, bonewort for a fever, juniper berries for calculus, balsam twigs for a rheum, poultice of red willow or"
398,1933,NEWS,Chicago,A,B,C,"  . "" Is this Ald. Schulz? "" asked the caller, who had dialed Juniper 1009, the phone number of the alderman's office at 2058 Wilson avenue."
221,1934,FIC,SmirtAnUrbaneNightmare,A,B,C,"  and the light green of ivy, sat this woman, beside a fire of juniper wood. In her hand was a large fork, like a trident, with"
101,1935,FIC,TimeOutMind,A,B,C,"  went off by myself to an old pasture higher up. It was thick with juniper, and blueberry leaves were blood-red underfoot. I remember that I stooped and picked"
146,1935,FIC,ThisBodyEarth,A,B,C,"  going into housekeeping sure enough, "" Dollis Chadbourne laughed. He'd bought a juniper washtub, a crate of geese, half a dozen chickens, and several home-made"
485,1935,FIC,Harpers,A,B,C,"  hill of them all, And after that the lonesome seagulls' call; A juniper upon a windy ledge, Splendor of granite on the world's bright edge,"
99,1936,FIC,DrumsAlongMohawk,A,B,C,"  , but the Indian found plain tracks and a tatter of cloth together beside a juniper. He could not understand it; it was too dark to see the tracks"
23,1937,FIC,EnemyGods,A,B,C,"  , staring between his horse's ears. Sixteen is too young. I told juniper -- not too young for that, the hot, sweet touch. I think"
25,1937,FIC,EnemyGods,A,B,C,"  savouring it.' And you?'' War Encircling. I'm called Juniper.' War Encircling. It suited. He thought vaguely, sinking into a"
59,1937,FIC,EnemyGods,A,B,C,  is right over there'; he made a decision. Those things were for Juniper.' Just wait till I get my goods.' She stood in the
60,1937,FIC,EnemyGods,A,B,C,"  asked,' And you, where from?' He hadn't looked at juniper yet.' The Rim above T'o Tlakai. My brother is helping your uncle"
71,1937,FIC,EnemyGods,A,B,C,"  threes. He stepped forward, an initiated man who belonged, and remembered that Juniper might be there. Her uncle, Returning Wisely, was expected, so her"
98,1937,FIC,EnemyGods,A,B,C,"  In making himself comfortable, he shifted his position, so that he could see Juniper. Her blanket drawn across the lower part of her face and over her head"
103,1937,FIC,EnemyGods,A,B,C,"  made one's middle heavy. | There are many girls, but only the one Juniper. And that was Warrior Comes Forth who looked at him and then went on"
113,1937,FIC,EnemyGods,A,B,C,  that he was done with hoeing corn. He knew that the fullness of losing juniper had not yet torn at his heart. A man can not be owned by
138,1937,FIC,EnemyGods,A,B,C,"  school' He paused, considering the idea of a man who could have had juniper and left her.' I can't mention her to strangers, but you"
154,1937,FIC,EnemyGods,A,B,C,  juniper. I don't see how you could want anyone else when you have juniper. Will she grow old? He thought of girls he'd had before his
158,1937,FIC,EnemyGods,A,B,C,"  What's hit you?' Nuttin. I just feel good.' | JUNIPER walked in a wide, slow circle around her flock. The animals grazed in"
167,1937,FIC,EnemyGods,A,B,C,"  ,' Pull in, brother, don't blow out.' He heard Juniper's laugh, distinct among the rest. He knew her voice only in seriousness"
168,1937,FIC,EnemyGods,A,B,C,  but bragging on it now when he ought to be sorry... He wondered where Juniper was now. Married probably. Last year -- two years. Two whole years
184,1937,FIC,EnemyGods,A,B,C,  . Myron went straight to the other fire. Perhaps because of the women -- Juniper and her mother and another matron with a child in her lap -- most of
189,1937,FIC,EnemyGods,A,B,C,"  Bay Horse,' Now here's a man with a real voice.' Juniper's father said,' Sit down. Be warm.' He seemed an"
193,1937,FIC,EnemyGods,A,B,C,"  juniper by the fire, the baby on her lap, the feeling vanished. She"
216,1937,FIC,EnemyGods,A,B,C,"  us know if you come over the mountain,' Bay Horse told him. Juniper's eyes met his, quick, complete. He kept his face plain with"
224,1937,FIC,EnemyGods,A,B,C,"  .' This afternoon, tomorrow morning. The sorrel's in good shape. Juniper. By noon tomorrow.' Listen. Graze up around that same place,"
236,1937,FIC,EnemyGods,A,B,C,"  Most kids are. In bed at Tsaili and the drum going, backsliding. Juniper, pifibn, and jack-pine moved in slow procession past him, falling behind,"
237,1937,FIC,EnemyGods,A,B,C,"  I help it if I am sent for?' This required an effort, Juniper had always been first, but the poor girl' When the police come,"
240,1937,FIC,EnemyGods,A,B,C,"  spoken. Don was bad. Don and Serafina -- well, there'd been juniper. It could just kind of happen. Of course he knew Don was loose"
247,1937,FIC,EnemyGods,A,B,C,"  Do you remember Juniper?' He twirled his quirt, watching him.' Juniper? Why -- yes.'' I married her.' ran up high"
253,1937,FIC,EnemyGods,A,B,C,"  after. But I said I'd marry her. Why, then --? juniper. He started along the back trail, leading the limping pony. Vividly the"
256,1937,FIC,EnemyGods,A,B,C,"  He scouted again, looking through the crowd, then to the country roundabout. Juniper was dragging a long, dead branch. He went out to meet her."
262,1937,FIC,EnemyGods,A,B,C,"  After they had ridden some distance, Singing Gambler said,' Do you remember Juniper?' He twirled his quirt, watching him.' Juniper? Why --"
292,1937,FIC,EnemyGods,A,B,C,"  all laughing, and Juniper let the blanket fall away from her face.' Juniper's mother -- her name was Red Woman -- said,' Here, give"
297,1937,FIC,EnemyGods,A,B,C,  Then you could have a clear conscience and amount to something. Clear conscience -- Juniper. Wasp201juniper bad? No. You couldn't put that word on a person
344,1937,FIC,EnemyGods,A,B,C,"  . Love, perhaps, I mustn't love an ignorant, I want -- Juniper, War Encircling. I've got to find out soon and then go see"
361,1937,FIC,EnemyGods,A,B,C,"  has to stay whole. With the loveliest girl in the world, even with juniper, he has to stay whole. Just looking at her, he knew that"
400,1937,FIC,EnemyGods,A,B,C,"  Paul Snyder wrote me that you hadn't come back. What happened?' Juniper, Shooting Singer, Nayeinezgani.' 1 du n no.'' It's"
420,1937,FIC,EnemyGods,A,B,C,"  a tired silence within his mind, his fingers tapping idly on the drum. Juniper.' Are you going to sing?' He roused himself. Sleep and"
423,1937,FIC,EnemyGods,A,B,C,"  times he was steady. It was comical, Bay Horse's new wife and juniper had theirp213babies almost together, and that mite was his son's uncle. The"
425,1937,FIC,EnemyGods,A,B,C,"  looked handsome. He noticed many things, but he had to pay attention to Juniper sitting there. It was the same face he had always known, the familiar"
429,1937,FIC,EnemyGods,A,B,C,  babies. He chuckled. I hope I'll last like that. And with juniper. I don't see how you could want anyone else when you have juniper
444,1937,FIC,EnemyGods,A,B,C,"  had come for him. There were many girls, but the thought of losing Juniper darkened the sun and made one's middle heavy. | There are many girls,"
497,1937,FIC,EnemyGods,A,B,C,"  upward, Myron hoped that the man could find what he lacked and win back juniper. P264It was partly just wanting not to have any more suffering and loneliness in"
24,1938,FIC,Fathers,A,B,C,"  , the cook, whom I did not like, but who was there because Juniper, our old cook at Pleasant Hill, |p120had begged papa not to bring her"
452,1938,FIC,Fathers,A,B,C,  south window I could see only a little light in the top leaves of the juniper tree that rose to the level of the sill. We were two brothers waiting
37,1939,FIC,Yearling,A,B,C,"  These fellers only fits a man's back, "" he said. They crossed Juniper Creek, then, after two miles of narrowIo8THE YEARLINGroad, picked up the main"
108,1939,MAG,Time,A,B,C,"  at all odd, I am always about in the quad. # Thus the Juniper tree Never ceases to be Since observed by yours faithfully God. This summer Monsignor"
124,1939,FIC,ChildrenGod,A,B,C,"  all they were worth, their faces eager in the glow of burning cottonwood and juniper. Some sang as they (lanced, others whistled, and a few played"
214,1939,FIC,Yearling,A,B,C,"  cakes. Jody was allowed a glass of wine. It was as clear as Juniper Springs. Penny smacked his lips over it, but Jody wished it was somethingsweeter"
380,1939,FIC,BigSleep,A,B,C,  with a deep old bay window and a stone fireplace in which a fire of juniper logs burned lazily. It was wainscoted in walnut and had a frieze of faded
385,1939,FIC,Yearling,A,B,C,"  the treeplantingof his grandfathers. Even the highway engineers were setting out little clumps of juniper and evergreens to relieve long, monotonous stretches -- with such native stuff as buffaloberry"
407,1939,MAG,NatGeog,A,B,C,"  kitchen police. All floors are scrubbed with sand and soap, and freshly cut juniper twigs are spread over the floor. In the fireplace birch branches are placed."
409,1939,MAG,Time,A,B,C,"  a young man who said, "" God Must think it exceedingly odd That the Juniper tree Just ceases to be When there's no one about in the quad."
428,1939,FIC,Yearling,A,B,C,"  We come up with him, men, right smack at the edge o' Juniper Creek, where the water flows swiftest and deepest. "" The story, Jody"
487,1939,FIC,Yearling,A,B,C,"  , past the golf links and out over rougher knolls dotted with clumps of new-planted juniper, like tufts of unruly hair in a wind. The shaggy sod of the"
312,1940,FIC,MrsMiniver,A,B,C,  Breck. IIe wore the striking black-andyellowof the MacLeods; there was a sprig of juniper in his bonnet. The second was younger134 135Mrs. Miniverand taller. He was
399,1940,MAG,Harpers,A,B,C,"  dingy gray, with here and there a single clump of some dwarfed bush, juniper or lentisk, just to emphasize the absence of life all around. A few"
440,1940,FIC,MrsMiniver,A,B,C,"  awe which had overcome her when, emerging suddenly from a painful encounter with a juniper thicket in Teesdale, she had once seen a startled woodcockunmistakably carrying off its young"
310,1941,FIC,MildredPierce,A,B,C,"  children had got their drinks, and as there was at least a whiff of juniper in all the glasses, they usually decided to agree. Tonight, although the switcheroo"
4,1942,FIC,Windswept,A,B,C,"  of dry, of wild strawberries ripe in the shaggy grass, of bayberry and juniper, of fresh wood, tarred paper, and pots of paint. Some of"
82,1942,FIC,Windswept,A,B,C,"  murky yellow, scudding above the land, trailing their frayed garments across the dripping juniper and bracken, sweeping on across the pasture slope to join the gray hosts mustered"
121,1942,FIC,ComeBackWayneCounty,A,B,C,"  Eight or nine boys, and they were called Oak, Hickory, Ash, Juniper, Beech, and a couple of others. Juniper, he remembered, was"
206,1942,FIC,ComeBackWayneCounty,A,B,C,"  , Hickory, Ash, Juniper, Beech, and a couple of others. Juniper, he remembered, was the one that always wanted to be alone, so"
300,1942,FIC,Windswept,A,B,C,"  the Tuesday ironing. Mrs. Haskell's road to Damascus was the path through the juniper and blueberries to her clothesline; her heavenly vision, the perennial shine on her"
387,1942,FIC,Windswept,A,B,C,"  land itself vivid patches of blue among the blueberry bushes, the alders, and juniper. Julian rather sheepishly drew from his belongings canvas, palette, and paints and"
10,1945,FIC,MrTuttFindsWay,A,B,C,"  sheep were grazing near by. Over the door was a little painted sign: JUNIPER COTTAGE. The storekeeper blocked their approach outside the gate. "" Y' ca"
106,1945,FIC,MrTuttFindsWay,A,B,C,"  down at her. "" But I'll compromise for two weeks every August at Juniper Cottage. "" |p171MR. TUTT was not superstitious. He would walk under a"
174,1945,FIC,SkipMyLou,A,B,C,"  , some said, was the same kind of tree known elsewhere as a Mexican juniper; but, be that as it may, it grew nowhere else in the"
354,1945,NEWS,NYT-Let,A,B,C,  ugly gob naval uniform. From the standpoint of utility it is indefensible. The juniper has only a small pocket. It is difficult to put on and take off
9,1946,FIC,SnakePit,A,B,C,"  hospitals but Juniper Hill, real or dreamed, never appeared in those works. Juniper Hill, one of the best in the country if not the best. Preserve"
52,1946,FIC,SnakePit,A,B,C,"  rather amusing if you had had a good stiff drink. Of paraldehyde. The Juniper Cocktail, as we call it, we gay ladies of Juniper Hill. A"
58,1946,FIC,SnakePit,A,B,C,  most of the visit talking about what they would do as soon as she left Juniper Hill. He said it would be very soon and while he was there she
64,1946,FIC,SnakePit,A,B,C,"  Mrs. Fled-.derson, "" but we get along. No one wants to be at Juniper Hill. I don't much want to be here myself. But if you"
112,1946,FIC,SnakePit,A,B,C,"  hard as the one you had in Three. Scratch the surface and you found Juniper Hill. But remember, this is the ward you go home from. This"
119,1946,FIC,SnakePit,A,B,C,"  with his stick. At the foot of the slopes buffalo-berry bushesshone like silver and juniper climbed in the rocks. Tongues of land ran out where the river turned,"
125,1946,FIC,SnakePit,A,B,C,"  has been here nine months. Nine months in One, almost two years in Juniper's other wards. But Lola is not sick; she is simply waiting for"
137,1946,FIC,SnakePit,A,B,C,  when she was writing it. What she did not know until she came to Juniper Hill was that the dozen scholarly volumes she had read on the subject were also
140,1946,FIC,SnakePit,A,B,C,  . There was the sound of a nurse coming fast. This was one sound Juniper Hill had in common with an ordinary hospital. A nurse coming fast always sounds
144,1946,FIC,SnakePit,A,B,C,  She asked why Virginia hadn't mentioned the matter before. Sometimes65it was difficult at Juniper Hill to remember which were the sick ones. Miss Hart boomed for her to
176,1946,FIC,SnakePit,A,B,C,"  insane and she was one of them. CHAPTER FOURMRS. ROBERT P. CUNNINGHAM, Juniper Hill Hospital. It was there on the envelopes, in Robert's writing."
230,1946,FIC,SnakePit,A,B,C,"  Charles was their doctor at home and also their good friend. Charles had said Juniper Hill was absolutely one of the best. Also, doctors Robert hadconsulted in New"
244,1946,FIC,SnakePit,A,B,C,  name. And in the past you had thought half blindness a burden. At Juniper Hill it was a blessing. How ugly the dayroom was. How much browner
291,1946,FIC,SnakePit,A,B,C,"  store with tables and wirebackedchairs and a soda fountain. She had always thought of Juniper's store as being just a storeroom, but it was a real store."
314,1946,FIC,SnakePit,A,B,C,"  somethingentirely foreign to your experience? I have read twelve books about mental hospitals but Juniper Hill, real or dreamed, never appeared in those works. Juniper Hill,"
333,1946,FIC,SnakePit,A,B,C,  say these long involved dreams take only a few minutes; perhaps the months at Juniper Hill are minutes in a night. Look at the years it took to write
355,1946,FIC,SnakePit,A,B,C,"  of course, and two children. She said she was going to stay at Juniper Hill until her husband agreed to let her have a divorce and the children."
374,1946,FIC,SnakePit,A,B,C,"  , "" she said. She must have had a peculiar life before coming to Juniper where all moments were insufferably dull. "" You might put the things you have"
406,1946,FIC,SnakePit,A,B,C,  about how long you can continue to spend more than your income. Here at Juniper Hill she got her wish and she learned that having a blank mind while awake
418,1946,FIC,SnakePit,A,B,C,  can be sure of things. This made her wonder if she actually was at Juniper Hill. Perhaps she was somewhere else; perhaps she was at home in bed
461,1946,FIC,SnakePit,A,B,C,"  write about them as they imagine themselves. Well, I shall try to remember Juniper Hill for a book and then they will say what an imagination you have,"
464,1946,FIC,SnakePit,A,B,C,"  was something you took for granted. But here, here in the world of Juniper Hill, a day might consist of weeks, of hours, of a minute"
467,1946,FIC,SnakePit,A,B,C,"  paraldehyde. The Juniper Cocktail, as we call it, we gay ladies of Juniper Hill. A martini, please, we more sophisticated ones say. And where"
393,1947,MAG,Time,A,B,C,"  0. Eastland, five Congressmen, scores of state officials, crowded into the Juniper Grove Baptist Church (built with Bilbo's donations) to attend the services."
136,1948,MAG,NatGeog,A,B,C,"  more thrills than did a Tulsa, Oklahoma, man when he found the pendulous juniper. He had tried without success to breed a Rocky Mountain silver cedar with drooping"
388,1948,MAG,NatGeog,A,B,C,  exactly as he desired. A limb was all he needed to propagate the graceful juniper he later patented. Other finds and hybrids include an improved tobacco plant for Connecticut
371,1950,MAG,GoodHouse,A,B,C,"  odor, sweeter than cathedral incense, of the pifion smoke? a sort of juniper. I would know I was in the South by the rich, sweet reek"
373,1951,FIC,CruelSea,A,B,C,"  of leaves and evergreen needles, and stopped to pick the last of the blue juniper berries from the shrubs. The warm, pungent taste of the berries made them"
263,1952,FIC,WonderfulCity,A,B,C,"  I don't know why. He stood shivering by the horse and the dripping juniper tree, with the scattered lumps and shapes dark on the hillside in the thinning"
446,1952,FIC,WonderfulCity,A,B,C,"  his buttocks. He rode talking, soothing, down the hill to a stumpy juniper where he tied the black frightened nose close to the shaggy trunk. The dun"
7,1953,NF,EnglishHousewife,A,B,C,"  , sugar, and butter. There was also mum, brewed from wheat, juniper ale, flavoured with juniper berries, bay-leaves, coriander, and caraway seeds,"
282,1953,NF,EnglishHousewife,A,B,C,"  . There was also mum, brewed from wheat, juniper ale, flavoured with juniper berries, bay-leaves, coriander, and caraway seeds, and cock ale which was"
308,1953,NF,EnglishHousewife,A,B,C,"  as a rule, allowed any fresh air. A bright fire with rosemary or juniper burning on it, closed windows, and bed-curtains tightly drawn at night were con-81"
350,1953,FIC,Good-for-Nothing,A,B,C,"  taller than 100 feet. On the fringe of the meadows were bushes of mountain juniper over which deer could jump and frequently did. The course of Squirrel Creek,"
450,1953,NF,EnglishHousewife,A,B,C,"  Damask Rose leaves, a peck of dried sweet Marjorum, a pretty stick of Juniper shaved very thin "", 1 and a variety of other ingredients, powdered and"
147,1954,FIC,Mov:SaltEarth,A,B,C,"  little ones, and Lus... CAMERA SWISH PANS to a clump of juniper on the hillside in deep b.g. We can make out Lus, crouching there"
165,1954,FIC,Mov:SaltEarth,A,B,C,  -- THE WOODED HILL. LONG SHOT FROM THEIR ANGLE. In a thicket of juniper far up the slope we can make out two boys: Lus and a comrade
408,1954,FIC,Mov:SaltEarth,A,B,C,"  SHOT: THE QUINTERO FAMILY standing apart from the others, near a clump of juniper. Lus stands beside his father, whose uneasy frown is directed at the picket"
21,1955,FIC,DreamKings,A,B,C,  of verse would be genteel. Mister Whittier's works seem decent enough. Carly Juniper stocks a few books. Tell him it's for me. For you?
28,1955,FIC,DreamKings,A,B,C,"  in my voice that was, still strange and new to me. At Carly Juniper's store the old men clustered round the stove like frost-sick bees around a smoke-pot"
123,1955,FIC,DreamKings,A,B,C,  fist and I stare up at the dull crescent of the lamp flame in Carly Juniper's store. What now? Aunt Sarah has driven us together at last into
223,1955,FIC,DreamKings,A,B,C,"  winter croups. How's your Aunt Sary, Tom? Just fine, Mister Juniper! By grannies, you've growed up overnight, Tom Christopher! You're"
258,1955,FIC,DreamKings,A,B,C,"  to bits in anger at some news of the Dred Scott business. At Carly juniper's General Store men who had once muttered, shouted at one another now,"
295,1955,FIC,DreamKings,A,B,C,  by Coy's hand to de house? Didn't you say yo'sef dat Carly juniper tol' him? Give it to me! I be dogged! And she
339,1955,FIC,DreamKings,A,B,C,  musty greatcoat from the hall antler and went off up the frozen road to Carly Juniper's store to buy the snuff that Aunt Sarah had refused him that morning when
340,1955,FIC,DreamKings,A,B,C,  Coy came up the meadow in the buckboard with a sack of flour from Carly Juniper's. My fear that the storm had done damage to the Nellie Queen was
341,1955,FIC,DreamKings,A,B,C,  quicken her fever all the more. We had walked all the way to Carly Juniper's store to buy licorice and a spool of green thread for Aunt Sarah and
437,1955,FIC,DreamKings,A,B,C,  sure.' Cause Coy said so! How he know!' Cause Carly Juniper told him -- that's how! Carly said that letter came in the mornin
