entry,year,genre,source,a,b,c,text
137,1884,FIC,QueerStoriesBoys,A,B,C,"  show Sukey how curious they were. He showed her how curiously one kind of lichen grew upon another, omitting its own stalk and leaves, and making use of"
138,1921,FIC,GalushaMagnificent,A,B,C,"  "" I see, I see, "" he said. "" It is the lichen. "" This explanation was not as satisfying as he evidently meant it to be"
139,1930,NF,LandLion,A,B,C,"  just as it does in less-sheltered areas along the California coast. The "" sea lichen, "" Flustra lichenoides, occurs on shells, rocks, and worm tubes as"
140,2000,FIC,FantasySciFi,A,B,C,"  human or a lichen. And, of course, one couldn't be a lichen, because lichens were symbiots. Ugh, she thought, botanical humor. Better"
141,1997,FIC,FantasySciFi,A,B,C,"  stood Brook Cottage -- built of rusty brown ironstone, roofed in blue slate which lichen had yellowed. The only occupants were Janet Meadows, in her seventies, and"
142,1891,FIC,ColonelCarterCartersville,A,B,C,"  the yielding ground stood Chad pointing to a smooth blaze, stained and overgrown with lichen. It bore this mark, C in a diamond! "" It tallies to"
143,1827,FIC,BuccaneersARomance,A,B,C,  masses bore pieces of bark that had been peeled by the wind from off the lichen or the fir that waved on the stern and rocky sides of the stoney point
144,1998,MAG,FieldStream,A,B,C,"  heavy load back against the slope, letting myself down into a thick carpet of lichen. I sat for a long time, looking west across those lovely basins to"
145,1993,FIC,DirtyWork,A,B,C,"  Tessa climbed partway up the rock fall and searched shadowed cracks for the particular silver-blue lichen Dalka wanted. Its paracrinelike secretions were specific and rare, essential to Dalka's"
146,1876,FIC,WychHazel,A,B,C,"  eye, and nearer by the lesser charms of rock and tree, moss and lichen, light and shadow, played with each other in wildering combinations. But Rollo"
147,1984,FIC,StarsInMyPocket,A,B,C,"  the canyons that worm the polar plates of Zetzor (its equatorial regions clotted with lichen jungles, fused deserts, and fuming bismuth swamps that make the - wrs of Velm"
148,1848,NF,PersonalNarrative,A,B,C,  of greater extent. In herborizing near La Paz we found a great quantity of Lichen roccella on the basaltic rocks bathed by the waters of the sea. The archil
149,1922,NF,AfootInEngland,A,B,C,"  the browns and rust-reds of the minute aerial alga, mixed with the greys of lichen, these darker stainings extending upwards to a height of fifty or sixty feet,"
150,1895,FIC,Zeit-Geist,A,B,C,"  of bright green moss in which the trees still stood dead, but bark and lichen now adhered to their trunks, and a few more strokes brought her to the"
151,1905,MAG,Atlantic,A,B,C,"  the shore. things in the water assume the hues of the water, the lichen matches the rock and the trees, the shell matches the beach and the waves"
152,1922,NF,AfootInEngland,A,B,C,"  its walls and a deep dark red on its roof, clouded with grey of lichen. From Newbury and the green meadows of the Kennet the Hampshire hills may be"
153,1926,MAG,Atlantic,A,B,C,"  little difficult to decipher now, as the years have obscured the lettering with green lichen. The epitaph reads as follows:? This inscription was, I learned,"
154,1920,FIC,PoemsHenryVanDyke,A,B,C,"  which they fight! Here hangs a fortress on the distant steep, -- A lichen clinging to the rock. There sails a fleet upon the deep, -- A"
155,1989,NEWS,CSMonitor,A,B,C,"  them is the Atlaelv River, as big as the Yukon, in meadows of lichen, rock, and wild grass. // I knew then why I felt homesick."
156,1867,FIC,SayingsDrBushwhacker,A,B,C,"  , sir, what is the use of having Ruskin's meagre representation of a lichen covered, metallic stained boulder from an obscure corner of the globe, in our"
157,1858,MAG,Atlantic,A,B,C,"  fabulous animal with similar branching and leafy horns, -- a sort of fucus or lichen in bone, -- to be the inhabitant of such a forest as this!"
158,1937,NF,FoodsAmericaGave,A,B,C,"  on the dry gray lichen known as reindeermoss. One might reasonably suppose that this lichen, which in many places covers acres of ground with a thick car108 FOODS AMERICA"
159,2002,FIC,FantasySciFi,A,B,C,"  the case, which snapped shut on the stuff, along with a bit of lichen and soil. # I shook it; it rattled like a stone. #"
160,1901,MAG,Harpers,A,B,C,"  on fountains, porticoes, and grottoes. Below the terrace, where a chrome-colored lichen. had sheeted the balustrade as with fine laminar of gold, vineyards stooped to"
161,1988,FIC,CrownStars,A,B,C,"  everyone had been so convinced that there was no life on Mars above something like lichen that absolutely no instructions had been thought up for meeting large-scale sentient life, let"
162,1932,FIC,MartianCabal,A,B,C,"  here too nothing met his eye but the orange cliffs with their patches of gray lichen. There was no comfort to be had in that desolate landscape. Nevertheless,"
163,1996,FIC,ShockWave,A,B,C,"  Antarctica. It was a singularly ugly place, inhabited only by few varieties of lichen and a rookery of Adlie penguins. The majority of the dead, buried in"
164,2003,FIC,Fantasy & Science Fiction,A,B,C,"  is lichen. "" # He went over to look, and it looked like lichen to him too, worked into the seams of individual rocks that had broken away"
165,1840,FIC,AirsPalestineOther,A,B,C,"  ponderous stones, To have given root to the minutest plant. Not even a lichen or a moss has dared To fix itself and flourish on these dry And everlasting"
166,1864,FIC,PicketDutyOther,A,B,C,"  her motherly hand upon him, as she leaves it in a dry, pale lichen, on the bosom of the roughest stone. Dick "" hailed "" from Illinois"
167,1883,FIC,EssaysByRalphWaldo,A,B,C,"  the rock is formed, then before the rock is broken, and the first lichen race has disintegrated the thinnest external plate into soil, and opened the door for"
168,1902,MAG,Century,A,B,C,"  but which are now toned to rich golden brown, brightened with white patches of lichen, thin and lace-like. | This fine monument of the days of Justinian and Theodora"
169,2009,FIC,WhisperingRoom,A,B,C,"  with purple blooms. The air smelled of mimosa, moss and the wet green lichen that grew on the bark of the cypress trees lining the banks. # It"
170,1930,NF,Hey!Yellowbacks!,A,B,C,"  , "" said Meta as we stood below it on a boulder gray-green with ancient lichen. "" You can stay there till the madness passes. I can bring you"
171,1987,FIC,WorldAsIFoundIt,A,B,C,"  arbitrarily make my life in those nooks where W. is not, like the hardy lichen one sees here clinging to the mountain rocks. Well, at least it is"
172,1953,FIC,Harpers,A,B,C,"  they do bloom year in and year out. "" Lucy was cleaning away the lichen from the stone at the head of her mother's grave. "" Poor old"
173,1931,FIC,FinchsFortune,A,B,C,"  wall had a peculiar golden bloom on it except where there were patches of grayish lichen. Ivy lay thick along its top, and clumps of yellow stonecrop. The"
174,1856,FIC,CharlemontOrPride,A,B,C,"  here, dearest Margaret. The rock here is smooth and covered with the softest lichen. A perfect carpet of it is at our feet, and the brooklet makes"
175,1947,NF,MalabarFarm,A,B,C,"  their need and liking for moisture but none can wholly thrive, even to the lichen growing tightly against a granite boulder, unless some minute quantity of moisture and organic"
176,1939,MAG,Atlantic,A,B,C,"  there than we do or our fellow creatures. On icy peaks the sprawling crustose lichen clings where even a mountain goat would gasp and stumble. Roots, following a"
177,1868,FIC,Daisy,A,B,C,"  . I feasted on the rocks and wild verdure, the mosses and ferns and lichen, the scrub forest and tangled undergrowth, among which we plunged and scrambled;"
178,1867,FIC,CondensedNovels,A,B,C,"  its calm and evenly-flowing current, the shapes are strange and frightful: an eating lichen gnaws at the heart of each; not only the clergymen, but witch,"
179,1988,MAG,Harpers,A,B,C,  on one of the forest trails. Every tree trunk seems to be covered with lichen and termite tunnels. Lianas dangle down from above like a backstage rigging for this
180,2008,FIC,PaulDune,A,B,C,"  the large boulders, some of which had just begun to show a mottling of lichen. "" We should keep this place a secret, Usul. Leave no marker"
181,1873,NF,OldportDays,A,B,C,"  see occasionally, "" he adds, "" a man from whom the usnea (lichen) hangs as gracefully as from a spruce. "" Footpaths bring us nearer both"
182,2003,FIC,Fantasy & Science Fiction,A,B,C,"  the "" discovery "" is a hoax: 1 to 1 # Odds that Mars lichen descended from Earth species: 4 to 1 # Odds that Earth lichen descended from"
183,1977,FIC,DarkDesign,A,B,C,"  ladder until he was on a platform placed against an area of stone from which lichen had not yet been removed. He reported to a foreman, who gave him"
184,1917,FIC,AdventuresPiang,A,B,C,"  with its velvet touch. Great stalagmites and stalactites, smothered in the embrace of lichen and creepers, accepted the homage of the plant life indifferently. Piang was blind"
185,1909,MAG,NatGeog,A,B,C,"  and larger branches, while the finer twigs are festooned with long beards of gray lichen, which give to the trees an unspeakably dreary and funereal aspect. This first"
186,1852,NF,StrayLeavesFrom,A,B,C,"  with the temperature at 60 deg. below freezing-point, they were grazing on moss or lichen; this point placed beyond doubt the fact, which is now incontestable, that"
187,1913,FIC,MountainSpring,A,B,C,"  - - Revelation 22:17. I wandered down a mountain road, Past flower and rock and lichen gray, Alone with nature and her God Upon a flitting summer day. The"
188,2005,FIC,SouthernRev,A,B,C,  and beads swishing against my arm. She smelled like camphor and booze and the lichen in the alley she had bruised under her small shoes. # Two days later
189,1884,NF,NaturalLawInSpiritual,A,B,C,"  If a botanist be asked the difference between an oak, a palm-tree and a lichen, he will declare that they are separated from one another by the broadest line"
190,1996,MAG,NaturalHist,A,B,C,"  as fifteen feet above the land, the caribou are able to reach the old-man's-beard lichen that hangs from the higher branches of the black spruce trees. With such a"
191,1865,MAG,Atlantic,A,B,C,"  as if it had slowly grown from the soil and the climate, like a lichen that clings closely to its rocky site. The heavy, many - storied buildings"
192,1961,FIC,ClockWithoutHands,A,B,C,"  He paused to rub his beak, both sides, against a patch of green lichen. She came behind and sharpened her bill on the same patch. One after"
193,2006,FIC,FantasySciFi,A,B,C,"  . They are the autochthones of Gamza, a large but harmless quasi-sapient species of lichen grazers. Yet they are "" fundamental to the nuisance, "" or so Malabar"
194,1907,FIC,FootRainbow,A,B,C,"  wound slowly toward its end, stopping its leisurely course for bird, flower, lichen face, blue sky, perfumed wind, and the closest intimacies of the daily"
195,1947,NF,MalabarFarm,A,B,C,"  boulder, unless some minute quantity of moisture and organic material is present. The lichen, once established on a rock, proceeds rapidly to provide its own organic material"
196,2007,FIC,FantasySciFi,A,B,C,"  knowledge, which are capacious. "" "" The desires of lichen, even astounding lichen, are not our concern, "" I said. "" We can now report"
197,1993,FIC,Ploughshares,A,B,C,"  smell from young birches filled my lungs. Touching a vine here, bracken or lichen there, I tracked the killer mushrooms through the quiet wood. # I was"
198,1850,MAG,AmWhigRev,A,B,C,"  and the remaining Canadian. The frost was now so severe too, that the lichen could only be detached from the rocks to which it ad-. 1850. 585 // hered"
199,1993,MAG,NatlParks,A,B,C,"  , such as the tree frog, above, and nonvascular plants, such as lichen, left, have suffered over the years from lack of attention, but the"
200,1989,FIC,Eden,A,B,C,"  as though an enormous plow had gone through. Nothing grew here but a velvety lichen and moss. Hungry, tired, with only one flashlight, they decided to"
