entry,year,genre,source,a,b,c,text
14,1821,FIC,WanderingBoys,A,B,C,"  1st and 2d wings, under a spacious archway, an arbour, formed with lilac, honeysuckles, &c.; &c.; so disposed as in no way to intercept the vault"
527,1824,FIC,SketchConnecticut,A,B,C,"  with a blush of carmine. In the borders, the purple clusters of the lilac, mingled with the feathery orb of the snow-ball, and the pure petals of"
288,1832,MAG,NewEngMag,A,B,C,"  this singular dwelling of a warrior. The sweet-brier, the rose, and the lilac, though long neglected, still grew, and bloomed freshly and sweetly; and"
68,1834,FIC,Poems,A,B,C,"  true, While modest Clematis appeared as a bride, And her husband, the Lilac, ne'er moved from her side, Though the belles giggled loudly and vowed """
50,1835,FIC,Home,A,B,C,"  were taken to bring on the green gages for father. A woody, scrawny lilac was permitted to remain, because Grandmama had said, "" It looked so natural"
122,1835,FIC,South-WestByYankee,A,B,C,"  pale pink ground slightly tinged with purple. In appearance and fragrance it resembles the lilac, though the cluster of flowers is larger and more irregularly formed. These after"
479,1835,FIC,South-WestByYankee,A,B,C,"  , closing, and falling blossoms, with an almost equal mixture of white, lilac, and purple flowers; while each morning the ground is seen covered with the"
844,1835,FIC,TraitsAmerican,A,B,C,"  side of this, had formerly been a summer-house, as was apparent from the lilac and rose bushes, and other flowering shrubs, clustered together; all over-run,"
948,1835,FIC,South-WestByYankee,A,B,C,"  a front yard, pay little regard to horticulture. So in New-England, a lilac tree between the windows, a few rose bushes and indigenous plants lining the walk"
73,1839,FIC,AdventuresHarry,A,B,C,"  card tables, where they were playing for money. My fellow traveller in the lilac shirt was dealing out the cards at one of these tables, and after dealing"
151,1839,FIC,AdventuresHarry,A,B,C,"  son could dress in any other than the very genteelest clothes. He wore a lilac calico shirt, with a little ruffle bristling in the bosom, and a cameo"
674,1839,MAG,USDemRev,A,B,C,"  of the light graceful willow that waved around and over it, interspersed with the lilac and laburnum, fresh with the youth of spring, and opening to give the"
929,1839,FIC,AdventuresHarry,A,B,C,"  "" "" Salt is certainly a great thing, "" said the gentleman with the lilac shirt, who sat opposite, and who had been listening, with his knife"
254,1841,NF,Book ATreatise,A,B,C,"  years planted, it commences yielding its blossoms in panicled clusters. These are bluish lilac, of an open mouthed, tubular form, are very abundantly distributed, and"
562,1841,FIC,Essays —FirstSeries,A,B,C,"  gleaming piles of stone; On the city's paved street Plant gardens lined with lilac sweet, Let spouting fountains cool the air, Singing in the sun-baked square."
239,1843,FIC,IdomenValeYumuri,A,B,C,"  to seek me, I gave him the verses tied with riband of pea-green and lilac -- colours most predominant in the dolphin while dying, in agony to himself,"
89,1844,NF,RoseManualContaining,A,B,C,"  growth, and very distinct. Emmeline is of a delicate flesh colour fading to lilac, and quite double. Fulgens, or Mai I on, of the French"
202,1844,NF,RoseManualContaining,A,B,C,"  will produce, no doubt, many fine varieties. Camaieu is a pretty rosy lilac, distinctly striped with blush white, perfectly double, always opening well. Font"
257,1844,NF,RoseManualContaining,A,B,C,"  "" Chloris has flowers of the medium size, double, of a distinct rosy lilac colour, and is a very fine dwarf /z/ variety. Comtesse Orloff is a"
289,1844,NF,RoseManualContaining,A,B,C,"  continues very distinct from any others; the flowers are perfectly formed, of a lilac colour, and though under the medium size, make up for the deficiency by"
390,1844,NF,RoseManualContaining,A,B,C,"  grower. La Tourterelle Parni, or the Dove Rose, is of a dark lilac colour, perfect cupped form, a large and early flower, grows freely,"
448,1844,NF,RoseManualContaining,A,B,C,"  bright rose colour and a dwarf grower. Due de Cases is a large rosy lilac changing to purple, very double, of a strong habit. D' flndigne"
582,1844,NF,RoseManualContaining,A,B,C,"  delicate rose colour, medium size, and fully double. Ceres is a rosy lilac, perfectly double, but does not open well in the early part of the"
766,1844,NF,RoseManualContaining,A,B,C,"  our climate well; the flowers are large and very double, of a rosy lilac colour, and frequently rose edged with lilac. Pompon, or Moss de Meaux"
776,1844,NF,RoseManualContaining,A,B,C,"  and very double, of a rosy lilac colour, and frequently rose edged with lilac. Pompon, or Moss de Meaux, is very small, and is the"
783,1844,NF,RoseManualContaining,A,B,C,"  for hybridizing with other sorts. Chatelaine and Lanzezure appear to be one; shaded lilac, crimson, purple, and often very bright red, varying very much according"
919,1844,NF,RoseManualContaining,A,B,C,"  Mathilde de Mondeville is one of the sweetest of roses, of a delicate rosy lilac fading to blush, and blooms profusely. Painted Damask, in some soils may"
374,1845,FIC,ForestLeaves,A,B,C,"  always there. In front, quite to the water's edge Grew rose and lilac bowers, And gardens lay on either side, Enrich'd with choicest flowers."
494,1845,FIC,FleetwoodTheStain,A,B,C,"  and Adelaide, dressed in a robe entirely white, with slippers of a delicate lilac hue, sat in a half recumbent posture, tapping an ivory paper folder against"
137,1846,FIC,FactFictionACollection,A,B,C,"  bread and milk. The cross-lights from side-window threw on them a reflection of the lilac ushes, so that they seemed seated in a flowering grove. It was the"
501,1846,FIC,ElinorWyllysVolume1,A,B,C,"  look if we can't procure the boned turkey. "" The lady in the lilac muslin agreed that when everything else was so genteel, it would be unfortunate indeed"
870,1846,FIC,LovesToken-flowers,A,B,C,"  martyr crown. Embury, Emma C. (Emma Catherine), 1806-1863: PURPLE LILAC. -- Syringa. First emotions of love. from Love's token-flowers (1846"
921,1846,FIC,ElinorWyllysVolume1,A,B,C,"  "" Mrs. Tibbs, a pretty little woman with light hair, wearing a fashionable lilac muslin, assented, of course. "" Taking for granted then, that we"
889,1847,FIC,MadmenAll,A,B,C,"  her silks and satins, of certain prize porkers I have seen, enveloped in lilac gauze. But who is yon inquisitive-looking being, with a nose that looks as"
139,1848,NF,PracticalTreatise,A,B,C,"  his garden, as early as 1811. It is represented to be near a lilac color. From Mr. William Leonard, of the Shaker Society, I received two"
569,1849,NF,HistoryPractice,A,B,C,"  solution, dried, and again exposed to sunshine, a positive picture of a lilac color will be produced by a few minutes exposure. Several other of the chromates"
895,1849,NF,HistoryPractice,A,B,C,"  , or aqueous chlorine, do not appear to increase the darkening power beyond the lilac to which the pure chloride of silver changes by exposure. This difference of color"
425,1850,NF,AmericanFruitCulturist,A,B,C,"  apples or thorns, and not at all upon plums or cherries; while the lilac will take on the ash, and the olive on the phillyrea, because they"
961,1850,NF,AmericanFruitCulturist,A,B,C,"  he has succeeded, notwithstanding the great difference in their vegetation, to work the lilac on the phillyrea, the olive on the ash, and the Bignonia radicans on"
130,1851,NF,FlowerGardenBrecks,A,B,C,"  a rich soil. /z/ Lilac. In addition to the varieties and species of Lilac noticed in the former edition, there are a number of others that are desirable"
136,1851,NF,FlowerGardenBrecks,A,B,C,"  of others that are desirable in a large collection. The variety of the common Lilac with double flowers is very curious, but not so handsome as the single."
178,1851,NF,FlowerGardenBrecks,A,B,C,"  a very graceful appearance. The white and purple, both beautiful; the Cut-leaved Lilac has interesting and delicate foliage. "" The Persian Lilac grows about four or five"
213,1851,NF,FlowerGardenBrecks,A,B,C,"  both beautiful; the Cut-leaved Lilac has interesting and delicate foliage. "" The Persian Lilac grows about four or five feet high. All the species bloom the last of"
225,1851,NF,FlowerGardenBrecks,A,B,C,"  of our most valuable and ornamental shrubs of the season. S. Persica. Persian Lilac. This species is "" far more delicate arid pretty than the common Lilacs,"
226,1851,NF,FlowerGardenBrecks,A,B,C,"  almost black; others a dark puce purple, and various shades, down to lilac; they are produced in heads. /z/ Schizanthus, from Greek words to cut"
300,1851,NF,FlowerGardenBrecks,A,B,C,"  many improved varieties of this species, viz. white, purple, large pink, lilac with a red eye, &c.; /z/ Phlox stolonifera. Creeping. The plant pats"
309,1851,NF,FlowerGardenBrecks,A,B,C,"  , resembling the Gloxinia, thick-set on spikes, and are of a delicate rosy lilac, blotched and shaded with bright crimson, with an agreeable odor. The foliage"
344,1851,NF,FlowerGardenBrecks,A,B,C,"  with longer and more open spikes of flowers, a little darker than the common lilac, and the whole plant more graceful in its habits. /z/ The Siberian LUac"
373,1851,NF,FlowerGardenBrecks,A,B,C,"  Large white flowers, with light-purple eyu. Madame Lierval. White, with delicate lilac eye, (fine). Rosa supcrba. Dwarf, fine clear rose."
378,1851,NF,FlowerGardenBrecks,A,B,C,"  fresh; And then there is some variety about it. In spring, the Lilac and the Snowball flower, And the Laburnum, with its golden strings Waving in"
392,1851,NF,FlowerGardenBrecks,A,B,C,"  with double flowers is very curious, but not so handsome as the single. Lilac Lady Joseki is a handsome species, flowering nearly a month later than the other"
428,1851,NF,FlowerGardenBrecks,A,B,C,"  the word is to be found in sirinx, its native name in Barbary. Lilac is a Persian word, signifying a flower. All the species are most beautiful"
541,1851,NF,FlowerGardenBrecks,A,B,C,"  its varieties, are magnificent plants, with flowers of various shades of red, lilac, light purple and white, measuring from four to eight inches in diameter,"
555,1851,FIC,EveningsAtDonaldson,A,B,C,"  a garden, whose roses and honey-suckles perfume the air, while its bowers of lilac and laburnum, of myrtle and jessamine, almost shut from the view the pretty"
585,1851,NF,FlowerGardenBrecks,A,B,C,"  , excepting yellow and blue. Some varieties are of a bluish-purple, ruby-purple, lilac and /z/ dark-purple, rose, scarlet, crimson, white, white with red"
590,1851,NF,FlowerGardenBrecks,A,B,C,"  . A bed of the double varieties, consisting of white, pearl color, lilac, pink, light and dark purple, is equal in beauty to a bed"
636,1851,NF,FlowerGardenBrecks,A,B,C,"  , flat-petalled, &c.,; with every shade of light purple, yellow, white, lilac, blush brown, red brown, &c.; For common culture, divide the roots"
699,1851,NF,FlowerGardenBrecks,A,B,C,"  , more desirable than either of these varieties. They prove as hardy as the Lilac, flower in great profusion, handsome, and sweet-scented. /z/ W. Sinensis alba."
709,1851,NF,FlowerGardenBrecks,A,B,C,"  to scarlet; shades from rose to crimson, from crimson to light purple, lilac, &c.; The flowers are handsome when it first commences the process of blooming;"
736,1851,NF,FlowerGardenBrecks,A,B,C,"  , readily propagated by suckers, which they throw up in abundance. The common Lilac seems to have been introduced before or during the reigp /z/ of Henry VIII."
759,1851,NF,FlowerGardenBrecks,A,B,C,"  trailing stems, bearing clusters of elegant flowers in dense umbels; color, delicate lilac, with white centre, highly and deliciously fragrant. The seeds are enclosed in"
777,1851,NF,FlowerGardenBrecks,A,B,C,"  , it makes a good plant for the flower-garden. S. leucantha has violet-purple and lilac flowers; is a fine bedding plant. S. fulgens, with crimson-scarlet, S."
794,1851,NF,FlowerGardenBrecks,A,B,C,"  also, by taking the suckers, which it throws up as freely as the Lilac. It will flourish without much difficulty. /z/ Sumach. Rhus, derived from"
826,1851,NF,FlowerGardenBrecks,A,B,C,"  It is a fine plant for growing in masses. When the fine, rosy lilac flowers of this very beautiful plant are fully expanded, being produced in vast profusion"
837,1851,NF,FlowerGardenBrecks,A,B,C,"  deep-red eye; rather delicate in its habits. Phlox Egyptie7ine. This has light lilac flowers shaded with purple, about one and a half foot high, in June"
890,1851,NF,FlowerGardenBrecks,A,B,C,"  Both these species thrive in the shade and under the droppings of trees. /z/ Lilac. "" Various in array, now white, Now sanguine, and her beauteous"
42,1852,FIC,UncleTomsCabin,A,B,C,"  , not a particle of litter in the turfy yard, with its clumps of lilac bushes growing up under the windows. Within, he will remember wide, clean"
121,1852,FIC,DollarsCents,A,B,C,"  their clusters lose somewhat of their first pink, and take more of the true lilac colour as the buds open: then they are all lilac -- or white,"
376,1852,FIC,TwoAltarsTwoPictures,A,B,C,"  snow blushed crimson red on their tops, and lay in shades of purple and lilac in the hollows; and the old wintry wind brushed shrewdly along the plain,"
993,1852,FIC,DollarsCents,A,B,C,"  more of the true lilac colour as the buds open: then they are all lilac -- or white, -- then touched with brown; and then among the things"
133,1853,FIC,MidnightQueenLeaves,A,B,C,"  for a grand explosion! "" But judge of my surprise when, entering the lilac room -- a neat little apartment, the walls covered with blue-colored paper, warmed"
180,1853,NF,AmericanHandBook,A,B,C,"  prepared, may be obtained of the dealers, and include Carmine, White, Lilac, Sky Blue, Pink, Yellow, Flesh color, Orange, Brown,"
281,1853,FIC,ClovernookRecollections,A,B,C,"  across it. It had once been adorned with a common rose bush and a lilac, but as they stood now, untrimmed and sprawling, with muddy leaves,"
318,1853,FIC,ClovernookRecollections,A,B,C,"  And the old homestead looked sad. The little brown-bird that had built in the lilac bush, summer after summer, for successive years, twittered and chirped in melancholy"
359,1853,FIC,ClovernookRecollections,A,B,C,"  the flower-beds, I stopped to rest in the faint shadow of the newly budding lilac. A scrap of newspaper held my flowerseeds; I emptied them in my lap"
707,1853,FIC,MidnightQueenLeaves,A,B,C,"  near eleven o'clock when the servant came to announce that breakfast was ready in the lilac room. As I descended to the breakfast room, I prepared myself to face"
874,1853,FIC,ClovernookRecollections,A,B,C,"  trellised summer-houses stood pitching down the hill, and here and there a rose-bush or lilac lopped aside devoid of beauty, except the silver seives woven amongst them by the"
939,1853,FIC,ClovernookRecollections,A,B,C,"  daffodils coming through the grass, for I had seen a blue-bird twittering in the lilac and picking its feathers that morning. "" How d' you do? """
62,1854,NF,SunnyMemoriesForeign,A,B,C,"  of a purplish green; the next of a vivid purple; the next, lilac; while far in the fading view the crystal summits and glaciers of the Oberland"
66,1854,FIC,Walden,A,B,C,"  edifying as the history of more famous schools of philosophy. Still grows the vivacious lilac a generation after the door and lintel and the sill are gone, unfolding its"
368,1854,FIC,Walden,A,B,C,"  as in that first spring. I mark its still tender, civil, cheerful lilac colors. But this small village, germ of something more, why did it"
424,1854,FIC,LifeSayingsMrs,A,B,C,"  build their nests, thinking it was spring, so mild was it; the lilac buds almost "" bursted "" in their anxiety to notice the occasion; and old"
460,1854,NF,SunnyMemoriesForeign,A,B,C,"  of the glaciers, and the hollows between the peaks, reflected wavering tints of lilac and purple. The effect was solemn and spiritual above every thing I have ever"
644,1854,NF,SunnyMemoriesForeign,A,B,C,"  decided cloud-like purple; and in the next still the purple tint changes to rosy lilac; while above all, like another world up in the sky, mingling its"
649,1854,FIC,Walden,A,B,C,"  family. Once more, on the left, where are seen the well and lilac bushes by the wall, in the now open field, lived Nutting and Le"
108,1855,FIC,NestInHoneysuckles,A,B,C,"  only neighbour of the robin. A pair of cat-birds have a nest in a lilac near the honeysuckle, and one of them sings hour after hour on the walnut-tree"
189,1855,NF,EightYearsWanderings,A,B,C,"  unknown in English collections. It blossoms in April; the flowers are a bright lilac, and I could lay my band upon it at any time, as I"
322,1855,FIC,WinklesTheMerry,A,B,C,"  barked fiercely; and the next moment Mr. Ralph Roland emerged from a cluster of lilac bushes near the pavilion. "" Be quiet, Dew, "" said he."
496,1855,FIC,NestInHoneysuckles,A,B,C,"  through the open casement. These birds have lived for several summers in that same lilac, and annually make all the repairs necessary to render their dwelling habitable. They"
658,1856,FIC,CharlemontOrPride,A,B,C,"  white cravat. For this he substituted a handkerchief which had the prettiest sprig of lilac, on a ground of the most delicato lemon color. He consulted complexions,"
222,1857,MAG,NorthAmRev,A,B,C,"  a handful of locust-blossoms as a handful of orange-blossoms, and the flowers of the lilac are as rare in our cities as flowers of the pomegranate. Where in New"
331,1857,FIC,MabelVaughan,A,B,C,"  "" Make haste, Mabel. O child, I wish you had on your lilac dress! It's the So and So's; do hurry down, they"
656,1857,MAG,NorthAmRev,A,B,C,"  and the gaudy blossoms of autumn nodded their plumes of purple, yellow, and lilac over the tops of the walls. Often in the heart of a mowing field"
687,1857,FIC,MabelVaughan,A,B,C,"  beyond recall. The softness of the summer air, the sight of Rosy's lilac branch, the well-known perfume of its flowers, -- all serve to awaken within"
750,1857,FIC,MabelVaughan,A,B,C,"  person of the fair mistress of the establishment, who, attired in a simple lilac print (none the less becoming to her faultless figure because her own hands had"
771,1857,FIC,MabelVaughan,A,B,C,"  which shone in the young teamster's face, no less than the sprig of lilac which occasionally adorned his hat, proved that he had been engaged in more cheering"
864,1857,FIC,MabelVaughan,A,B,C,"  her satisfaction, the ruddy, laughing teamster gaily lifted his hat, removed the lilac branch from its crown, and flung the cluster of purple flowers into the lap"
941,1857,FIC,MabelVaughan,A,B,C,"  the door, the old stone step, worn smooth by childish feet, the lilac bushes which graced it on either side, and the robins which yearly built their"
942,1857,FIC,SongsSummer,A,B,C,"  Creeps upon the tufted carpet in a diamond slab of panes, Sleeps amid the lilac shadows waving on the dreamy walls, Still my soul with you remains! Bends"
773,1858,FIC,LucyHowardsJournal,A,B,C,"  the pavements, and in sheltered places of the fields. The leaves of the lilac are already "" larger than a mouse's ear, "" to borrow the comparison"
786,1858,MAG,Harpers,A,B,C,"  chain, supported by small granite obelisks, and c*crtained with shrubs of seringo, lilac, and rose. In the branches of the Inaples the birds, lately so"
866,1860,FIC,LeavesGrass1860-61,A,B,C,"  I hit upon a name -- tossing toward whoever is near me, Here! lilac, with a branch of pine, Here, out of my pocket, some"
312,1861,NF,BookHouseholdManagement,A,B,C,  colours which go best together are green with violet; gold-colour with dark crimson or lilac; pale blue with scarlet; pink with black or white; and gray with
679,1863,FIC,FaithGartneysGirlhood,A,B,C,"  pleasant, unpretentious words of welcome. Squire Leatherbee's daughters made themselves fine in lilac silks and green Estella shawls, to offer acquaintance to the new "" city people"
725,1863,FIC,HannahThurston,A,B,C,"  by the evening stage, and the Misses Smith, having recently supplied themselves with lilac dresses, which, as a half-mourning color, would not be inappropriate, resolved"
849,1863,FIC,HannahThurston,A,B,C,"  . The place was really unchanged, to all appearance. Perhaps the clumps of lilac and snowball, along the northern wall were somewhat higher, and the apple-trees in"
272,1866,FIC,LucyArlyn,A,B,C,"  jealous pangs; for, when the wild youth shook the boughs of the rustling lilac under Lucy's window, a beautiful head with curls stole out of the shadows"
539,1866,FIC,StoryKennett,A,B,C,"  demonstrative community, would have been a cheer. Somebody had arranged a wreath of lilac and snowy viburnum, and fastened it around Roger's forehead; and he seemed"
561,1866,FIC,StoryKennett,A,B,C,"  and there were already brown tufts, which would soon be blossoms, on the lilac twigs. Suddenly Miss Betsy lifted up her head and exclaimed, "" Well,"
588,1866,MAG,Atlantic,A,B,C,"  . Atril 26. - Here is another misty day, muffling the sun. The lilac shrubs under my study-window are almost in leaf. In two or three days more"
718,1866,FIC,GoodCompanyEvery,A,B,C,"  all. "" I did not mean what I said; I don't think lilac too old or green too young: and I think the mixture very becoming to"
878,1866,FIC,GoodCompanyEvery,A,B,C,"  were running down that cap like anything. You said, you know, that lilac was too old a color for me; and green too young; and that"
954,1866,FIC,StoryKennett,A,B,C,"  buds, and May came clothed completely in pale green, with a wreath of lilac and hawthorn bloom on her brow. For twenty years no such perfect spring had"
535,1867,FIC,ManWithTheBroken,A,B,C,"  home; let me have the will of that good old gentleman who wore the lilac wig. Give me some books on history, too -- a big pile of them -- all that"
628,1867,FIC,HiddenHand,A,B,C,"  wooden gate, pass up the moldering paved walk, between the old, leafless lilac bushes, and pass through the front door right into a large, clean but"
946,1867,NF,OurCommonInsects,A,B,C,"  in its rich dress of velvety black and red. Later still, when the lilac blooms, and farther south the broad-leaved Kalmia, the gaily-colored Humming Bird moth ("
229,1869,FIC,JanetsLoveService,A,B,C,"  itself. Before the house was a large grassy yard, having many rose-bushes and lilac trees scattered along the fences and the path that led to the door. There"
416,1869,FIC,OldtownFolks,A,B,C,"  , through a prairie-land of wild-flowers. The whole tribe of asters -- white, lilac, pale blue, and royal purple -- were rolling in perfect billows of blossoms"
484,1869,FIC,SteppingHeavenward,A,B,C,"  attached to it in haphazard fashion. In the front yard were overgrown clusters of lilac and rose bushes and, behind the barn, was the stubble of a departed"
669,1869,FIC,OldtownFolks,A,B,C,"  spotless snow, glowing with the rosy radiance, and fading away in purple and lilac shadows; and the evening stars began to twinkle, one after another, keen"
449,1870,FIC,Last,A,B,C,"  flowers ventured into later and healthier bloom, and a robin, swinging upon the lilac spray nearest Rosa's window, sang blithe greeting to the reinstated spring. Rosa"
524,1870,FIC,ShadowMolochMountain,A,B,C,"  to the vanity of the laborious artist. "" There's a piece of your lilac calico, "" and "" Where did you get that rosy piece? "" or"
899,1870,FIC,UnderLilacs,A,B,C,"  in the middle of the door. A sprig of white and one of purple lilac nodded over her, a dress of yellow calico, richly trimmed with red-flannel scallops"
944,1870,FIC,UnderLilacs,A,B,C,"  heartily. "" Ten years ago I came here a little girl, and made lilac chains under these very bushes, and picked chickweed over there for my bird,"
966,1870,FIC,ShadowMolochMountain,A,B,C,"  of the house; its unhewn "" door-rock "" and primitive elmshaded well; its lilac and syringa bushes, and the fine, short turf crowding close to the low"
314,1871,FIC,AdmetusOtherPoems,A,B,C,"  still, Under the pulsing, stirring, glowing earth; Not rising with the lilac on the hill, Not waking with the sunny daffodil, Living and breathing with"
515,1871,FIC,PinkWhiteTyranny,A,B,C,"  does. Every thing becomes her. Sometimes it' s rose color, or lilac, or pale blue, -- just the most trying things to others are what"
346,1872,FIC,BeautyBeastTales,A,B,C,"  from the meadow. She carried a bunch of flowers, with delicate blue and lilac bells, and asked him the name. "" Them's Brandywine cowslips, """
544,1872,FIC,BeautyBeastTales,A,B,C,"  hollow just below it, the walled garden, with its clumps of box and lilac, and the vast barn on the left, all joining in expressing a silent"
761,1872,FIC,BeautyBeastTales,A,B,C,"  the ten thousand serfs, clothed in loose white trousers and shirts of pink or lilac silk; their soft golden hair, parted in the middle, fell upon their"
934,1872,FIC,Round-aboutRambles,A,B,C,"  Every color is here, rich green, royal purple, red, yellow, lilac, brown, and gray. The vines, which overrun everything, are filled"
61,1873,FIC,OldStoneHouse,A,B,C,"  , lady-slippers, tiger-lilies, flower-de-luce, hollyhocks, and pinks, besides bushes of lilac and matrimony; then we have old cedars clipped into shape, and ever so"
468,1873,FIC,HerMajestyQueen,A,B,C,"  -- Baltimore Gazette. "" In the longest of these stories, A Branch of Lilac,' the simplicity of the narrative -- so direct and truthful -- produces the"
