entry,year,genre,source,a,b,c,text
619,1948,FIC,RemembranceRock,A,B,C,"  and moved over a little toward me on the swing. She had on some lilac talcumpowder, I think. I used to belong to a high school fraternity at"
992,1948,FIC,RemembranceRock,A,B,C,"  no rain. Robert left the road, ran across back fields to where among lilac bushes in a lot back between the blacksmith shop and the Jonathan Harrington house,"
170,1949,FIC,Harpers,A,B,C,"  them: up the stairs, down, out and through, spring sweet and lilac shadows in the air and the creaking of a porch-swing; all gone, she"
324,1949,NF,ClothingModerns,A,B,C,"  healthier and accents your best features. Even though a color such as pink or lilac in a dress is most flattering to you, it may not be practical to"
351,1949,MAG,Harpers,A,B,C,"  the night. But he was also modern in the most pitiful way. His lilac eyelids were heavy, his pale full mouth was heavy, his large head itself"
481,1949,FIC,Ruth,A,B,C,  fertile and fruitful garden. There were snowy-blossoming orchards of pear and plum and the lilac clouds of almond trees and silver-green groves of twisted old olives. There were well-pruned
532,1949,FIC,Harpers,A,B,C,"  by thin poles, the stone spring-houses covered with creepers, the pink mimosa and lilac and myrtle in the yards. They struck a responsive chord in the memory as"
667,1949,NF,ClothingModerns,A,B,C,"  expensive or smaller articles in other gay or unusual colors. If the pink or lilac is becoming but too pretty or theatrical, use it for negligees. Study fashion"
668,1949,MAG,Time,A,B,C,"  for 1,500 once desperate, now hopeful people. Bicycles were stacked up against a lilac tree in the village; cars from every Dutch province thronged the narrow main road"
781,1949,NF,ClothingModerns,A,B,C,"  jersey skirt, mauve crepe blouse, violet leather belt. Black velveteen pants, lilac rayon jersey shirt, jade satin cummerbund. Black jersey blouse, mustard tweed skirt"
157,1950,MAG,Time,A,B,C,"  abstractionism to souped-up realism. Basket Bouquet, an impeccable and wholly uninspiring arrangement of lilac smudges by Cape Cod Abstractionist Karl Knaths, took first prize. It looked rather"
873,1950,FIC,Play:LittleBlueLight,A,B,C,"  which China roses are blooming, shuts the garden in from the street. High lilac bushes close in the back of the stage. In the middle of the lawn"
915,1950,FIC,Town,A,B,C,"  wholep 275city hardly a tree could her eyes find. She knew it had some lilac, apple and peach trees tucked away here and yonder in side and back yards"
280,1951,FIC,CruelSea,A,B,C,  her fingers tightened about the key in her pocket. She stopped behind a French lilac bush. The house was dark. No light anywhere. She moved along the
567,1951,FIC,NeverLookBack,A,B,C,  She sat on the wide window ledge and looked down. The heavy clumps of lilac and azalea shrubs had taken on soft shades of green. The sun lay in
760,1951,MAG,Nation,A,B,C,"  say nothing of "" Facsimile "" and "" The Cage "" In Tudor's "" Lilac Garden, "" in which Kaye and Laing danced their old roles very well,"
863,1951,FIC,Mov:SealedCargo,A,B,C,"  had changed. (looks at Margaret) Well, not entirely. Remember the lilac bush you planted, Migs?   MARGARET (matter-of-factly) No. -- 53 --"
885,1951,FIC,ProudNewFlags,A,B,C,"  the older woman and kiss a very soft and withered cheek that smelt faintly of lilac water. "" Dear Mother Seymour, please don't look so unhappy. I"
510,1952,FIC,CatherineWheel,A,B,C,"  into bloom. She moved in a nebula of this and of dove-gray chiffon or lilac lawn, regarding the works of Robert Browning and the Roman poets through a shell"
586,1952,FIC,CatherineWheel,A,B,C,"  , drinking tea on a steamer crossing Loch Katrine, strolling through the Arboretum on Lilac Sunday. In one of them, the two girls sat on the lawn at"
689,1952,FIC,CatherineWheel,A,B,C,"  legal pen, sentencing the prisoner to death. "" I sent thee late a lilac wreath, Not so much honoring thee, As giving it a hope, that"
813,1952,FIC,CatherineWheel,A,B,C,"  picket fence, a square of lawn or a spring garden, a pair of lilac bushes, this road was as familiar to him as his own face and so"
104,1953,MAG,NewRepublic,A,B,C,"  ? Poets in older modes might have coveted such dramatic properties for the occasion as lilac and star and bird. (Hardy might have said of the dead man,"
126,1953,NF,PlantFormFunction,A,B,C,"  The much greater rapidity of transpiration from the lower surface of many leaves (e.g. Lilac) can be shown by this method, as well as in the following way"
266,1953,FIC,LordVanity,A,B,C,"  sometimes I confuse them. I believe this one is the Royal Order of the Lilac. It was conferred on me by the Shah of Persia in Baghdad, if"
388,1953,MAG,NewRepublic,A,B,C,"  , mourned wherever it passes through the teeming American scene. The key-symbols are the lilac which stands for the new birth in the spring of the year, the drooping"
700,1953,FIC,Good-for-Nothing,A,B,C,  . What we want is to keep the fair Potter name as sweet as mountain lilac. She married you because she needed a front. She needs it worse than
810,1953,FIC,ChildrenAreBored,A,B,C,"  to change color. Another of the elders, a spry old dandy in a lilac turban, flung up his hands. He expostulated with the meek, hesitant sayyid"
852,1953,FIC,GoldenApplesSun,A,B,C,  with only a scattering of yellow star points. Around the bottom of the old lilac clump the suckers had spread into a waste thicket. Mrs. Richardson was a long
13,1954,MAG,Time,A,B,C,"  $27.50 (wage of average Russian: $175 a month). At an opulent lilac negligee lined with white silk and with a white ruffed collar, said Salisbury,"
464,1954,NF,GoodTasteInHome,A,B,C,"  bright magenta, Chinese pink and caustic blue, mustard and black. Fawn, lilac, light blues, cream, terra cotta, buff, and rose arc also"
77,1955,FIC,QuicksilverPool,A,B,C,"  scene, with a stiff little girl in flounced skirts daintily sniffing a spray of lilac. | "" There! This is the one Aunt Morgan did when she was"
232,1955,FIC,TenNorthFrederick,A,B,C,"  Not like Janice Gray -- "" "" Fresh, sweet, blue-eyed, a sprig of lilac in the morning sun. Darling, shouldn't bait you, but I ca"
475,1955,FIC,MissMorissaDoctor,A,B,C,"  , and also a large plot of herbs. Then the boy arranged the young lilac sprouts in a trench from which they might grow into a wall of spring purple"
516,1955,FIC,FaithfulAreWounds,A,B,C,"  , helped to bring in the dawn, and the room was already suffused with lilac gray, when several industrioustoilets went to work, one after the other, and"
587,1955,FIC,FaithfulAreWounds,A,B,C,"  overlapping dark firs, interrupted in places by pale puffs of aspen; pink and lilac formations, Pharaonic, phallic, "" too prehistoric for words "" (blase Lo"
672,1955,FIC,FaithfulAreWounds,A,B,C,"  southern deserts where we wintered; reached the Pacific, turned north through the pale lilac fluff of flowering shrubs along forest roads; almost reached the Canadian border; and"
838,1955,FIC,NoTimeForSergeants,A,B,C,"  picture framed in black: a fat yellow bird perched upon a sagging spray of lilac. "" My mother's sister, Lucy, executed that work while in a"
214,1956,NF,StoryAmericanLetters,A,B,C,"  describes the web of solemn harmony which Whitman weaves about his three motifs, the lilac, the star, and the bird. Without making his pattern of thought too"
415,1956,MAG,Time,A,B,C,"  down the driveway, rammed a truck, jumped the curb, mowed down a lilac bush and crashed into the bedroom of the house next door. # # Raw"
5,1957,FIC,OldManBoy,A,B,C,  would bust the machine that takes it. Your heart is so loud it sounds lilac? pile driver. There is something in your throat about the sir.c of a
206,1957,FIC,Line,A,B,C,"  , or to have his big fat rump slapped because it stuck out from the lilac bush. Now, for the first time, he was desperate not to be"
240,1957,FIC,WapshotChronicle,A,B,C,  and the hired hand -- Bentley -- had been getting her into shape. The lilac was in bloom and in St. Botolphs there were hedges of lilac -- there were
267,1957,FIC,WapshotChronicle,A,B,C,  carryinglilac branches to school. Early on the morning of the thirtieth he cut some lilac himself and took it to the cemetery and then he went down to the Topaze
268,1957,FIC,WapshotChronicle,A,B,C,"  the early mornings Leander saw that the children walking to school all carried branches of lilac. He wondered if they gave it to their teachers, who must have lilac"
572,1957,FIC,WapshotChronicle,A,B,C,  to the wharf and they took on some passengers including an old lady with some lilac branches wrapped in a newspaper. The sky and the river were blue and it
621,1957,FIC,WapshotChronicle,A,B,C,  shape. The lilac was in bloom and in St. Botolphs there were hedges of lilac -- there were whole groves and forests of it blooming the length of River Street
817,1957,FIC,WapshotChronicle,A,B,C,"  lilac. He wondered if they gave it to their teachers, who must have lilac trees themselves, or used it to decorate the classrooms. All that week he"
383,1958,FIC,Maggie-Now,A,B,C,"  she began asking her mother soon after Easter. "" You'll know by the lilac bush in Father Flynn's yard. Lilacs always bloom for Decoration Day. """
459,1958,FIC,SummerPlace,A,B,C,"  is it? "" John asked. His mother's perfume pervaded the room, lilac, and the scent of talcum powder. On Sylvia's mirrored dressing table was"
647,1958,FIC,DaughterEve,A,B,C,"  held my hand toward the sheriff's door. "" Shall we retire to the lilac room and carry on? I'll rally shortly. "" "" You first,"
660,1958,FIC,SummerPlace,A,B,C,"  's what the skipper of the destroyer said, Bart told his son beneath the lilac trees; "" well done, and good luck. "" And Bart kept repeating"
834,1958,FIC,AnatomyMurder,A,B,C,"  held my hand toward the sheriff's door. "" Shall we retire to the lilac room and carry on? I'll rally shortly. "" "" You first,"
249,1959,FIC,Mansion,A,B,C,"  , "" George Dudley said. ALEXANDRA SAT in front of the mirror in the Lilac Room, the quarters which she shared with Sharon on the second floor of the"
283,1959,FIC,Harpers,A,B,C,"  often walked at noon. A huge myrtle tree spread at its center, exhaling lilac color and soft bitter scent into the air. The forms of the mausoleums belonging"
338,1959,FIC,WalkWithPeril,A,B,C,  ; being quiet to keep his bells from telling of his presence. Behind the lilac bushes a jangle of voices shouted of triumph. Then a shadow fell over him
421,1959,FIC,WalkWithPeril,A,B,C,"  far side of the yard at the top of the steps, backed by thick lilac bushes, behind which was the stableyard for the lads who lived there. Under"
865,1959,FIC,EmpireCity,A,B,C,"  to castrate, the mine outside the home port, the sniper camouflaged as a lilac bush, the birthday telegram that proves to be a message of death. These"
886,1959,FIC,Mansion,A,B,C,"  the receiving line, she led the way out of the room. 6 OUTSIDE the Lilac Room a mild circle of light splashed downward. It came from a gas jet"
951,1959,FIC,WalkWithPeril,A,B,C,  him. The sounds in the garden seemed to swell. The stableboys behind the lilac bushes were pushing one another about and gossiping. Wat's voice rose above them
438,1960,FIC,Harpers,A,B,C,  -- and that the Queen even had a fox boa dyed to match her pale lilac gown. My ambassadresses stuck it out for a few minutes longer in their fragile
724,1960,FIC,ConstantImage,A,B,C,"  with flowers, the pale roses that he always sent, sprays of lovely white lilac from Holland, a faience tub in the corner with a tall plant of mimosa"
739,1960,FIC,SouthAngels,A,B,C,"  summer wool was the first indicationof her intentions. She was also scented with White Lilac, and shampooed with Golden Glint -- and whatever the effect on Lute might prove"
17,1961,NF,ColoringFinishing,A,B,C,"  red, and scarlet. 12. Gold with lilac, or blue-violet. 13. Lilac with scarlet, white, or black. 14. Gold with practically any color"
56,1961,FIC,ChairmanBored,A,B,C,"  fun, either. And here's a pair of snippers, Harry. Those lilac bushes at the end of the terrace need thinning out. "" They took the"
59,1961,FIC,ChairmanBored,A,B,C,"  this particular morning, as he grubbed for crumbling leaves between the back of a lilac bush and the foundations of the house, his pre-retirement philosophy about gardening began to"
452,1961,FIC,ClockWithoutHands,A,B,C,"  it, hoping for the sight of an unbroken flask or medicine vial with the lilac of fifty years of sun in it. She would have taken such a find"
830,1961,FIC,WinterOurDiscontent,A,B,C,  of them with one shot. Then I buried the furry ruins under the big lilac and I was miserable in the stomach. It was simply that I had grown
120,1962,FIC,SevenDaysInMay,A,B,C,  ; could run with Martha up from the dock to where Lily cried beneath the lilac in the twilightand be home free. |p148He did not want to see Lily that morning
311,1962,FIC,TaleMirror,A,B,C,"  In addition they had several lines of talcums and toilet water -- old-fashioned essences of lilac, rose, coreopsis, lily of the valley, and violet, favored mostly"
330,1962,NF,HeavenInvention,A,B,C,"  held together in even the simplest geometrical shapes, the rounded pebble and the heart-shaped lilac leaf, they would be too great for any eye to apprehend. We do"
538,1962,FIC,TaleMirror,A,B,C,"  samples of all its products. Here were the bottles with their intricate labels: Lilac, Parma Violet, Coreopsis of Japan, and Triple Essence of California Rose."
565,1962,FIC,CircuitRiders,A,B,C,"  , not puffy at all. He'd fool them. He sprinkled himself with lilac water, put the bottle to his lips, and swished some of it in"
626,1962,FIC,TaleMirror,A,B,C,"  . At the door, Mira and the young man paused. A rush of lilac came to them from the outside, and Mira's fur slid from shoulder to"
144,1963,FIC,Centaur,A,B,C,"  and had eroded sharply away from the house. A few feet away stood the lilac tree that had always been stunted, stunted in the shade of the house."
166,1963,FIC,Centaur,A,B,C,"  never cried -- until he heard the news. Behind Will one of the big lilac trees was moving a little in the wind, all its flowers shriveled and brown"
423,1963,FIC,TheeShoesFisherman,A,B,C,"  the glow. A small breeze stirred across the land, carrying the scent of lilac and roses, and mown grass. The sound of childish laughter rose from the"
502,1963,FIC,Play:BehindYellow,A,B,C,  to your suit. (Goes to the dresser to unwrap the lilac-and-pink suit and lilac top hat). p. 7 GAMALDIEN (explains with gestures) It's the
720,1963,FIC,WyomingSummer,A,B,C,"  The flower border is full of light-blue meadow iris. The four big clumps of lilac are just getting ready to bloom. Up here, with the high altitude,"
796,1963,FIC,CityNight,A,B,C,"  the same she was not going to give in to anything Italian. "" The lilac would be out at Stebbings, too, "" she said. If she had"
847,1963,FIC,Centaur,A,B,C,"  He looks at the sky and it answers his eyes with a mauve, a lilac, a muffled yellow-pearl. Only after sonic moments of focusing does the downflow visually"
913,1963,FIC,Play:BehindYellow,A,B,C,"  That's just his private studying. GAMALDIEN (enters, resplendent in pink and lilac satin) How's that, folks? RAYMOND, MRS. Oh! GAMALDIEN"
991,1963,FIC,WyomingSummer,A,B,C,  Michael only yesterday weeded and hoed the borders and dug up the ground around the lilac bushes. The big cloud is right overhead and thunder is rolling. Milking time
333,1964,FIC,LittleBigMan,A,B,C,"  against the rawhide lines all night long. Next day his whole upper body was lilac an open sore, and he didn't treat it with salve or mud or"
604,1964,FIC,INeverPromised,A,B,C,"  , I would be so grateful! "" |p260Dead pale, cold-handed, in a lilac flowered dress that ill suited the lithe tiger wearing it, Helene came to B"
623,1964,FIC,EarlyGrave,A,B,C,"  its thrust. A squeeze at his armpit. A scent of camphor stick and lilac water. Sandra Luboff. Miss Social Welfare. Vigorous her step, determined her"
661,1964,FIC,President,A,B,C,"  between their home and the school, back and forth, peering behind hedges and lilac bushes, up and down alleys. "" Where's your father this morning?"
49,1965,FIC,DoLordRemember,A,B,C,"  Mrs. Hammond was waiting endlessly, with her hands across her breasts to keep the lilac cloth in place. She seemed to be planning to keep silent forever, if"
235,1965,FIC,JournalFromEllipsia,A,B,C,"  With a handkerchiefhe wiped his forehead and dabbed under his chin. A whiff of lilac in the air made him close his eyes, and when he opened them,"
406,1965,FIC,DoLordRemember,A,B,C,"  that dress she was working on, that -- was it purple? "" "" Lilac, "" said Mrs. Hammond. "" Princess style. "" "" That's the"
426,1965,NF,365ShortcutsHome,A,B,C,"  , also completely washable, moth- and mildew-proof in pink, red, orange, lilac, black, white, avocado, suede, larkspur blue, copen blue,"
461,1965,NF,365ShortcutsHome,A,B,C,"  new color from tip to toe and have your bathroom looking as refreshed as a lilac after a gentle rain. Mix pinks, purple, and loganberry. Mix plain"
522,1965,FIC,JournalFromEllipsia,A,B,C,"  and two smaller isosceles triangles. The geometry of it reassuredher against the hodgepodge of lilac plumes, colossal depth of sky; no matter if the whole thing trembled as"
608,1965,FIC,JournalFromEllipsia,A,B,C,"  to shake her head at her sister's tears, and Clem stood by the lilac bush with the balloons -- "" Hey, you kids, these are for you"
629,1965,FIC,DoLordRemember,A,B,C,"  was saying, "" the harder the fat clings. "" She had patches of lilac pinned on over her regular dress now, but she was more or less doing"
666,1965,FIC,JournalFromEllipsia,A,B,C,"  as Rooney knelt in the grass top146comfort her. Clem and Irma stood by the lilac bush watching, Clem holding two balloons attached to sticks and Irma in a cap"
705,1965,FIC,OrchardKeeper,A,B,C,  of the chair and he was watching one of the deputies hunkered up under a lilac bush in the west corner of the lot. The old man kept watching him
741,1965,FIC,DoLordRemember,A,B,C,"  Pike would do. Mrs. Pike didn't do anything. She looked at the lilac cloth as if she'd never seen it before. "" Well, now,"
974,1965,FIC,DoLordRemember,A,B,C,"  I just want to sleep a while. "" "" After you make up my lilac dress, I'll let you sleep all you like, "" said Mrs. Hammond"
695,1966,FIC,MusicSchool,A,B,C,"  old hope, the wallpaper parts and reveals the lack of a wall. A lilac bush, and the woman's hair engulfs me. Guitar music drifts from a"
820,1966,FIC,OmensettersLuck,A,B,C,"  as well ancestored as anyone in Gilean, and her daughter Eliza, lovely as lilac, whose hand she held, then Mrs. Emory Root with Lutie on the Sheraton"
857,1966,MAG,Harpers,A,B,C,"  midmorning sun blazed down on the women's flowing gowns, shimmering in pastels of lilac, peach, citron, and lavender. One particularly buxom lady billowed into the"
348,1967,MAG,SatEvePost,A,B,C,"  air blowing up from a subway grating on my legs, and I could smell lilac and garbage and expensive perfume, and I knew that it would cost something sooner"
973,1967,FIC,TechnicolourTime,A,B,C,"  that hung richly in the air. He recognized old fish, tar, lockerroom lilac, plus others that he did not want to recognize. For the moment he"
980,1967,FIC,CaughtInThatMusic,A,B,C,"  from the bottom, and a soft breeze carrying something deliciously sweet -- honeysuckle or lilac -- wafted in. Jonas closed his eyes and breathed in the fragrance. It"
3,1968,FIC,Bloodline,A,B,C,  I pick it up and hug it. There is a little chair in the lilac tree made by three branches that come together. I like to sit here and
152,1968,FIC,Bloodline,A,B,C,  and its eyes staring as if they saw something that frightened them. In the lilac tree some blackbirds are arguing. Not too far away is the cherry orchard;
492,1968,FIC,Bloodline,A,B,C,"  years old. There, at the end of the porch, is the old lilac tree. Everything is blurred with misty light, because there was a fog the"
525,1968,FIC,Airport,A,B,C,"  cat, calico, with a mildewed eye, ran off and hid in the lilac hedge. Foxy asked Hanema, "" Is that yours? "" "" The cat"
900,1968,FIC,Bloodline,A,B,C,  into the cinder drive go together; everythinggoes together. I climb up into the lilac tree. The first branch is hard to hold. The birds fly away.
995,1968,FIC,Airport,A,B,C,"  rear wheel as he went down the drive and banked into the road beyond the lilac hedge, which was losing transparence to the swelling of buds. The cat raced"
1000,1968,FIC,Airport,A,B,C,"  were budding in reddish florets but the elms in tan tassels. Rips in a lilac sky. Nature, this sad grinding fine, seed and weed. His spirits"
493,1969,FIC,WhatImGoingDoI,A,B,C,"  led to the barn and one to the toolshed. Another one, bordered with lilac bushes that spotted it with blossoms, led to the outdoor toilet. Another path"
57,1970,FIC,BechABook,A,B,C,"  ' Union gave him as expense money a stack of ruble notes, pink and lilac Lenin and powder-blue Spasskaya Tower. In the following month, in the guise of"
579,1970,FIC,GreatLionGod,A,B,C,"  dark purple under a purple sky, the east, over the hills, turning lilac and geld. Hillel ben Borush rode for a pace in the rushing chariot of"
681,1970,FIC,ElectricCotillion,A,B,C,"  the hungry i for six-thirty that evening and we worked out three tunes: "" Lilac Wine, "" "" If Love Were All, "" a rarely done Noel Coward"
691,1970,FIC,ElectricCotillion,A,B,C,"  as we went into the bar. "" I thought you were a gas. Lilac Wine' got me right here, "" Val said, clutching his groin."
731,1970,FIC,ElectricCotillion,A,B,C,"  , learning haunting strangely constructed blues tunes that I didn't know existed, "" Lilac Wine, "" "" Chicken Road "" and a gorgeous one from House of Flowers"
791,1970,FIC,DesperateCharacters,A,B,C,"  an outdoor activity, until they were all caught in a community squat beneath a lilac bush? Sophie had been shut into the bathKimfor an hour, in order,"
926,1970,FIC,BayNoon,A,B,C,"  rather than otherwise, at the prospect of remembering Naples in similar terms -- a lilac dress Gioconda wore one morning driving to Caserta, or the Siena-coloured curtains of the"
105,1971,FIC,Mov:HospitalThe,A,B,C,  arrest.   P.A. SYSTEM (off-screen) Dr. Rigby. Dr. Rigby. Dr. Lilac.   DR. MORSEHow long has he been like this?   BOCKAbout a
856,1971,FIC,DreamMuseum,A,B,C,"  . Just pop it down the throat. For your fragrances. Of fern, lilac or heather. Matched pills for perfume. For evening wear. At one of"
924,1971,FIC,Harpers,A,B,C,"  rich, green river. Violets and poppies embroidered the meadows and a scent of lilac inundated the air while he -- only he could not be certain it was he"
746,1972,FIC,OpenHeart,A,B,C,"  enemy once Jesus gets it open wide enough. "" Sharon was standing by the lilac bush. Bebb came over and put his arm around her shoulder. He pointed"
16,1973,FIC,WindShiftingWest,A,B,C,  myself brought the flowers from her other room -- a big sprig of purple California lilac. I knew she was very fond of it. I simply removed it from
193,1973,FIC,Burr,A,B,C,"  in no mood for work. Instead we sat on a bench beside a purple lilac hedge. Burr breathed contentedly; looked about the well-kept park. "" This used"
46,1974,FIC,LoveFeast,A,B,C,"  Afghanistan vest trimmed with sequins and yeti fur. The dowagers of Gouverneur Road and Lilac Lane. "" I was a mere child, "" she said. "" I"
236,1974,FIC,FanClub,A,B,C,"  She was wearing a purple turtleneck sweater, abbreviated yellow skirt, panty hose, lilac leather boots. Her voice was high-pitched. "" My name is Gretchen. I"
455,1974,MAG,Harpers,A,B,C,"  late I was hunched on the log staring spellbound at spreading, reflected stains of lilac on the water. A cloud in the sky suddenly lighted as if turned on"
31,1975,FIC,MassacreAtFall,A,B,C,"  , not even a little low picket fence; no rows of trees, no lilac or snowball bushes. There's not even the clutter of rigs and farm implements"
303,1975,FIC,BeyondBedroomWall,A,B,C,  out at the snow; it was mounded four feet high in the tangle of lilac stems; the wind had eroded a corrugated bank of it along the foundation;
491,1975,FIC,Ragtime,A,B,C,  face in her hands. Sobs shook her body. The walls were a faded lilac print. An electric lamp at the bedside provided the only light. HearingGoldman coming
546,1975,FIC,BeyondBedroomWall,A,B,C,"  higher into the air in streaking wings. There was a gray shape beyond the lilac stems. It moved toward her, growing larger and more dense at the edge"
580,1975,FIC,MassacreAtFall,A,B,C,"  , not even a little low picket fence; no rows of trees, no lilac or snowball bushes. There's not even the clutter of rigs and farm implements"
912,1975,FIC,BeyondBedroomWall,A,B,C,"  his way and then reached deep in them and began pulling out branches of cut lilac and laying them on the ground, and as more and more came out,"
931,1975,FIC,Mov:Nashville,A,B,C,"  between Haven and Glen Campbell. Haven's mistress, LADY PEARL, dressed in lilac, as usual, of some fifteen-odd years, and his producer, BOB."
11,1976,FIC,yyy,A,B,C,"  rather like Leonardo's silverpoint crosshatching. Puss Belknap, however, smells like a lilac garden; and most of the ladies at dinner tonight were good to look at"
84,1976,FIC,SpectatorBird,A,B,C,"  from Ruth. Manon motioned the servant, who brought around fingerbowls with sprays of lilac in them. The old lady paddled and dabbled and touched her puckered lips with"
