entry,year,genre,source,a,b,c,text
73,1853,NF,MysteriesBee-keeping,A,B,C,"  were then in bloom. I found the flowers of the Silkweed, (or Milkweed, as some call it,) sometimes holding a dead bee by the foot"
82,1854,FIC,Walden,A,B,C,"  afternoon, for such days especially they settle on to the lakes, like the milkweed down, having looked in vain over the pond for a loon, suddenly one"
47,1856,FIC,HomeAndAbroad,A,B,C,"  art. The bluff was decked with great bunches of a scarlet variety of the milkweed, like cut coral, and all starred with a mysterious-looking dark flower, whose"
65,1869,FIC,OldtownFolks,A,B,C,"  when Miss Asphyxia was not looking, he drew from his vest-pocket a couple of milkweed pods, and said, "" Them' s putty, -- mebbe ye'"
100,1869,FIC,OldtownFolks,A,B,C,"  placed her treasure in the great bony claw. "" Why, that' s milkweed silk, "" said Miss Asphyxia. ""' T ain't good for nothin"
41,1875,FIC,RoseRoof-Tree,A,B,C,"  , score the slow, voiceless hours With unrebounding stroke. All round about Green milkweed rankly thrives, and golden-rod Sprouts from his prostrate heart in fine-poised grace Of haughty"
62,1892,FIC,Poems,A,B,C,"  The gentian's bluest fringes Are curling in the sun; In dusty pods the milkweed Its hidden silk has spun. The sedges flaunt their harvest, In every meadow"
43,1896,MAG,Atlantic,A,B,C,"  where Craigie Street now turns off from Brattle Street, there was a clump of milkweed, where every day there was some new variety of spotted ladybird (coccinelict or"
18,1900,FIC,VoicePeople,A,B,C,"  noise beneath the leaves of coarse mullein plants or the slender, unopened pods of milkweed, the puppy made sudden desperate skirmishes into the tangled pathside, pointing ineffectually at"
11,1901,NF,WildFlowers,A,B,C,"  ; and although the botanists have now removed its family one step away, the milkweed butterflies, especially the Monarch (Anosia plexippus), ignoring the arbitrary dividing line"
22,1901,NF,WildFlowers,A,B,C,"  hoods in wet places. Its leaves are lance-shaped or oblong-lanceolate, whereas the purple milkweed' s leaves are oblong or ovate-oblong. This is a smooth plant; and"
26,1901,NF,WildFlowers,A,B,C,"  Both plants bear erect, rather slender, tapering pods. # The POKE or TALL MILKWEED (A. exaltata - A. phytolaecoides of Gray) may attain a height of six"
37,1901,NF,WildFlowers,A,B,C,"  or more pollinia in its stigmatic cavities. # Dr. Kerner thought the milky juice in milkweed plants, especially abundant in the uppermost leaves and stems, serves to protect the"
49,1901,NF,WildFlowers,A,B,C,"  certain structural resemblances in the flowers, one might guess this plant belonged to the milkweed tribe. Formerly it was so classed; and although the botanists have now removed"
55,1901,NF,WildFlowers,A,B,C,"  doubtless owe their lives to it. Among the "" protected "" insects are the milkweed butterflies and their caterpillars, which are provided with secretions that are distasteful to birds"
59,1901,NF,WildFlowers,A,B,C,"  was considered poisonous to dogs; and we also know that all the tribe of milkweed butterflies are provided with protective secretions which are distasteful to birds and predaceous insects,"
64,1901,NF,WildFlowers,A,B,C,"  # Like the dandelion, thistle, and other triumphant strugglers for survival, the milkweed sends its offspring adrift on the winds to found fresh colonies afar. Children delight"
93,1901,NF,WildFlowers,A,B,C,"  of course, other insects not adapted to them are visitors - is the PURPLE MILKWEED (A. purpurasceus), whose deep magenta umbels are so conspicuous through the summer"
94,1901,NF,WildFlowers,A,B,C,  of the milkweeds that Professor Robertson has. # Better than any written description of the milkweed blossom' s mechanism is a simple experiment. If you have neither time nor
98,1901,NF,WildFlowers,A,B,C,  drawn out to an unusually long point. # One may always distinguish the low-growing FOUR-LEAVED MILKWEED (A. quadrifolia) from its relatives of ranker growth by its general air of
99,1901,NF,WildFlowers,A,B,C,"  feed. # COMMON MIIKWEED or SILKWEED (Asclepias Syriaca; A. cornuti of Gray) Milkweed family # Flowers - Dull pale greenish purple pink, or brownish pink, borne"
57,1902,FIC,MrPatsLittleGirl,A,B,C,"  yellow butterflies along the road told it, so did the bursting pods of the milkweed, and the golden-rod and asters, wreathing the meadows in royal colors. The"
91,1904,MAG,Atlantic,A,B,C,"  uses that we I; now not flow an Indian helps himself with fibre of milkweed, or withe-bush, or Wild hemp, or root of spruce, black or"
20,1906,MAG,Harpers,A,B,C,"  lumbermen had had camps or "" landings, "" the misty pink-purple blossoms of the milkweed poured a wild sweetness upon the air. In a shallow run near the shore"
12,1907,NF,ThreeAcresLiberty,A,B,C,"  nettle, pokeweed, pigweed or lamb' s quarters, black mustard. Young milkweed is better than spinach, and also makes an excellent salad. Probably all the"
40,1907,NF,ThreeAcresLiberty,A,B,C,"  stinging nettle, pokeweed, pigweed or lamb's quarters, black mustard. Young milkweed is better than spinach, and also makes an excellent salad. Probably all the"
35,1915,FIC,Police!!!,A,B,C,"  take them! "" he yelled; "" and you left me a bunch of milkweed butterflies' eggs! Give me my eggs or I shall violently assault you!"
70,1915,FIC,LPMEndGreatWar,A,B,C,"  polishers and a Sunday School teacher, while the Virginia creeper and the North Carolina milkweed twined about it to make nests for the Dove of Peace. "" "" No"
15,1918,FIC,MyÁntonia,A,B,C,"  wire fence, in the long grass, I saw a clump of flaming orange-colored milkweed, rare in that part of the State. I left the road and went"
7,1919,FIC,WinesburgOhioGroup,A,B,C,"  Take milkweed now, "" he cried. "" A lot might be done with milkweed, eh? It's almost unbelievable. I want you to think about it"
28,1919,FIC,WinesburgOhioGroup,A,B,C,"  leaned over, listening -- absorbed, fascinated. Joe Welling again talked excitedly. "" Take milkweed now, "" he cried. "" A lot might be done with milkweed,"
1,1921,FIC,HerFathersDaughter,A,B,C,"  from the mesquite and the incense plant. She knew she could from the willow milkweed; and under the head of "" sweets "" an appetizing jelly from manzanita."
63,1922,NF,ReignRubber,A,B,C,"  trees permits a milky sap to flow. It looks like the juice of a milkweed or a dandelion. When it dries, there is left a brownish mass of"
81,1922,FIC,DownMotherLode,A,B,C,"  Chinamen. The feeling began, presumably, through intermarriage and flourished like the celebrated milkweed vine of the foothills, which has been known to grow - I quote a"
69,1924,MAG,Atlantic,A,B,C,"  ? that were sipping deliriously at the puddles. Shining out by the roadside, milkweed showed what it could do in the tropics, where its flowers are half golden"
88,1931,FIC,ShadowsOnRock,A,B,C,"  go back to France? "" Her father was engaged with a plant of the milkweed kind, which the French colonists called le cotonnier. He did not look up"
21,1932,FIC,Invasion,A,B,C,"  of the child was a soft brown, and silky as the inside of a milkweed pod, the eyes dark, although still blurred curiously with blue, the iris"
38,1932,FIC,Harpers,A,B,C,"  Her fancy work lay scattered over the chest, and down on the floor the milkweed floss lay in a silvery heap on a paper, spotted with the seeds of"
45,1932,FIC,MurderByArisocrat,A,B,C,"  which I somewhat unkindly prolonged, taking him through some thickets where there were opening milkweed pods whose soft silks clung stubbornly to his trousers and resisted his savage efforts to"
89,1932,FIC,Harpers,A,B,C,  was a girl. She had dug it out of her chest along with the milkweed cushion. It was made out of an old summer dress she used to wear
29,1936,FIC,HeadOW-Hollow,A,B,C,"  see her handle the rattlesnake. "" When Anse shaves the part beard and part milkweed furze from his eighteen-year-old face, he runs to the hickory-pole clothesline upstairs and grabs"
42,1936,FIC,BigMoney,A,B,C,"  curtains in the window he could see a piece of sky bright and fleecy as milkweed silk. Charley began to feel a vague sense of accomplishment, like a man"
10,1937,NF,FoodsAmericaGave,A,B,C,"  our fields and roadsides which is not only edible but delicious, is the common milkweed (Fig. 1). The young sprouts or stalks of this very common wild"
54,1939,FIC,SongYears,A,B,C,"  into the field, or ever, under the most trying circumstances, neglected her milkweed cream at night. Melinda, as sunburned as a Musquakie, had on her"
76,1939,FIC,SongYears,A,B,C,"  looked over at Celia lying there so peacefully asleep in her bleached muslin nightgown, milkweed cream on her face and her oldest mitts over her creamed hands, and envied"
5,1942,MAG,Time,A,B,C,"  gin, a Michigan factory will next month start removing 1,000,000 lb. of floss from milkweed pods, for the U.S. Navy. The floss will replace kapok, formerly imported"
14,1942,MAG,Time,A,B,C,"  drag, lift, stratosphere, bomber. # > Nature classes will learn that milkweed and dandelions disperse their seeds by means of tiny parachutes; that a maple seed"
32,1942,FIC,ComeBackWayneCounty,A,B,C,"  up in the saddle and sang. A cat, crouched behind a clump of milkweed beside the road, looked at him superciliously. When he saw Ora's barn"
39,1942,MAG,Time,A,B,C,"  wool but six times lighter. Next year farmers will be paid to plant free milkweed seed in 50,000 barren acres of upper Michigan."
80,1942,MAG,Time,A,B,C,"   257580 The pesky milkweed, cursed by farmers, has found a use-as a substitute for kapok. With"
30,1943,NEWS,WallStJrnl,A,B,C,"  present prices. Col. Lent said, farmers could make $100 an acre from growing milkweed. The number of inventions received by the Council parallels the war crises. The"
33,1943,NEWS,WallStJrnl,A,B,C,"  . concerning a new gun sight for field artillery pieces, has been adopted. Milkweed for VI ar The National Inventors Council and an amateur inventor are responsible for adapting"
44,1943,NEWS,WallStJrnl,A,B,C,  VI ar The National Inventors Council and an amateur inventor are responsible for adapting the milkweed plant to war uses As a result of what has been done with the milkweed
52,1943,FIC,HumanComedy,A,B,C,"  from the way I had come, through a field that was grown up in milkweed and goldenrod. I lost the path and did not try to find it again"
67,1943,NEWS,WallStJrnl,A,B,C,  Burkman financial aid from the Government. One of the most important products derived from milkweed is a material that 111 substituting for kapok in life preservers and flying suits.
78,1943,NEWS,WallStJrnl,A,B,C,  pick the pods off the plant. These machines made it economic to harvest the milkweed and paved the way for further development. Seeing possibilities in it. the Council
79,1943,NEWS,WallStJrnl,A,B,C,"  Seeking a plant that would be useful in preventing soil erosion. he hit on milkweed, which has roots almost as deep as the aboveground plant. Dr. Burkman went"
84,1943,MAG,Time,A,B,C,"  acreage but vital in the war: quick-growing Russian dandelions for rubber, cattails and milkweed to be used as filler in life preservers, henbane used as a sedative."
87,1943,NEWS,WallStJrnl,A,B,C,"  the war. Dr. Boris Burkman, a Chicago physician, is responsible for the milkweed inventions. His avocation was agriculture, Colonel Stiles said. Seeking a plant that"
74,1944,FIC,HistoryRomeHanks,A,B,C,"  electric lights falling on the lawns and parkings, the jimson weed and ragweed and milkweed on vacant lots, the elmtrunks and mapletrunks and the sheathing and the stone of"
77,1949,FIC,BeulahLand,A,B,C,"  him, I guess, "" Ruhama said, and yanked loose a sprig of milkweed with force enough to have uprooted a small sapling. "" They've worked at"
9,1950,FIC,CastColdEye,A,B,C,"  30virid, the most weedlike weeds, the coarse growers -- burdock, thistle, milkweed, Queen Anne's lace; the crawlers -- carrotweed, Jill-run-over-the-ground, and especiallythe"
34,1950,FIC,WorldEnoughTime,A,B,C,"  unrepaired, land washed, fences down, cattlestraying, pastures gone to burdock, milkweed and nettle, brush coming back into good fields, idleness among the hands."
6,1953,FIC,GoodSpiritLaurel,A,B,C,  I can jist see that stuff spread over the water like the juice from a milkweed stem. It was a lot of fun. I wasn't old enough then
53,1953,FIC,GoodSpiritLaurel,A,B,C,"  ! "" Jack was so excited the foamy spittle flew from his mouth faster than milkweed furze drifting from an opened pod on an August wind. "" And I started"
86,1953,FIC,ChainInHeart,A,B,C,"  and all her remedies seemed of no avail. For some weeks May had drunk milkweed tea, but her breasts did not noticeably swell. During several days previous to"
90,1953,FIC,GoodSpiritLaurel,A,B,C,"  somethin' was the matter with' er. She was as white as a milkweed furze. When she didn't speak to me, as friendly a gal as"
46,1955,MAG,Harpers,A,B,C,"  with cattails, bulrushes, sedges, and blue and yellow flags. Bindweed, milkweed, pokeweed, blue toadllax, tansy, and the like have covered much of"
51,1956,FIC,Greenwillow,A,B,C,"  loose and watched it drift to the ground, wondering if there were such things as milkweed pods in the far-off places of India and Chiny. His father had never been"
61,1956,FIC,Greenwillow,A,B,C,"  the fence and looking at the brown land lying asleep. A dry stalk of milkweed with its parchment seed pods brushed his hand, and he pulled off the big"
48,1960,FIC,SouthAngels,A,B,C,  come was heralded by the chirping of katydids. Big white butterflies fluttered around the milkweed pods. He trod on a wild gourd vine and stooped to breathe deep of
66,1960,FIC,FallHouseUsher,A,B,C,"  and peeped over the brooks to see themselves; and the dusty pods of the milkweed were bursting with their silky fluffs, the spinning of the long summer. Autumn"
31,1963,FIC,GatesMountains,A,B,C,"  York around. He can hear a mouse high in a wall. Or a milkweed land in deep dust. And eyesight? Why, lad, the cat's"
56,1964,FIC,Herzog,A,B,C,"  room at the leafless weeds in back. Brown, delicate frames of ragweed. Milkweed with the discharged pods gaping. Or else gazing at the dark gray face of"
85,1965,FIC,OrchardKeeper,A,B,C,"  of potsherds, and turned up an artery of the wash, grown here with milkweed and burdock. following a faint aura of vole or shrew, until she came to"
36,1966,FIC,OmensettersLuck,A,B,C,  like Pompeii. Somebody called him Henry just now? Who? Millicent? The milkweed virgin? Naming is knowing. I can see from here she's got bad
96,1966,FIC,OmensettersLuck,A,B,C,"  legs too closely at a musicale. Note the coat of arms embossed. That milkweed woman was shouting something, seeds were winding from her mouth, heads were turning"
27,1970,MAG,SportsIll,A,B,C,"  of striped sunlight in the woods you shouldn't miss, of a stand of milkweed you must at all costs smell and of a German shepherd three blocks away that"
95,1970,FIC,DesperateCharacters,A,B,C,"  didn't come by to see me, I think I'd blow away like milkweed. Sometimes, in the late afternoons, I sit for hours until evening comes"
24,1978,FIC,TenderMercies,A,B,C,"  heavy wind, all his words blew back at him, broke up emptied, milkweed pods split and shaken out. "" I need my leg bag drained. """
92,1978,NF,WildWildWoman,A,B,C,"  , the new shoots of certain ferns that look like the tops of violins. Milkweed shoots are another popular and fairly easy-tolocate delicacy, and flour made from cattails is"
83,1980,FIC,RiddleyWalker,A,B,C,"  day of heart-stopping beauty (only a very few clouds, diaphanous, subtle as milkweed fluff, were brushed against the china-blue sky) that Vernon Bellefleur, who had"
72,1990,MAG,Smithsonian,A,B,C,"  a small island, some mallards on the water, a monarch butterfly on a milkweed. The stream seems innocent of what is happening up on its banks. There"
13,1991,MAG,Sierra,A,B,C,"  # "" Pretty, "" Allison says, toddling toward a small patch of surviving milkweed. Not yet knowing how the world is supposed to look, she is undismayed"
4,1993,FIC,StrangeDevices,A,B,C,"  In their rented farmhouse there, the windows collected sunshine from surrounding fields full of milkweed and daisies and buttercups. Hard to believe that it was only an hour from"
25,1993,MAG,NaturalHist,A,B,C,"  (blazing-star, wild petunia, Missouri coneflower, rosinweed, false boneset, horsetail milkweed, and purple prairie clover). A narrow strip of woods with red maple"
50,1993,FIC,ShiningOnes,A,B,C,"  and spindly legs. His fur was almost startlingly soft. It reminded her of milkweed. When she stroked him, he shrank beneath her hand, but he seemed"
60,1994,FIC,FantasySciFi,A,B,C,"  fore foot and shook her head until the white mane flew about as light as milkweed milk. # "" What is that noise? "" she asked. # Neither"
17,1995,FIC,SouthernRev,A,B,C,"  be sleeping. He pictured her in her crib, small fingers curled, her milkweed hair, and he felt something squeeze his heart, squeeze it hard, not"
3,1997,FIC,HarpersMag,A,B,C,"  , the veranda doors flew open. A great wind lifted up the sisters' milkweed hair and chased the cards about like a flock of bats. The room swelled"
23,1997,MAG,TodaysParent,A,B,C,"   407299 Needle Points BY JUNE ROGERS Like the feathery seeds of a milkweed plant on a windy day, microscopic viruses and bacteria are propelled into the air"
16,2001,FIC,ChangEngNovel,A,B,C,"  , and to either side of us a fast-passing scene of blond grass and dead milkweed thirsted under the burnt sky of sunset. My ear tingled with the nearness of"
19,2003,FIC,FantasySciFi,A,B,C,"  touch. "" # Outside he donned his pack and, feeling light as a milkweed parachute, bounded past the studio, across the bridge spanning the creek, and"
75,2003,NF,PSAJournal,A,B,C,"  - "" Three Points "" by Paul Talbot # 3rd - "" Bee on a Milkweed "" by David Kesner # Circuit No. 10, Round R # 1st and 3rd"
71,2004,FIC,LastDieNovel,A,B,C,"  body was covered with shredded remnants of cheap toilet paper. You look like a milkweed. She started laughing, not sure why. She laughed so hard it almost"
97,2005,MAG,Shape,A,B,C,"  from May through late July. View them flitting about purple coneflowers and dainty orange milkweed blossoms. Trace the 9.7-mile Cove Lake Trail, favored by hikers, wild turkeys"
8,2006,FIC,PrettyWoman,A,B,C,"  she noted that she had more than enough mustard leaves, nettle, plantain, milkweed, lady's thumb, and horsetail. She looked over to the left to"
58,2006,FIC,Smitten,A,B,C,"  about whittling herself down to the average fairy height of five inches, or having milkweed skin or gobs of fairy hair. Lizabeth Kane wanted the pluck, the joie"
68,2006,FIC,Smitten,A,B,C,  to be a fairy. She wanted skin that was as smooth and white as milkweed silk. And she wanted hair that cascaded halfway down her back in a luxuriant
2,2007,FIC,FantasySciFi,A,B,C,"  across the bed, and hit the nearest wall, bursting open like a giant milkweed pod and spraying its contents all over the room. The recoil catapulted Bella to"
