entry,year,genre,source,a,b,c,text,
279,1927,MAG,Time,A,B,C,"  five acres of mulberry trees would support a family sumptuously. Nine state legislatures established mulberry and silk-reeling bounties. As always before, the boom languished. The industry stayed",
280,1921,FIC,Play:Greatness,A,B,C,"  to speak at a banquet to the Mayor of Newark. KITTY enters. KITTY MULBERRY Eighteen minutes after twelve, the clock says, sir. TILLERTON It's slow",
281,1833,NF,HistoryVegetable,A,B,C,"  year, or they are kept low by pruning. When the leaves of the mulberry fail, or are deficient, in China, those of the ash are said",
282,1968,FIC,Bloodline,A,B,C,"  what do you think of the place? "" Frank said, looking at the little mulberry tree, not at Copper. But when he did that he forgot Copper was",
283,1841,NF,Book,ATreatise,A,B,C,"  The apple, citron, almond, pear, and date, Pomegranates, purple mulberry, and fig, From interlacing branches mix their hues And scents, the passengers"
284,1879,FIC,NightOff,A,B,C,"  . She is now at the White Sulphur Springs with my daughter. MUL. Mulberry Ah, with Angelica? PROF. Professor (astonished). No; with",
285,1841,NF,Book,ATreatise,A,B,C,"  of several distinct trees, is frequently met with in the case of very old mulberry trees in Great Britain, and olive trees in Italy. Kircher, about a"
286,1983,FIC,Phantoms,A,B,C,"  "" Here we go' round the mulberry bush, the mulberry bush, the mulberry bush. "" The air was filled with a child's singing. A little",
287,1953,MAG,Time,A,B,C,"  test- it's free, it's easy and it's quick. "" Befitting Mulberry Street's cosmopolitanism, the English spiels alternated with the same pitch in Italian,",
288,1934,NF,UponFieldHusbandry,A,B,C,"  said, that they will yield no Silk. Having considered the Subject of planting Mulberry Trees, as absolutely and essentially necessary, for the Support of the Silk Manufactory",
289,1921,FIC,Play:Greatness,A,B,C,"  . Does that young woman really borrow our stove, Kitty? p. 13 KITTY MULBERRY She takes it, sir. She comes tiptoeing to the kitchen door: """,
290,1847,NF,AmericanMechanic,A,B,C,"  silk business, and forsake their own calling, to plant acres of the Chinese mulberry. One in fifty of these draws a prize; the rest, after some",
291,1860,FIC,ElFureidis,A,B,C,"  neat white villa was separated from the factory and its unsightly appendages by a thick mulberry plantation; but all were evidently the property of one owner, being built on",
292,2009,FIC,ShadowsStillRemain,A,B,C,"  and video games, then hugs the high brick wall that borders the cemetery from Mulberry to Mott. # Compared with midtown, Nolita is barely reduced by the holiday",
293,1921,FIC,GayCockade,A,B,C,"  picture of herself between the tall white candles which illumined the dark mahogany and the mulberry brocades. I leaned back in my chair and watched her, her white fingers",
294,1879,FIC,NightOff,A,B,C,"  The very thing. Come when you can. Don't hurry. MUL. Mulberry Pray, remember where we left off. I don't want to begin all",
295,1879,FIC,NightOff,A,B,C,"  begins by deceiving you. You are, indeed, to be pitied. READY MULBERRY, to enter L. C. with ANGELICA. ANG. Angelica No, mamma!",
296,1992,NEWS,Atlanta,A,B,C,"  "" Bread &; Circuses. "" It'll be on the seven-piece band's own Mulberry Street Records label. # 9 p.m. Imaginary Friend and Soulfinger open. 695",
297,1889,FIC,BustedEx-Texan,A,B,C,"  reached out one foot, and when I came to I found myself facing a mulberry tree, with one leg on each side of it. Illustration: "" AND",
298,1904,FIC,RoseOldStLouis,A,B,C,"  sorry or glad. I had fully intended to make no stay at all at Mulberry Hill, but go on at once to my uncle's; but now that",
299,1841,NF,Book,ATreatise,A,B,C,"  possesses when laden with its long, hairy berries. The value of the Paper mulberry, in ornamental plantations, arises from its exotic look, as compared with other"
300,1944,FIC,Play:PolkCounty,A,B,C,"  no mail from there. LONNIE This do nt say Hell. It say, Mulberry, Florida. BOX CAR Maybe they done took in Mulberry for a new addition",
301,1893,FIC,ColonelSellers,A,B,C,"  'll throw myself forward -- MRS. SELLERS: Wait, wait a minute, Mulberry; I've got something to tell you. SELLERS, faltering: What is",
302,1955,MAG,Harpers,A,B,C,"  she set about realizing her desire by having one of her boys fetch home some mulberry shoots. Having grown their feed, she acquired the necessary livestock, processed their",
303,1928,NEWS,NYT-Reg,A,B,C,"  , was found dead in a sitting posture on a bench in Roosevelt Park, Mulberry and Bayard Streets, at noon by Patrolman Scherbaum of the Elizabeth Street Station.",
304,1896,FIC,WinterEveningTales,A,B,C,"  Then he rose and went to the jury. They were sitting together under some mulberry trees, smoking. Naturally silent, they had scarcely spoken since their verdict.",
305,1974,MAG,NewYorker,A,B,C,"  : half a Pizza Rustica from the Italian Food Center, at Grand Street and Mulberry; a couple of smoked mozzarellas from Alleva, the cheese store across the street",
306,1943,NF,scan,A,B,C,"  for the most part it is manufactured by hand from bamboo, straw, or mulberry bark or a mixture of these fibres. JAPAN In travelling through the more remote",
307,1913,FIC,Virginia,A,B,C,"  of the river, was just beginning to blow in soft gusts under the old mulberry trees in the street, and to scatter the loosened petals of syringa blossoms in",
308,1879,FIC,NightOff,A,B,C,"  remember this night as long as I live! (Listens, L. C.) MULBERRY (outside). Professor Babbitt! ANG. Angelica (outside). My",
309,1920,NF,DaysBeforeYesterday,A,B,C,"  and attention. The trays have to be perpetually cleaned out, and all stale mulberry leaves removed, for the quality and quantity of the silk depend on the most",
310,1991,FIC,SouthernRev,A,B,C,"  through the fern and seven-bark until it joined Mulberry Creek. She knew the changeable Mulberry frolicked and danced into the hills, finally flowing into the river. # The",
311,1835,FIC,ItalianSketchBook,A,B,C,"  in form it is not comparable with what I had seen at home; the mulberry, too, prevailed, and, as we learned, was cultivated wholly on",
312,1892,MAG,Century,A,B,C,"  tations; or who will follow Mr. Riis in his explorations through Baxter street and Mulberry Street in New York, will understand why the people who live in such quarters",
313,1879,FIC,NightOff,A,B,C,  Professor (apologetically). Not at all! not at all! MUL. Mulberry Not at all agreeable? PROF. Professor I mean to say I'm delighted,
314,1879,FIC,NightOff,A,B,C,"  Professor (shakes his head). No! no! no! MUL. Mulberry To make a short story, my wife was a woman of romantic ideas --",
315,1921,FIC,Play:Greatness,A,B,C,"  again...? TILLERTON A little sternly. What about it? KITTY MULBERRY Awkwardly. Nothing, sir. Only I was glancing at the paper myself,",
316,1971,FIC,Play:CowboyMouth,A,B,C,"  ways. Up past Ridge Avenue, down through Ashland, we'll slide through Mulberry, and bingo! We'll be there. CAVALE It won't take long",
317,1934,NF,UponFieldHusbandry,A,B,C,"  whom we derive our Original. To this End, as we have but few Mulberry Trees, we should increase the Number, and as soon as possible. There",
318,1879,FIC,NightOff,A,B,C,  sorry he's not in. MUL. Mulberry My name is -- ahem -- Mulberry. MRS. B. Mrs. Babbitt Mul -- ANG. Angelica Berry. MUL.,
319,1931,NEWS,NYT-Reg,A,B,C,"  Street, 118 Sullivan Street, 133-9 West Thirty-eighth Street, 1,393 Broadway, 119 Mulberry Street, 825 Sixth Avenue. JOHN D. WENDEL estate-51-3 Beekman Street, 53-5 Carmine",
320,1943,NF,scan,A,B,C,"  making these balloons, of remarkable tensile strength, was made of long, drawn-out mulberry fibre, and to render the material impervious to water it was treated in the",
321,1902,FIC,ArtDisappearing,A,B,C,"  loving notice was a trap set by Sonia. On the road which led from Mulberry Street to Cambridge, from the home of Anne Dillon to the home of Lois",
322,1929,NF,NewRegionalGeography,A,B,C,"  , tobacco, fruits, etc., are all grown, but not olives, mulberry trees nor citrus fruits. South of the Gironde estuary there is a barren,",
323,1928,NF,HelenKouesOnDecorating,A,B,C,"  scenes. In such an instance, if the figures in the paper are a mulberry, the dressing table could be in yellow, with the ruchings of mulberry.",
324,1934,NF,UponFieldHusbandry,A,B,C,"  vigorous Prosecution of that useful Work. i. That we may order the planting Mulberry Trees, in such Manner, that they shall spoil no Land, nor in",
325,1984,FIC,GodKnows,A,B,C,  in my chats with Him originated with me. The plan of stealing through the mulberry trees to encircle the Philistines at night at the second battle of Rephaim was I,
326,1928,NF,HelenKouesOnDecorating,A,B,C,"  a background a window-seat showing curtains of a toile de Jouy print in a soft mulberry on a cream ground, hung from a painted wooden cornice. The glass curtains",
327,1918,FIC,MyÁntonia,A,B,C,"  crept through it by a hole known only to themselves and hid under the low-branching mulberry bushes. As we walked through the apple orchard, grown up in tall bluegrass",
328,1860,FIC,ElFureidis,A,B,C,"  rude songs, and curious implements of the peasants at work in their gardens and mulberry plantations, the various domestic occupations which the women were carrying on in the open",
329,1879,FIC,NightOff,A,B,C,"  taking it in different directions, we all go to New York? MUL. Mulberry With me? That will be delightful. PROF. Professor Let's pack,",
330,1930,NEWS,NYT-Reg,A,B,C,  Corrigan expressed his defiance of the underworld from the bench in his court at 300 Mulberry Street at a hearing for Patrolman Leigh Halpern and Daniel Sullivan of Inspector Patrick S.,
331,1904,MAG,Harpers,A,B,C,"  , the thought into the action, the action into the character. When the mulberry seed falls into the ground and germinates, it begins to be transformed into silk",
332,1837,FIC,Nacoochee,A,B,C,  all my life to procure them again. And shoot with my cross-bow -- my mulberry cross-bow -- The robins that perched on the boughs near the gate. How gladly,
333,1927,MAG,Time,A,B,C,  A law still on the books though long dead requires Virginia farmers to plant six mulberry trees per annum for seven years. Just before. the Revolution a great fever,
334,1934,NF,UponFieldHusbandry,A,B,C,"  , I design, in the Spring, to set many Slips of the white Mulberry, and a few of the black Sort, for a Trial; I apprehend",
335,1843,FIC,VariousWritings,A,B,C,"  was a middle-aged man with a long, dry countenance and a complexion like a mulberry. His coat was buttoned up, in a threatening manner, from waistband to",
336,1893,FIC,Poems,A,B,C,"  silent window-sill The jessamine peeps in. All day the red-bird warbles, Upon the mulberry near, And the night-sparrow trills her song, All night, with none to",
337,1993,MAG,NaturalHist,A,B,C,"  do not expect to see breadfruit, this unexpected first cousin of the fig, mulberry, and Osage orange (all members of the Moraceae family), become the",
338,1873,NF,GreatRiotsNewYork17121873,A,B,C,"  , under the pretence of going down through Broadway, knowing that when they reached Mulberry Street they would be in hailing distance of the head-quarters of the police. It",
339,1912,NF,MothsLimberlost,A,B,C,"  them to a big box. The remainder I placed with less ceremony, over mulberry, elm, maple, wild cherry, grape, rose, apple, and",
340,1995,MAG,Horticulture,A,B,C,"  ) turn russet orange, and, like Cinderella at the ball, the common mulberry, so drab and unappreciated the remainder of the year, suddenly (briefly)",
341,1910,MAG,Atlantic,A,B,C,"  To-day science knows that t he silkworm must be fed on the leaves of the mulberry tree, but does not know that the soul of man must be fed on",
342,1904,FIC,RoseOldStLouis,A,B,C,"  before many minutes we were running our nose into the bank at the foot of Mulberry Hill. Down the bank came a long line of men and boys, chiefly",
343,1940,NF,VanLoonsGeography,A,B,C,"  also looked after his wife's garments. Early during the ninth century, the mulberry tree, which is the basic necessity for the cultivation of the silk-worm, made",
344,1984,FIC,CrescentCity,A,B,C,"  turning, tamping the earth down to make a cool place for herself under the mulberry bush. There much later, on another night, she had danced -- danced",
345,1879,FIC,NightOff,A,B,C,"  (aside). I never saw the man in my life. MUL. Mulberry (crosses R., unwrapping shawl). I keep my word, you see",
346,1934,NF,UponFieldHusbandry,A,B,C,"  Fruit, and the Grass.) 2. We are to consider, that, Mulberry Trees planted in great Numbers, will afford us a Supply of Fire Wood,",
347,1879,FIC,NightOff,A,B,C,  mildly and bewildered). I'm really very busy at present. MUL. Mulberry (testily). Do you think I have nothing to do? I must,
348,1841,FIC,JulianScenesIn,A,B,C,  many. No ray of the sun seemed to penetrate the high roof of the mulberry and some lofty palms that were stretched over it. The signs not of poverty,
349,1920,NF,DaysBeforeYesterday,A,B,C,"  hillside, olive-yards below, and mulberry trees on the lower levels. Our black mulberry, with its cloying, luscious fruit, is not the sort used for silkworms",
350,1939,NEWS,CSMonitor,A,B,C,"  about 12 or 14 feet high, with a tremendous umbrella spread like an oversized mulberry tree and people from Maine to Montana try to figure out what it is and",
351,1913,FIC,Virginia,A,B,C,"  broken only by small flower-like flakes of light that fell in clusters through boughs of mulberry or linden trees, there was the sound of whispering voices and of rustling palm-leaf",
352,1897,FIC,Child-World,A,B,C,"  a bow' at you kin brag on some! Er -- ef you can't git mulberry, you bring Me a' old locus' hitch-post, and i jing!",
353,1835,FIC,HorseShoeRobinson,A,B,C,"  The spot pitched upon for this purpose, was at the foot of a large mulberry that stood on the border of the plain, at a short distance from the",
354,1953,MAG,Time,A,B,C,"  and have your health checked, "" blared the sound trucks on lower Manhattan's Mulberry Street last week. "" Step up and get a blood test- it's free",
355,1829,NF,ChronicleConquest,A,B,C,"  , the citron, the fig, and the pomegranate, with great plantations of mulberry trees, from which was produced the finest silk. The vine clambered from tree",
356,1863,FIC,WildWesternScenes,A,B,C,"  . "" "" Behold! "" said Mr. Roughgrove, parting the branches of a mulberry tree, whose large leaves had obscured the objects beyond. "" Mercy on us",
357,1993,FIC,BoneBone,A,B,C,"  that nobody needs. I remember other insignificant details too: a garden, a mulberry tree, a washing line, an ironing board on the back porch. And",
358,1845,NF,HeFruitsFruitTrees,A,B,C,"  The large English black mulberry is propagated by cuttings /z/ as follows: about the last of October, take",
359,2009,FIC,MarryingCaptain,A,B,C,"  her by the wrist. "" Miss Massie, I intend to stay at the Mulberry for a month, but if you tell me another lie, I'll be",
360,1873,NF,GreatRiotsNewYork17121873,A,B,C,  work had been done by General Brown and the Police Commissioners from their head-quarters in Mulberry Street. Acton and Brown had no time to grumble or dispute about etiquette.,
361,1879,FIC,NightOff,A,B,C,"  Babbitt A strange voice! ANGELICA RE-ENTERS, preceding, in some alarm, LORD MULBERRY, who is over polite. Both ladies much frightened. A stranger! What",
362,1904,FIC,RoseOldStLouis,A,B,C,"  grasped him by the hand. When he found I was just from Kentucky and Mulberry Hill, he was more excited than I, and especially was he eager for",
363,1928,FIC,Play:BlueThunder,A,B,C,"  . BLUE THUNDER pondering.Little black man? WOMEN Drive a stake through our breastsSo the mulberry witch can't rob our grave -- Don't leave us alone, don't",
364,1934,FIC,Harpers,A,B,C,"  . "" "" How? "" "" You watch. "" At the corner of Mulberry and Main, Bart turned the truck slowly toward the left and made toward the",
365,1934,NF,UponFieldHusbandry,A,B,C,"  Timber. The Masters of Vessels- that coast it to the Southern Colonies, where Mulberry Trees are plentiful, say, that they use it as Ship-Timber, and value",
366,1833,NF,HistoryVegetable,A,B,C,"  of which is now used merely for fuel, or thrown away. The fustic mulberry (Moms tinctoria) is a native of many parts of South America (especially",
367,1955,MAG,Time,A,B,C,"  Foundation). In preparation, Menotti made two afternoon field trips to Manhattan's Mulberry Street to get the flavor of his subject. He writes with absolute conviction in",
368,1921,FIC,Play:Greatness,A,B,C,"  'd say. TILLERTON Never mind, I'll be careful, Kitty. KITTY MULBERRY Yes, sir. But the lady who used to be your wife wouldn't",
369,2008,FIC,Driftless,A,B,C,"  between several dozen gravestones, climbed the woven wire fence, picked his way through mulberry and hazelnut bushes, and found a small hollow of land covered with long grass",
370,1879,FIC,NightOff,A,B,C,"  back.) PROF. Professor (absently). Any time. MUL. Mulberry (severely). I am confiding a most important family matter to you,",
371,1984,MAG,NewYorker,A,B,C,"  the strength. A young Yale divinity student, Sam Todd, disappeared from a Mulberry Street party on New Year's Eve. In the weeks since, his family",
372,1860,FIC,ElFureidis,A,B,C,"  fertile valley, lying between mountains whose sides were festooned with the olive, the mulberry, and the vine, and whose distant opening disclosed the blue sea-line of the",
373,1921,FIC,Play:Greatness,A,B,C,"  's no one more concerned about what happens to her than I. p. 107 KITTY MULBERRY Sympathetically. Yes, sir; so I thought.... Do you",
374,1921,FIC,KingdomRoundCorner,A,B,C,"  helped her into the cab. II As he and Terry chugged their way to Mulberry Tree Court he eyed her, sitting beside him. Would he ever get her",
375,1899,NF,BeatriceDEsteDuchess,A,B,C,"  two or three ladies. Beatrice's own couch was gorgeously adorned with draperies of mulberry colour and gold, and a crimson canopy bearing the names of Lodovico and Beatrice",
376,1995,FIC,MurderAtMonticello,A,B,C,"  thousand dollars for the purpose of excavating and ultimately restoring the servants' quarters on Mulberry Row. "" As Mim extolled the value of the new project, Harry reflected",
377,1850,NF,AmericanFruitCulturist,A,B,C,"  they resemble blood, which is caused by their being at first grafted upon a mulberry stock. "" Roses, it was said, became black when grafted on black",
378,1880,FIC,BricksWithoutStraw,A,B,C,"  upon the porch and watched with dewy, love-lit eyes the road which led to Mulberry Hill. The shadows came. The night fell; the stars came out;",
379,1991,FIC,SouthernRev,A,B,C,"  joining up with a gadfly, or the dark, still river wedding the fickle Mulberry Creek that ran all over the woods, changing beds after every rain. Leetha",
380,1873,NF,GreatRiotsNewYork17121873,A,B,C,"  , between Amity and Bleecker Streets, but in fact to attack police head-quarters in Mulberry Street, and break up the very centre of operations. It was a bold",
381,1880,FIC,BricksWithoutStraw,A,B,C,"  before she had fully recovered. He begged her, therefore, to remain at Mulberry Hill at least a month longer; and, to support his request, informed",
382,1933,NF,HomeMankind,A,B,C,"  also looked after his wife's garments. Early during the ninth century, the mulberry tree, which is the basic necessity for the cultivation of the silkworm, made",
383,1949,MAG,Time,A,B,C,"  were great generals or great statesmen. The laborious account in Poor White of Allie Mulberry, the village idiot who astonishes the townspeople by carving a ship and placing it",
384,2002,NF,MiddleEverywhere,A,B,C,"  Nebraska cornfields. // I'm from muddy Platte and Republican, // from cottonwood and mulberry, tumbleweed and switchgrass // from Willa Cather, Walt Whitman, and Janis Joplin",
385,1968,NEWS,Chicago,A,B,C,"  block only three blocks from Beale street on the edge of downtown Memphis. Across Mulberry street is a 6-foot high wall, topped by bushes and grasses, and then",
386,1913,FIC,Virginia,A,B,C,"  holding small black silk bags in their hands, sprang out of the shadows of mulberry trees, and barred their leisurely progress. And though nothing had happened in Dinwiddie",
387,2005,FIC,Ploughshares,A,B,C,  remember. # Tony was staring out the window at the leafy branches of the mulberry. At the work trucks lined up and down the street and the kids on,
388,1995,MAG,SatEvenPost,A,B,C,"  lawyer once told me, "" All the whores in town aren't down on Mulberry Street. "" What he was referring to are appraisers and experts who can be",
389,1879,FIC,NightOff,A,B,C,  Mrs. Babbitt (shrugs her shoulders). We don't know. MUL. Mulberry And when will they be back? ANG. Angelica (crosses to C.),
390,1921,FIC,Play:Greatness,A,B,C,"  a minute, will you, while I get rid of this box? Kitty Mulberry can have it for kindling-wood now. He starts out, but decides to take",
391,2008,NEWS,SanFran,A,B,C,"  by 8 feet - printed on friable-looking, but quite stable, gampi or Thai mulberry paper. # The largest image describes at colossal scale a statue of 1/4-3 hours",
392,1913,FIC,OPioneers!,A,B,C,"  South of the hill, in a low, sheltered swale, surrounded by a mulberry hedge, was the orchard, its fruit trees knee-deep in timothy grass. Any",
393,1896,FIC,FameFortune,A,B,C,"  Tim Ryan, sir. "" "" Where do you live? "" "" In Mulberry Street. "" "" Tell what you know of this case. "" "" I",
394,1835,MAG,NewEngMag,A,B,C,"  , black, Spanish and yellow oak - all growing // luxuriantly - the branching mulberry, the tall and graceful persunmon, and the bumble but beautiful passaw, with",
395,1982,FIC,ColorPurple,A,B,C,"  It was ferociously cold by the time Hardesty and Virginia arrived at the apartment house on Mulberry Street and climbed the dimly lighted winding stairs, their faces red with the stinging",
396,1879,FIC,NightOff,A,B,C,"  (Wraps up articles handed by ANGELICA, and packs vigorously.) MUL. Mulberry I suppose you've been expecting me? PROF. Professor (L., impatiently",
397,1880,FIC,BricksWithoutStraw,A,B,C,  us great pleasure; but I am afraid you will have only sad memories of Mulberry Hill. It is too bad! Poor Hildreth had taken such a liking to,
398,1898,FIC,GapInFence,A,B,C,"  I want to let the rabbits out for a run after I've given these mulberry leaves to the silk-worms. "" The children had planned to have tea in Weedon",
399,1838,FIC,RobBowlALegend,A,B,C,"  the Proprietary, whose long-respected and holy repose, beneath the scant shade of the mulberry, has, within twenty years past, been desecrated by a worse than Vandal",
400,1934,NF,UponFieldHusbandry,A,B,C,"  June 12, I am able to assure the Reader, that many of the Mulberry Slips, or Twigs, are now growing, which I set this Spring,",
401,1880,FIC,BricksWithoutStraw,A,B,C,"  own all up and down the river on both sides, from Red Wing to Mulberry Hill, where Hesden now lives. Richards had a big family of boys and",
402,1841,MAG,NorthAmRev,A,B,C,"  in many cases pine barrens or swamps unfit for cultivation. The idea of planting mulberry trees on such a soil was absurd, and the requisition to clear up and",
403,1939,FIC,Yearling,A,B,C,  grubbing hoe from the shed behind the house and strolled toward the road. The mulberry trees by the fence were a sharp green. His mother's favorite hen clucked,
404,1952,FIC,WorksLove,A,B,C,  his feet. It was a fat middle-aged Italian in a Sulka dressing gown (mulberry with gold figurings) who wore over his face a rubber mask like the ones,
405,2004,NEWS,CSMonitor,A,B,C,  prince in a far-off western region. She smuggled silkworm eggs in her hair and mulberry seeds in her medicines. # Commerce along the Silk Road reached its height in,
406,1916,NF,QuestQuaint,A,B,C,"  English ladies in large bonnets. After the blue wave in Staffordshire, came the mulberry, the pink, the green, and the brown. Then came the decline",
407,1934,NF,UponFieldHusbandry,A,B,C,"  , which we may expect from Mulberry Trees, is the Fruit; the white Mulberry Tree bears abundance more Fruit, than the black; in Italy, where they",
408,1942,MAG,Harpers,A,B,C,  the secretary of one of the Chinese Emperors introduced a method of making paper from mulberry bark. The Arabs carried some Chinese papermakers back to Samarkand as prisoners of war,
409,1839,NF,ReportOnEducation,A,B,C,"  each day in manual labour: in summer, in agriculture, the rearing of mulberry trees, and in gardening, having also an opportunity to learn the management of",
410,1899,MAG,Atlantic,A,B,C,"  . Again, there occurs to me an experience the police had last summer in Mulberry Street. They were looking for a murderer, and came upon a nest of",
411,1880,FIC,BricksWithoutStraw,A,B,C,"  with the reading of this riddle! On the morning when Eliab was brought to Mulberry Hill, Mrs. Le Moyne and Mollie breakfasted together alone in the room of the",
412,1896,NF,PrehistoricTextile,A,B,C,"  of swans, turkies, or India ducks. The bark they take from young mulberry shoots that rise from the roots of trees that have been cut down; after",
413,1833,NF,HistoryVegetable,A,B,C,  gray colour; it feeds very voraciously on the leaves of the black and white mulberry tree indiscriminately; and it will also feed upon lettuce and some other plants.,
414,1880,FIC,BricksWithoutStraw,A,B,C,"  over a bulk of leaf tobacco, in the loft over the old dining-room at Mulberry Hill, and Hesden Le Moyne was busy bathing his face, examining his wounds",
415,1983,FIC,Valedictory,A,B,C,  hardly even bears discussing anymore. We just go around and around the same old mulberry bush. Your entire life is jittering apart and you stand there and ask me,
416,1882,NF,AtlantisAntediluvian,A,B,C,"  , no catalpa or sassafras, not a single elm or hackberry, not a mulberry, not a hickory, or a beech, or a true chestnut. These",
