entry,year,genre,source,a,b,c,text,
417,1879,FIC,NightOff,A,B,C,"  helps her mother to pack silverware, small boxes, jewel-cases, etc. LORD MULBERRY ENTERS, L. C. MULBERRY. Here I am, dear friends. PROF.",
418,1879,FIC,NightOff,A,B,C,"  old friend of my college days; you've often heard me speak of Jack Mulberry. JACK. Quite so! Charmed, I'm sure. ANGELICA (crosses",
419,1880,FIC,BricksWithoutStraw,A,B,C,"  the touch. "" Remember, sir, "" she continued threateningly, "" that Mulberry Hill is still mine, and it shall never go to a Radical -- never",
420,1849,FIC,Sketch-BookGeoffrey,A,B,C,"  I mentioned her valuable and inexhaustible collection of relics, particularly her remains of the mulberry tree; and the old sexton even expressed a doubt as to Shakespeare having been",
421,1973,NF,BraggAboutYour,A,B,C,"  interspersed with flowers. Pastel shades were replaced with bottle green, bright yellow, mulberry, and aubergine. Wallpaper came into widespread use, and incorporated the above designs",
422,1902,FIC,ArtDisappearing,A,B,C,  others who did not matter; what a long distance from the famous cat-show and Mulberry Street! Arthur also looked up the table with satisfaction. If his part in,
423,1929,NF,NewRegionalGeography,A,B,C,"  wheat, the region yields certain special products, notably silk, dependent upon the mulberry, grown particularly in the lower Rhone valley; olive oil; early flowers;",
424,1985,MAG,NatGeog,A,B,C,"  the Panjsher Valley, a center of resistance, told me how their walnut and mulberry trees were systematically cut down by the enemy during Soviet offensives. Here in the",
425,1896,NF,PrehistoricTextile,A,B,C,"  on a little petticoat, which is a kind of fringe made of threads of mulberry bark. 35 This is illustrated farther on. The manner of weaving in the middle",
426,1948,NF,PracticalBookAmerican,A,B,C,"  is attained by the use of two or three hues, such as red, mulberry, and black or red, brown, and black. Oftentimes, also,",
427,1886,FIC,MortalAntipathy,A,B,C,"  deal with her, treat her as one treats a silkworm: give it its mulberry leaf, and it will spin its own cocoon. Give her the books,",
428,1879,FIC,NightOff,A,B,C,  B. Mrs. Babbitt Don't leave me! (Grasps her.) MUL. Mulberry (to MRS. BABBITT). I knew how it would end. He,
429,1841,NF,Book,ATreatise,A,B,C,  to have been planted in the 16th century by the botanist Turner. The White mulberry (M. alba) is the species upon the leaves of which the silkworms are
430,1934,NF,UponFieldHusbandry,A,B,C,"  Experience, that the white Mulberry will grow from Slips or Twigs, thrust into the Ground; and it is",
431,1951,FIC,ProudNewFlags,A,B,C,"  scarcely be his destination, if he could help it. Should she wear her mulberry cloak with its pretty gray squirrel collar or -- she never arrived at a decision",
432,1879,FIC,NightOff,A,B,C,"  .) You must consider our house your own while you stay here, Mr. Mulberry My husband will want to talk over old times with you. (Sits on",
433,1841,NF,Book,ATreatise,A,B,C,  The Three-thorned Acacia. The Judas-tree. The Chestnut. The Osage Orange. The Mulberry. The Paper Mulberry. The Sweet Gum. The Walnut. The Hickory The
434,1899,NF,BeatriceDEsteDuchess,A,B,C,"  the help of exports from Vicenza and Verona, he introduced the culture of the mulberry with excellent results, and planted large vineyards. Here he tried various experiments in",
435,1837,FIC,Nacoochee,A,B,C,"  eve, to the mocking-bird's song. And shot with my cross-bow -- my mulberry cross-bow -- The robins that perched on the boughs near the gate.' T",
436,1913,FIC,OPioneers!,A,B,C,"  Emil reached the lower corner by the hedge, Marie was sitting under her white mulberry tree, the pailful of cherries beside her, looking off at the gentle,",
437,1896,FIC,Writings [1896-1914],A,B,C,"  your life' t was that! Nifty! (short for magnificat). Mulberry panels, -- heraldic spread, -- Ebony wheels picked out with red, And",
438,1913,FIC,PirateParts,A,B,C,"  a species of Oscar Hammerstein in embryo, with a blending of Wilkins Micawber and Mulberry Sellers mixed in. The company employed the afternoon in folding circulars and programmes.",
439,1966,FIC,SecretSantaVittoria,A,B,C,"  's uncle, stood up in the room | and struck the floor with his mulberry stick until there was silence. "" You forget who you are, "" he",
440,1985,NEWS,Chicago,A,B,C,"  books, "" publishing ""... And to Think I Saw It on Mulberry Street. "" That book was followed by scores of other tales, including """,
441,1918,MAG,Atlantic,A,B,C,"  ,? the old hawthorn that grew so near the house, and the old mulberry,? and the rooks wheeling on a spring sky so many years ago.",
442,1896,NF,StoriesOfGeorgia,A,B,C,"  with everything the land afforded, and rested in comfortable wigwams under the shade of mulberry trees. The soldiers were so delighted with the situation, that they were anxious",
443,1984,FIC,Play:Peccadillo,A,B,C,  Not bad. Different. Personality. Image. VITO DE ANGELIS I am some Mulberry Street dago? RACHEL GARLAND DE ANGELIS Vito! VITO DE ANGELIS (With an,
444,1984,FIC,GodKnows,A,B,C,  . I beat them for good at Rephaim by surrounding them at night through the mulberry trees. Saul knew the results beforehand. Samuel had given him the gory details,
445,1918,MAG,Atlantic,A,B,C,"  dissatisfied lips, as she lay on a garden chair in the shade of the mulberry tree; querulously arguing with his father, who, good-humored and very indifferent,",
446,1833,NF,HistoryVegetable,A,B,C,"  to the axe, and the fig-trees and vines died away; but sometimes the mulberry is left, and the strawberry and the raspberry struggle among the ruins. There",
447,1943,FIC,LadyInLake,A,B,C,  built-in dresser with paneled mirrors on the wall above it. An open door showed mulberry bathroom tiles. The phone was on a night table by the bed. I,
448,1921,FIC,Play:Greatness,A,B,C,"  of a man who has been at the mercy of an economical female like Kitty Mulberry for many years.... He regards his work half-whimsically. However,",
449,1879,FIC,NightOff,A,B,C,"  his name, and he said, "" No matter on second thoughts tell him Mulberry. "" READY MULBERRY, to enter L. C. PROF. Professor (L.)",
450,1996,FIC,PeopleLightning,A,B,C,"  his voice held threat. "" Or did you allow him to escape? "" Mulberry tried to scowl, but his resolve quickly faltered and he wet his thin lips",
451,1913,MAG,Atlantic,A,B,C,"  differently about this matter. The oaks shaded a whole terrace of precious, silk-yielding mulberry trees for us, and some grapevines, while their mighty roots drained the soil",
452,1958,FIC,WinthropWoman,A,B,C,"  he had finished, clinging hard to his hand and leaning against the gnarled old mulberry trunk. Then she whispered, "" Peyto knew it was coming -- he saw",
453,1879,FIC,NightOff,A,B,C,"  READY SNAP, to enter L. C. DAM. Damask Of course. MUL. Mulberry I was there. MRS. B., DAM., and ANG. Well?",
454,1952,FIC,WorksLove,A,B,C,"  he pronounced the incantation than the Pigp104stood up abruptly, spilling sherry all over its mulberry dressing gown. Hands to its head, as though the piggish jowls might burst",
455,1833,NF,HistoryVegetable,A,B,C,  dunghill. The attempt succeeded; the worms were fed with the leaves of wild mulberry trees; they multiplied rapidly; and the produce of their labours proved to be,
456,1971,MAG,Harpers,A,B,C,"  Marcone also made sure that quiet, co-operative crowds leaned out of their windows on Mulberry Street to cheer Marlon Brando, made up stooped and sixtvish to play the Don",
457,1920,FIC,PoorWhite,A,B,C,"  to when I want' em to, "" he said to himself. Allie Mulberry worked at the factory during the day. Under Hugh's direction he whittled pieces",
458,1930,NEWS,NYT-Reg,A,B,C,"  Broom, bartender, 16 Bowery, and John E. Busso, owner, 98 Mulberry Street. Get "" Smoke "" In Lunch Room. "" Mike Whisky "" was",
459,1998,FIC,Gamble,A,B,C,"  He flicked his eyes quickly up and down my person, taking in my old mulberry pelisse and hat. "" Miss... Newbury? "" he said haughtily. I",
460,1934,NF,UponFieldHusbandry,A,B,C,"  it be when thou hearest the Sound of a going in the Tops of the Mulberry Trees, that then thou shalt bestir thyself. Psal. lxxxiv. 6. Who passing",
461,1902,FIC,ArtDisappearing,A,B,C,"  welfare, he went to see Anne Dillon. Her home, no longer on Mulberry Street, but on the confines of Washington Square, in a modest enough dwelling",
462,1958,FIC,Terrace,A,B,C,"  they were twisting and pulling at it. The sparrows fluttered and squaaked in the mulberry tree. "" Belle, hey, "" Eddie said, "" go get us",
463,1902,NEWS,NYT-Reg,A,B,C,"  the Monday night raids in the precinct of Capt. John T. Stephenson of the Mulberry Street Station, District Attorney Jerome yesterday filed charges with Police Commissioner Partridge, not",
464,1871,NF,AdventuresYoung,A,B,C,"  the thicket. Soon he reappeared, with his hands full of a kind of mulberry, the fruit of the sarsaparilla, the acid flavor of which much revived Lucien",
465,2007,FIC,FantasySciFi,A,B,C,"  their silent colloquy again, their fingers flashing like a flock of sparrows in a mulberry. I left them at it, retired to my solitary, almost barren room",
466,1943,NF,scan,A,B,C,  had set down their writings. The manuscripts were duly macerated and added to the mulberry bark and it was thought that the dark grey footnote * Many of the early,
467,1950,NF,ForestProducts,A,B,C,"  in appreciable numbers included catalpa, oak, ash, elm, butternut, red mulberry, and in some localized areas even cottonwood, sassafras, and spruce. During",
468,1893,NEWS,NYT-Ed,A,B,C,"  An example is afforded by the results of a recent inspection of certain houses in Mulberry, Hester, and Essex Streets, which were in a very deplorable and dangerous",
469,1879,FIC,NightOff,A,B,C,  . MRS. B. Mrs. Babbitt Mul -- ANG. Angelica Berry. MUL. Mulberry From England. At present stopping in New York. MRS. B. Mrs. Babbitt,
470,1882,MAG,Century,A,B,C,"  and we found only a family of women, feeding their fat silk-worms with fresh mulberry leaves, in the rooms behind the temple. On we went, through intricate",
471,1948,FIC,RemembranceRock,A,B,C,"  , for beds of pansies, for winding paths lined with bushes and bordered with mulberry and magnolia. He had walked other blocks where the two-story houses had only a",
472,1918,FIC,MyÁntonia,A,B,C,"  enclosure; the wire fence, then the hedge of thorny locusts, then the mulberry hedge which kept out the hot winds of summer and held fast to the protecting",
473,1874,NEWS,NYT-Ed,A,B,C,"  which nothing but the most determined attitude could save him. He seems like Col. Mulberry Sellers, in the "" Gilded Age, "" to search within the depths of",
474,1879,FIC,NightOff,A,B,C,"  we must get rid of him. (Gets behind ANGELICA.) MUL. Mulberry (at table, seated, L., to ANGELICA). The doctor told",
475,1851,NF,GlancesAtEurope,A,B,C,"  one vast, low forest or "" timbered opening "" of Poplar, Willow, Mulberry, Locust, &c.; There are a few Oaks, more Elms, and some",
476,1921,FIC,Play:Greatness,A,B,C,"  great many more later, maybe. TILLERTON Oh, yes. p. 108 KITTY MULBERRY They'll fill up very nice, I must say. I haven't had",
477,1843,FIC,VariousWritings,A,B,C,"  awaken Mr Brangle's most powerful feelings in reply; and, hastily converting his mulberry into a deep red, he exclaimed -- "" Thou beggarly scamp! how darest",
478,1896,FIC,Cinderella,A,B,C,"  heart of a prisoner in the Tombs. Many of his countrymen bade good-by to Mulberry Street and sailed away; but they had grown rich through obeying the padrones,",
479,1879,FIC,NightOff,A,B,C,  tells me anything. I have to find out everything by chance. MUL. Mulberry (aside). Singular person! The Professor described his wife as possessing remarkable,
480,1896,NEWS,NYT-Reg,A,B,C,"  head was knocked out. The turpentine flowed along the street-car tracks as far as Mulberry Street, and a little urchin ignited it with a match. Flame shot along",
481,1904,NEWS,NYT-Reg,A,B,C,"  Madison Street, 3: Charles Street, 1; Macdougal Street, 1; Mulberry Street, 2: Eldridge Street, 1; Delancey Street, 1; Union",
482,1879,FIC,NightOff,A,B,C,"  . Professor Oh, yes! your son John, the rascal! MUL. Mulberry (piteously and half crying). Things went on just as I told you",
483,1913,MAG,Atlantic,A,B,C,"  garden of any kind, no flower-beds. The immediate surroundings were our grove of mulberry trees, consisting of four large terraces, a terrace of grapevines, a large",
484,1882,FIC,ForegoneConclusion,A,B,C,"  , but she was the boldest of all. In this garden there were some mulberry and pomegranate trees, several of which hung about the fountain with seats in their",
485,1901,NEWS,NYT-Reg,A,B,C,"  Manhattan Music Hall, was raided. Three agents of the Fifteen called at the Mulberry Street Station at midnight and handed a bunch of warrants to Sergt. Hearley. He",
486,1841,NF,Book,ATreatise,A,B,C,"  fruit, or the suitableness of the. foliage for feeding silkworms. Our common mulberry, however, in free, open situations, forms a large, wide-spreading,"
487,1927,MAG,Time,A,B,C,  Aspinwall persuaded the New York Assembly to promise a bounty of $3 for every 100 mulberry trees reaching the age of three years in good health. Mr. Aspinwall then rushed,
488,1879,FIC,NightOff,A,B,C,  York two years ago. PROF. Professor Yes; on business. MUL. Mulberry I suppose so. I met you at a matine. PROF. Professor I,
489,1964,FIC,Wanderer,A,B,C,"  she had sprung across the cabin and was poised above him, dagger-claws spread, mulberry lips writhed back from inchand-a-half needle canines in her upper jaw. She still held",
490,1923,NF,scan,A,B,C,"  South America. Tapa-bark cloth was nearly as scarce as canoes, because the paper mulberry withstands the cool winds of Easter Island only with considerable coddling. Breadfruit and coconuts",
491,1906,NEWS,NYT-Reg,A,B,C,"  occasion to meet the Colonel on sundry occasions and invite him to call at 800 Mulberry Street. The Colonel when he was known as "" Kid Murray had a smooth",
492,1934,NF,UponFieldHusbandry,A,B,C,"  ; Apple Trees, planted on such a Bank, makes an impenetrable Fence; Mulberry Trees have never yet, been try'd, that I have heard of,",
493,1896,NF,PrehistoricTextile,A,B,C,  of work they make mantles either of feathers or woven of the bark of the mulberry tree. We will describe their method of doing this. The feather mantles are,
494,1896,NF,StoriesOfGeorgia,A,B,C,"  Whitney attracted the attention of the widow of General Nathanael Greene, who lived at Mulberry Grove, on the river at no great distance from the city. Mrs. Greene",
495,1899,NF,BeatriceDEsteDuchess,A,B,C,"  balass bore the effigy of Lodovico, and the insignia of the Moraglia, or Mulberry, was composed of emeralds, diamonds, and pearls. This jewel was frequently",
496,1879,FIC,NightOff,A,B,C,"  , muffled in travelling-coat, shawl round throat, big fur gloves, etc. MULBERRY (L.). Ah, my dear sir, there you are; I",
497,1880,FIC,BricksWithoutStraw,A,B,C,"  the horrible virus of "" Radicalism, "" had most alarmingly prostrated the invalid of Mulberry Hill. For a long time it was feared that her life of sufferirig was",
498,1986,FIC,GoldenCup,A,B,C,"  your age. "" He spoke with admiration. They walked through Bottle Alley onto Mulberry Street. Rags blew on the clotheslines overhead; a hawker offered a worn coat",
499,1879,FIC,NightOff,A,B,C,  .) We haven't a soul to send for a policeman. MUL. Mulberry You must know that the rascal has played the most incredible pranks. For two,
500,1922,MAG,NatGeog,A,B,C,"  Kai then visits the ancient village shrine to pray for the preservation of his precious mulberry trees from the dread scourge. Strangely enough, however, these trees are said",
