entry,year,genre,source,a,b,c,text
1,1835,FIC,InfidelFallMexico,A,B,C,"  only defensive armour was a little round buckler of the skin of the danta or tapir, not exceeding fourteen inches in diameter, strapped to his left arm. The"
2,1835,FIC,InfidelFallMexico,A,B,C,"  even the great bear from the ridges of the Oregon or Rocky Mountains. The tapir of Guatemala rolled by his fenny pool, and the peccary herded hard by."
3,1844,NF,VestigesNatural,A,B,C,"  A considerable number are pachydermata, 127 of a character approximating to the South American tapir: the names, palaeotherium, anthracotherium, anoplotherium, lophiodon, &c.,; have been"
4,1844,NF,VestigesNatural,A,B,C,"  marked, but yet considerable. The predominating forms are still pachydermatous, and the tapir type continues to be conspicuous. One animal of this kind, called the dinotherium"
5,1847,NF,NaturalistInNicaragua,A,B,C,"  are the curassows and penelopes. In the lower ground, the footmarks of the tapir are very frequent, especially along the small paths, where I have sometimes traced"
6,1847,NF,NaturalistInNicaragua,A,B,C,"  the forest along a path where I had often seen the great footmarks of the tapir. After riding about a couple of miles, I heard the notes of some"
7,1847,NF,NaturalistInNicaragua,A,B,C,"  a jaguar before in the woods, and having often seen the footprints of the tapir, I thought it was the latter, and thinking I would have to get"
8,1848,NF,PersonalNarrative,A,B,C,"  to the jaguar, the small species of tiger cat, the cabiai or thick-nosed tapir, * (* Cavia capybara, Linn.; chiguire.) the galinazo vulture,"
9,1849,NF,PersonalNarrative,A,B,C,"  only by deer, and a large species of cavy. * (* The thick-nosed tapir, or river cavy (Cavia capybara), called chiguire in those countries."
10,1849,NF,PersonalNarrative,A,B,C,"  during Lent. According to their zoological classification they place the armadillo, the thick-nosed tapir, and the manatee, near the tortoises; the first, because it is"
11,1850,MAG,NewEngYaleRev,A,B,C,"  rhinoceros, hippopotainus, those giants of the old world, the feeble and harmless tapir and peccary. In the ruminants, instead of the camel and the dromedary,"
12,1855,NF,WondersGeology,A,B,C,  afterwards in Bavaria and Austria. The molar teeth or grinders resemble those of the tapir in form and structure; and Cuvier described the animal under the name of the
13,1855,NF,WondersGeology,A,B,C,"  form and structure; and Cuvier described the animal under the name of the gigantic tapir. Professor Kaup, however, regards it as a new genus, between the"
14,1855,NF,WondersGeology,A,B,C,"  . Professor Kaup, however, regards it as a new genus, between the tapir and the mastodon, and adapted to a marshy or lacustrine condition of the earth"
15,1855,NF,WondersGeology,A,B,C,"  was massive, and its legs and tail were short. It resembled a large tapir, but differed somewhat as to the teeth, and had one toe less on"
16,1855,NF,WondersGeology,A,B,C,"  size, probably not larger than the roebuck, and of similar form to the tapir. It had light and slender limbs. The Anoplotherium gracile was of elegant propor-"
17,1855,NF,WondersGeology,A,B,C,"  oolitic saliferous, and Ichthyosaurus, Plesiosaurus, Pterodactyle, $c., restored. Fossil Tapir, fyc., restored. Fossil Elephant. Fossils, Megatherium, Gigantic Elk. /z/"
18,1855,NF,WondersGeology,A,B,C,"  species of extinct genera. /z/ 2. Miocene Period: Ape, Dinotherium, Tapir, Chalicotherium, Rhinoceros, Tetracaulodon, Hippotherium, Sus, Felis, Machairodus,"
19,1855,NF,WondersGeology,A,B,C,"  of colossal magnitude. And I saw in its rivers and marshes the hippopotamus, tapir, and rhinoceros; and I heard the roar of the lion and the tiger"
20,1859,NF,TestimonyModern,A,B,C,"  species, of the same great class, were nowhere to be seen the /z/ tapir, the lama, the pecari, the jaguar, the cougar, the agouti"
21,1863,NF,NaturalistOnRiver,A,B,C,"  or sound of life. We did not see or hear monkeys, and no tapir or jaguar crossed our path. Birds, also, appeared to be exceedingly scarce"
22,1874,NF,WesternWorld,A,B,C,"  waree, or wild hog, runs in large droves in many districts. The tapir, similar to that of the southern continent, also frequents the seashore and banks"
23,1874,NF,WesternWorld,A,B,C,"  prehensile tail, the ant-eater, arborial and terrestrial; the diminutive sloth, thick-skinned tapir, alligators, turtles, and manatees; lizards, serpents; the beautiful denizens"
24,1882,MAG,Atlantic,A,B,C,  of horses and tapirs such as now exist we find an animal something like a tapir and something like a horse; and instead of leopards and wolves and bears we
25,1882,MAG,Atlantic,A,B,C,"  equus from a five-toed mammal not larger than a pig, and somewhat resembling a tapir. All the "" missing links "" in this case have been found; //"
26,1883,NF,GoldenChersonese,A,B,C,"  . Among this thick-skinned family are the elephant, the one-horned rhinoceros, the Malayan tapir, and the wild hog; the last held in abomination by the Malays,"
27,1895,FIC,UncleRemusHisSongs,A,B,C,"  there is the story of how the tortoise pretended that he was stronger than the tapir. He tells the latter he can drag him into the sea, but the"
28,1895,FIC,UncleRemusHisSongs,A,B,C,"  . He tells the latter he can drag him into the sea, but the tapir retorts that he will pull the tortoise into the forest and kill him besides."
29,1895,FIC,UncleRemusHisSongs,A,B,C,"  The tortoise thereupon gets a vine-stem, ties one end around the body of the tapir, and goes to the sea, where he ties the other end to the"
30,1895,FIC,UncleRemusHisSongs,A,B,C,  as a signal for the pulling to begin. The struggle between the whale and tapir goes on until each thinks the tortoise is the strongest of animals. Compare this
31,1900,NF,StoryNineteenth-,A,B,C,"  bridged over. In a similar way, various diverse mammalian forms, as the tapir, the rhinoceros, and the horse, are linked together by fossil progenitors."
32,1904,NF,GeologyApplied,A,B,C,"  abounded. There were many large mammals, including now extinct species of elephant, tapir, rhinoceros, horse, tiger, lion, wolf, peccary, etc."
33,1910,NF,WorldsGreatest,A,B,C,"  on quadrupeds already described, accounts of animals not noticed before, such as the tapir, quagga, gnu, nylghau, many antelopes, the vicuna, Cape ant-eater"
34,1914,MAG,Harpers,A,B,C,"  is a noble and heroic pastime, and the elephant, rhinoceros, panther, tapir, orang-outang, and python are to he encountered in the territory. They enjoy"
35,1918,MAG,Atlantic,A,B,C,"  easy for him to gauge that of an opponent. He feared neither deer nor tapir, yet at their approach he would sound his warning as a reciprocal precaution,"
36,1919,MAG,Atlantic,A,B,C,"  would require only a few instants, and the death of a jaguar or a tapir would mean only a few more. Against this attack, claws, teeth,"
37,1922,FIC,BlackPhantom,A,B,C,"  blinking eyes, and then curled up again for another nap. Sama, the tapir, one massive forefoot raised in midair, stopped soothing with his tongue the ugly"
38,1922,FIC,BlackPhantom,A,B,C,  from the neck that she gained little more than a secure hold and this the tapir broke by promptly bolting through the densest brush where the stout overhanging branches brushed the
39,1922,NF,MalayArchipelago,A,B,C,"  could only have been separated at a very recent geological epoch. The elephant and tapir of Sumatra and Borneo, the rhinoceros of Sumatra and the allied species of Java"
40,1922,NF,MalayArchipelago,A,B,C,"  is from thirty to fifty miles wide; and five hoofed animals, including the Tapir, two species of rhinoceros, and an elephant. Besides these there are thirteen"
41,1922,NF,MalayArchipelago,A,B,C,"  than it is to Java. The great man-like apes, the elephant, the tapir, and the Malay bear, are all common to the two former countries,"
42,1922,NF,ArcheologicalInvestigations,A,B,C,"  all belong to modern species except one tooth, which is that of the cave tapir, and (possibly) the jaw of an otter. # BLEDSOE COUNTY COLLEGE"
43,1925,MAG,Time,A,B,C,"  meats! What were they? Before the white men lay crackly tidbits of wild tapir (pig). The coppery Indian guides gorged on chunks of monkey carcasses,"
44,1925,MAG,Time,A,B,C,"  . "" (P. 13, col. 3.) # Crackly tidbits of wild tapir (pig). (P. 18, col. 1.) # The only"
45,1926,NEWS,NYT-Reg,A,B,C,"  skulls of the Stegodon, an animal which resembled the mammoth; of a giant tapir and a rhinoceros; a complete fossilized skeleton of a guar, or East Indian"
46,1928,MAG,Time,A,B,C,"  , but not unique, find was the skull of a titanothere, an archaic tapir. The skull is saddle shaped. The nose bone stands straight up and reaches"
47,1928,NF,LanguageItsNature,A,B,C,"  have taken the name of jasmine from Persian, chimpanzee from some African, and tapir from some Brazilian language. It is characteristic of all words of this kind that"
48,1933,MAG,NatGeog,A,B,C,"  dart, and below, in the foam, whirls the body of an unfortunate tapir which ventured too near the brink. We pass fire-scarred clearings on the face of"
49,1933,MAG,NatGeog,A,B,C,"  a black head, black head tufts, and a yellow and black beak. Tapir, deer, carpincho, otter, and coypu abound in the marshy regions."
50,1937,NF,FoodsAmericaGave,A,B,C,"  and guanacos of the Andean regions of South America, the big cabybaras, the tapir, the prong-horned // antelope, the big-horned sheep and mountain goat, the bison"
51,1937,NF,FoodsAmericaGave,A,B,C,"  , while opossoms are not confined to America, and there is a species of tapir in Malaya. But there are others, such as the raccoon, the prong-horn"
52,1947,FIC,WaywardBus,A,B,C,  deeply channeled upper lip was raised over his teeth like the little trunk of a tapir. The point over his middle teeth seemed to be almost prehensile. His eyes
53,1948,FIC,StormEcho,A,B,C,"  an old woman's. Moola Mutandi entered and developed a snout, like a tapir's. Let us go, "" he pleaded gently, "" through the savannahs"
54,1956,MAG,SportsIllustrated,A,B,C,"  skeletons of nine mammoths, a prehistoric bison, a prehistoric horse and a prehistoric tapir. They also found interspersed among the bones 13 stone spear heads, eight butchering"
55,1959,MAG,NatGeog,A,B,C,"  . My friend Kratchet, in whose house I shall live, has shot a tapir. Others bring in anteaters and monkeys. Villagers Share and Share Alike The animals"
56,1965,FIC,JournalFromEllipsia,A,B,C,"  up forever all hope of the dinosauric archways, of that affinity of elephant and tapir, the brontothere, whose sweet, paleolithic expression had for long intrigued me."
57,1966,MAG,Harpers,A,B,C,  saw creatures called Agouti that look like the offspring of an unfortunate cross between a tapir and a miniature poodle. I realized then the difficulties that a laboratory director faces
58,1967,FIC,EighthDay,A,B,C,"  it never stops raining -- in a thatched hut, holding an umbrella over her tapir stew; and of being in some diggings higher up than this, where you"
59,1978,NF,UnderstandingLaughter,A,B,C,  not secure a mate; so does the cavewife who can not cook filet of tapir without burning it; and ditto for the male suitor spurned by all eligible maids
60,1983,NF,LatelyTortured,A,B,C,"  American legend supplies significant detail. "" The Arawak of Guyana call the Galaxy the Tapir's Way.' This is confirmed in a tale of the Chirignano and some"
61,1983,NF,LatelyTortured,A,B,C,"  of the Tupi-Guarani of South America. "" According to Cuna tradition, "" the Tapir chopped down the Saltwater Tree', at the roots of which is God's"
62,1985,FIC,Harpers,A,B,C,  has suffered some sort of accident. Harold's nose makes him look like a tapir. I work for him because he pays. But there's a limit to
63,1985,FIC,Harpers,A,B,C,"  he may have a heart attack. "" You look a good deal like a tapir with that nose, "" I say. Harold is still inarticulate. "" A"
64,1985,FIC,Harpers,A,B,C,"  with that nose, "" I say. Harold is still inarticulate. "" A tapir is a South American pig, "" I explain. "" It has a nose"
65,1985,FIC,Harpers,A,B,C,"  what I'm talking about. That's what your nose looks like, a tapir's nose. "" That was the end of my employment with Harold, and"
66,1987,FIC,Mov:Predator,A,B,C,"  GROWING LOUDER. Blain's finger moves closer to the trigger. Suddenly a small TAPIR bursts through the leaves, startling Blain. He relaxes momentarily as he watches the"
67,1997,FIC,OrdinarySeaman,A,B,C,"  , but he'd only fired it in "" combat "" once, when a tapir bursting from riverbank foliage startled him... missed it, pues. "" I was"
