entry,year,genre,source,a,b,c,text
143,1834,FIC,CalavarTheKnight,A,B,C,"  , it should be only when the wolf spoke to the vulture, and the vulture to the red star, that Camael the angel should unlock the lips of destiny"
144,1982,FIC,DifferentSeasons,A,B,C,"  , his head hunched into the collar of his robe like the head of a vulture waiting for some hurt animal to give up the ghost. In that instant,"
145,1948,FIC,GoldenHawk,A,B,C,"  as graceful. Her hair hung loose about her shoulders, as black as a vulture's wing against the spring snow of her face. Under her slim brows her"
146,1902,MAG,Harpers,A,B,C,"  not Ascanius' rich cloak for bravery, but covet to be sheltered from the vulture's tyranny. "" In days when the courts were liable at any moment to"
147,1999,FIC,SouthwestRev,A,B,C,"  called it; and this friend was a brilliant woman, peering like a kindly vulture through her thick glasses. # Debutante was not what Daisy would have called her"
148,1945,FIC,HappyTime,A,B,C,"  barely cooked. It was like taking wings from a bird. "" Begone, vulture! "" Desmonde exclaimed. "" The medicine is worse than the malady. """
149,2002,FIC,SouthernRev,A,B,C,"  know what to say. # "" You must think I'm some kind of vulture, asking this. And maybe that's right. I don't know."
150,1946,FIC,SalemFrigate,A,B,C,"  the only living things we saw were snakes and scorpions and lizards and an occasional vulture. About midmorning of the fifth day we calve to a tiny oasis, a"
151,1921,FIC,BrazilianTales,A,B,C,"  sky passed some urubus7 in search of distant lodgings. 7 Urubu: the black vulture of South America. Suddenly a pigeon winged through the air, then another,"
152,1883,MAG,Atlantic,A,B,C,"  am ashamed), what of a few days of agony, what of a vulture being the bier, tomb, and parson of a hero, compared to the"
153,1856,FIC,ErnestLinwood,A,B,C,"  only to be torn open afresh, is an emblem of the victim of that vulture passion, which the word of God declares to be cruel and insatiable as the"
154,1959,FIC,Mov:BenHur,A,B,C,"  blood gets more blood, as dog begets dog; death generates death, as vulture breeds the vulture. But the voice of Jesus of Nazareth I heard today on"
155,1980,FIC,RiddleyWalker,A,B,C,"  scream at once, and ran forward, waving her arms as if the Noir Vulture were an ordinary bird to be frightened away. Then she saw the squirming bleedingbaby"
156,1863,FIC,HannahThurston,A,B,C,"  attract, at last, Mrs. Babb's attention. The grim housekeeper had a vulture's beak for scenting prey of this kind. While she assisted Mrs. Styles to"
157,1915,FIC,BoyAlliesUnder,A,B,C,"  their gaze. To leeward, not half a dozen rods away, lay The Vulture almost upon her side. Half a dozen men were floating in the water and"
158,1899,NF,Heart-CryJesus,A,B,C,"  or damned with electric speed. THE BUZZARD AND VULTURE. The buzzard and the vulture will find food if they look for it, but with them we are not"
159,1925,MAG,Harpers,A,B,C,"  ? indolent, awkward, chinless cowards. They are to a barracuta as a vulture to an eagle; a ladyfish has a thousand times less weight and double their"
160,1941,NF,SurveyCycleSod,A,B,C,"  in the drinking to make new ones. He spies a fat bankroll like a vulture in the sky sees fresh meat from afar, and soon has your party matched"
161,1921,FIC,TriumphEggOther,A,B,C,"  looked like a gigantic bird, an aged wise old bird, "" perhaps a vulture "" she thought. For a time he was silent and then he began to"
162,1987,FIC,Mov:BigEasyThe,A,B,C,"  a wall: a grinning vulture. As the shot WIDENS, we see the vulture's perched on a blow-up of the brass, crescent-shaped shield of the New Orleans"
163,1911,NF,LettersGeorgeBorrow,A,B,C,"  the carcass of a horse half-devoured. Upon it with lustrous eyes stood an enormous vulture, who, as I approached, slowly soared aloft till he alighted on the"
164,1985,NEWS,Chicago,A,B,C,"  the first place, otherwise we might be calling a cockroach a sparrow, a vulture a lamb, and have no idea what to call lawyers. Part of Bramble"
165,1866,NF,CampaignsNon-Combatant and,A,B,C,"  the window-frames, and imperilled his neck to tear out the roof-beams; a dead vulture was pinned over the door by pieces of broken bayonets. "" Langley's,"
166,1871,NF,AdventuresYoung,A,B,C,  Woodpecker. -- The Basilisk. -- L'Encuerado's fresh Idea. 104 CHAPTER VIII. A Vulture's Feast. -- Dragon's Blood. -- A Coral Serpent. -- The
167,1849,FIC,SongsSea,A,B,C,"  tortures: -- The pool of Tantalus, Ixion's wheel, Prometheus with the vulture at his vitals, Procrustes' bed, the bull of Phalaris -- All these"
168,1839,FIC,GeraldineAthenia,A,B,C,  Ophira Who said the ravens brought Elijah food? Hush!' t was the vulture's scream! --' T was manna saved them. To think that the
169,1880,NF,Wake-Robin,A,B,C,"  . Bunting, snow (Passerina nivalis). Buzzard, turkey, or turkey vulture (Cathartes aura). Cardinal. SEE Grosbeak, cardinal. Catbird (Galeoscoptes"
170,1847,FIC,Bucktails,A,B,C,"  'll swallow my feelings, though they were live coals. Were it Promethous' vulture, I'd hug it, rather than its fluttering should be seen by this"
171,1862,FIC,KingsStratagem,A,B,C,"  wicked -- Will thank Heaven for the shelter of the tomb, And to the vulture bare their hearts no more; Therefore, let me return into the grave,"
172,1840,FIC,CountessIdaATale,A,B,C,"  prey might pick at Prometheus while chained and writhing under the beaks of his fierce vulture. "" Don't mind' em, sir, "" said a wretched little"
173,2006,FIC,ChinatownDeath,A,B,C,"  Right after the Golden Vulture disappeared. "" And there it was. The Golden Vulture. He'd brought it up. All of a sudden Gibson could sense Dent"
174,1876,NF,WinterSunshine,A,B,C,"  (Sialia sialis). Bobolink (Dodichonyx oryzivorus). Buzzard, or turkey vulture (Cathartes aura). Cardinal. See Grosbeak, cardinal. Cedar-bird, or"
175,1847,FIC,Arnold,A,B,C,"  womb cast out! Exit. SCENE IV. Room in Smith's House. Vulture seen through the Window, in the distance. Andre dressed in a British Uniform"
176,1939,FIC,AllYourBornDays,A,B,C,"  nodding absently at the elaborate explanation of why the car would not go. A vulture was wheeling over the valley, high up, giving scale and a sort of"
177,1834,MAG,NorthAmRev,A,B,C,"  flat, as it certainly was unprofitable, that the audience were introduced to the vulture, who was kept so long hovering over the head of Mr. Burges's opponent"
178,1860,FIC,ElFureidis,A,B,C,"  melodious song; far down might be dimly discerned the majestic eagle or the greedy vulture, hovering expectantly along the filmy wreaths of fog, which were soon destined to"
179,1835,MAG,NorthAmRev,A,B,C,"  of Europe; hut in this country, that name is wanted for the black vulture; and assuredly no creature can more eminently deserve it. Mr. Audubon considers our"
180,1856,FIC,ErnestLinwood,A,B,C,"  deep and strong. Prometheus bound to the rock, with the beak of the vulture in his bleeding breast, suffering daily renewing pangs, his wounds healed only to"
181,1847,FIC,Arnold,A,B,C,"  Arnold Yet heeds it Not, since all will properly be understood On board the Vulture; moreover, to thy Better sense' twill obvious run, that' t"
182,1976,FIC,RatnersStar,A,B,C,"  days now that squatting was the vogue. "" I wish there was a hooded vulture rental agency, "" Natasha said. "" It would be perfect for people our"
183,1822,FIC,OdofriedeOutcast,A,B,C,"  -- hence -- hence -- I'll seek the crag -- and plunge. The vulture On my bones shall batten, not thou -- sings. He comes! --"
184,1842,FIC,BeauchampeVolume2,A,B,C,  out the whole. I must be prepared. Beauchampe's as fierce as a vulture when roused. I've seen that in him before. I must get my
185,1994,FIC,ParisRev,A,B,C,"  black dress he wore falling awkwardly from his crooked shoulders; he resembled a turkey vulture with broken wings. He would remain with us until spring, drill me in"
186,1824,FIC,RedwoodATaleVolume2,A,B,C,"  find the old fox an overmatch for the young hound. "" Never did a vulture fasten his talons around his victim with more exultation than Harrington thrust poor little Emily"
187,1999,FIC,SouthwestRev,A,B,C,"  what; only she knew she could not look at her beautiful friend, the vulture, in the teacher's arms (even while knowing that no one was in"
188,1947,FIC,Gallery,A,B,C,"  master. Then there was a supply sergeant of the port battalion, with his vulture face. His every movement seemed to Momma a raucous suppression of some deeper inferiority"
189,2004,FIC,Conquistador,A,B,C,"  , something like an enormous vulture, thrashing and screeching hoarsely. A really enormous vulture... An adult California condor. Tom felt his teeth show in an involuntary snarl"
190,1987,FIC,Mov:BigEasyThe,A,B,C,"  HOMICIDE DIVISION - DAY ON A CARTOON CUT-OUT hanging on a wall: a grinning vulture. As the shot WIDENS, we see the vulture's perched on a blow-up"
191,1882,FIC,Poems,A,B,C,"  th'lowest pit, they spared Nor sex, nor age, nor infancy; the vulture Followed their track, and a black smoke like hell's Hung its foul reek"
192,1915,FIC,BoyAlliesUnder,A,B,C,"  , "" said Lord Hastings. He was right, for a moment later The Vulture began to sink lower in the water. At this moment the German craft fired"
193,1854,FIC,PoeticalWorks,A,B,C,"  on my breaking heart. Why, pleading friendship! vainly try to smother The vulture grief, that on my bosom preys? Far, far away, my youngest"
194,1930,NF,LandLion,A,B,C,"  to finish the feast. Sometimes at an early hour you may see a single vulture in the sky, but directly he sights the kill others will appear as if"
195,1993,FIC,UglyWays,A,B,C,"  time, "" he began. "" Once upon a time there was a turkey vulture who lived in Austin, Texas. His name was Jacksonville and he had a"
196,1930,FIC,FifthSonShoemaker,A,B,C,"  yet inevitable, had claimed him out of this dolce far niente, as the vulture snatched the talisman out of Camaralzaman's very hands in the Arabic tale. And"
197,1873,NF,MythsMyth-makers,A,B,C,"  : Euhemerism has done its best with this bird, representing it as an immense vulture or condor or as a reminiscence of the extinct dodo. But a Chinese myth"
198,2001,FIC,FantasySciFi,A,B,C,"  up again, is: How fortunate to be alive so far! The turkey vulture soars. One tiny cloud. For a while a raven family keeps one step"
199,1982,MAG,NewYorker,A,B,C,"  with big, brightly painted cardboard cutouts: a cowboy, a cactus with a vulture sitting on it, an ear of corn, a rattler and a lightly clad"
200,1986,FIC,Mov:Salvador,A,B,C,"  viscera. Doc follows Boyle. Throws away the remnants of his hamburger. A vulture unseen to him, coming up to get it behind him. Boyle crossing down"
